tunableop_results0.csv
Validator,PT_VERSION,2.9.1
Validator,HIP_VERSION,702
Validator,HIPBLASLT_VERSION,100201-5b515cf1bc
Validator,GCN_ARCH_NAME,gfx1151
Validator,ROCBLAS_VERSION,5.2.0.5b515cf1bc
GemmTunableOp_float_TT,tt_512_784_512_ld_512_784_512,Gemm_Rocblas_6374,0.175388
GemmTunableOp_float_TT,tt_1536_784_512_ld_512_784_1536,Gemm_Rocblas_6376,0.552386
GemmTunableOp_float_TT,tt_256_400_256_ld_256_400_256,Gemm_Hipblaslt_6373,0.0254326
GemmTunableOp_float_TT,tt_6625_212_120_ld_120_212_6625,Gemm_Rocblas_6374,0.145561
GemmTunableOp_float_TN,tn_64_1_1_ld_1_1_1,Gemm_Hipblaslt_6376,0.00747248
GemmTunableOp_float_TN,tn_6625_810_120_ld_120_120_6625,Gemm_Hipblaslt_6377,0.597095
GemmTunableOp_float_TN,tn_6625_420_120_ld_120_120_6625,Gemm_Hipblaslt_6377,0.330292
GemmTunableOp_float_TN,tn_6625_1074_120_ld_120_120_6625,Gemm_Hipblaslt_6377,0.814986
GemmTunableOp_float_TN,tn_6625_492_120_ld_120_120_6625,Gemm_Rocblas_6378,0.333315
GemmTunableOp_float_TN,tn_6625_510_120_ld_120_120_6625,Gemm_Rocblas_6378,0.358445
GemmTunableOp_float_TN,tn_6625_360_120_ld_120_120_6625,Gemm_Hipblaslt_6377,0.270765
GemmTunableOp_float_TN,tn_6625_432_120_ld_120_120_6625,Gemm_Rocblas_6378,0.317812
GemmTunableOp_float_TN,tn_6625_756_120_ld_120_120_6625,Gemm_Rocblas_6378,0.542847
GemmTunableOp_float_TN,tn_6625_372_120_ld_120_120_6625,Gemm_Rocblas_6378,0.273679
GemmTunableOp_float_TN,tn_6625_240_120_ld_120_120_6625,Gemm_Hipblaslt_6377,0.181919
GemmTunableOp_float_TN,tn_6625_462_120_ld_120_120_6625,Gemm_Hipblaslt_6377,0.346269
GemmTunableOp_float_TN,tn_6625_392_120_ld_120_120_6625,Gemm_Rocblas_6378,0.289957
GemmTunableOp_float_TN,tn_6625_330_120_ld_120_120_6625,Gemm_Rocblas_6378,0.261804
GemmTunableOp_float_TN,tn_6625_402_120_ld_120_120_6625,Gemm_Rocblas_6378,0.300531
GemmTunableOp_float_TN,tn_6625_591_120_ld_120_120_6625,Gemm_Hipblaslt_6377,0.377724
GemmTunableOp_float_TN,tn_6625_930_120_ld_120_120_6625,Gemm_Rocblas_6378,0.672448
GemmTunableOp_float_TN,tn_6625_594_120_ld_120_120_6625,Gemm_Rocblas_6378,0.447915
GemmTunableOp_float_TN,tn_6625_540_120_ld_120_120_6625,Gemm_Hipblaslt_6377,0.408405
GemmTunableOp_float_TN,tn_6625_528_120_ld_120_120_6625,Gemm_Hipblaslt_6377,0.376318
GemmTunableOp_float_TN,tn_6625_252_120_ld_120_120_6625,Gemm_Rocblas_6378,0.192285
GemmTunableOp_float_TN,tn_6625_306_120_ld_120_120_6625,Gemm_Rocblas_6378,0.24403
GemmTunableOp_float_TN,tn_6625_1050_120_ld_120_120_6625,Gemm_Rocblas_6378,0.789083
GemmTunableOp_float_TN,tn_6625_396_120_ld_120_120_6625,Gemm_Rocblas_6378,0.290317
GemmTunableOp_float_TN,tn_6625_390_120_ld_120_120_6625,Gemm_Rocblas_6378,0.308698
GemmTunableOp_float_TN,tn_6625_268_120_ld_120_120_6625,Gemm_Rocblas_6378,0.204694
GemmTunableOp_float_TN,tn_6625_468_120_ld_120_120_6625,Gemm_Rocblas_6378,0.336266
GemmTunableOp_float_TN,tn_6625_258_120_ld_120_120_6625,Gemm_Rocblas_6378,0.205136
GemmTunableOp_float_TN,tn_6625_618_120_ld_120_120_6625,Gemm_Rocblas_6378,0.447396
GemmTunableOp_float_TN,tn_6625_894_120_ld_120_120_6625,Gemm_Hipblaslt_6377,0.575549
GemmTunableOp_float_TN,tn_6625_564_120_ld_120_120_6625,Gemm_Hipblaslt_6377,0.365201
GemmTunableOp_float_TN,tn_6625_750_120_ld_120_120_6625,Gemm_Hipblaslt_6377,0.502833
GemmTunableOp_float_TN,tn_6625_864_120_ld_120_120_6625,Gemm_Hipblaslt_6377,0.550284
GemmTunableOp_float_TN,tn_6625_408_120_ld_120_120_6625,Gemm_Hipblaslt_6377,0.311836
GemmTunableOp_float_TN,tn_6625_780_120_ld_120_120_6625,Gemm_Rocblas_6378,0.478012
GemmTunableOp_float_TN,tn_6625_384_120_ld_120_120_6625,Gemm_Hipblaslt_6377,0.252337
GemmTunableOp_float_TN,tn_6625_606_120_ld_120_120_6625,Gemm_Hipblaslt_6377,0.388809
GemmTunableOp_float_TN,tn_6625_786_120_ld_120_120_6625,Gemm_Rocblas_6378,0.584451
GemmTunableOp_float_TN,tn_6625_1374_120_ld_120_120_6625,Gemm_Rocblas_6378,0.889281
GemmTunableOp_float_TN,tn_6625_288_120_ld_120_120_6625,Gemm_Rocblas_6378,0.209356
GemmTunableOp_float_TN,tn_6625_576_120_ld_120_120_6625,Gemm_Hipblaslt_6377,0.423684
GemmTunableOp_float_TN,tn_6625_738_120_ld_120_120_6625,Gemm_Rocblas_6378,0.537821
GemmTunableOp_float_TN,tn_6625_342_120_ld_120_120_6625,Gemm_Rocblas_6378,0.258798
GemmTunableOp_float_TN,tn_6625_216_120_ld_120_120_6625,Gemm_Hipblaslt_6377,0.147911
GemmTunableOp_float_TN,tn_6625_570_120_ld_120_120_6625,Gemm_Rocblas_6378,0.415427
GemmTunableOp_float_TN,tn_6625_672_120_ld_120_120_6625,Gemm_Hipblaslt_6377,0.458938
GemmTunableOp_float_TN,tn_6625_702_120_ld_120_120_6625,Gemm_Hipblaslt_6377,0.428664
GemmTunableOp_float_TN,tn_6625_624_120_ld_120_120_6625,Gemm_Rocblas_6378,0.399814
GemmTunableOp_float_TN,tn_6625_246_120_ld_120_120_6625,Gemm_Hipblaslt_6377,0.187582
GemmTunableOp_float_TN,tn_6625_444_120_ld_120_120_6625,Gemm_Hipblaslt_6377,0.338619
GemmTunableOp_float_TN,tn_6625_450_120_ld_120_120_6625,Gemm_Hipblaslt_6377,0.298846
GemmTunableOp_float_TN,tn_6625_276_120_ld_120_120_6625,Gemm_Hipblaslt_6377,0.185591
GemmTunableOp_float_TN,tn_6625_516_120_ld_120_120_6625,Gemm_Hipblaslt_6377,0.399361
GemmTunableOp_float_TN,tn_6625_426_120_ld_120_120_6625,Gemm_Hipblaslt_6377,0.309359
GemmTunableOp_float_TN,tn_6625_336_120_ld_120_120_6625,Gemm_Rocblas_6378,0.249932
GemmTunableOp_float_TN,tn_6625_264_120_ld_120_120_6625,Gemm_Rocblas_6378,0.205306
GemmTunableOp_float_TN,tn_6625_745_120_ld_120_120_6625,Gemm_Rocblas_6378,0.541528
GemmTunableOp_float_TN,tn_6625_282_120_ld_120_120_6625,Gemm_Hipblaslt_6377,0.19839
GemmTunableOp_float_TN,tn_6625_318_120_ld_120_120_6625,Gemm_Rocblas_6378,0.248401
GemmTunableOp_float_TN,tn_6625_354_120_ld_120_120_6625,Gemm_Hipblaslt_6377,0.264539
GemmAndBiasTunableOp_float_TN,tn_1024_1023_512_ld_512_512_1024,Default,0.470452
GemmAndBiasTunableOp_float_TN,tn_1024_1016_512_ld_512_512_1024,Default,0.463822
GemmAndBiasTunableOp_float_TN,tn_1024_1013_512_ld_512_512_1024,Gemm_Hipblaslt_6377,0.466296
GemmAndBiasTunableOp_float_TN,tn_1024_1012_512_ld_512_512_1024,Gemm_Hipblaslt_6377,0.462335
GemmAndBiasTunableOp_float_TN,tn_1024_1011_512_ld_512_512_1024,Gemm_Hipblaslt_6377,0.462108
GemmAndBiasTunableOp_float_TN,tn_1024_1010_512_ld_512_512_1024,Default,0.47261
GemmAndBiasTunableOp_float_TN,tn_1024_1009_512_ld_512_512_1024,Gemm_Hipblaslt_6377,0.465484
GemmAndBiasTunableOp_float_TN,tn_1024_1008_512_ld_512_512_1024,Gemm_Hipblaslt_6377,0.459664
GemmAndBiasTunableOp_float_TN,tn_1024_1007_512_ld_512_512_1024,Gemm_Hipblaslt_6377,0.453906
GemmAndBiasTunableOp_float_TN,tn_1024_1006_512_ld_512_512_1024,Gemm_Hipblaslt_6377,0.46439
GemmAndBiasTunableOp_float_TN,tn_1024_1004_512_ld_512_512_1024,Gemm_Hipblaslt_6377,0.463554
GemmAndBiasTunableOp_float_TN,tn_1024_1001_512_ld_512_512_1024,Gemm_Hipblaslt_6377,0.457014
GemmAndBiasTunableOp_float_TN,tn_1024_1000_512_ld_512_512_1024,Gemm_Hipblaslt_6377,0.456997
GemmAndBiasTunableOp_float_TN,tn_1024_999_512_ld_512_512_1024,Gemm_Hipblaslt_6377,0.452501
GemmAndBiasTunableOp_float_TN,tn_1024_995_512_ld_512_512_1024,Gemm_Hipblaslt_6377,0.458321
GemmAndBiasTunableOp_float_TN,tn_1024_989_512_ld_512_512_1024,Gemm_Hipblaslt_6377,0.449478
GemmAndBiasTunableOp_float_TN,tn_1024_988_512_ld_512_512_1024,Default,0.452026
GemmAndBiasTunableOp_float_TN,tn_1024_985_512_ld_512_512_1024,Gemm_Hipblaslt_6377,0.445821
GemmAndBiasTunableOp_float_TN,tn_1024_983_512_ld_512_512_1024,Gemm_Hipblaslt_6377,0.447827
GemmAndBiasTunableOp_float_TN,tn_1024_982_512_ld_512_512_1024,Gemm_Hipblaslt_6377,0.460651
GemmAndBiasTunableOp_float_TN,tn_1024_980_512_ld_512_512_1024,Default,0.465869
GemmAndBiasTunableOp_float_TN,tn_1024_979_512_ld_512_512_1024,Gemm_Hipblaslt_6377,0.445915
GemmAndBiasTunableOp_float_TN,tn_1024_978_512_ld_512_512_1024,Gemm_Hipblaslt_6377,0.453894
GemmAndBiasTunableOp_float_TN,tn_1024_977_512_ld_512_512_1024,Gemm_Hipblaslt_6377,0.446651
GemmAndBiasTunableOp_float_TN,tn_1024_976_512_ld_512_512_1024,Default,0.445814
GemmAndBiasTunableOp_float_TN,tn_1024_975_512_ld_512_512_1024,Default,0.444029
GemmAndBiasTunableOp_float_TN,tn_1024_972_512_ld_512_512_1024,Default,0.453002
GemmAndBiasTunableOp_float_TN,tn_1024_969_512_ld_512_512_1024,Gemm_Hipblaslt_6377,0.444517
GemmAndBiasTunableOp_float_TN,tn_1024_967_512_ld_512_512_1024,Default,0.447192
GemmAndBiasTunableOp_float_TN,tn_1024_966_512_ld_512_512_1024,Gemm_Hipblaslt_6377,0.450692
GemmAndBiasTunableOp_float_TN,tn_1024_965_512_ld_512_512_1024,Gemm_Hipblaslt_6377,0.43951
GemmAndBiasTunableOp_float_TN,tn_1024_964_512_ld_512_512_1024,Gemm_Hipblaslt_6377,0.453306
GemmAndBiasTunableOp_float_TN,tn_1024_963_512_ld_512_512_1024,Default,0.450264
GemmAndBiasTunableOp_float_TN,tn_1024_962_512_ld_512_512_1024,Default,0.448335
GemmAndBiasTunableOp_float_TN,tn_1024_961_512_ld_512_512_1024,Gemm_Hipblaslt_6377,0.443411
GemmAndBiasTunableOp_float_TN,tn_1024_958_512_ld_512_512_1024,Gemm_Hipblaslt_6377,0.446346
GemmAndBiasTunableOp_float_TN,tn_1024_953_512_ld_512_512_1024,Default,0.442906
GemmAndBiasTunableOp_float_TN,tn_1024_952_512_ld_512_512_1024,Gemm_Hipblaslt_6377,0.436593
GemmAndBiasTunableOp_float_TN,tn_1024_950_512_ld_512_512_1024,Gemm_Hipblaslt_6377,0.436964
GemmAndBiasTunableOp_float_TN,tn_1024_948_512_ld_512_512_1024,Gemm_Hipblaslt_6377,0.436064
GemmAndBiasTunableOp_float_TN,tn_1024_946_512_ld_512_512_1024,Gemm_Hipblaslt_6377,0.439607
GemmAndBiasTunableOp_float_TN,tn_1024_945_512_ld_512_512_1024,Gemm_Hipblaslt_6377,0.432065
GemmAndBiasTunableOp_float_TN,tn_1024_944_512_ld_512_512_1024,Gemm_Hipblaslt_6377,0.428566
GemmAndBiasTunableOp_float_TN,tn_1024_942_512_ld_512_512_1024,Default,0.435687
GemmAndBiasTunableOp_float_TN,tn_1024_941_512_ld_512_512_1024,Default,0.425649
GemmAndBiasTunableOp_float_TN,tn_1024_939_512_ld_512_512_1024,Gemm_Hipblaslt_6377,0.432321
GemmAndBiasTunableOp_float_TN,tn_1024_938_512_ld_512_512_1024,Default,0.440547
GemmAndBiasTunableOp_float_TN,tn_1024_1024_512_ld_512_512_1024,Gemm_Hipblaslt_6377,0.46037
GemmAndBiasTunableOp_float_TN,tn_1024_935_512_ld_512_512_1024,Default,0.425643
GemmAndBiasTunableOp_float_TN,tn_1024_934_512_ld_512_512_1024,Gemm_Hipblaslt_6377,0.436068
GemmAndBiasTunableOp_float_TN,tn_1024_933_512_ld_512_512_1024,Default,0.423433
GemmAndBiasTunableOp_float_TN,tn_1024_932_512_ld_512_512_1024,Gemm_Hipblaslt_6377,0.428865
GemmAndBiasTunableOp_float_TN,tn_1024_931_512_ld_512_512_1024,Gemm_Hipblaslt_6377,0.42163
GemmAndBiasTunableOp_float_TN,tn_1024_930_512_ld_512_512_1024,Gemm_Hipblaslt_6377,0.431889
GemmAndBiasTunableOp_float_TN,tn_1024_929_512_ld_512_512_1024,Gemm_Hipblaslt_6377,0.42847
GemmAndBiasTunableOp_float_TN,tn_1024_922_512_ld_512_512_1024,Gemm_Hipblaslt_6377,0.425688
GemmAndBiasTunableOp_float_TN,tn_1024_920_512_ld_512_512_1024,Gemm_Hipblaslt_6377,0.424204
GemmAndBiasTunableOp_float_TN,tn_1024_919_512_ld_512_512_1024,Gemm_Hipblaslt_6377,0.417487
GemmAndBiasTunableOp_float_TN,tn_1024_918_512_ld_512_512_1024,Gemm_Hipblaslt_6377,0.426211
GemmAndBiasTunableOp_float_TN,tn_1024_917_512_ld_512_512_1024,Default,0.425592
GemmAndBiasTunableOp_float_TN,tn_1024_916_512_ld_512_512_1024,Default,0.423185
GemmAndBiasTunableOp_float_TN,tn_1024_915_512_ld_512_512_1024,Default,0.417723
GemmAndBiasTunableOp_float_TN,tn_1024_912_512_ld_512_512_1024,Gemm_Hipblaslt_6377,0.41696
GemmAndBiasTunableOp_float_TN,tn_1024_911_512_ld_512_512_1024,Gemm_Hipblaslt_6377,0.41408
GemmAndBiasTunableOp_float_TN,tn_1024_909_512_ld_512_512_1024,Gemm_Hipblaslt_6377,0.408564
GemmAndBiasTunableOp_float_TN,tn_1024_908_512_ld_512_512_1024,Gemm_Hipblaslt_6377,0.413382
GemmAndBiasTunableOp_float_TN,tn_1024_906_512_ld_512_512_1024,Default,0.42056
GemmAndBiasTunableOp_float_TN,tn_1024_905_512_ld_512_512_1024,Gemm_Hipblaslt_6377,0.414761
GemmAndBiasTunableOp_float_TN,tn_1024_903_512_ld_512_512_1024,Gemm_Hipblaslt_6377,0.41499
GemmAndBiasTunableOp_float_TN,tn_1024_900_512_ld_512_512_1024,Gemm_Hipblaslt_6377,0.416846
GemmAndBiasTunableOp_float_TN,tn_1024_898_512_ld_512_512_1024,Gemm_Hipblaslt_6377,0.417104
GemmAndBiasTunableOp_float_TN,tn_1024_895_512_ld_512_512_1024,Default,0.407157
GemmAndBiasTunableOp_float_TN,tn_1024_894_512_ld_512_512_1024,Default,0.414682
GemmAndBiasTunableOp_float_TN,tn_1024_893_512_ld_512_512_1024,Gemm_Hipblaslt_6377,0.407037
GemmAndBiasTunableOp_float_TN,tn_1024_892_512_ld_512_512_1024,Gemm_Hipblaslt_6377,0.410886
GemmAndBiasTunableOp_float_TN,tn_1024_890_512_ld_512_512_1024,Gemm_Hipblaslt_6377,0.413367
GemmAndBiasTunableOp_float_TN,tn_1024_888_512_ld_512_512_1024,Default,0.420014
GemmAndBiasTunableOp_float_TN,tn_1024_973_512_ld_512_512_1024,Gemm_Hipblaslt_6377,0.443308
GemmAndBiasTunableOp_float_TN,tn_1024_885_512_ld_512_512_1024,Gemm_Hipblaslt_6377,0.405781
GemmAndBiasTunableOp_float_TN,tn_1024_883_512_ld_512_512_1024,Gemm_Hipblaslt_6377,0.408072
GemmAndBiasTunableOp_float_TN,tn_1024_882_512_ld_512_512_1024,Default,0.411907
GemmAndBiasTunableOp_float_TN,tn_1024_881_512_ld_512_512_1024,Default,0.405803
GemmAndBiasTunableOp_float_TN,tn_1024_879_512_ld_512_512_1024,Default,0.395185
GemmAndBiasTunableOp_float_TN,tn_1024_878_512_ld_512_512_1024,Default,0.408409
GemmAndBiasTunableOp_float_TN,tn_1024_876_512_ld_512_512_1024,Default,0.428618
GemmAndBiasTunableOp_float_TN,tn_1024_873_512_ld_512_512_1024,Gemm_Hipblaslt_6377,0.398172
GemmAndBiasTunableOp_float_TN,tn_1024_872_512_ld_512_512_1024,Default,0.406212
GemmAndBiasTunableOp_float_TN,tn_1024_871_512_ld_512_512_1024,Gemm_Hipblaslt_6377,0.39797
GemmAndBiasTunableOp_float_TN,tn_1024_870_512_ld_512_512_1024,Gemm_Hipblaslt_6377,0.406826
GemmAndBiasTunableOp_float_TN,tn_1024_880_512_ld_512_512_1024,Default,0.414628
GemmAndBiasTunableOp_float_TN,tn_1024_868_512_ld_512_512_1024,Default,0.406153
GemmAndBiasTunableOp_float_TN,tn_1024_867_512_ld_512_512_1024,Gemm_Hipblaslt_6377,0.396656
GemmAndBiasTunableOp_float_TN,tn_1024_860_512_ld_512_512_1024,Default,0.404248
GemmAndBiasTunableOp_float_TN,tn_1024_859_512_ld_512_512_1024,Gemm_Hipblaslt_6377,0.391549
GemmAndBiasTunableOp_float_TN,tn_1024_858_512_ld_512_512_1024,Gemm_Hipblaslt_6377,0.396452
GemmAndBiasTunableOp_float_TN,tn_1024_857_512_ld_512_512_1024,Default,0.392651
GemmAndBiasTunableOp_float_TN,tn_1024_856_512_ld_512_512_1024,Default,0.40027
GemmAndBiasTunableOp_float_TN,tn_1024_855_512_ld_512_512_1024,Gemm_Hipblaslt_6377,0.391323
GemmAndBiasTunableOp_float_TN,tn_1024_851_512_ld_512_512_1024,Gemm_Hipblaslt_6377,0.391776
GemmAndBiasTunableOp_float_TN,tn_1024_849_512_ld_512_512_1024,Gemm_Hipblaslt_6377,0.394067
GemmAndBiasTunableOp_float_TN,tn_1024_846_512_ld_512_512_1024,Default,0.389357
GemmAndBiasTunableOp_float_TN,tn_1024_845_512_ld_512_512_1024,Gemm_Hipblaslt_6377,0.403945
GemmAndBiasTunableOp_float_TN,tn_1024_844_512_ld_512_512_1024,Gemm_Hipblaslt_6377,0.386863
GemmAndBiasTunableOp_float_TN,tn_1024_843_512_ld_512_512_1024,Default,0.384616
GemmAndBiasTunableOp_float_TN,tn_1024_842_512_ld_512_512_1024,Gemm_Hipblaslt_6377,0.393267
GemmAndBiasTunableOp_float_TN,tn_1024_841_512_ld_512_512_1024,Gemm_Hipblaslt_6377,0.387319
GemmAndBiasTunableOp_float_TN,tn_1024_840_512_ld_512_512_1024,Gemm_Hipblaslt_6377,0.388587
GemmAndBiasTunableOp_float_TN,tn_1024_838_512_ld_512_512_1024,Gemm_Hipblaslt_6377,0.389377
GemmAndBiasTunableOp_float_TN,tn_1024_828_512_ld_512_512_1024,Gemm_Hipblaslt_6377,0.383665
GemmAndBiasTunableOp_float_TN,tn_1024_233_512_ld_512_512_1024,Gemm_Hipblaslt_6377,0.120939
GemmAndBiasTunableOp_float_TN,tn_1024_344_512_ld_512_512_1024,Gemm_Hipblaslt_6377,0.163819
GemmAndBiasTunableOp_float_TN,tn_240_930_120_ld_120_120_240,Gemm_Hipblaslt_6377,0.0299347
GemmAndBiasTunableOp_float_TN,tn_120_432_240_ld_240_240_120,Gemm_Hipblaslt_6377,0.0179393
GemmAndBiasTunableOp_float_TN,tn_1024_387_512_ld_512_512_1024,Gemm_Hipblaslt_6377,0.180593
GemmAndBiasTunableOp_float_TN,tn_360_258_120_ld_120_120_360,Gemm_Hipblaslt_6377,0.0168456
GemmAndBiasTunableOp_float_TN,tn_2_2_200_ld_200_200_2,Gemm_Hipblaslt_6376,0.0117838
GemmAndBiasTunableOp_float_TN,tn_1024_421_512_ld_512_512_1024,Gemm_Hipblaslt_6377,0.197183
GemmAndBiasTunableOp_float_TN,tn_240_786_120_ld_120_120_240,Gemm_Hipblaslt_6377,0.0262357
GemmAndBiasTunableOp_float_TN,tn_120_306_240_ld_240_240_120,Gemm_Hipblaslt_6377,0.0153993
GemmAndBiasTunableOp_float_TN,tn_120_786_120_ld_120_120_120,Gemm_Hipblaslt_6377,0.0166329
GemmAndBiasTunableOp_float_TN,tn_1024_50_512_ld_512_512_1024,Gemm_Hipblaslt_6377,0.0370352
GemmAndBiasTunableOp_float_TN,tn_1024_524_512_ld_512_512_1024,Gemm_Hipblaslt_6377,0.258757
GemmAndBiasTunableOp_float_TN,tn_1024_336_512_ld_512_512_1024,Gemm_Hipblaslt_6377,0.161394
GemmAndBiasTunableOp_float_TN,tn_120_240_120_ld_120_120_120,Gemm_Hipblaslt_6377,0.0109013
GemmAndBiasTunableOp_float_TN,tn_120_392_240_ld_240_240_120,Gemm_Hipblaslt_6377,0.0169314
GemmAndBiasTunableOp_float_TN,tn_360_264_120_ld_120_120_360,Gemm_Hipblaslt_6377,0.0167595
GemmAndBiasTunableOp_float_TN,tn_1024_24_512_ld_512_512_1024,Gemm_Hipblaslt_6377,0.026806
GemmAndBiasTunableOp_float_TN,tn_1024_39_512_ld_512_512_1024,Gemm_Hipblaslt_6377,0.0303182
GemmAndBiasTunableOp_float_TN,tn_1024_46_512_ld_512_512_1024,Gemm_Hipblaslt_6377,0.0302886
GemmAndBiasTunableOp_float_TN,tn_1024_497_512_ld_512_512_1024,Gemm_Hipblaslt_6377,0.224552
GemmAndBiasTunableOp_float_TN,tn_1024_100_512_ld_512_512_1024,Gemm_Hipblaslt_6377,0.0575405
GemmAndBiasTunableOp_float_TN,tn_1024_48_512_ld_512_512_1024,Gemm_Hipblaslt_6377,0.0301499
GemmAndBiasTunableOp_float_TN,tn_1024_292_512_ld_512_512_1024,Gemm_Hipblaslt_6377,0.178319
GemmAndBiasTunableOp_float_TN,tn_120_1374_240_ld_240_240_120,Gemm_Hipblaslt_6377,0.0477759
GemmAndBiasTunableOp_float_TN,tn_1024_556_512_ld_512_512_1024,Gemm_Hipblaslt_6377,0.285834
GemmAndBiasTunableOp_float_TN,tn_1024_616_512_ld_512_512_1024,Gemm_Hipblaslt_6377,0.309915
GemmAndBiasTunableOp_float_TN,tn_1024_13_512_ld_512_512_1024,Gemm_Hipblaslt_6378,0.0241526
GemmAndBiasTunableOp_float_TN,tn_240_576_120_ld_120_120_240,Gemm_Hipblaslt_6377,0.0203162
GemmAndBiasTunableOp_float_TN,tn_1024_242_512_ld_512_512_1024,Gemm_Hipblaslt_6377,0.142363
GemmAndBiasTunableOp_float_TN,tn_1024_70_512_ld_512_512_1024,Gemm_Hipblaslt_6377,0.0421028
GemmAndBiasTunableOp_float_TN,tn_1024_124_512_ld_512_512_1024,Gemm_Hipblaslt_6377,0.0635804
GemmAndBiasTunableOp_float_TN,tn_1024_193_512_ld_512_512_1024,Gemm_Hipblaslt_6377,0.116032
GemmAndBiasTunableOp_float_TN,tn_1024_5_512_ld_512_512_1024,Gemm_Hipblaslt_6378,0.0219718
GemmAndBiasTunableOp_float_TN,tn_1024_886_512_ld_512_512_1024,Default,0.420485
GemmAndBiasTunableOp_float_TN,tn_1024_665_512_ld_512_512_1024,Default,0.329644
GemmAndBiasTunableOp_float_TN,tn_1024_45_512_ld_512_512_1024,Gemm_Hipblaslt_6377,0.0305126
GemmAndBiasTunableOp_float_TN,tn_1024_492_512_ld_512_512_1024,Gemm_Hipblaslt_6377,0.22147
GemmAndBiasTunableOp_float_TN,tn_1024_285_512_ld_512_512_1024,Gemm_Hipblaslt_6377,0.213167
GemmAndBiasTunableOp_float_TN,tn_120_594_240_ld_240_240_120,Gemm_Hipblaslt_6377,0.0227071
GemmAndBiasTunableOp_float_TN,tn_1024_290_512_ld_512_512_1024,Gemm_Hipblaslt_6377,0.146551
GemmAndBiasTunableOp_float_TN,tn_1024_558_512_ld_512_512_1024,Gemm_Hipblaslt_6377,0.271457
GemmAndBiasTunableOp_float_TN,tn_1024_333_512_ld_512_512_1024,Gemm_Hipblaslt_6377,0.154145
GemmAndBiasTunableOp_float_TN,tn_120_516_240_ld_240_240_120,Gemm_Hipblaslt_6377,0.0207642
GemmAndBiasTunableOp_float_TN,tn_1024_298_512_ld_512_512_1024,Gemm_Hipblaslt_6377,0.150006
GemmAndBiasTunableOp_float_TN,tn_360_432_120_ld_120_120_360,Gemm_Hipblaslt_6377,0.0227312
GemmAndBiasTunableOp_float_TN,tn_120_702_240_ld_240_240_120,Gemm_Hipblaslt_6379,0.0310439
GemmAndBiasTunableOp_float_TN,tn_1024_238_512_ld_512_512_1024,Gemm_Hipblaslt_6377,0.135646
GemmAndBiasTunableOp_float_TN,tn_240_606_120_ld_120_120_240,Gemm_Hipblaslt_6376,0.0323733
GemmAndBiasTunableOp_float_TN,tn_1024_442_512_ld_512_512_1024,Gemm_Hipblaslt_6377,0.190621
GemmAndBiasTunableOp_float_TN,tn_360_564_120_ld_120_120_360,Gemm_Hipblaslt_6377,0.0308925
GemmAndBiasTunableOp_float_TN,tn_120_576_240_ld_240_240_120,Gemm_Hipblaslt_6377,0.0219893
GemmAndBiasTunableOp_float_TN,tn_1024_270_512_ld_512_512_1024,Gemm_Hipblaslt_6377,0.131279
GemmAndBiasTunableOp_float_TN,tn_360_594_120_ld_120_120_360,Gemm_Hipblaslt_6377,0.0312166
GemmAndBiasTunableOp_float_TN,tn_1024_348_512_ld_512_512_1024,Gemm_Hipblaslt_6377,0.171424
GemmAndBiasTunableOp_float_TN,tn_1024_268_512_ld_512_512_1024,Gemm_Hipblaslt_6377,0.134164
GemmAndBiasTunableOp_float_TN,tn_1024_355_512_ld_512_512_1024,Gemm_Hipblaslt_6377,0.167445
GemmAndBiasTunableOp_float_TN,tn_120_444_240_ld_240_240_120,Gemm_Hipblaslt_6377,0.0185152
GemmAndBiasTunableOp_float_TN,tn_240_306_120_ld_120_120_240,Gemm_Hipblaslt_6377,0.014468
GemmAndBiasTunableOp_float_TN,tn_1024_21_512_ld_512_512_1024,Gemm_Hipblaslt_6377,0.0265988
GemmAndBiasTunableOp_float_TN,tn_1024_44_512_ld_512_512_1024,Gemm_Hipblaslt_6377,0.0304849
GemmAndBiasTunableOp_float_TN,tn_1024_126_512_ld_512_512_1024,Gemm_Hipblaslt_6377,0.0640589
GemmAndBiasTunableOp_float_TN,tn_240_462_120_ld_120_120_240,Gemm_Hipblaslt_6377,0.0176973
GemmAndBiasTunableOp_float_TN,tn_240_268_120_ld_120_120_240,Gemm_Hipblaslt_6377,0.0134494
GemmAndBiasTunableOp_float_TN,tn_1024_792_512_ld_512_512_1024,Gemm_Hipblaslt_6377,0.370193
GemmAndBiasTunableOp_float_TN,tn_1024_487_512_ld_512_512_1024,Gemm_Hipblaslt_6377,0.219363
GemmAndBiasTunableOp_float_TN,tn_1024_115_512_ld_512_512_1024,Gemm_Hipblaslt_6377,0.0644415
GemmAndBiasTunableOp_float_TN,tn_240_810_120_ld_120_120_240,Gemm_Hipblaslt_6377,0.0266926
GemmAndBiasTunableOp_float_TN,tn_1024_434_512_ld_512_512_1024,Gemm_Hipblaslt_6377,0.20364
GemmAndBiasTunableOp_float_TN,tn_1024_803_512_ld_512_512_1024,Default,0.370595
GemmAndBiasTunableOp_float_TN,tn_1024_11_512_ld_512_512_1024,Gemm_Hipblaslt_6378,0.0241097
GemmAndBiasTunableOp_float_TN,tn_240_570_120_ld_120_120_240,Gemm_Hipblaslt_6377,0.0207583
GemmAndBiasTunableOp_float_TN,tn_1024_66_512_ld_512_512_1024,Gemm_Hipblaslt_6377,0.0425191
GemmAndBiasTunableOp_float_TN,tn_1024_403_512_ld_512_512_1024,Gemm_Hipblaslt_6377,0.185257
GemmAndBiasTunableOp_float_TN,tn_1024_913_512_ld_512_512_1024,Gemm_Hipblaslt_6377,0.425393
GemmAndBiasTunableOp_float_TN,tn_1024_9_512_ld_512_512_1024,Gemm_Hipblaslt_6376,0.0221641
GemmAndBiasTunableOp_float_TN,tn_1024_1_512_ld_512_512_1024,Gemm_Hipblaslt_6378,0.0219982
GemmAndBiasTunableOp_float_TN,tn_120_492_240_ld_240_240_120,Gemm_Hipblaslt_6377,0.01983
GemmAndBiasTunableOp_float_TN,tn_240_672_120_ld_120_120_240,Gemm_Hipblaslt_6377,0.0230653
GemmAndBiasTunableOp_float_TN,tn_1024_631_512_ld_512_512_1024,Gemm_Hipblaslt_6377,0.310635
GemmAndBiasTunableOp_float_TN,tn_1024_40_512_ld_512_512_1024,Gemm_Hipblaslt_6377,0.0305615
GemmAndBiasTunableOp_float_TN,tn_1024_467_512_ld_512_512_1024,Gemm_Hipblaslt_6377,0.213988
GemmAndBiasTunableOp_float_TN,tn_240_528_120_ld_120_120_240,Gemm_Hipblaslt_6377,0.0193924
GemmAndBiasTunableOp_float_TN,tn_120_1374_120_ld_120_120_120,Gemm_Hipblaslt_6379,0.0330048
GemmAndBiasTunableOp_float_TN,tn_1024_593_512_ld_512_512_1024,Default,0.307092
GemmAndBiasTunableOp_float_TN,tn_1024_200_512_ld_512_512_1024,Gemm_Hipblaslt_6377,0.107644
GemmAndBiasTunableOp_float_TN,tn_1024_914_512_ld_512_512_1024,Default,0.423339
GemmAndBiasTunableOp_float_TN,tn_192_300_256_ld_256_256_192,Gemm_Hipblaslt_6377,0.0194225
GemmAndBiasTunableOp_float_TN,tn_1024_637_512_ld_512_512_1024,Gemm_Hipblaslt_6377,0.316745
GemmAndBiasTunableOp_float_TN,tn_1024_30_512_ld_512_512_1024,Gemm_Hipblaslt_6377,0.0267803
GemmAndBiasTunableOp_float_TN,tn_1024_545_512_ld_512_512_1024,Gemm_Hipblaslt_6377,0.27934
GemmAndBiasTunableOp_float_TN,tn_1024_531_512_ld_512_512_1024,Gemm_Hipblaslt_6377,0.251576
GemmAndBiasTunableOp_float_TN,tn_1024_936_512_ld_512_512_1024,Default,0.426336
GemmAndBiasTunableOp_float_TN,tn_240_276_120_ld_120_120_240,Gemm_Hipblaslt_6377,0.014492
GemmAndBiasTunableOp_float_TN,tn_360_384_120_ld_120_120_360,Gemm_Hipblaslt_6377,0.0297488
GemmAndBiasTunableOp_float_TN,tn_360_354_120_ld_120_120_360,Gemm_Hipblaslt_6377,0.0202344
GemmAndBiasTunableOp_float_TN,tn_1024_784_512_ld_512_512_1024,Gemm_Hipblaslt_6377,0.317215
GemmAndBiasTunableOp_float_TN,tn_240_618_120_ld_120_120_240,Gemm_Hipblaslt_6377,0.0223015
GemmAndBiasTunableOp_float_TN,tn_1024_960_512_ld_512_512_1024,Default,0.440277
GemmAndBiasTunableOp_float_TN,tn_1024_288_512_ld_512_512_1024,Gemm_Hipblaslt_6377,0.141866
GemmAndBiasTunableOp_float_TN,tn_1024_149_512_ld_512_512_1024,Gemm_Hipblaslt_6377,0.0822415
GemmAndBiasTunableOp_float_TN,tn_1024_287_512_ld_512_512_1024,Gemm_Hipblaslt_6377,0.145311
GemmAndBiasTunableOp_float_TN,tn_240_240_120_ld_120_120_240,Gemm_Hipblaslt_6377,0.0124362
GemmAndBiasTunableOp_float_TN,tn_1024_609_512_ld_512_512_1024,Gemm_Hipblaslt_6377,0.307118
GemmAndBiasTunableOp_float_TN,tn_1024_36_512_ld_512_512_1024,Gemm_Hipblaslt_6377,0.030539
GemmAndBiasTunableOp_float_TN,tn_2_6_200_ld_200_200_2,Gemm_Hipblaslt_6378,0.0119813
GemmAndBiasTunableOp_float_TN,tn_1024_6_512_ld_512_512_1024,Gemm_Hipblaslt_6378,0.021999
GemmAndBiasTunableOp_float_TN,tn_1024_159_512_ld_512_512_1024,Gemm_Hipblaslt_6377,0.0818996
GemmAndBiasTunableOp_float_TN,tn_360_402_120_ld_120_120_360,Gemm_Hipblaslt_6377,0.0222045
GemmAndBiasTunableOp_float_TN,tn_1024_351_512_ld_512_512_1024,Gemm_Hipblaslt_6377,0.164889
GemmAndBiasTunableOp_float_TN,tn_1024_266_512_ld_512_512_1024,Gemm_Hipblaslt_6377,0.133914
GemmAndBiasTunableOp_float_TN,tn_120_462_240_ld_240_240_120,Gemm_Hipblaslt_6377,0.0186715
GemmAndBiasTunableOp_float_TN,tn_120_276_120_ld_120_120_120,Gemm_Hipblaslt_6376,0.0131363
GemmAndBiasTunableOp_float_TN,tn_1024_209_512_ld_512_512_1024,Gemm_Hipblaslt_6377,0.114048
GemmAndBiasTunableOp_float_TN,tn_120_745_120_ld_120_120_120,Gemm_Hipblaslt_6377,0.0162225
GemmAndBiasTunableOp_float_TN,tn_1024_51_512_ld_512_512_1024,Gemm_Hipblaslt_6377,0.0369054
GemmAndBiasTunableOp_float_TN,tn_1024_23_512_ld_512_512_1024,Gemm_Hipblaslt_6377,0.0268886
GemmAndBiasTunableOp_float_TN,tn_120_336_240_ld_240_240_120,Gemm_Hipblaslt_6377,0.016283
GemmAndBiasTunableOp_float_TN,tn_1024_219_512_ld_512_512_1024,Gemm_Hipblaslt_6379,0.242741
GemmAndBiasTunableOp_float_TN,tn_1024_630_512_ld_512_512_1024,Gemm_Hipblaslt_6377,0.31456
GemmAndBiasTunableOp_float_TN,tn_1024_866_512_ld_512_512_1024,Gemm_Hipblaslt_6377,0.413332
GemmAndBiasTunableOp_float_TN,tn_1024_283_512_ld_512_512_1024,Gemm_Hipblaslt_6377,0.157691
GemmAndBiasTunableOp_float_TN,tn_1024_474_512_ld_512_512_1024,Gemm_Hipblaslt_6377,0.209361
GemmAndBiasTunableOp_float_TN,tn_1024_223_512_ld_512_512_1024,Gemm_Hipblaslt_6377,0.122052
GemmAndBiasTunableOp_float_TN,tn_120_738_240_ld_240_240_120,Gemm_Hipblaslt_6377,0.0262874
GemmAndBiasTunableOp_float_TN,tn_1024_515_512_ld_512_512_1024,Gemm_Hipblaslt_6377,0.260136
GemmAndBiasTunableOp_float_TN,tn_120_576_120_ld_120_120_120,Gemm_Hipblaslt_6377,0.0140866
GemmAndBiasTunableOp_float_TN,tn_240_372_120_ld_120_120_240,Gemm_Hipblaslt_6377,0.0158634
GemmAndBiasTunableOp_float_TN,tn_240_1374_120_ld_120_120_240,Gemm_Hipblaslt_6379,0.0540524
GemmAndBiasTunableOp_float_TN,tn_1024_383_512_ld_512_512_1024,Gemm_Hipblaslt_6377,0.175298
GemmAndBiasTunableOp_float_TN,tn_120_810_120_ld_120_120_120,Gemm_Hipblaslt_6377,0.0174055
GemmAndBiasTunableOp_float_TN,tn_1024_331_512_ld_512_512_1024,Gemm_Hipblaslt_6377,0.159746
GemmAndBiasTunableOp_float_TN,tn_120_354_240_ld_240_240_120,Gemm_Hipblaslt_6377,0.0169303
GemmAndBiasTunableOp_float_TN,tn_4_1_256_ld_256_256_4,Gemm_Hipblaslt_6378,0.0128446
GemmAndBiasTunableOp_float_TN,tn_1024_493_512_ld_512_512_1024,Gemm_Hipblaslt_6377,0.218399
GemmAndBiasTunableOp_float_TN,tn_1024_968_512_ld_512_512_1024,Default,0.455745
GemmAndBiasTunableOp_float_TN,tn_1024_480_512_ld_512_512_1024,Gemm_Hipblaslt_6377,0.20844
GemmAndBiasTunableOp_float_TN,tn_120_462_120_ld_120_120_120,Gemm_Hipblaslt_6377,0.0126657
GemmAndBiasTunableOp_float_TN,tn_240_756_120_ld_120_120_240,Gemm_Hipblaslt_6377,0.0251072
GemmAndBiasTunableOp_float_TN,tn_240_258_120_ld_120_120_240,Gemm_Hipblaslt_6377,0.0131644
GemmAndBiasTunableOp_float_TN,tn_1024_107_512_ld_512_512_1024,Gemm_Hipblaslt_6377,0.057648
GemmAndBiasTunableOp_float_TN,tn_120_810_240_ld_240_240_120,Gemm_Hipblaslt_6377,0.0280306
GemmAndBiasTunableOp_float_TN,tn_1024_402_512_ld_512_512_1024,Gemm_Hipblaslt_6377,0.184368
GemmAndBiasTunableOp_float_TN,tn_360_756_120_ld_120_120_360,Gemm_Hipblaslt_6377,0.0364778
GemmAndBiasTunableOp_float_TN,tn_1024_927_512_ld_512_512_1024,Gemm_Hipblaslt_6377,0.41518
GemmAndBiasTunableOp_float_TN,tn_1024_907_512_ld_512_512_1024,Gemm_Hipblaslt_6377,0.412927
GemmAndBiasTunableOp_float_TN,tn_120_468_120_ld_120_120_120,Gemm_Hipblaslt_6377,0.0206965
GemmAndBiasTunableOp_float_TN,tn_1024_334_512_ld_512_512_1024,Gemm_Hipblaslt_6377,0.161323
GemmAndBiasTunableOp_float_TN,tn_120_672_120_ld_120_120_120,Gemm_Hipblaslt_6377,0.0153468
GemmAndBiasTunableOp_float_TN,tn_120_396_120_ld_120_120_120,Gemm_Hipblaslt_6377,0.0119312
GemmAndBiasTunableOp_float_TN,tn_360_268_120_ld_120_120_360,Gemm_Hipblaslt_6377,0.0166565
GemmAndBiasTunableOp_float_TN,tn_120_252_240_ld_240_240_120,Gemm_Hipblaslt_6377,0.0146876
GemmAndBiasTunableOp_float_TN,tn_1024_227_512_ld_512_512_1024,Gemm_Hipblaslt_6377,0.125818
GemmAndBiasTunableOp_float_TN,tn_1024_488_512_ld_512_512_1024,Gemm_Hipblaslt_6377,0.230328
GemmAndBiasTunableOp_float_TN,tn_1024_1018_512_ld_512_512_1024,Default,0.477042
GemmAndBiasTunableOp_float_TN,tn_360_576_120_ld_120_120_360,Gemm_Hipblaslt_6377,0.0281037
GemmAndBiasTunableOp_float_TN,tn_1024_110_512_ld_512_512_1024,Gemm_Hipblaslt_6377,0.0578263
GemmAndBiasTunableOp_float_TN,tn_240_516_120_ld_120_120_240,Gemm_Hipblaslt_6377,0.0195032
GemmAndBiasTunableOp_float_TN,tn_1024_296_512_ld_512_512_1024,Gemm_Hipblaslt_6377,0.150513
GemmAndBiasTunableOp_float_TN,tn_1024_195_512_ld_512_512_1024,Gemm_Hipblaslt_6377,0.105488
GemmAndBiasTunableOp_float_TN,tn_120_864_240_ld_240_240_120,Gemm_Hipblaslt_6377,0.0415878
GemmAndBiasTunableOp_float_TN,tn_2_4_200_ld_200_200_2,Gemm_Hipblaslt_6378,0.0123728
GemmAndBiasTunableOp_float_TN,tn_1024_700_512_ld_512_512_1024,Gemm_Hipblaslt_6377,0.331317
GemmAndBiasTunableOp_float_TN,tn_512_784_512_ld_512_512_512,Gemm_Hipblaslt_6377,0.161532
GemmAndBiasTunableOp_float_TN,tn_1024_171_512_ld_512_512_1024,Gemm_Hipblaslt_6377,0.0886022
GemmAndBiasTunableOp_float_TN,tn_120_570_120_ld_120_120_120,Gemm_Hipblaslt_6377,0.0142789
GemmAndBiasTunableOp_float_TN,tn_240_212_120_ld_120_120_240,Gemm_Hipblaslt_6377,0.0122602
GemmAndBiasTunableOp_float_TN,tn_120_510_120_ld_120_120_120,Gemm_Hipblaslt_6377,0.01346
GemmAndBiasTunableOp_float_TN,tn_1024_588_512_ld_512_512_1024,Default,0.294989
GemmAndBiasTunableOp_float_TN,tn_1024_682_512_ld_512_512_1024,Gemm_Hipblaslt_6377,0.324349
GemmAndBiasTunableOp_float_TN,tn_120_1050_120_ld_120_120_120,Gemm_Hipblaslt_6377,0.0203547
GemmAndBiasTunableOp_float_TN,tn_360_360_120_ld_120_120_360,Gemm_Hipblaslt_6377,0.0205459
GemmAndBiasTunableOp_float_TN,tn_1024_438_512_ld_512_512_1024,Gemm_Hipblaslt_6377,0.19682
GemmAndBiasTunableOp_float_TN,tn_1024_726_512_ld_512_512_1024,Gemm_Hipblaslt_6377,0.341565
GemmAndBiasTunableOp_float_TN,tn_1024_956_512_ld_512_512_1024,Default,0.446199
GemmAndBiasTunableOp_float_TN,tn_1024_750_512_ld_512_512_1024,Gemm_Hipblaslt_6377,0.344324
GemmAndBiasTunableOp_float_TN,tn_240_408_120_ld_120_120_240,Gemm_Hipblaslt_6377,0.0166597
GemmAndBiasTunableOp_float_TN,tn_1024_676_512_ld_512_512_1024,Gemm_Hipblaslt_6377,0.32632
GemmAndBiasTunableOp_float_TN,tn_120_372_240_ld_240_240_120,Gemm_Hipblaslt_6377,0.0168925
GemmAndBiasTunableOp_float_TN,tn_1024_374_512_ld_512_512_1024,Gemm_Hipblaslt_6377,0.174637
GemmAndBiasTunableOp_float_TN,tn_1024_27_512_ld_512_512_1024,Gemm_Hipblaslt_6377,0.0267844
GemmAndBiasTunableOp_float_TN,tn_1024_22_512_ld_512_512_1024,Gemm_Hipblaslt_6376,0.0266738
GemmAndBiasTunableOp_float_TN,tn_1024_617_512_ld_512_512_1024,Gemm_Hipblaslt_6377,0.31146
GemmAndBiasTunableOp_float_TN,tn_1024_144_512_ld_512_512_1024,Gemm_Hipblaslt_6377,0.0844808
GemmAndBiasTunableOp_float_TN,tn_1024_7_512_ld_512_512_1024,Gemm_Hipblaslt_6378,0.0220855
GemmAndBiasTunableOp_float_TN,tn_1024_388_512_ld_512_512_1024,Gemm_Hipblaslt_6377,0.182879
GemmAndBiasTunableOp_float_TN,tn_1024_211_512_ld_512_512_1024,Gemm_Hipblaslt_6377,0.114871
GemmAndBiasTunableOp_float_TN,tn_1024_864_512_ld_512_512_1024,Default,0.400351
GemmAndBiasTunableOp_float_TN,tn_120_1074_240_ld_240_240_120,Gemm_Hipblaslt_6377,0.0350703
GemmAndBiasTunableOp_float_TN,tn_1024_396_512_ld_512_512_1024,Gemm_Hipblaslt_6377,0.177323
GemmAndBiasTunableOp_float_TN,tn_1024_444_512_ld_512_512_1024,Gemm_Hipblaslt_6377,0.191482
GemmAndBiasTunableOp_float_TN,tn_1024_658_512_ld_512_512_1024,Gemm_Hipblaslt_6377,0.31619
GemmAndBiasTunableOp_float_TN,tn_1024_349_512_ld_512_512_1024,Gemm_Hipblaslt_6377,0.166559
GemmAndBiasTunableOp_float_TN,tn_1024_804_512_ld_512_512_1024,Default,0.37623
GemmAndBiasTunableOp_float_TN,tn_1024_822_512_ld_512_512_1024,Gemm_Hipblaslt_6377,0.382031
GemmAndBiasTunableOp_float_TN,tn_1024_481_512_ld_512_512_1024,Gemm_Hipblaslt_6377,0.221396
GemmAndBiasTunableOp_float_TN,tn_1024_981_512_ld_512_512_1024,Default,0.449947
GemmAndBiasTunableOp_float_TN,tn_1024_496_512_ld_512_512_1024,Gemm_Hipblaslt_6377,0.218396
GemmAndBiasTunableOp_float_TN,tn_1024_409_512_ld_512_512_1024,Gemm_Hipblaslt_6377,0.186563
GemmAndBiasTunableOp_float_TN,tn_1024_17_512_ld_512_512_1024,Gemm_Hipblaslt_6376,0.0267283
GemmAndBiasTunableOp_float_TN,tn_1024_537_512_ld_512_512_1024,Gemm_Hipblaslt_6377,0.254583
GemmAndBiasTunableOp_float_TN,tn_1024_316_512_ld_512_512_1024,Gemm_Hipblaslt_6377,0.156566
GemmAndBiasTunableOp_float_TN,tn_1024_422_512_ld_512_512_1024,Gemm_Hipblaslt_6377,0.201221
GemmAndBiasTunableOp_float_TN,tn_1024_538_512_ld_512_512_1024,Gemm_Hipblaslt_6377,0.266253
GemmAndBiasTunableOp_float_TN,tn_1024_473_512_ld_512_512_1024,Gemm_Hipblaslt_6377,0.215555
GemmAndBiasTunableOp_float_TN,tn_1024_954_512_ld_512_512_1024,Default,0.445856
GemmAndBiasTunableOp_float_TN,tn_360_672_120_ld_120_120_360,Gemm_Hipblaslt_6377,0.032217
GemmAndBiasTunableOp_float_TN,tn_1024_709_512_ld_512_512_1024,Gemm_Hipblaslt_6377,0.339423
GemmAndBiasTunableOp_float_TN,tn_1024_987_512_ld_512_512_1024,Default,0.452801
GemmAndBiasTunableOp_float_TN,tn_1024_776_512_ld_512_512_1024,Default,0.364711
GemmAndBiasTunableOp_float_TN,tn_1024_364_512_ld_512_512_1024,Gemm_Hipblaslt_6377,0.172223
GemmAndBiasTunableOp_float_TN,tn_1024_437_512_ld_512_512_1024,Gemm_Hipblaslt_6377,0.202694
GemmAndBiasTunableOp_float_TN,tn_1024_451_512_ld_512_512_1024,Gemm_Hipblaslt_6377,0.199882
GemmAndBiasTunableOp_float_TN,tn_360_492_120_ld_120_120_360,Gemm_Hipblaslt_6377,0.025205
GemmAndBiasTunableOp_float_TN,tn_1024_509_512_ld_512_512_1024,Gemm_Hipblaslt_6377,0.229435
GemmAndBiasTunableOp_float_TN,tn_120_288_240_ld_240_240_120,Gemm_Hipblaslt_6377,0.015229
GemmAndBiasTunableOp_float_TN,tn_120_528_240_ld_240_240_120,Gemm_Hipblaslt_6377,0.020606
GemmAndBiasTunableOp_float_TN,tn_1024_394_512_ld_512_512_1024,Gemm_Hipblaslt_6377,0.183233
GemmAndBiasTunableOp_float_TN,tn_1024_530_512_ld_512_512_1024,Gemm_Hipblaslt_6377,0.27353
GemmAndBiasTunableOp_float_TN,tn_1024_74_512_ld_512_512_1024,Gemm_Hipblaslt_6377,0.042455
GemmAndBiasTunableOp_float_TN,tn_1024_993_512_ld_512_512_1024,Gemm_Hipblaslt_6377,0.458134
GemmAndBiasTunableOp_float_TN,tn_120_396_240_ld_240_240_120,Gemm_Hipblaslt_6377,0.0170381
GemmAndBiasTunableOp_float_TN,tn_1024_755_512_ld_512_512_1024,Gemm_Hipblaslt_6377,0.35479
GemmAndBiasTunableOp_float_TN,tn_1024_827_512_ld_512_512_1024,Gemm_Hipblaslt_6377,0.380676
GemmAndBiasTunableOp_float_TN,tn_1024_921_512_ld_512_512_1024,Default,0.423818
GemmAndBiasTunableOp_float_TN,tn_1024_375_512_ld_512_512_1024,Gemm_Hipblaslt_6377,0.177088
GemmAndBiasTunableOp_float_TN,tn_1024_368_512_ld_512_512_1024,Gemm_Hipblaslt_6377,0.165928
GemmAndBiasTunableOp_float_TN,tn_1024_740_512_ld_512_512_1024,Gemm_Hipblaslt_6377,0.345787
GemmAndBiasTunableOp_float_TN,tn_1024_525_512_ld_512_512_1024,Gemm_Hipblaslt_6377,0.257302
GemmAndBiasTunableOp_float_TN,tn_1024_450_512_ld_512_512_1024,Gemm_Hipblaslt_6377,0.207813
GemmAndBiasTunableOp_float_TN,tn_1024_313_512_ld_512_512_1024,Gemm_Hipblaslt_6377,0.157818
GemmAndBiasTunableOp_float_TN,tn_360_468_120_ld_120_120_360,Gemm_Hipblaslt_6377,0.028119
GemmAndBiasTunableOp_float_TN,tn_1024_55_512_ld_512_512_1024,Gemm_Hipblaslt_6377,0.0367439
GemmAndBiasTunableOp_float_TN,tn_1024_61_512_ld_512_512_1024,Gemm_Hipblaslt_6377,0.0367551
GemmAndBiasTunableOp_float_TN,tn_1024_734_512_ld_512_512_1024,Gemm_Hipblaslt_6377,0.345597
GemmAndBiasTunableOp_float_TN,tn_120_342_120_ld_120_120_120,Gemm_Hipblaslt_6377,0.0115025
GemmAndBiasTunableOp_float_TN,tn_1024_794_512_ld_512_512_1024,Default,0.377711
GemmAndBiasTunableOp_float_TN,tn_1024_16_512_ld_512_512_1024,Gemm_Hipblaslt_6378,0.0239775
GemmAndBiasTunableOp_float_TN,tn_256_300_512_ld_512_512_256,Gemm_Hipblaslt_6377,0.0419782
GemmAndBiasTunableOp_float_TN,tn_1024_742_512_ld_512_512_1024,Gemm_Hipblaslt_6377,0.346736
GemmAndBiasTunableOp_float_TN,tn_1024_472_512_ld_512_512_1024,Gemm_Hipblaslt_6377,0.218427
GemmAndBiasTunableOp_float_TN,tn_1024_230_512_ld_512_512_1024,Gemm_Hipblaslt_6377,0.147544
GemmAndBiasTunableOp_float_TN,tn_1024_638_512_ld_512_512_1024,Gemm_Hipblaslt_6377,0.31432
GemmAndBiasTunableOp_float_TN,tn_1024_475_512_ld_512_512_1024,Gemm_Hipblaslt_6377,0.210707
GemmAndBiasTunableOp_float_TN,tn_1024_357_512_ld_512_512_1024,Gemm_Hipblaslt_6377,0.166259
GemmAndBiasTunableOp_float_TN,tn_1024_356_512_ld_512_512_1024,Gemm_Hipblaslt_6377,0.169244
GemmAndBiasTunableOp_float_TN,tn_120_624_120_ld_120_120_120,Gemm_Hipblaslt_6377,0.0156222
GemmAndBiasTunableOp_float_TN,tn_1024_791_512_ld_512_512_1024,Default,0.370636
GemmAndBiasTunableOp_float_TN,tn_120_780_120_ld_120_120_120,Gemm_Hipblaslt_6376,0.0251477
GemmAndBiasTunableOp_float_TN,tn_1024_456_512_ld_512_512_1024,Gemm_Hipblaslt_6377,0.202585
GemmAndBiasTunableOp_float_TN,tn_1024_435_512_ld_512_512_1024,Gemm_Hipblaslt_6377,0.198494
GemmAndBiasTunableOp_float_TN,tn_1024_327_512_ld_512_512_1024,Gemm_Hipblaslt_6377,0.154303
GemmAndBiasTunableOp_float_TN,tn_1024_461_512_ld_512_512_1024,Gemm_Hipblaslt_6377,0.204078
GemmAndBiasTunableOp_float_TN,tn_1024_836_512_ld_512_512_1024,Gemm_Hipblaslt_6377,0.383761
GemmAndBiasTunableOp_float_TN,tn_360_462_120_ld_120_120_360,Gemm_Hipblaslt_6377,0.0238826
GemmAndBiasTunableOp_float_TN,tn_1024_955_512_ld_512_512_1024,Gemm_Hipblaslt_6377,0.443625
GemmAndBiasTunableOp_float_TN,tn_1024_735_512_ld_512_512_1024,Gemm_Hipblaslt_6377,0.337545
GemmAndBiasTunableOp_float_TN,tn_1024_771_512_ld_512_512_1024,Gemm_Hipblaslt_6377,0.364328
GemmAndBiasTunableOp_float_TN,tn_1024_483_512_ld_512_512_1024,Gemm_Hipblaslt_6377,0.222232
GemmAndBiasTunableOp_float_TN,tn_1024_400_512_ld_512_512_1024,Gemm_Hipblaslt_6377,0.189795
GemmAndBiasTunableOp_float_TN,tn_1024_274_512_ld_512_512_1024,Gemm_Hipblaslt_6377,0.152795
GemmAndBiasTunableOp_float_TN,tn_1024_49_512_ld_512_512_1024,Gemm_Hipblaslt_6377,0.0365427
GemmAndBiasTunableOp_float_TN,tn_360_591_120_ld_120_120_360,Gemm_Hipblaslt_6377,0.0371414
GemmAndBiasTunableOp_float_TN,tn_1024_582_512_ld_512_512_1024,Default,0.298883
GemmAndBiasTunableOp_float_TN,tn_1024_614_512_ld_512_512_1024,Gemm_Hipblaslt_6377,0.301199
GemmAndBiasTunableOp_float_TN,tn_1024_778_512_ld_512_512_1024,Gemm_Hipblaslt_6377,0.365245
GemmAndBiasTunableOp_float_TN,tn_1024_447_512_ld_512_512_1024,Gemm_Hipblaslt_6377,0.19501
GemmAndBiasTunableOp_float_TN,tn_240_392_120_ld_120_120_240,Gemm_Hipblaslt_6377,0.0163932
GemmAndBiasTunableOp_float_TN,tn_1024_405_512_ld_512_512_1024,Gemm_Hipblaslt_6377,0.190717
GemmAndBiasTunableOp_float_TN,tn_1024_506_512_ld_512_512_1024,Gemm_Hipblaslt_6377,0.227371
GemmAndBiasTunableOp_float_TN,tn_360_372_120_ld_120_120_360,Gemm_Hipblaslt_6377,0.0207963
GemmAndBiasTunableOp_float_TN,tn_1024_318_512_ld_512_512_1024,Gemm_Hipblaslt_6377,0.15996
GemmAndBiasTunableOp_float_TN,tn_360_276_120_ld_120_120_360,Gemm_Hipblaslt_6377,0.0180038
GemmAndBiasTunableOp_float_TN,tn_1024_542_512_ld_512_512_1024,Gemm_Hipblaslt_6377,0.277029
GemmAndBiasTunableOp_float_TN,tn_1024_498_512_ld_512_512_1024,Gemm_Hipblaslt_6377,0.235079
GemmAndBiasTunableOp_float_TN,tn_1024_384_512_ld_512_512_1024,Gemm_Hipblaslt_6377,0.175146
GemmAndBiasTunableOp_float_TN,tn_1024_573_512_ld_512_512_1024,Gemm_Hipblaslt_6377,0.288962
GemmAndBiasTunableOp_float_TN,tn_240_216_120_ld_120_120_240,Gemm_Hipblaslt_6379,0.014983
GemmAndBiasTunableOp_float_TN,tn_1024_786_512_ld_512_512_1024,Gemm_Hipblaslt_6377,0.369792
GemmAndBiasTunableOp_float_TN,tn_1024_552_512_ld_512_512_1024,Gemm_Hipblaslt_6377,0.288702
GemmAndBiasTunableOp_float_TN,tn_1024_2_512_ld_512_512_1024,Gemm_Hipblaslt_6378,0.0218367
GemmAndBiasTunableOp_float_TN,tn_1024_197_512_ld_512_512_1024,Gemm_Hipblaslt_6377,0.108762
GemmAndBiasTunableOp_float_TN,tn_1024_1002_512_ld_512_512_1024,Gemm_Hipblaslt_6377,0.465155
GemmAndBiasTunableOp_float_TN,tn_1024_877_512_ld_512_512_1024,Default,0.397774
GemmAndBiasTunableOp_float_TN,tn_1024_563_512_ld_512_512_1024,Gemm_Hipblaslt_6377,0.287509
GemmAndBiasTunableOp_float_TN,tn_1024_571_512_ld_512_512_1024,Gemm_Hipblaslt_6377,0.290092
GemmAndBiasTunableOp_float_TN,tn_1024_455_512_ld_512_512_1024,Gemm_Hipblaslt_6377,0.208273
GemmAndBiasTunableOp_float_TN,tn_1024_512_512_ld_512_512_1024,Gemm_Hipblaslt_6377,0.223341
GemmAndBiasTunableOp_float_TN,tn_1024_286_512_ld_512_512_1024,Gemm_Hipblaslt_6377,0.138138
GemmAndBiasTunableOp_float_TN,tn_1024_166_512_ld_512_512_1024,Gemm_Hipblaslt_6377,0.0906906
GemmAndBiasTunableOp_float_TN,tn_1024_806_512_ld_512_512_1024,Gemm_Hipblaslt_6377,0.379086
GemmAndBiasTunableOp_float_TN,tn_1024_533_512_ld_512_512_1024,Gemm_Hipblaslt_6377,0.253316
GemmAndBiasTunableOp_float_TN,tn_1024_536_512_ld_512_512_1024,Gemm_Hipblaslt_6377,0.268899
GemmAndBiasTunableOp_float_TN,tn_1024_57_512_ld_512_512_1024,Gemm_Hipblaslt_6377,0.0370244
GemmAndBiasTunableOp_float_TN,tn_1024_534_512_ld_512_512_1024,Gemm_Hipblaslt_6377,0.274395
GemmAndBiasTunableOp_float_TN,tn_1024_385_512_ld_512_512_1024,Gemm_Hipblaslt_6377,0.176659
GemmAndBiasTunableOp_float_TN,tn_1024_691_512_ld_512_512_1024,Gemm_Hipblaslt_6377,0.335601
GemmAndBiasTunableOp_float_TN,tn_1024_884_512_ld_512_512_1024,Default,0.415036
GemmAndBiasTunableOp_float_TN,tn_1024_592_512_ld_512_512_1024,Gemm_Hipblaslt_6377,0.295192
GemmAndBiasTunableOp_float_TN,tn_17_300_256_ld_256_256_17,Gemm_Hipblaslt_6378,0.0124855
GemmAndBiasTunableOp_float_TN,tn_1024_436_512_ld_512_512_1024,Gemm_Hipblaslt_6377,0.203478
GemmAndBiasTunableOp_float_TN,tn_1024_510_512_ld_512_512_1024,Gemm_Hipblaslt_6377,0.228554
GemmAndBiasTunableOp_float_TN,tn_96_300_256_ld_256_256_96,Gemm_Hipblaslt_6377,0.014912
GemmAndBiasTunableOp_float_TN,tn_1024_733_512_ld_512_512_1024,Gemm_Hipblaslt_6377,0.337369
GemmAndBiasTunableOp_float_TN,tn_1024_439_512_ld_512_512_1024,Gemm_Hipblaslt_6377,0.196378
GemmAndBiasTunableOp_float_TN,tn_1024_636_512_ld_512_512_1024,Gemm_Hipblaslt_6377,0.317031
GemmAndBiasTunableOp_float_TN,tn_1024_656_512_ld_512_512_1024,Gemm_Hipblaslt_6377,0.320956
GemmAndBiasTunableOp_float_TN,tn_1024_586_512_ld_512_512_1024,Gemm_Hipblaslt_6377,0.294262
GemmAndBiasTunableOp_float_TN,tn_1024_583_512_ld_512_512_1024,Default,0.302317
GemmAndBiasTunableOp_float_TN,tn_240_336_120_ld_120_120_240,Gemm_Hipblaslt_6377,0.0147653
GemmAndBiasTunableOp_float_TN,tn_120_894_120_ld_120_120_120,Gemm_Hipblaslt_6377,0.019509
GemmAndBiasTunableOp_float_TN,tn_120_276_240_ld_240_240_120,Gemm_Hipblaslt_6379,0.0192614
GemmAndBiasTunableOp_float_TN,tn_1024_253_512_ld_512_512_1024,Gemm_Hipblaslt_6377,0.123824
GemmAndBiasTunableOp_float_TN,tn_1024_217_512_ld_512_512_1024,Gemm_Hipblaslt_6379,0.168536
GemmAndBiasTunableOp_float_TN,tn_1024_463_512_ld_512_512_1024,Gemm_Hipblaslt_6377,0.199326
GemmAndBiasTunableOp_float_TN,tn_1024_381_512_ld_512_512_1024,Gemm_Hipblaslt_6377,0.176251
GemmAndBiasTunableOp_float_TN,tn_1024_837_512_ld_512_512_1024,Gemm_Hipblaslt_6377,0.391534
GemmAndBiasTunableOp_float_TN,tn_1024_940_512_ld_512_512_1024,Default,0.430566
GemmAndBiasTunableOp_float_TN,tn_1024_309_512_ld_512_512_1024,Gemm_Hipblaslt_6377,0.156615
GemmAndBiasTunableOp_float_TN,tn_1024_580_512_ld_512_512_1024,Gemm_Hipblaslt_6377,0.290665
GemmAndBiasTunableOp_float_TN,tn_1024_523_512_ld_512_512_1024,Gemm_Hipblaslt_6377,0.251017
GemmAndBiasTunableOp_float_TN,tn_1024_379_512_ld_512_512_1024,Gemm_Hipblaslt_6377,0.17344
GemmAndBiasTunableOp_float_TN,tn_1024_780_512_ld_512_512_1024,Gemm_Hipblaslt_6377,0.38467
GemmAndBiasTunableOp_float_TN,tn_1024_687_512_ld_512_512_1024,Gemm_Hipblaslt_6377,0.329642
GemmAndBiasTunableOp_float_TN,tn_1024_469_512_ld_512_512_1024,Gemm_Hipblaslt_6377,0.237925
GemmAndBiasTunableOp_float_TN,tn_1024_377_512_ld_512_512_1024,Gemm_Hipblaslt_6377,0.185178
GemmAndBiasTunableOp_float_TN,tn_1024_768_512_ld_512_512_1024,Default,0.351885
GemmAndBiasTunableOp_float_TN,tn_1024_454_512_ld_512_512_1024,Gemm_Hipblaslt_6377,0.19748
GemmAndBiasTunableOp_float_TN,tn_1024_787_512_ld_512_512_1024,Default,0.370276
GemmAndBiasTunableOp_float_TN,tn_1024_465_512_ld_512_512_1024,Gemm_Hipblaslt_6377,0.208327
GemmAndBiasTunableOp_float_TN,tn_4_300_256_ld_256_256_4,Gemm_Hipblaslt_6378,0.0126434
GemmAndBiasTunableOp_float_TN,tn_1024_522_512_ld_512_512_1024,Gemm_Hipblaslt_6377,0.243646
GemmAndBiasTunableOp_float_TN,tn_1024_551_512_ld_512_512_1024,Gemm_Hipblaslt_6377,0.280347
GemmAndBiasTunableOp_float_TN,tn_1024_273_512_ld_512_512_1024,Gemm_Hipblaslt_6377,0.146879
GemmAndBiasTunableOp_float_TN,tn_360_426_120_ld_120_120_360,Gemm_Hipblaslt_6377,0.0227732
GemmAndBiasTunableOp_float_TN,tn_1024_565_512_ld_512_512_1024,Gemm_Hipblaslt_6377,0.29243
GemmAndBiasTunableOp_float_TN,tn_1024_482_512_ld_512_512_1024,Gemm_Hipblaslt_6377,0.221002
GemmAndBiasTunableOp_float_TN,tn_256_1_256_ld_256_256_256,Gemm_Hipblaslt_6378,0.0127223
GemmAndBiasTunableOp_float_TN,tn_1024_937_512_ld_512_512_1024,Gemm_Hipblaslt_6377,0.42695
GemmAndBiasTunableOp_float_TN,tn_256_300_1024_ld_1024_1024_256,Gemm_Hipblaslt_6377,0.0814311
GemmAndBiasTunableOp_float_TN,tn_1024_513_512_ld_512_512_1024,Gemm_Hipblaslt_6377,0.250657
GemmAndBiasTunableOp_float_TN,tn_1024_516_512_ld_512_512_1024,Gemm_Hipblaslt_6377,0.245872
GemmAndBiasTunableOp_float_TN,tn_1024_559_512_ld_512_512_1024,Gemm_Hipblaslt_6377,0.269037
GemmAndBiasTunableOp_float_TN,tn_1024_555_512_ld_512_512_1024,Gemm_Hipblaslt_6377,0.279608
GemmAndBiasTunableOp_float_TN,tn_1024_418_512_ld_512_512_1024,Gemm_Hipblaslt_6377,0.192722
GemmAndBiasTunableOp_float_TN,tn_1024_572_512_ld_512_512_1024,Gemm_Hipblaslt_6377,0.279045
GemmAndBiasTunableOp_float_TN,tn_1024_307_512_ld_512_512_1024,Gemm_Hipblaslt_6377,0.159349
GemmAndBiasTunableOp_float_TN,tn_1024_390_512_ld_512_512_1024,Gemm_Hipblaslt_6377,0.177384
GemmAndBiasTunableOp_float_TN,tn_1024_401_512_ld_512_512_1024,Gemm_Hipblaslt_6377,0.187996
GemmAndBiasTunableOp_float_TN,tn_1024_947_512_ld_512_512_1024,Gemm_Hipblaslt_6377,0.434312
GemmAndBiasTunableOp_float_TN,tn_1024_520_512_ld_512_512_1024,Gemm_Hipblaslt_6377,0.256454
GemmAndBiasTunableOp_float_TN,tn_240_318_120_ld_120_120_240,Gemm_Hipblaslt_6377,0.014684
GemmAndBiasTunableOp_float_TN,tn_1024_216_512_ld_512_512_1024,Gemm_Hipblaslt_6379,0.149381
GemmAndBiasTunableOp_float_TN,tn_1024_889_512_ld_512_512_1024,Gemm_Hipblaslt_6377,0.406871
GemmAndBiasTunableOp_float_TN,tn_1024_462_512_ld_512_512_1024,Gemm_Hipblaslt_6377,0.198477
GemmAndBiasTunableOp_float_TN,tn_1024_26_512_ld_512_512_1024,Gemm_Hipblaslt_6377,0.0267315
GemmAndBiasTunableOp_float_TN,tn_1024_494_512_ld_512_512_1024,Gemm_Hipblaslt_6377,0.219674
GemmAndBiasTunableOp_float_TN,tn_1024_212_512_ld_512_512_1024,Gemm_Hipblaslt_6377,0.114695
GemmAndBiasTunableOp_float_TN,tn_1024_269_512_ld_512_512_1024,Gemm_Hipblaslt_6379,0.16598
GemmAndBiasTunableOp_float_TN,tn_120_702_120_ld_120_120_120,Gemm_Hipblaslt_6377,0.0164718
GemmAndBiasTunableOp_float_TN,tn_1024_578_512_ld_512_512_1024,Gemm_Hipblaslt_6377,0.306825
GemmAndBiasTunableOp_float_TN,tn_360_288_120_ld_120_120_360,Gemm_Hipblaslt_6377,0.0175703
GemmAndBiasTunableOp_float_TN,tn_1024_161_512_ld_512_512_1024,Gemm_Hipblaslt_6377,0.0910817
GemmAndBiasTunableOp_float_TN,tn_120_342_240_ld_240_240_120,Gemm_Hipblaslt_6377,0.0163512
GemmAndBiasTunableOp_float_TN,tn_1024_602_512_ld_512_512_1024,Default,0.303208
GemmAndBiasTunableOp_float_TN,tn_1024_646_512_ld_512_512_1024,Gemm_Hipblaslt_6377,0.313398
GemmAndBiasTunableOp_float_TN,tn_1024_951_512_ld_512_512_1024,Gemm_Hipblaslt_6377,0.434995
GemmAndBiasTunableOp_float_TN,tn_1024_508_512_ld_512_512_1024,Gemm_Hipblaslt_6377,0.22587
GemmAndBiasTunableOp_float_TN,tn_1024_484_512_ld_512_512_1024,Gemm_Hipblaslt_6377,0.241086
GemmAndBiasTunableOp_float_TN,tn_1024_716_512_ld_512_512_1024,Gemm_Hipblaslt_6377,0.337274
GemmAndBiasTunableOp_float_TN,tn_1024_332_512_ld_512_512_1024,Gemm_Hipblaslt_6377,0.161006
GemmAndBiasTunableOp_float_TN,tn_1024_518_512_ld_512_512_1024,Gemm_Hipblaslt_6377,0.253863
GemmAndBiasTunableOp_float_TN,tn_1024_503_512_ld_512_512_1024,Gemm_Hipblaslt_6377,0.222147
GemmAndBiasTunableOp_float_TN,tn_120_894_240_ld_240_240_120,Gemm_Hipblaslt_6377,0.0308392
GemmAndBiasTunableOp_float_TN,tn_1024_651_512_ld_512_512_1024,Gemm_Hipblaslt_6377,0.318181
GemmAndBiasTunableOp_float_TN,tn_1024_92_512_ld_512_512_1024,Gemm_Hipblaslt_6377,0.0505679
GemmAndBiasTunableOp_float_TN,tn_1024_398_512_ld_512_512_1024,Gemm_Hipblaslt_6377,0.186918
GemmAndBiasTunableOp_float_TN,tn_1024_306_512_ld_512_512_1024,Gemm_Hipblaslt_6377,0.157458
GemmAndBiasTunableOp_float_TN,tn_1024_618_512_ld_512_512_1024,Default,0.310412
GemmAndBiasTunableOp_float_TN,tn_1024_295_512_ld_512_512_1024,Gemm_Hipblaslt_6377,0.154026
GemmAndBiasTunableOp_float_TN,tn_1024_645_512_ld_512_512_1024,Gemm_Hipblaslt_6377,0.316197
GemmAndBiasTunableOp_float_TN,tn_1024_517_512_ld_512_512_1024,Gemm_Hipblaslt_6377,0.247702
GemmAndBiasTunableOp_float_TN,tn_1024_714_512_ld_512_512_1024,Gemm_Hipblaslt_6377,0.33829
GemmAndBiasTunableOp_float_TN,tn_1024_486_512_ld_512_512_1024,Gemm_Hipblaslt_6377,0.219577
GemmAndBiasTunableOp_float_TN,tn_1024_798_512_ld_512_512_1024,Gemm_Hipblaslt_6377,0.37128
GemmAndBiasTunableOp_float_TN,tn_240_540_120_ld_120_120_240,Gemm_Hipblaslt_6377,0.0196718
GemmAndBiasTunableOp_float_TN,tn_1024_511_512_ld_512_512_1024,Gemm_Hipblaslt_6377,0.230419
GemmAndBiasTunableOp_float_TN,tn_1024_138_512_ld_512_512_1024,Gemm_Hipblaslt_6377,0.0751068
GemmAndBiasTunableOp_float_TN,tn_1024_743_512_ld_512_512_1024,Gemm_Hipblaslt_6377,0.345242
GemmAndBiasTunableOp_float_TN,tn_1024_502_512_ld_512_512_1024,Gemm_Hipblaslt_6377,0.225498
GemmAndBiasTunableOp_float_TN,tn_1024_544_512_ld_512_512_1024,Gemm_Hipblaslt_6377,0.255675
GemmAndBiasTunableOp_float_TN,tn_1024_910_512_ld_512_512_1024,Default,0.415884
GemmAndBiasTunableOp_float_TN,tn_1024_554_512_ld_512_512_1024,Gemm_Hipblaslt_6377,0.27657
GemmAndBiasTunableOp_float_TN,tn_1024_769_512_ld_512_512_1024,Gemm_Hipblaslt_6377,0.360033
GemmAndBiasTunableOp_float_TN,tn_1024_850_512_ld_512_512_1024,Default,0.396393
GemmAndBiasTunableOp_float_TN,tn_1024_696_512_ld_512_512_1024,Gemm_Hipblaslt_6377,0.326339
GemmAndBiasTunableOp_float_TN,tn_1024_568_512_ld_512_512_1024,Gemm_Hipblaslt_6377,0.293804
GemmAndBiasTunableOp_float_TN,tn_1024_717_512_ld_512_512_1024,Gemm_Hipblaslt_6377,0.335692
GemmAndBiasTunableOp_float_TN,tn_1024_491_512_ld_512_512_1024,Gemm_Hipblaslt_6377,0.222763
GemmAndBiasTunableOp_float_TN,tn_1024_485_512_ld_512_512_1024,Gemm_Hipblaslt_6377,0.223001
GemmAndBiasTunableOp_float_TN,tn_1024_632_512_ld_512_512_1024,Gemm_Hipblaslt_6377,0.317315
GemmAndBiasTunableOp_float_TN,tn_240_510_120_ld_120_120_240,Gemm_Hipblaslt_6377,0.018724
GemmAndBiasTunableOp_float_TN,tn_360_408_120_ld_120_120_360,Gemm_Hipblaslt_6377,0.0220931
GemmAndBiasTunableOp_float_TN,tn_120_624_240_ld_240_240_120,Gemm_Hipblaslt_6377,0.023487
GemmAndBiasTunableOp_float_TN,tn_1024_369_512_ld_512_512_1024,Gemm_Hipblaslt_6377,0.18416
GemmAndBiasTunableOp_float_TN,tn_1024_335_512_ld_512_512_1024,Gemm_Hipblaslt_6377,0.162048
GemmAndBiasTunableOp_float_TN,tn_360_306_120_ld_120_120_360,Gemm_Hipblaslt_6377,0.0181766
GemmAndBiasTunableOp_float_TN,tn_1024_367_512_ld_512_512_1024,Gemm_Hipblaslt_6377,0.168437
GemmAndBiasTunableOp_float_TN,tn_1024_744_512_ld_512_512_1024,Gemm_Hipblaslt_6377,0.345492
GemmAndBiasTunableOp_float_TN,tn_1024_352_512_ld_512_512_1024,Gemm_Hipblaslt_6377,0.167516
GemmAndBiasTunableOp_float_TN,tn_1024_365_512_ld_512_512_1024,Gemm_Hipblaslt_6377,0.173875
GemmAndBiasTunableOp_float_TN,tn_120_258_120_ld_120_120_120,Gemm_Hipblaslt_6377,0.0108989
GemmAndBiasTunableOp_float_TN,tn_1024_392_512_ld_512_512_1024,Gemm_Hipblaslt_6377,0.180624
GemmAndBiasTunableOp_float_TN,tn_1024_902_512_ld_512_512_1024,Gemm_Hipblaslt_6377,0.426062
GemmAndBiasTunableOp_float_TN,tn_1024_361_512_ld_512_512_1024,Gemm_Hipblaslt_6377,0.168693
GemmAndBiasTunableOp_float_TN,tn_1024_360_512_ld_512_512_1024,Gemm_Hipblaslt_6377,0.167165
GemmAndBiasTunableOp_float_TN,tn_240_745_120_ld_120_120_240,Gemm_Hipblaslt_6377,0.0249914
GemmAndBiasTunableOp_float_TN,tn_120_420_120_ld_120_120_120,Gemm_Hipblaslt_6377,0.0125364
GemmAndBiasTunableOp_float_TN,tn_1024_478_512_ld_512_512_1024,Gemm_Hipblaslt_6377,0.208119
GemmAndBiasTunableOp_float_TN,tn_1024_673_512_ld_512_512_1024,Gemm_Hipblaslt_6377,0.328552
GemmAndBiasTunableOp_float_TN,tn_1024_315_512_ld_512_512_1024,Gemm_Hipblaslt_6377,0.156841
GemmAndBiasTunableOp_float_TN,tn_1024_928_512_ld_512_512_1024,Default,0.420112
GemmAndBiasTunableOp_float_TN,tn_1024_345_512_ld_512_512_1024,Gemm_Hipblaslt_6377,0.165174
GemmAndBiasTunableOp_float_TN,tn_1024_234_512_ld_512_512_1024,Gemm_Hipblaslt_6377,0.12225
GemmAndBiasTunableOp_float_TN,tn_2_3_200_ld_200_200_2,Gemm_Hipblaslt_6378,0.0118021
GemmAndBiasTunableOp_float_TN,tn_1024_343_512_ld_512_512_1024,Gemm_Hipblaslt_6377,0.165393
GemmAndBiasTunableOp_float_TN,tn_1024_468_512_ld_512_512_1024,Gemm_Hipblaslt_6377,0.221134
GemmAndBiasTunableOp_float_TN,tn_120_268_240_ld_240_240_120,Gemm_Hipblaslt_6377,0.0147057
GemmAndBiasTunableOp_float_TN,tn_1024_397_512_ld_512_512_1024,Gemm_Hipblaslt_6377,0.179814
GemmAndBiasTunableOp_float_TN,tn_1024_342_512_ld_512_512_1024,Gemm_Hipblaslt_6377,0.166403
GemmAndBiasTunableOp_float_TN,tn_120_570_240_ld_240_240_120,Gemm_Hipblaslt_6377,0.0218503
GemmAndBiasTunableOp_float_TN,tn_1024_121_512_ld_512_512_1024,Gemm_Hipblaslt_6377,0.0761095
GemmAndBiasTunableOp_float_TN,tn_1024_800_512_ld_512_512_1024,Gemm_Hipblaslt_6377,0.36982
GemmAndBiasTunableOp_float_TN,tn_240_780_120_ld_120_120_240,Gemm_Hipblaslt_6377,0.0268857
GemmAndBiasTunableOp_float_TN,tn_1024_235_512_ld_512_512_1024,Gemm_Hipblaslt_6377,0.127368
GemmAndBiasTunableOp_float_TN,tn_1024_340_512_ld_512_512_1024,Gemm_Hipblaslt_6377,0.165551
GemmAndBiasTunableOp_float_TN,tn_1024_326_512_ld_512_512_1024,Gemm_Hipblaslt_6377,0.16197
GemmAndBiasTunableOp_float_TN,tn_1024_575_512_ld_512_512_1024,Gemm_Hipblaslt_6377,0.278497
GemmAndBiasTunableOp_float_TN,tn_1024_341_512_ld_512_512_1024,Gemm_Hipblaslt_6377,0.168083
GemmAndBiasTunableOp_float_TN,tn_360_390_120_ld_120_120_360,Gemm_Hipblaslt_6377,0.0242716
GemmAndBiasTunableOp_float_TN,tn_1024_1005_512_ld_512_512_1024,Gemm_Hipblaslt_6377,0.455732
GemmAndBiasTunableOp_float_TN,tn_360_738_120_ld_120_120_360,Gemm_Hipblaslt_6377,0.0357351
GemmAndBiasTunableOp_float_TN,tn_1024_337_512_ld_512_512_1024,Gemm_Hipblaslt_6377,0.160969
GemmAndBiasTunableOp_float_TN,tn_1024_606_512_ld_512_512_1024,Default,0.302285
GemmAndBiasTunableOp_float_TN,tn_512_1_1024_ld_1024_1024_512,Gemm_Hipblaslt_6378,0.0296409
GemmAndBiasTunableOp_float_TN,tn_120_268_120_ld_120_120_120,Gemm_Hipblaslt_6377,0.0110484
GemmAndBiasTunableOp_float_TN,tn_1024_330_512_ld_512_512_1024,Gemm_Hipblaslt_6377,0.16312
GemmAndBiasTunableOp_float_TN,tn_1024_477_512_ld_512_512_1024,Gemm_Hipblaslt_6377,0.213291
GemmAndBiasTunableOp_float_TN,tn_120_564_240_ld_240_240_120,Gemm_Hipblaslt_6376,0.0310552
GemmAndBiasTunableOp_float_TN,tn_1024_258_512_ld_512_512_1024,Gemm_Hipblaslt_6377,0.154073
GemmAndBiasTunableOp_float_TN,tn_1024_604_512_ld_512_512_1024,Gemm_Hipblaslt_6377,0.296095
GemmAndBiasTunableOp_float_TN,tn_1024_719_512_ld_512_512_1024,Default,0.33782
GemmAndBiasTunableOp_float_TN,tn_1024_535_512_ld_512_512_1024,Gemm_Hipblaslt_6377,0.272466
GemmAndBiasTunableOp_float_TN,tn_1024_25_512_ld_512_512_1024,Gemm_Hipblaslt_6377,0.0267434
GemmAndBiasTunableOp_float_TN,tn_1024_427_512_ld_512_512_1024,Gemm_Hipblaslt_6377,0.200088
GemmAndBiasTunableOp_float_TN,tn_1024_325_512_ld_512_512_1024,Gemm_Hipblaslt_6377,0.154562
GemmAndBiasTunableOp_float_TN,tn_1024_280_512_ld_512_512_1024,Gemm_Hipblaslt_6377,0.138042
GemmAndBiasTunableOp_float_TN,tn_1024_821_512_ld_512_512_1024,Default,0.382778
GemmAndBiasTunableOp_float_TN,tn_1024_160_512_ld_512_512_1024,Gemm_Hipblaslt_6377,0.0818255
GemmAndBiasTunableOp_float_TN,tn_1024_176_512_ld_512_512_1024,Gemm_Hipblaslt_6377,0.0924426
GemmAndBiasTunableOp_float_TN,tn_1536_784_512_ld_512_512_1536,Gemm_Hipblaslt_6377,0.51415
GemmAndBiasTunableOp_float_TN,tn_1024_731_512_ld_512_512_1024,Default,0.342306
GemmAndBiasTunableOp_float_TN,tn_1024_423_512_ld_512_512_1024,Gemm_Hipblaslt_6377,0.189604
GemmAndBiasTunableOp_float_TN,tn_360_318_120_ld_120_120_360,Gemm_Hipblaslt_6377,0.0182259
GemmAndBiasTunableOp_float_TN,tn_1024_464_512_ld_512_512_1024,Gemm_Hipblaslt_6377,0.203325
GemmAndBiasTunableOp_float_TN,tn_1024_324_512_ld_512_512_1024,Gemm_Hipblaslt_6377,0.162398
GemmAndBiasTunableOp_float_TN,tn_1024_12_512_ld_512_512_1024,Gemm_Hipblaslt_6378,0.0242941
GemmAndBiasTunableOp_float_TN,tn_2_5_200_ld_200_200_2,Gemm_Hipblaslt_6378,0.011779
GemmAndBiasTunableOp_float_TN,tn_240_591_120_ld_120_120_240,Gemm_Hipblaslt_6377,0.0235247
GemmAndBiasTunableOp_float_TN,tn_1024_75_512_ld_512_512_1024,Gemm_Hipblaslt_6377,0.0425981
GemmAndBiasTunableOp_float_TN,tn_1024_428_512_ld_512_512_1024,Gemm_Hipblaslt_6377,0.208624
GemmAndBiasTunableOp_float_TN,tn_1024_31_512_ld_512_512_1024,Gemm_Hipblaslt_6377,0.026913
GemmAndBiasTunableOp_float_TN,tn_1024_322_512_ld_512_512_1024,Gemm_Hipblaslt_6377,0.161144
GemmAndBiasTunableOp_float_TN,tn_1024_718_512_ld_512_512_1024,Gemm_Hipblaslt_6377,0.336978
GemmAndBiasTunableOp_float_TN,tn_1024_289_512_ld_512_512_1024,Gemm_Hipblaslt_6377,0.169668
GemmAndBiasTunableOp_float_TN,tn_1024_320_512_ld_512_512_1024,Gemm_Hipblaslt_6377,0.157605
GemmAndBiasTunableOp_float_TN,tn_1024_317_512_ld_512_512_1024,Gemm_Hipblaslt_6377,0.159693
GemmAndBiasTunableOp_float_TN,tn_1024_668_512_ld_512_512_1024,Default,0.324274
GemmAndBiasTunableOp_float_TN,tn_1024_777_512_ld_512_512_1024,Gemm_Hipblaslt_6377,0.363125
GemmAndBiasTunableOp_float_TN,tn_1024_896_512_ld_512_512_1024,Gemm_Hipblaslt_6377,0.431091
GemmAndBiasTunableOp_float_TN,tn_1024_18_512_ld_512_512_1024,Gemm_Hipblaslt_6376,0.0267391
GemmAndBiasTunableOp_float_TN,tn_1024_278_512_ld_512_512_1024,Gemm_Hipblaslt_6377,0.143894
GemmAndBiasTunableOp_float_TN,tn_1024_629_512_ld_512_512_1024,Gemm_Hipblaslt_6377,0.312518
GemmAndBiasTunableOp_float_TN,tn_1024_704_512_ld_512_512_1024,Gemm_Hipblaslt_6377,0.334158
GemmAndBiasTunableOp_float_TN,tn_1024_29_512_ld_512_512_1024,Gemm_Hipblaslt_6377,0.0270108
GemmAndBiasTunableOp_float_TN,tn_120_408_240_ld_240_240_120,Gemm_Hipblaslt_6377,0.0179951
GemmAndBiasTunableOp_float_TN,tn_1024_311_512_ld_512_512_1024,Gemm_Hipblaslt_6377,0.173347
GemmAndBiasTunableOp_float_TN,tn_1024_277_512_ld_512_512_1024,Gemm_Hipblaslt_6377,0.153459
GemmAndBiasTunableOp_float_TN,tn_1024_411_512_ld_512_512_1024,Gemm_Hipblaslt_6377,0.204292
GemmAndBiasTunableOp_float_TN,tn_1024_310_512_ld_512_512_1024,Gemm_Hipblaslt_6377,0.157127
GemmAndBiasTunableOp_float_TN,tn_1024_1003_512_ld_512_512_1024,Gemm_Hipblaslt_6377,0.458658
GemmAndBiasTunableOp_float_TN,tn_1024_3_512_ld_512_512_1024,Gemm_Hipblaslt_6378,0.0219397
GemmAndBiasTunableOp_float_TN,tn_1024_540_512_ld_512_512_1024,Gemm_Hipblaslt_6377,0.254606
GemmAndBiasTunableOp_float_TN,tn_1024_260_512_ld_512_512_1024,Gemm_Hipblaslt_6377,0.138424
GemmAndBiasTunableOp_float_TN,tn_1024_308_512_ld_512_512_1024,Gemm_Hipblaslt_6377,0.156629
GemmAndBiasTunableOp_float_TN,tn_1024_373_512_ld_512_512_1024,Gemm_Hipblaslt_6377,0.174172
GemmAndBiasTunableOp_float_TN,tn_1024_705_512_ld_512_512_1024,Gemm_Hipblaslt_6377,0.340987
GemmAndBiasTunableOp_float_TN,tn_1024_362_512_ld_512_512_1024,Gemm_Hipblaslt_6377,0.169204
GemmAndBiasTunableOp_float_TN,tn_1024_301_512_ld_512_512_1024,Gemm_Hipblaslt_6377,0.151676
GemmAndBiasTunableOp_float_TN,tn_1024_621_512_ld_512_512_1024,Gemm_Hipblaslt_6377,0.307026
GemmAndBiasTunableOp_float_TN,tn_1024_560_512_ld_512_512_1024,Gemm_Hipblaslt_6377,0.279163
GemmAndBiasTunableOp_float_TN,tn_120_591_240_ld_240_240_120,Gemm_Hipblaslt_6377,0.0228057
GemmAndBiasTunableOp_float_TN,tn_1024_429_512_ld_512_512_1024,Gemm_Hipblaslt_6377,0.192041
GemmAndBiasTunableOp_float_TN,tn_1024_284_512_ld_512_512_1024,Gemm_Hipblaslt_6377,0.178666
GemmAndBiasTunableOp_float_TN,tn_1024_113_512_ld_512_512_1024,Gemm_Hipblaslt_6377,0.0642027
GemmAndBiasTunableOp_float_TN,tn_1024_715_512_ld_512_512_1024,Gemm_Hipblaslt_6377,0.338182
GemmAndBiasTunableOp_float_TN,tn_1024_957_512_ld_512_512_1024,Gemm_Hipblaslt_6377,0.433641
GemmAndBiasTunableOp_float_TN,tn_1024_271_512_ld_512_512_1024,Gemm_Hipblaslt_6377,0.134744
GemmAndBiasTunableOp_float_TN,tn_1024_789_512_ld_512_512_1024,Gemm_Hipblaslt_6377,0.361046
GemmAndBiasTunableOp_float_TN,tn_1024_448_512_ld_512_512_1024,Gemm_Hipblaslt_6377,0.190528
GemmAndBiasTunableOp_float_TN,tn_120_780_240_ld_240_240_120,Gemm_Hipblaslt_6379,0.0337911
GemmAndBiasTunableOp_float_TN,tn_1024_581_512_ld_512_512_1024,Default,0.294507
GemmAndBiasTunableOp_float_TN,tn_1024_647_512_ld_512_512_1024,Gemm_Hipblaslt_6377,0.315524
GemmAndBiasTunableOp_float_TN,tn_1024_264_512_ld_512_512_1024,Gemm_Hipblaslt_6377,0.132778
GemmAndBiasTunableOp_float_TN,tn_1024_499_512_ld_512_512_1024,Gemm_Hipblaslt_6377,0.229676
GemmAndBiasTunableOp_float_TN,tn_120_591_120_ld_120_120_120,Gemm_Hipblaslt_6377,0.0246993
GemmAndBiasTunableOp_float_TN,tn_256_300_256_ld_256_256_256,Gemm_Hipblaslt_6377,0.0238561
GemmAndBiasTunableOp_float_TN,tn_1024_612_512_ld_512_512_1024,Gemm_Hipblaslt_6377,0.307444
GemmAndBiasTunableOp_float_TN,tn_1024_779_512_ld_512_512_1024,Gemm_Hipblaslt_6377,0.362962
GemmAndBiasTunableOp_float_TN,tn_1024_694_512_ld_512_512_1024,Gemm_Hipblaslt_6377,0.330821
GemmAndBiasTunableOp_float_TN,tn_360_528_120_ld_120_120_360,Gemm_Hipblaslt_6377,0.0261989
GemmAndBiasTunableOp_float_TN,tn_360_212_120_ld_120_120_360,Gemm_Hipblaslt_6377,0.0150948
GemmAndBiasTunableOp_float_TN,tn_1024_386_512_ld_512_512_1024,Gemm_Hipblaslt_6377,0.17624
GemmAndBiasTunableOp_float_TN,tn_240_1050_120_ld_120_120_240,Gemm_Hipblaslt_6377,0.0324001
GemmAndBiasTunableOp_float_TN,tn_1024_370_512_ld_512_512_1024,Gemm_Hipblaslt_6377,0.177722
GemmAndBiasTunableOp_float_TN,tn_1024_226_512_ld_512_512_1024,Gemm_Hipblaslt_6377,0.135244
GemmAndBiasTunableOp_float_TN,tn_1024_986_512_ld_512_512_1024,Default,0.459144
GemmAndBiasTunableOp_float_TN,tn_1024_854_512_ld_512_512_1024,Gemm_Hipblaslt_6377,0.395495
GemmAndBiasTunableOp_float_TN,tn_1024_788_512_ld_512_512_1024,Default,0.373531
GemmAndBiasTunableOp_float_TN,tn_240_330_120_ld_120_120_240,Gemm_Hipblaslt_6377,0.0147321
GemmAndBiasTunableOp_float_TN,tn_120_444_120_ld_120_120_120,Gemm_Hipblaslt_6377,0.0127536
GemmAndBiasTunableOp_float_TN,tn_1024_984_512_ld_512_512_1024,Default,0.460639
GemmAndBiasTunableOp_float_TN,tn_1024_500_512_ld_512_512_1024,Gemm_Hipblaslt_6377,0.25647
GemmAndBiasTunableOp_float_TN,tn_1024_619_512_ld_512_512_1024,Gemm_Hipblaslt_6377,0.307929
GemmAndBiasTunableOp_float_TN,tn_360_810_120_ld_120_120_360,Gemm_Hipblaslt_6377,0.0406276
GemmAndBiasTunableOp_float_TN,tn_1024_141_512_ld_512_512_1024,Gemm_Hipblaslt_6377,0.075203
GemmAndBiasTunableOp_float_TN,tn_1024_1022_512_ld_512_512_1024,Default,0.4768
GemmAndBiasTunableOp_float_TN,tn_2_1_200_ld_200_200_2,Gemm_Hipblaslt_6376,0.0123195
GemmAndBiasTunableOp_float_TN,tn_1024_425_512_ld_512_512_1024,Gemm_Hipblaslt_6377,0.194308
GemmAndBiasTunableOp_float_TN,tn_360_396_120_ld_120_120_360,Gemm_Hipblaslt_6377,0.0214414
GemmAndBiasTunableOp_float_TN,tn_1024_34_512_ld_512_512_1024,Gemm_Hipblaslt_6377,0.0301863
GemmAndBiasTunableOp_float_TN,tn_1024_114_512_ld_512_512_1024,Gemm_Hipblaslt_6377,0.0641511
GemmAndBiasTunableOp_float_TN,tn_1024_263_512_ld_512_512_1024,Gemm_Hipblaslt_6377,0.159395
GemmAndBiasTunableOp_float_TN,tn_1024_416_512_ld_512_512_1024,Gemm_Hipblaslt_6377,0.193811
GemmAndBiasTunableOp_float_TN,tn_1024_56_512_ld_512_512_1024,Gemm_Hipblaslt_6377,0.0370913
GemmAndBiasTunableOp_float_TN,tn_240_360_120_ld_120_120_240,Gemm_Hipblaslt_6377,0.0155132
GemmAndBiasTunableOp_float_TN,tn_1024_41_512_ld_512_512_1024,Gemm_Hipblaslt_6377,0.0304485
GemmAndBiasTunableOp_float_TN,tn_1024_504_512_ld_512_512_1024,Gemm_Hipblaslt_6377,0.229903
GemmAndBiasTunableOp_float_TN,tn_120_1074_120_ld_120_120_120,Gemm_Hipblaslt_6377,0.0207996
GemmAndBiasTunableOp_float_TN,tn_1024_852_512_ld_512_512_1024,Default,0.397381
GemmAndBiasTunableOp_float_TN,tn_1024_275_512_ld_512_512_1024,Gemm_Hipblaslt_6377,0.163504
GemmAndBiasTunableOp_float_TN,tn_1024_338_512_ld_512_512_1024,Gemm_Hipblaslt_6377,0.166516
GemmAndBiasTunableOp_float_TN,tn_360_342_120_ld_120_120_360,Gemm_Hipblaslt_6377,0.0195504
GemmAndBiasTunableOp_float_TN,tn_1024_254_512_ld_512_512_1024,Gemm_Hipblaslt_6377,0.155207
GemmAndBiasTunableOp_float_TN,tn_1024_818_512_ld_512_512_1024,Gemm_Hipblaslt_6377,0.378986
GemmAndBiasTunableOp_float_TN,tn_1024_112_512_ld_512_512_1024,Gemm_Hipblaslt_6377,0.0579353
GemmAndBiasTunableOp_float_TN,tn_1024_686_512_ld_512_512_1024,Default,0.333822
GemmAndBiasTunableOp_float_TN,tn_1024_476_512_ld_512_512_1024,Gemm_Hipblaslt_6377,0.207694
GemmAndBiasTunableOp_float_TN,tn_360_702_120_ld_120_120_360,Gemm_Hipblaslt_6379,0.0433163
GemmAndBiasTunableOp_float_TN,tn_1024_440_512_ld_512_512_1024,Gemm_Hipblaslt_6377,0.190875
GemmAndBiasTunableOp_float_TN,tn_120_318_240_ld_240_240_120,Gemm_Hipblaslt_6377,0.0153926
GemmAndBiasTunableOp_float_TN,tn_1024_833_512_ld_512_512_1024,Default,0.383314
GemmAndBiasTunableOp_float_TN,tn_1024_300_256_ld_256_256_1024,Gemm_Hipblaslt_6377,0.0839571
GemmAndBiasTunableOp_float_TN,tn_240_1074_120_ld_120_120_240,Gemm_Hipblaslt_6377,0.0331596
GemmAndBiasTunableOp_float_TN,tn_120_594_120_ld_120_120_120,Gemm_Hipblaslt_6377,0.0146323
GemmAndBiasTunableOp_float_TN,tn_120_564_120_ld_120_120_120,Gemm_Hipblaslt_6377,0.0221203
GemmAndBiasTunableOp_float_TN,tn_1024_94_512_ld_512_512_1024,Gemm_Hipblaslt_6377,0.0505478
GemmAndBiasTunableOp_float_TN,tn_1024_796_512_ld_512_512_1024,Gemm_Hipblaslt_6377,0.373253
GemmAndBiasTunableOp_float_TN,tn_1024_875_512_ld_512_512_1024,Gemm_Hipblaslt_6377,0.401887
GemmAndBiasTunableOp_float_TN,tn_1024_458_512_ld_512_512_1024,Gemm_Hipblaslt_6377,0.199945
GemmAndBiasTunableOp_float_TN,tn_1024_33_512_ld_512_512_1024,Gemm_Hipblaslt_6377,0.0302212
GemmAndBiasTunableOp_float_TN,tn_1024_109_512_ld_512_512_1024,Gemm_Hipblaslt_6377,0.0571975
GemmAndBiasTunableOp_float_TN,tn_1024_146_512_ld_512_512_1024,Gemm_Hipblaslt_6377,0.0816175
GemmAndBiasTunableOp_float_TN,tn_120_354_120_ld_120_120_120,Gemm_Hipblaslt_6377,0.011846
GemmAndBiasTunableOp_float_TN,tn_120_618_120_ld_120_120_120,Gemm_Hipblaslt_6377,0.0147694
GemmAndBiasTunableOp_float_TN,tn_1024_548_512_ld_512_512_1024,Gemm_Hipblaslt_6377,0.282838
GemmAndBiasTunableOp_float_TN,tn_1024_452_512_ld_512_512_1024,Gemm_Hipblaslt_6377,0.208894
GemmAndBiasTunableOp_float_TN,tn_240_354_120_ld_120_120_240,Gemm_Hipblaslt_6377,0.0157768
GemmAndBiasTunableOp_float_TN,tn_13_1_512_ld_512_512_13,Gemm_Hipblaslt_6378,0.0182239
GemmAndBiasTunableOp_float_TN,tn_1024_393_512_ld_512_512_1024,Gemm_Hipblaslt_6377,0.185377
GemmAndBiasTunableOp_float_TN,tn_1024_15_512_ld_512_512_1024,Gemm_Hipblaslt_6378,0.0225673
GemmAndBiasTunableOp_float_TN,tn_120_264_240_ld_240_240_120,Gemm_Hipblaslt_6377,0.0148326
GemmAndBiasTunableOp_float_TN,tn_120_432_120_ld_120_120_120,Gemm_Hipblaslt_6377,0.0121553
GemmAndBiasTunableOp_float_TN,tn_1024_814_512_ld_512_512_1024,Gemm_Hipblaslt_6377,0.377456
GemmAndBiasTunableOp_float_TN,tn_1024_507_512_ld_512_512_1024,Gemm_Hipblaslt_6377,0.226052
GemmAndBiasTunableOp_float_TN,tn_120_745_240_ld_240_240_120,Gemm_Hipblaslt_6377,0.0263119
GemmAndBiasTunableOp_float_TN,tn_360_252_120_ld_120_120_360,Gemm_Hipblaslt_6377,0.0161977
GemmAndBiasTunableOp_float_TN,tn_1024_457_512_ld_512_512_1024,Gemm_Hipblaslt_6377,0.201059
GemmAndBiasTunableOp_float_TN,tn_1024_187_512_ld_512_512_1024,Gemm_Hipblaslt_6377,0.099641
GemmAndBiasTunableOp_float_TN,tn_1024_832_512_ld_512_512_1024,Default,0.389689
GemmAndBiasTunableOp_float_TN,tn_120_492_120_ld_120_120_120,Gemm_Hipblaslt_6377,0.0133495
GemmAndBiasTunableOp_float_TN,tn_1024_191_512_ld_512_512_1024,Gemm_Hipblaslt_6377,0.0986271
GemmAndBiasTunableOp_float_TN,tn_120_216_240_ld_240_240_120,Gemm_Hipblaslt_6379,0.0200565
GemmAndBiasTunableOp_float_TN,tn_360_745_120_ld_120_120_360,Gemm_Hipblaslt_6377,0.0354855
GemmAndBiasTunableOp_float_TN,tn_360_516_120_ld_120_120_360,Gemm_Hipblaslt_6377,0.0264726
GemmAndBiasTunableOp_float_TN,tn_1024_127_512_ld_512_512_1024,Gemm_Hipblaslt_6377,0.0670269
GemmAndBiasTunableOp_float_TN,tn_240_252_120_ld_120_120_240,Gemm_Hipblaslt_6377,0.0127884
GemmAndBiasTunableOp_float_TN,tn_1024_407_512_ld_512_512_1024,Gemm_Hipblaslt_6377,0.185946
GemmAndBiasTunableOp_float_TN,tn_1024_8_512_ld_512_512_1024,Gemm_Hipblaslt_6378,0.0221553
GemmAndBiasTunableOp_float_TN,tn_120_288_120_ld_120_120_120,Gemm_Hipblaslt_6377,0.0109742
GemmAndBiasTunableOp_float_TN,tn_120_392_120_ld_120_120_120,Gemm_Hipblaslt_6377,0.0116419
GemmAndBiasTunableOp_float_TN,tn_1024_372_512_ld_512_512_1024,Gemm_Hipblaslt_6377,0.173588
GemmAndBiasTunableOp_float_TN,tn_120_930_240_ld_240_240_120,Gemm_Hipblaslt_6377,0.0312704
GemmAndBiasTunableOp_float_TN,tn_1024_760_512_ld_512_512_1024,Gemm_Hipblaslt_6377,0.352894
GemmAndBiasTunableOp_float_TN,tn_240_288_120_ld_120_120_240,Gemm_Hipblaslt_6377,0.0134914
GemmAndBiasTunableOp_float_TN,tn_1024_117_512_ld_512_512_1024,Gemm_Hipblaslt_6377,0.0635006
GemmAndBiasTunableOp_float_TN,tn_1024_992_512_ld_512_512_1024,Default,0.470417
GemmAndBiasTunableOp_float_TN,tn_1024_453_512_ld_512_512_1024,Gemm_Hipblaslt_6377,0.20978
GemmAndBiasTunableOp_float_TN,tn_120_212_120_ld_120_120_120,Gemm_Hipblaslt_6377,0.0108155
GemmAndBiasTunableOp_float_TN,tn_1024_132_512_ld_512_512_1024,Gemm_Hipblaslt_6377,0.0741311
GemmAndBiasTunableOp_float_TN,tn_240_402_120_ld_120_120_240,Gemm_Hipblaslt_6377,0.0165315
GemmAndBiasTunableOp_float_TN,tn_1024_210_512_ld_512_512_1024,Gemm_Hipblaslt_6377,0.121624
GemmAndBiasTunableOp_float_TN,tn_1024_28_512_ld_512_512_1024,Gemm_Hipblaslt_6377,0.0269142
GemmAndBiasTunableOp_float_TN,tn_360_1074_120_ld_120_120_360,Gemm_Hipblaslt_6377,0.0475117
GemmAndBiasTunableOp_float_TN,tn_1024_150_512_ld_512_512_1024,Gemm_Hipblaslt_6377,0.0810148
GemmAndBiasTunableOp_float_TN,tn_1024_53_512_ld_512_512_1024,Gemm_Hipblaslt_6377,0.0366822
GemmAndBiasTunableOp_float_TN,tn_120_306_120_ld_120_120_120,Gemm_Hipblaslt_6377,0.0110901
GemmAndBiasTunableOp_float_TN,tn_120_426_120_ld_120_120_120,Gemm_Hipblaslt_6377,0.0125497
GemmAndBiasTunableOp_float_TN,tn_1024_314_512_ld_512_512_1024,Gemm_Hipblaslt_6377,0.156516
GemmAndBiasTunableOp_float_TN,tn_120_402_120_ld_120_120_120,Gemm_Hipblaslt_6377,0.0123893
GemmAndBiasTunableOp_float_TN,tn_1024_154_512_ld_512_512_1024,Gemm_Hipblaslt_6377,0.081373
GemmAndBiasTunableOp_float_TN,tn_360_786_120_ld_120_120_360,Gemm_Hipblaslt_6377,0.0403315
GemmAndBiasTunableOp_float_TN,tn_120_264_120_ld_120_120_120,Gemm_Hipblaslt_6377,0.0109795
GemmAndBiasTunableOp_float_TN,tn_1024_514_512_ld_512_512_1024,Gemm_Hipblaslt_6377,0.251657
GemmAndBiasTunableOp_float_TN,tn_120_402_240_ld_240_240_120,Gemm_Hipblaslt_6377,0.0180019
GemmAndBiasTunableOp_float_TN,tn_240_420_120_ld_120_120_240,Gemm_Hipblaslt_6377,0.0171575
GemmAndBiasTunableOp_float_TN,tn_1024_220_512_ld_512_512_1024,Gemm_Hipblaslt_6377,0.125566
GemmAndBiasTunableOp_float_TN,tn_360_618_120_ld_120_120_360,Gemm_Hipblaslt_6377,0.0300173
GemmAndBiasTunableOp_float_TN,tn_1024_449_512_ld_512_512_1024,Gemm_Hipblaslt_6377,0.202362
GemmAndBiasTunableOp_float_TN,tn_120_336_120_ld_120_120_120,Gemm_Hipblaslt_6377,0.0115182
GemmAndBiasTunableOp_float_TN,tn_120_510_240_ld_240_240_120,Gemm_Hipblaslt_6377,0.02022
GemmAndBiasTunableOp_float_TN,tn_1024_997_512_ld_512_512_1024,Default,0.461173
GemmAndBiasTunableOp_float_TN,tn_256_400_256_ld_256_256_256,Gemm_Hipblaslt_6377,0.0279269
GemmAndBiasTunableOp_float_TN,tn_1024_702_512_ld_512_512_1024,Gemm_Hipblaslt_6377,0.331538
GemmAndBiasTunableOp_float_TN,tn_1024_71_512_ld_512_512_1024,Gemm_Hipblaslt_6377,0.0423598
GemmAndBiasTunableOp_float_TN,tn_1024_97_512_ld_512_512_1024,Gemm_Hipblaslt_6377,0.057876
GemmAndBiasTunableOp_float_TN,tn_1024_408_512_ld_512_512_1024,Gemm_Hipblaslt_6377,0.184366
GemmAndBiasTunableOp_float_TN,tn_1024_853_512_ld_512_512_1024,Gemm_Hipblaslt_6377,0.388296
GemmAndBiasTunableOp_float_TN,tn_1024_188_512_ld_512_512_1024,Gemm_Hipblaslt_6377,0.0985578
GemmAndBiasTunableOp_float_TN,tn_1024_690_512_ld_512_512_1024,Default,0.348125
GemmAndBiasTunableOp_float_TN,tn_1024_319_512_ld_512_512_1024,Gemm_Hipblaslt_6377,0.160001
GemmAndBiasTunableOp_float_TN,tn_360_894_120_ld_120_120_360,Gemm_Hipblaslt_6379,0.0717208
GemmAndBiasTunableOp_float_TN,tn_1024_380_512_ld_512_512_1024,Gemm_Hipblaslt_6377,0.172372
GemmAndBiasTunableOp_float_TN,tn_1024_413_512_ld_512_512_1024,Gemm_Hipblaslt_6377,0.18834
GemmAndBiasTunableOp_float_TN,tn_120_212_240_ld_240_240_120,Gemm_Hipblaslt_6377,0.0143149
GemmAndBiasTunableOp_float_TN,tn_1024_625_512_ld_512_512_1024,Gemm_Hipblaslt_6377,0.311532
GemmAndBiasTunableOp_float_TN,tn_360_606_120_ld_120_120_360,Gemm_Hipblaslt_6376,0.0427913
GemmAndBiasTunableOp_float_TN,tn_120_252_120_ld_120_120_120,Gemm_Hipblaslt_6377,0.0108752
GemmAndBiasTunableOp_float_TN,tn_1024_443_512_ld_512_512_1024,Gemm_Hipblaslt_6377,0.190951
GemmAndBiasTunableOp_float_TN,tn_360_1050_120_ld_120_120_360,Gemm_Hipblaslt_6377,0.0446885
GemmAndBiasTunableOp_float_TN,tn_1024_839_512_ld_512_512_1024,Gemm_Hipblaslt_6377,0.384663
GemmAndBiasTunableOp_float_TN,tn_1024_546_512_ld_512_512_1024,Gemm_Hipblaslt_6377,0.265852
GemmAndBiasTunableOp_float_TN,tn_1024_460_512_ld_512_512_1024,Gemm_Hipblaslt_6377,0.200004
GemmAndBiasTunableOp_float_TN,tn_1024_252_512_ld_512_512_1024,Gemm_Hipblaslt_6377,0.125275
GemmAndBiasTunableOp_float_TN,tn_1024_923_512_ld_512_512_1024,Gemm_Hipblaslt_6377,0.419085
GemmAndBiasTunableOp_float_TN,tn_1024_762_512_ld_512_512_1024,Default,0.359689
GemmAndBiasTunableOp_float_TN,tn_360_420_120_ld_120_120_360,Gemm_Hipblaslt_6377,0.0228725
GemmAndBiasTunableOp_float_TN,tn_1024_199_512_ld_512_512_1024,Gemm_Hipblaslt_6377,0.108749
GemmAndBiasTunableOp_float_TN,tn_1024_590_512_ld_512_512_1024,Gemm_Hipblaslt_6377,0.300344
GemmAndBiasTunableOp_float_TN,tn_120_360_120_ld_120_120_120,Gemm_Hipblaslt_6377,0.0117243
GemmAndBiasTunableOp_float_TN,tn_1024_145_512_ld_512_512_1024,Gemm_Hipblaslt_6377,0.0829768
GemmAndBiasTunableOp_float_TN,tn_240_432_120_ld_120_120_240,Gemm_Hipblaslt_6377,0.017488
GemmAndBiasTunableOp_float_TN,tn_1024_294_512_ld_512_512_1024,Gemm_Hipblaslt_6377,0.151723
GemmAndBiasTunableOp_float_TN,tn_120_330_120_ld_120_120_120,Gemm_Hipblaslt_6377,0.0112248
GemmAndBiasTunableOp_float_TN,tn_120_540_120_ld_120_120_120,Gemm_Hipblaslt_6377,0.0137699
GemmAndBiasTunableOp_float_TN,tn_360_510_120_ld_120_120_360,Gemm_Hipblaslt_6377,0.0258049
GemmAndBiasTunableOp_float_TN,tn_1024_432_512_ld_512_512_1024,Gemm_Hipblaslt_6377,0.200226
GemmAndBiasTunableOp_float_TN,tn_1024_1021_512_ld_512_512_1024,Gemm_Hipblaslt_6377,0.467418
GemmAndBiasTunableOp_float_TN,tn_240_624_120_ld_120_120_240,Gemm_Hipblaslt_6377,0.0273738
GemmAndBiasTunableOp_float_TN,tn_120_618_240_ld_240_240_120,Gemm_Hipblaslt_6377,0.0227531
GemmAndBiasTunableOp_float_TN,tn_1024_926_512_ld_512_512_1024,Gemm_Hipblaslt_6377,0.422182
GemmAndBiasTunableOp_float_TN,tn_1024_135_512_ld_512_512_1024,Gemm_Hipblaslt_6377,0.0755557
GemmAndBiasTunableOp_float_TN,tn_1024_59_512_ld_512_512_1024,Gemm_Hipblaslt_6377,0.0373426
GemmAndBiasTunableOp_float_TN,tn_1024_60_512_ld_512_512_1024,Gemm_Hipblaslt_6377,0.0371037
GemmAndBiasTunableOp_float_TN,tn_1024_347_512_ld_512_512_1024,Gemm_Hipblaslt_6377,0.168415
GemmAndBiasTunableOp_float_TN,tn_1024_459_512_ld_512_512_1024,Gemm_Hipblaslt_6377,0.199121
GemmAndBiasTunableOp_float_TN,tn_1024_805_512_ld_512_512_1024,Default,0.373336
GemmAndBiasTunableOp_float_TN,tn_1024_192_512_ld_512_512_1024,Gemm_Hipblaslt_6377,0.100498
GemmAndBiasTunableOp_float_TN,tn_1024_62_512_ld_512_512_1024,Gemm_Hipblaslt_6377,0.0367599
GemmAndBiasTunableOp_float_TN,tn_1024_175_512_ld_512_512_1024,Gemm_Hipblaslt_6377,0.089358
GemmAndBiasTunableOp_float_TN,tn_1024_63_512_ld_512_512_1024,Gemm_Hipblaslt_6377,0.0367583
GemmAndBiasTunableOp_float_TN,tn_1024_415_512_ld_512_512_1024,Gemm_Hipblaslt_6377,0.192361
GemmAndBiasTunableOp_float_TN,tn_1024_172_512_ld_512_512_1024,Gemm_Hipblaslt_6377,0.0923929
GemmAndBiasTunableOp_float_TN,tn_1024_847_512_ld_512_512_1024,Gemm_Hipblaslt_6377,0.382915
GemmAndBiasTunableOp_float_TN,tn_360_540_120_ld_120_120_360,Gemm_Hipblaslt_6377,0.0271723
GemmAndBiasTunableOp_float_TN,tn_1024_155_512_ld_512_512_1024,Gemm_Hipblaslt_6377,0.0819513
GemmAndBiasTunableOp_float_TN,tn_1024_519_512_ld_512_512_1024,Gemm_Hipblaslt_6377,0.262519
GemmAndBiasTunableOp_float_TN,tn_1024_65_512_ld_512_512_1024,Gemm_Hipblaslt_6377,0.0420575
GemmAndBiasTunableOp_float_TN,tn_1024_745_512_ld_512_512_1024,Gemm_Hipblaslt_6377,0.342746
GemmAndBiasTunableOp_float_TN,tn_360_570_120_ld_120_120_360,Gemm_Hipblaslt_6377,0.0287797
GemmAndBiasTunableOp_float_TN,tn_1024_228_512_ld_512_512_1024,Gemm_Hipblaslt_6377,0.154004
GemmAndBiasTunableOp_float_TN,tn_1024_67_512_ld_512_512_1024,Gemm_Hipblaslt_6377,0.0424382
GemmAndBiasTunableOp_float_TN,tn_1024_68_512_ld_512_512_1024,Gemm_Hipblaslt_6377,0.0422218
GemmAndBiasTunableOp_float_TN,tn_1024_291_512_ld_512_512_1024,Gemm_Hipblaslt_6377,0.147209
GemmAndBiasTunableOp_float_TN,tn_1024_677_512_ld_512_512_1024,Gemm_Hipblaslt_6377,0.327597
GemmAndBiasTunableOp_float_TN,tn_1024_69_512_ld_512_512_1024,Gemm_Hipblaslt_6377,0.0421317
GemmAndBiasTunableOp_float_TN,tn_1024_72_512_ld_512_512_1024,Gemm_Hipblaslt_6377,0.0422719
GemmAndBiasTunableOp_float_TN,tn_1024_628_512_ld_512_512_1024,Gemm_Hipblaslt_6377,0.313898
GemmAndBiasTunableOp_float_TN,tn_1024_400_256_ld_256_256_1024,Gemm_Hipblaslt_6377,0.0916396
GemmAndBiasTunableOp_float_TN,tn_1024_272_512_ld_512_512_1024,Gemm_Hipblaslt_6377,0.130976
GemmAndBiasTunableOp_float_TN,tn_1024_707_512_ld_512_512_1024,Default,0.34578
GemmAndBiasTunableOp_float_TN,tn_1024_73_512_ld_512_512_1024,Gemm_Hipblaslt_6377,0.042729
GemmAndBiasTunableOp_float_TN,tn_1024_391_512_ld_512_512_1024,Gemm_Hipblaslt_6377,0.177679
GemmAndBiasTunableOp_float_TN,tn_240_492_120_ld_120_120_240,Gemm_Hipblaslt_6377,0.0188066
GemmAndBiasTunableOp_float_TN,tn_1024_76_512_ld_512_512_1024,Gemm_Hipblaslt_6377,0.0423003
GemmAndBiasTunableOp_float_TN,tn_1024_998_512_ld_512_512_1024,Default,0.464708
GemmAndBiasTunableOp_float_TN,tn_1024_782_512_ld_512_512_1024,Default,0.365398
GemmAndBiasTunableOp_float_TN,tn_1024_35_512_ld_512_512_1024,Gemm_Hipblaslt_6377,0.0305847
GemmAndBiasTunableOp_float_TN,tn_1024_77_512_ld_512_512_1024,Gemm_Hipblaslt_6377,0.0430141
GemmAndBiasTunableOp_float_TN,tn_1024_366_512_ld_512_512_1024,Gemm_Hipblaslt_6377,0.169097
GemmAndBiasTunableOp_float_TN,tn_1024_644_512_ld_512_512_1024,Default,0.329143
GemmAndBiasTunableOp_float_TN,tn_1024_904_512_ld_512_512_1024,Gemm_Hipblaslt_6377,0.415831
GemmAndBiasTunableOp_float_TN,tn_1024_79_512_ld_512_512_1024,Gemm_Hipblaslt_6377,0.042526
GemmAndBiasTunableOp_float_TN,tn_1024_82_512_ld_512_512_1024,Gemm_Hipblaslt_6377,0.0504657
GemmAndBiasTunableOp_float_TN,tn_360_336_120_ld_120_120_360,Gemm_Hipblaslt_6377,0.0193671
GemmAndBiasTunableOp_float_TN,tn_1024_83_512_ld_512_512_1024,Gemm_Hipblaslt_6377,0.0505695
GemmAndBiasTunableOp_float_TN,tn_1024_84_512_ld_512_512_1024,Gemm_Hipblaslt_6377,0.0504669
GemmAndBiasTunableOp_float_TN,tn_1024_550_512_ld_512_512_1024,Gemm_Hipblaslt_6377,0.262985
GemmAndBiasTunableOp_float_TN,tn_1024_282_512_ld_512_512_1024,Gemm_Hipblaslt_6377,0.150544
GemmAndBiasTunableOp_float_TN,tn_1024_85_512_ld_512_512_1024,Gemm_Hipblaslt_6377,0.0508203
GemmAndBiasTunableOp_float_TN,tn_1024_86_512_ld_512_512_1024,Gemm_Hipblaslt_6377,0.0507947
GemmAndBiasTunableOp_float_TN,tn_1024_611_512_ld_512_512_1024,Gemm_Hipblaslt_6377,0.301097
GemmAndBiasTunableOp_float_TN,tn_120_282_120_ld_120_120_120,Gemm_Hipblaslt_6379,0.0127263
GemmAndBiasTunableOp_float_TN,tn_120_468_240_ld_240_240_120,Gemm_Hipblaslt_6377,0.0196671
GemmAndBiasTunableOp_float_TN,tn_1024_43_512_ld_512_512_1024,Gemm_Hipblaslt_6377,0.0304986
GemmAndBiasTunableOp_float_TN,tn_256_1_512_ld_512_512_256,Gemm_Hipblaslt_6378,0.0180295
GemmAndBiasTunableOp_float_TN,tn_1024_87_512_ld_512_512_1024,Gemm_Hipblaslt_6377,0.0505971
GemmAndBiasTunableOp_float_TN,tn_1024_201_512_ld_512_512_1024,Gemm_Hipblaslt_6377,0.115847
GemmAndBiasTunableOp_float_TN,tn_1024_90_512_ld_512_512_1024,Gemm_Hipblaslt_6377,0.0520876
GemmAndBiasTunableOp_float_TN,tn_1024_865_512_ld_512_512_1024,Gemm_Hipblaslt_6377,0.397993
GemmAndBiasTunableOp_float_TN,tn_1024_417_512_ld_512_512_1024,Gemm_Hipblaslt_6377,0.1914
GemmAndBiasTunableOp_float_TN,tn_1024_91_512_ld_512_512_1024,Gemm_Hipblaslt_6377,0.0506111
GemmAndBiasTunableOp_float_TN,tn_1024_793_512_ld_512_512_1024,Default,0.368511
GemmAndBiasTunableOp_float_TN,tn_1024_221_512_ld_512_512_1024,Gemm_Hipblaslt_6377,0.125647
GemmAndBiasTunableOp_float_TN,tn_1024_585_512_ld_512_512_1024,Gemm_Hipblaslt_6377,0.299276
GemmAndBiasTunableOp_float_TN,tn_360_330_120_ld_120_120_360,Gemm_Hipblaslt_6377,0.0191588
GemmAndBiasTunableOp_float_TN,tn_1024_706_512_ld_512_512_1024,Default,0.340417
GemmAndBiasTunableOp_float_TN,tn_1024_529_512_ld_512_512_1024,Gemm_Hipblaslt_6377,0.273105
GemmAndBiasTunableOp_float_TN,tn_1024_93_512_ld_512_512_1024,Gemm_Hipblaslt_6377,0.0511205
GemmAndBiasTunableOp_float_TN,tn_1024_566_512_ld_512_512_1024,Gemm_Hipblaslt_6377,0.28828
GemmAndBiasTunableOp_float_TN,tn_1024_433_512_ld_512_512_1024,Gemm_Hipblaslt_6377,0.200078
GemmAndBiasTunableOp_float_TN,tn_512_784_1024_ld_1024_1024_512,Gemm_Hipblaslt_6377,0.360793
GemmAndBiasTunableOp_float_TN,tn_1024_99_512_ld_512_512_1024,Gemm_Hipblaslt_6377,0.0579337
GemmAndBiasTunableOp_float_TN,tn_1024_101_512_ld_512_512_1024,Gemm_Hipblaslt_6377,0.0578576
GemmAndBiasTunableOp_float_TN,tn_120_408_120_ld_120_120_120,Gemm_Hipblaslt_6377,0.0123388
GemmAndBiasTunableOp_float_TN,tn_1024_526_512_ld_512_512_1024,Gemm_Hipblaslt_6377,0.244009
GemmAndBiasTunableOp_float_TN,tn_1024_244_512_ld_512_512_1024,Gemm_Hipblaslt_6377,0.139159
GemmAndBiasTunableOp_float_TN,tn_1024_610_512_ld_512_512_1024,Gemm_Hipblaslt_6377,0.299611
GemmAndBiasTunableOp_float_TN,tn_1024_430_512_ld_512_512_1024,Gemm_Hipblaslt_6377,0.194569
GemmAndBiasTunableOp_float_TN,tn_1024_102_512_ld_512_512_1024,Gemm_Hipblaslt_6377,0.057527
GemmAndBiasTunableOp_float_TN,tn_1024_925_512_ld_512_512_1024,Gemm_Hipblaslt_6377,0.418996
GemmAndBiasTunableOp_float_TN,tn_1024_81_512_ld_512_512_1024,Gemm_Hipblaslt_6377,0.0506777
GemmAndBiasTunableOp_float_TN,tn_1024_466_512_ld_512_512_1024,Gemm_Hipblaslt_6377,0.20631
GemmAndBiasTunableOp_float_TN,tn_1024_103_512_ld_512_512_1024,Gemm_Hipblaslt_6377,0.0579397
GemmAndBiasTunableOp_float_TN,tn_1024_164_512_ld_512_512_1024,Gemm_Hipblaslt_6377,0.0903279
GemmAndBiasTunableOp_float_TN,tn_120_318_120_ld_120_120_120,Gemm_Hipblaslt_6377,0.0113173
GemmAndBiasTunableOp_float_TN,tn_1024_104_512_ld_512_512_1024,Gemm_Hipblaslt_6377,0.0576617
GemmAndBiasTunableOp_float_TN,tn_1024_569_512_ld_512_512_1024,Gemm_Hipblaslt_6377,0.294571
GemmAndBiasTunableOp_float_TN,tn_1024_766_512_ld_512_512_1024,Gemm_Hipblaslt_6377,0.354288
GemmAndBiasTunableOp_float_TN,tn_360_624_120_ld_120_120_360,Gemm_Hipblaslt_6377,0.0318055
GemmAndBiasTunableOp_float_TN,tn_1024_547_512_ld_512_512_1024,Gemm_Hipblaslt_6377,0.282899
GemmAndBiasTunableOp_float_TN,tn_1024_32_512_ld_512_512_1024,Gemm_Hipblaslt_6377,0.0267768
GemmAndBiasTunableOp_float_TN,tn_120_738_120_ld_120_120_120,Gemm_Hipblaslt_6377,0.0162609
GemmAndBiasTunableOp_float_TN,tn_1024_106_512_ld_512_512_1024,Gemm_Hipblaslt_6377,0.057723
GemmAndBiasTunableOp_float_TN,tn_1024_959_512_ld_512_512_1024,Default,0.436977
GemmAndBiasTunableOp_float_TN,tn_1024_108_512_ld_512_512_1024,Gemm_Hipblaslt_6377,0.0572649
GemmAndBiasTunableOp_float_TN,tn_240_894_120_ld_120_120_240,Gemm_Hipblaslt_6377,0.0321099
GemmAndBiasTunableOp_float_TN,tn_240_702_120_ld_120_120_240,Gemm_Hipblaslt_6379,0.0336237
GemmAndBiasTunableOp_float_TN,tn_1024_111_512_ld_512_512_1024,Gemm_Hipblaslt_6377,0.0582711
GemmAndBiasTunableOp_float_TN,tn_1024_118_512_ld_512_512_1024,Gemm_Hipblaslt_6377,0.0636645
GemmAndBiasTunableOp_float_TN,tn_1024_627_512_ld_512_512_1024,Default,0.328113
GemmAndBiasTunableOp_float_TN,tn_1024_815_512_ld_512_512_1024,Default,0.385894
GemmAndBiasTunableOp_float_TN,tn_1024_120_512_ld_512_512_1024,Gemm_Hipblaslt_6377,0.0641602
GemmAndBiasTunableOp_float_TN,tn_1024_122_512_ld_512_512_1024,Gemm_Hipblaslt_6377,0.0640444
GemmAndBiasTunableOp_float_TN,tn_1024_725_512_ld_512_512_1024,Gemm_Hipblaslt_6377,0.340485
GemmAndBiasTunableOp_float_TN,tn_1024_901_512_ld_512_512_1024,Gemm_Hipblaslt_6377,0.415443
GemmAndBiasTunableOp_float_TN,tn_120_384_120_ld_120_120_120,Gemm_Hipblaslt_6377,0.0176439
GemmAndBiasTunableOp_float_TN,tn_1024_302_512_ld_512_512_1024,Gemm_Hipblaslt_6377,0.15088
GemmAndBiasTunableOp_float_TN,tn_1024_182_512_ld_512_512_1024,Gemm_Hipblaslt_6377,0.0995745
GemmAndBiasTunableOp_float_TN,tn_1024_169_512_ld_512_512_1024,Gemm_Hipblaslt_6379,0.111175
GemmAndBiasTunableOp_float_TN,tn_1024_727_512_ld_512_512_1024,Gemm_Hipblaslt_6377,0.336086
GemmAndBiasTunableOp_float_TN,tn_1024_179_512_ld_512_512_1024,Gemm_Hipblaslt_6377,0.0983566
GemmAndBiasTunableOp_float_TN,tn_256_400_1024_ld_1024_1024_256,Gemm_Hipblaslt_6377,0.0962442
GemmAndBiasTunableOp_float_TN,tn_1024_123_512_ld_512_512_1024,Gemm_Hipblaslt_6377,0.0639179
GemmAndBiasTunableOp_float_TN,tn_1024_125_512_ld_512_512_1024,Gemm_Hipblaslt_6377,0.0634658
GemmAndBiasTunableOp_float_TN,tn_120_372_120_ld_120_120_120,Gemm_Hipblaslt_6377,0.0119168
GemmAndBiasTunableOp_float_TN,tn_1024_128_512_ld_512_512_1024,Gemm_Hipblaslt_6377,0.0642608
GemmAndBiasTunableOp_float_TN,tn_1024_129_512_ld_512_512_1024,Gemm_Hipblaslt_6377,0.074874
GemmAndBiasTunableOp_float_TN,tn_1024_130_512_ld_512_512_1024,Gemm_Hipblaslt_6377,0.0747534
GemmAndBiasTunableOp_float_TN,tn_1024_591_512_ld_512_512_1024,Gemm_Hipblaslt_6377,0.303081
GemmAndBiasTunableOp_float_TN,tn_1024_119_512_ld_512_512_1024,Gemm_Hipblaslt_6377,0.064214
GemmAndBiasTunableOp_float_TN,tn_240_426_120_ld_120_120_240,Gemm_Hipblaslt_6377,0.0172
GemmAndBiasTunableOp_float_TN,tn_1024_116_512_ld_512_512_1024,Gemm_Hipblaslt_6377,0.0638024
GemmAndBiasTunableOp_float_TN,tn_1024_246_512_ld_512_512_1024,Gemm_Hipblaslt_6377,0.230255
GemmAndBiasTunableOp_float_TN,tn_1024_131_512_ld_512_512_1024,Gemm_Hipblaslt_6377,0.0744072
GemmAndBiasTunableOp_float_TN,tn_1024_991_512_ld_512_512_1024,Gemm_Hipblaslt_6377,0.446046
GemmAndBiasTunableOp_float_TN,tn_1024_424_512_ld_512_512_1024,Gemm_Hipblaslt_6377,0.190146
GemmAndBiasTunableOp_float_TN,tn_1024_133_512_ld_512_512_1024,Gemm_Hipblaslt_6377,0.0757745
GemmAndBiasTunableOp_float_TN,tn_120_420_240_ld_240_240_120,Gemm_Hipblaslt_6377,0.0180708
GemmAndBiasTunableOp_float_TN,tn_1024_134_512_ld_512_512_1024,Gemm_Hipblaslt_6377,0.0751906
GemmAndBiasTunableOp_float_TN,tn_1024_446_512_ld_512_512_1024,Gemm_Hipblaslt_6377,0.190848
GemmAndBiasTunableOp_float_TN,tn_1024_974_512_ld_512_512_1024,Gemm_Hipblaslt_6377,0.4539
GemmAndBiasTunableOp_float_TN,tn_120_360_240_ld_240_240_120,Gemm_Hipblaslt_6377,0.0165696
GemmAndBiasTunableOp_float_TN,tn_1024_165_512_ld_512_512_1024,Gemm_Hipblaslt_6377,0.0887288
GemmAndBiasTunableOp_float_TN,tn_1024_136_512_ld_512_512_1024,Gemm_Hipblaslt_6377,0.0759764
GemmAndBiasTunableOp_float_TN,tn_1024_358_512_ld_512_512_1024,Gemm_Hipblaslt_6377,0.17096
GemmAndBiasTunableOp_float_TN,tn_1024_137_512_ld_512_512_1024,Gemm_Hipblaslt_6377,0.0754671
GemmAndBiasTunableOp_float_TN,tn_1024_139_512_ld_512_512_1024,Gemm_Hipblaslt_6377,0.0757083
GemmAndBiasTunableOp_float_TN,tn_120_426_240_ld_240_240_120,Gemm_Hipblaslt_6377,0.0180879
GemmAndBiasTunableOp_float_TN,tn_1024_346_512_ld_512_512_1024,Gemm_Hipblaslt_6377,0.183506
GemmAndBiasTunableOp_float_TN,tn_1024_971_512_ld_512_512_1024,Gemm_Hipblaslt_6377,0.451053
GemmAndBiasTunableOp_float_TN,tn_1024_180_512_ld_512_512_1024,Gemm_Hipblaslt_6377,0.0956839
GemmAndBiasTunableOp_float_TN,tn_1024_147_512_ld_512_512_1024,Gemm_Hipblaslt_6377,0.0800658
GemmAndBiasTunableOp_float_TN,tn_1024_239_512_ld_512_512_1024,Gemm_Hipblaslt_6377,0.133397
GemmAndBiasTunableOp_float_TN,tn_1024_183_512_ld_512_512_1024,Gemm_Hipblaslt_6377,0.0996021
GemmAndBiasTunableOp_float_TN,tn_1024_863_512_ld_512_512_1024,Default,0.394594
GemmAndBiasTunableOp_float_TN,tn_1024_729_512_ld_512_512_1024,Gemm_Hipblaslt_6377,0.341207
GemmAndBiasTunableOp_float_TN,tn_1024_151_512_ld_512_512_1024,Gemm_Hipblaslt_6377,0.0854355
GemmAndBiasTunableOp_float_TN,tn_120_330_240_ld_240_240_120,Gemm_Hipblaslt_6377,0.0163795
GemmAndBiasTunableOp_float_TN,tn_1024_156_512_ld_512_512_1024,Gemm_Hipblaslt_6377,0.0820447
GemmAndBiasTunableOp_float_TN,tn_1024_305_512_ld_512_512_1024,Gemm_Hipblaslt_6377,0.156576
GemmAndBiasTunableOp_float_TN,tn_1024_157_512_ld_512_512_1024,Gemm_Hipblaslt_6377,0.0825813
GemmAndBiasTunableOp_float_TN,tn_1024_532_512_ld_512_512_1024,Gemm_Hipblaslt_6377,0.258908
GemmAndBiasTunableOp_float_TN,tn_1024_363_512_ld_512_512_1024,Gemm_Hipblaslt_6377,0.167659
GemmAndBiasTunableOp_float_TN,tn_1024_728_512_ld_512_512_1024,Default,0.351707
GemmAndBiasTunableOp_float_TN,tn_1024_158_512_ld_512_512_1024,Gemm_Hipblaslt_6377,0.0805524
GemmAndBiasTunableOp_float_TN,tn_1024_265_512_ld_512_512_1024,Gemm_Hipblaslt_6377,0.133341
GemmAndBiasTunableOp_float_TN,tn_1024_80_512_ld_512_512_1024,Gemm_Hipblaslt_6377,0.0419954
GemmAndBiasTunableOp_float_TN,tn_1024_813_512_ld_512_512_1024,Gemm_Hipblaslt_6377,0.374459
GemmAndBiasTunableOp_float_TN,tn_3_1_512_ld_512_512_3,Gemm_Hipblaslt_6378,0.0182334
GemmAndBiasTunableOp_float_TN,tn_1024_521_512_ld_512_512_1024,Gemm_Hipblaslt_6377,0.243739
GemmAndBiasTunableOp_float_TN,tn_1024_162_512_ld_512_512_1024,Gemm_Hipblaslt_6377,0.0901275
GemmAndBiasTunableOp_float_TN,tn_1024_163_512_ld_512_512_1024,Gemm_Hipblaslt_6377,0.0893372
GemmAndBiasTunableOp_float_TN,tn_1024_736_512_ld_512_512_1024,Default,0.353837
GemmAndBiasTunableOp_float_TN,tn_1024_557_512_ld_512_512_1024,Gemm_Hipblaslt_6377,0.28259
GemmAndBiasTunableOp_float_TN,tn_1024_395_512_ld_512_512_1024,Gemm_Hipblaslt_6377,0.178794
GemmAndBiasTunableOp_float_TN,tn_1024_47_512_ld_512_512_1024,Gemm_Hipblaslt_6377,0.0306071
GemmAndBiasTunableOp_float_TN,tn_1024_214_512_ld_512_512_1024,Gemm_Hipblaslt_6377,0.123194
GemmAndBiasTunableOp_float_TN,tn_1024_601_512_ld_512_512_1024,Gemm_Hipblaslt_6377,0.296971
GemmAndBiasTunableOp_float_TN,tn_1024_167_512_ld_512_512_1024,Gemm_Hipblaslt_6377,0.091724
GemmAndBiasTunableOp_float_TN,tn_1024_255_512_ld_512_512_1024,Gemm_Hipblaslt_6377,0.124613
GemmAndBiasTunableOp_float_TN,tn_1024_924_512_ld_512_512_1024,Gemm_Hipblaslt_6377,0.424482
GemmAndBiasTunableOp_float_TN,tn_120_216_120_ld_120_120_120,Gemm_Hipblaslt_6379,0.0123203
GemmAndBiasTunableOp_float_TN,tn_1024_389_512_ld_512_512_1024,Gemm_Hipblaslt_6377,0.17879
GemmAndBiasTunableOp_float_TN,tn_1024_168_512_ld_512_512_1024,Gemm_Hipblaslt_6377,0.0923509
GemmAndBiasTunableOp_float_TN,tn_1024_328_512_ld_512_512_1024,Gemm_Hipblaslt_6377,0.159998
GemmAndBiasTunableOp_float_TN,tn_1024_312_512_ld_512_512_1024,Gemm_Hipblaslt_6377,0.157992
GemmAndBiasTunableOp_float_TN,tn_1024_596_512_ld_512_512_1024,Default,0.298824
GemmAndBiasTunableOp_float_TN,tn_1024_371_512_ld_512_512_1024,Gemm_Hipblaslt_6377,0.175708
GemmAndBiasTunableOp_float_TN,tn_360_444_120_ld_120_120_360,Gemm_Hipblaslt_6377,0.0232942
GemmAndBiasTunableOp_float_TN,tn_1024_174_512_ld_512_512_1024,Gemm_Hipblaslt_6377,0.0901102
GemmAndBiasTunableOp_float_TN,tn_1024_1014_512_ld_512_512_1024,Default,0.477958
GemmAndBiasTunableOp_float_TN,tn_1024_579_512_ld_512_512_1024,Gemm_Hipblaslt_6377,0.296268
GemmAndBiasTunableOp_float_TN,tn_1024_181_512_ld_512_512_1024,Gemm_Hipblaslt_6377,0.098066
GemmAndBiasTunableOp_float_TN,tn_120_606_240_ld_240_240_120,Gemm_Hipblaslt_6379,0.0286739
GemmAndBiasTunableOp_float_TN,tn_1024_781_512_ld_512_512_1024,Gemm_Hipblaslt_6377,0.365348
GemmAndBiasTunableOp_float_TN,tn_1024_37_512_ld_512_512_1024,Gemm_Hipblaslt_6377,0.030372
GemmAndBiasTunableOp_float_TN,tn_1024_184_512_ld_512_512_1024,Gemm_Hipblaslt_6377,0.0987621
GemmAndBiasTunableOp_float_TN,tn_240_264_120_ld_120_120_240,Gemm_Hipblaslt_6377,0.0134265
GemmAndBiasTunableOp_float_TN,tn_1024_697_512_ld_512_512_1024,Default,0.34186
GemmAndBiasTunableOp_float_TN,tn_240_390_120_ld_120_120_240,Gemm_Hipblaslt_6377,0.019265
GemmAndBiasTunableOp_float_TN,tn_1024_378_512_ld_512_512_1024,Gemm_Hipblaslt_6377,0.174875
GemmAndBiasTunableOp_float_TN,tn_1024_185_512_ld_512_512_1024,Gemm_Hipblaslt_6377,0.0958831
GemmAndBiasTunableOp_float_TN,tn_360_864_120_ld_120_120_360,Gemm_Hipblaslt_6377,0.0433604
GemmAndBiasTunableOp_float_TN,tn_1024_382_512_ld_512_512_1024,Gemm_Hipblaslt_6377,0.175303
GemmAndBiasTunableOp_float_TN,tn_1024_412_512_ld_512_512_1024,Gemm_Hipblaslt_6377,0.197869
GemmAndBiasTunableOp_float_TN,tn_1024_186_512_ld_512_512_1024,Gemm_Hipblaslt_6377,0.0998409
GemmAndBiasTunableOp_float_TN,tn_1024_695_512_ld_512_512_1024,Gemm_Hipblaslt_6377,0.330812
GemmAndBiasTunableOp_float_TN,tn_1024_189_512_ld_512_512_1024,Gemm_Hipblaslt_6377,0.100127
GemmAndBiasTunableOp_float_TN,tn_1024_584_512_ld_512_512_1024,Default,0.297778
GemmAndBiasTunableOp_float_TN,tn_1024_194_512_ld_512_512_1024,Gemm_Hipblaslt_6377,0.10512
GemmAndBiasTunableOp_float_TN,tn_1024_970_512_ld_512_512_1024,Gemm_Hipblaslt_6377,0.451496
GemmAndBiasTunableOp_float_TN,tn_1024_196_512_ld_512_512_1024,Gemm_Hipblaslt_6377,0.105514
GemmAndBiasTunableOp_float_TN,tn_1024_861_512_ld_512_512_1024,Gemm_Hipblaslt_6377,0.391403
GemmAndBiasTunableOp_float_TN,tn_1024_52_512_ld_512_512_1024,Gemm_Hipblaslt_6377,0.0369555
GemmAndBiasTunableOp_float_TN,tn_1024_597_512_ld_512_512_1024,Gemm_Hipblaslt_6377,0.299393
GemmAndBiasTunableOp_float_TN,tn_1024_576_512_ld_512_512_1024,Gemm_Hipblaslt_6377,0.281999
GemmAndBiasTunableOp_float_TN,tn_1024_198_512_ld_512_512_1024,Gemm_Hipblaslt_6377,0.104869
GemmAndBiasTunableOp_float_TN,tn_1024_1015_512_ld_512_512_1024,Default,0.474675
GemmAndBiasTunableOp_float_TN,tn_1024_549_512_ld_512_512_1024,Gemm_Hipblaslt_6377,0.280576
GemmAndBiasTunableOp_float_TN,tn_256_8400_256_ld_256_256_256,Gemm_Hipblaslt_6377,0.454785
GemmAndBiasTunableOp_float_TN,tn_120_528_120_ld_120_120_120,Gemm_Hipblaslt_6377,0.0134745
GemmAndBiasTunableOp_float_TN,tn_1024_202_512_ld_512_512_1024,Gemm_Hipblaslt_6377,0.106908
GemmAndBiasTunableOp_float_TN,tn_1024_262_512_ld_512_512_1024,Gemm_Hipblaslt_6377,0.131303
GemmAndBiasTunableOp_float_TN,tn_1024_205_512_ld_512_512_1024,Gemm_Hipblaslt_6377,0.108084
GemmAndBiasTunableOp_float_TN,tn_1024_281_512_ld_512_512_1024,Gemm_Hipblaslt_6377,0.137381
GemmAndBiasTunableOp_float_TN,tn_1024_353_512_ld_512_512_1024,Gemm_Hipblaslt_6377,0.168352
GemmAndBiasTunableOp_float_TN,tn_1024_206_512_ld_512_512_1024,Gemm_Hipblaslt_6377,0.106855
GemmAndBiasTunableOp_float_TN,tn_1024_887_512_ld_512_512_1024,Gemm_Hipblaslt_6377,0.40454
GemmAndBiasTunableOp_float_TN,tn_1024_501_512_ld_512_512_1024,Gemm_Hipblaslt_6377,0.238271
GemmAndBiasTunableOp_float_TN,tn_1024_207_512_ld_512_512_1024,Gemm_Hipblaslt_6377,0.108691
GemmAndBiasTunableOp_float_TN,tn_1024_299_512_ld_512_512_1024,Gemm_Hipblaslt_6377,0.151127
GemmAndBiasTunableOp_float_TN,tn_360_780_120_ld_120_120_360,Gemm_Hipblaslt_6377,0.0373358
GemmAndBiasTunableOp_float_TN,tn_360_930_120_ld_120_120_360,Gemm_Hipblaslt_6377,0.0417685
GemmAndBiasTunableOp_float_TN,tn_1024_350_512_ld_512_512_1024,Gemm_Hipblaslt_6377,0.165066
GemmAndBiasTunableOp_float_TN,tn_1024_996_512_ld_512_512_1024,Default,0.466426
GemmAndBiasTunableOp_float_TN,tn_1024_543_512_ld_512_512_1024,Gemm_Hipblaslt_6377,0.278802
GemmAndBiasTunableOp_float_TN,tn_1024_633_512_ld_512_512_1024,Gemm_Hipblaslt_6377,0.314403
GemmAndBiasTunableOp_float_TN,tn_1024_208_512_ld_512_512_1024,Gemm_Hipblaslt_6377,0.106929
GemmAndBiasTunableOp_float_TN,tn_1024_772_512_ld_512_512_1024,Gemm_Hipblaslt_6377,0.35807
GemmAndBiasTunableOp_float_TN,tn_1024_406_512_ld_512_512_1024,Gemm_Hipblaslt_6377,0.187096
GemmAndBiasTunableOp_float_TN,tn_1024_541_512_ld_512_512_1024,Gemm_Hipblaslt_6377,0.258574
GemmAndBiasTunableOp_float_TN,tn_1024_213_512_ld_512_512_1024,Gemm_Hipblaslt_6377,0.11638
GemmAndBiasTunableOp_float_TN,tn_1024_64_512_ld_512_512_1024,Gemm_Hipblaslt_6377,0.0376299
GemmAndBiasTunableOp_float_TN,tn_1024_949_512_ld_512_512_1024,Gemm_Hipblaslt_6377,0.434057
GemmAndBiasTunableOp_float_TN,tn_1024_248_512_ld_512_512_1024,Gemm_Hipblaslt_6377,0.149256
GemmAndBiasTunableOp_float_TN,tn_1024_323_512_ld_512_512_1024,Gemm_Hipblaslt_6377,0.166765
GemmAndBiasTunableOp_float_TN,tn_1024_303_512_ld_512_512_1024,Gemm_Hipblaslt_6377,0.150798
GemmAndBiasTunableOp_float_TN,tn_1024_329_512_ld_512_512_1024,Gemm_Hipblaslt_6377,0.156002
GemmAndBiasTunableOp_float_TN,tn_1024_300_512_ld_512_512_1024,Gemm_Hipblaslt_6377,0.152647
GemmAndBiasTunableOp_float_TN,tn_1024_215_512_ld_512_512_1024,Gemm_Hipblaslt_6377,0.120924
GemmAndBiasTunableOp_float_TN,tn_1024_376_512_ld_512_512_1024,Gemm_Hipblaslt_6377,0.175779
GemmAndBiasTunableOp_float_TN,tn_1024_140_512_ld_512_512_1024,Gemm_Hipblaslt_6377,0.0755224
GemmAndBiasTunableOp_float_TN,tn_360_246_120_ld_120_120_360,Gemm_Hipblaslt_6377,0.0228389
GemmAndBiasTunableOp_float_TN,tn_1024_293_512_ld_512_512_1024,Gemm_Hipblaslt_6377,0.143577
GemmAndBiasTunableOp_float_TN,tn_120_246_120_ld_120_120_120,Gemm_Hipblaslt_6379,0.0125581
GemmAndBiasTunableOp_float_TN,tn_240_246_120_ld_120_120_240,Gemm_Hipblaslt_6377,0.0134424
GemmAndBiasTunableOp_float_TN,tn_120_246_240_ld_240_240_120,Gemm_Hipblaslt_6377,0.0157389
GemmAndBiasTunableOp_float_TN,tn_1024_562_512_ld_512_512_1024,Gemm_Hipblaslt_6377,0.288277
GemmAndBiasTunableOp_float_TN,tn_1024_990_512_ld_512_512_1024,Gemm_Hipblaslt_6377,0.45435
GemmAndBiasTunableOp_float_TN,tn_1024_152_512_ld_512_512_1024,Gemm_Hipblaslt_6377,0.0798551
GemmAndBiasTunableOp_float_TN,tn_1024_222_512_ld_512_512_1024,Gemm_Hipblaslt_6377,0.124694
GemmAndBiasTunableOp_float_TN,tn_1024_224_512_ld_512_512_1024,Gemm_Hipblaslt_6377,0.135109
GemmAndBiasTunableOp_float_TN,tn_1024_994_512_ld_512_512_1024,Gemm_Hipblaslt_6377,0.463607
GemmAndBiasTunableOp_float_TN,tn_1024_142_512_ld_512_512_1024,Gemm_Hipblaslt_6377,0.0749834
GemmAndBiasTunableOp_float_TN,tn_120_390_120_ld_120_120_120,Gemm_Hipblaslt_6379,0.0143706
GemmAndBiasTunableOp_float_TN,tn_1024_218_512_ld_512_512_1024,Gemm_Hipblaslt_6377,0.124701
GemmAndBiasTunableOp_float_TN,tn_120_390_240_ld_240_240_120,Gemm_Hipblaslt_6376,0.0234722
GemmAndBiasTunableOp_float_TN,tn_1024_539_512_ld_512_512_1024,Gemm_Hipblaslt_6377,0.275027
GemmAndBiasTunableOp_float_TN,tn_1024_564_512_ld_512_512_1024,Gemm_Hipblaslt_6377,0.288167
GemmAndBiasTunableOp_float_TN,tn_1024_225_512_ld_512_512_1024,Gemm_Hipblaslt_6377,0.134171
GemmAndBiasTunableOp_float_TN,tn_1024_19_512_ld_512_512_1024,Gemm_Hipblaslt_6376,0.0266713
GemmAndBiasTunableOp_float_TN,tn_1024_261_512_ld_512_512_1024,Gemm_Hipblaslt_6377,0.163276
GemmAndBiasTunableOp_float_TN,tn_1024_88_512_ld_512_512_1024,Gemm_Hipblaslt_6377,0.0506004
GemmAndBiasTunableOp_float_TN,tn_1024_267_512_ld_512_512_1024,Gemm_Hipblaslt_6377,0.135498
GemmAndBiasTunableOp_float_TN,tn_512_300_4_ld_4_4_512,Gemm_Hipblaslt_6377,0.00890918
GemmAndBiasTunableOp_float_TN,tn_1024_259_512_ld_512_512_1024,Gemm_Hipblaslt_6377,0.131336
GemmAndBiasTunableOp_float_TN,tn_1024_354_512_ld_512_512_1024,Gemm_Hipblaslt_6377,0.17137
GemmAndBiasTunableOp_float_TN,tn_240_468_120_ld_120_120_240,Gemm_Hipblaslt_6377,0.0188983
GemmAndBiasTunableOp_float_TN,tn_360_750_120_ld_120_120_360,Gemm_Hipblaslt_6377,0.0371851
GemmAndBiasTunableOp_float_TN,tn_1024_577_512_ld_512_512_1024,Gemm_Hipblaslt_6377,0.290178
GemmAndBiasTunableOp_float_TN,tn_1024_279_512_ld_512_512_1024,Gemm_Hipblaslt_6377,0.142612
GemmAndBiasTunableOp_float_TN,tn_1024_229_512_ld_512_512_1024,Gemm_Hipblaslt_6377,0.129917
GemmAndBiasTunableOp_float_TN,tn_120_750_120_ld_120_120_120,Gemm_Hipblaslt_6376,0.0273815
GemmAndBiasTunableOp_float_TN,tn_512_1_512_ld_512_512_512,Gemm_Hipblaslt_6378,0.0183084
GemmAndBiasTunableOp_float_TN,tn_1024_247_512_ld_512_512_1024,Gemm_Hipblaslt_6377,0.128029
GemmAndBiasTunableOp_float_TN,tn_1024_38_512_ld_512_512_1024,Gemm_Hipblaslt_6377,0.0304757
GemmAndBiasTunableOp_float_TN,tn_240_594_120_ld_120_120_240,Gemm_Hipblaslt_6377,0.0215549
GemmAndBiasTunableOp_float_TN,tn_240_750_120_ld_120_120_240,Gemm_Hipblaslt_6379,0.0330774
GemmAndBiasTunableOp_float_TN,tn_120_750_240_ld_240_240_120,Gemm_Hipblaslt_6377,0.0265447
GemmAndBiasTunableOp_float_TN,tn_1024_304_512_ld_512_512_1024,Gemm_Hipblaslt_6377,0.151681
GemmAndBiasTunableOp_float_TN,tn_1024_237_512_ld_512_512_1024,Gemm_Hipblaslt_6377,0.121401
GemmAndBiasTunableOp_float_TN,tn_1024_773_512_ld_512_512_1024,Gemm_Hipblaslt_6377,0.3601
GemmAndBiasTunableOp_float_TN,tn_240_564_120_ld_120_120_240,Gemm_Hipblaslt_6379,0.0259444
GemmAndBiasTunableOp_float_TN,tn_1024_471_512_ld_512_512_1024,Gemm_Hipblaslt_6377,0.214216
GemmAndBiasTunableOp_float_TN,tn_1024_809_512_ld_512_512_1024,Gemm_Hipblaslt_6377,0.36836
GemmAndBiasTunableOp_float_TN,tn_1024_231_512_ld_512_512_1024,Gemm_Hipblaslt_6377,0.117253
GemmAndBiasTunableOp_float_TN,tn_1024_232_512_ld_512_512_1024,Gemm_Hipblaslt_6377,0.117953
GemmAndBiasTunableOp_float_TN,tn_1024_561_512_ld_512_512_1024,Default,0.292991
GemmAndBiasTunableOp_float_TN,tn_1024_698_512_ld_512_512_1024,Default,0.333691
GemmAndBiasTunableOp_float_TN,tn_1024_10_512_ld_512_512_1024,Gemm_Hipblaslt_6378,0.0239454
GemmAndBiasTunableOp_float_TN,tn_1024_359_512_ld_512_512_1024,Gemm_Hipblaslt_6377,0.170957
GemmAndBiasTunableOp_float_TN,tn_120_864_120_ld_120_120_120,Gemm_Hipblaslt_6377,0.0297219
GemmAndBiasTunableOp_float_TN,tn_1024_236_512_ld_512_512_1024,Gemm_Hipblaslt_6377,0.115936
GemmAndBiasTunableOp_float_TN,tn_1024_98_512_ld_512_512_1024,Gemm_Hipblaslt_6377,0.0575695
GemmAndBiasTunableOp_float_TN,tn_1024_240_512_ld_512_512_1024,Gemm_Hipblaslt_6377,0.127999
GemmAndBiasTunableOp_float_TN,tn_1024_470_512_ld_512_512_1024,Gemm_Hipblaslt_6377,0.226999
GemmAndBiasTunableOp_float_TN,tn_1024_553_512_ld_512_512_1024,Gemm_Hipblaslt_6377,0.270604
GemmAndBiasTunableOp_float_TN,tn_360_392_120_ld_120_120_360,Gemm_Hipblaslt_6379,0.0270192
GemmAndBiasTunableOp_float_TN,tn_1024_241_512_ld_512_512_1024,Gemm_Hipblaslt_6377,0.124481
GemmAndBiasTunableOp_float_TN,tn_1024_243_512_ld_512_512_1024,Gemm_Hipblaslt_6377,0.137425
GemmAndBiasTunableOp_float_TN,tn_17_8400_256_ld_256_256_17,Gemm_Hipblaslt_6377,0.0747766
GemmAndBiasTunableOp_float_TN,tn_1024_204_512_ld_512_512_1024,Gemm_Hipblaslt_6377,0.10596
GemmAndBiasTunableOp_float_TN,tn_360_240_120_ld_120_120_360,Gemm_Hipblaslt_6377,0.0157043
GemmAndBiasTunableOp_float_TN,tn_1024_245_512_ld_512_512_1024,Gemm_Hipblaslt_6377,0.135649
GemmAndBiasTunableOp_float_TN,tn_1024_620_512_ld_512_512_1024,Gemm_Hipblaslt_6377,0.306093
GemmAndBiasTunableOp_float_TN,tn_1024_4_512_ld_512_512_1024,Gemm_Hipblaslt_6378,0.022189
GemmAndBiasTunableOp_float_TN,tn_120_930_120_ld_120_120_120,Gemm_Hipblaslt_6377,0.0188391
GemmAndBiasTunableOp_float_TN,tn_360_282_120_ld_120_120_360,Gemm_Hipblaslt_6377,0.0193175
GemmAndBiasTunableOp_float_TN,tn_1024_89_512_ld_512_512_1024,Gemm_Hipblaslt_6377,0.0506537
GemmAndBiasTunableOp_float_TN,tn_120_282_240_ld_240_240_120,Gemm_Hipblaslt_6377,0.0250635
GemmAndBiasTunableOp_float_TN,tn_1024_570_512_ld_512_512_1024,Default,0.295067
GemmAndBiasTunableOp_float_TN,tn_1024_276_512_ld_512_512_1024,Gemm_Hipblaslt_6377,0.141498
GemmAndBiasTunableOp_float_TN,tn_1024_105_512_ld_512_512_1024,Gemm_Hipblaslt_6377,0.0575411
GemmAndBiasTunableOp_float_TN,tn_1024_178_512_ld_512_512_1024,Gemm_Hipblaslt_6377,0.0992314
GemmAndBiasTunableOp_float_TN,tn_1024_249_512_ld_512_512_1024,Gemm_Hipblaslt_6377,0.145962
GemmAndBiasTunableOp_float_TN,tn_1024_1020_512_ld_512_512_1024,Gemm_Hipblaslt_6377,0.465011
GemmAndBiasTunableOp_float_TN,tn_1024_78_512_ld_512_512_1024,Gemm_Hipblaslt_6377,0.0420069
GemmAndBiasTunableOp_float_TN,tn_1024_862_512_ld_512_512_1024,Default,0.401015
GemmAndBiasTunableOp_float_TN,tn_1024_250_512_ld_512_512_1024,Gemm_Hipblaslt_6377,0.124684
GemmAndBiasTunableOp_float_TN,tn_1024_1017_512_ld_512_512_1024,Gemm_Hipblaslt_6377,0.464337
GemmAndBiasTunableOp_float_TN,tn_4_8400_256_ld_256_256_4,Gemm_Hipblaslt_6376,0.031064
GemmAndBiasTunableOp_float_TN,tn_1024_251_512_ld_512_512_1024,Gemm_Hipblaslt_6377,0.136446
GemmAndBiasTunableOp_float_TN,tn_1024_528_512_ld_512_512_1024,Gemm_Hipblaslt_6377,0.248089
GemmAndBiasTunableOp_float_TN,tn_120_606_120_ld_120_120_120,Gemm_Hipblaslt_6377,0.0278075
GemmAndBiasTunableOp_float_TN,tn_240_384_120_ld_120_120_240,Gemm_Hipblaslt_6379,0.0229188
GemmAndBiasTunableOp_float_TN,tn_1024_96_512_ld_512_512_1024,Gemm_Hipblaslt_6377,0.050533
GemmAndBiasTunableOp_float_TN,tn_1024_495_512_ld_512_512_1024,Gemm_Hipblaslt_6377,0.217717
GemmAndBiasTunableOp_float_TN,tn_1024_505_512_ld_512_512_1024,Gemm_Hipblaslt_6377,0.229593
GemmAndBiasTunableOp_float_TN,tn_120_384_240_ld_240_240_120,Gemm_Hipblaslt_6376,0.0235163
GemmAndBiasTunableOp_float_TN,tn_1024_811_512_ld_512_512_1024,Default,0.373258
GemmAndBiasTunableOp_float_TN,tn_1024_339_512_ld_512_512_1024,Gemm_Hipblaslt_6377,0.164919
GemmAndBiasTunableOp_float_TN,tn_1024_58_512_ld_512_512_1024,Gemm_Hipblaslt_6377,0.0368913
GemmAndBiasTunableOp_float_TN,tn_1024_589_512_ld_512_512_1024,Default,0.295933
GemmAndBiasTunableOp_float_TN,tn_1024_14_512_ld_512_512_1024,Gemm_Hipblaslt_6378,0.0242035
GemmAndBiasTunableOp_float_TN,tn_360_450_120_ld_120_120_360,Gemm_Hipblaslt_6377,0.0253048
GemmAndBiasTunableOp_float_TN,tn_240_450_120_ld_120_120_240,Gemm_Hipblaslt_6379,0.0257088
GemmAndBiasTunableOp_float_TN,tn_120_516_120_ld_120_120_120,Gemm_Hipblaslt_6377,0.0136084
GemmAndBiasTunableOp_float_TN,tn_1024_190_512_ld_512_512_1024,Gemm_Hipblaslt_6377,0.0964671
GemmAndBiasTunableOp_float_TN,tn_1024_419_512_ld_512_512_1024,Gemm_Hipblaslt_6377,0.193856
GemmAndBiasTunableOp_float_TN,tn_240_864_120_ld_120_120_240,Gemm_Hipblaslt_6377,0.0397031
GemmAndBiasTunableOp_float_TN,tn_1024_20_512_ld_512_512_1024,Gemm_Hipblaslt_6377,0.0268316
GemmAndBiasTunableOp_float_TN,tn_120_450_240_ld_240_240_120,Gemm_Hipblaslt_6377,0.0312091
GemmAndBiasTunableOp_float_TN,tn_1024_746_512_ld_512_512_1024,Default,0.350089
GemmAndBiasTunableOp_float_TN,tn_1024_170_512_ld_512_512_1024,Gemm_Hipblaslt_6377,0.0907747
GemmAndBiasTunableOp_float_TN,tn_1024_414_512_ld_512_512_1024,Gemm_Hipblaslt_6377,0.186133
GemmAndBiasTunableOp_float_TN,tn_1024_256_512_ld_512_512_1024,Gemm_Hipblaslt_6377,0.12631
GemmAndBiasTunableOp_float_TN,tn_1024_599_512_ld_512_512_1024,Gemm_Hipblaslt_6377,0.298675
GemmAndBiasTunableOp_float_TN,tn_1024_42_512_ld_512_512_1024,Gemm_Hipblaslt_6377,0.0304954
GemmAndBiasTunableOp_float_TN,tn_360_1374_120_ld_120_120_360,Gemm_Hipblaslt_6379,0.0720342
GemmAndBiasTunableOp_float_TN,tn_1024_257_512_ld_512_512_1024,Gemm_Hipblaslt_6377,0.161991
GemmAndBiasTunableOp_float_TN,tn_1024_595_512_ld_512_512_1024,Gemm_Hipblaslt_6377,0.296524
GemmAndBiasTunableOp_float_TN,tn_1024_712_512_ld_512_512_1024,Gemm_Hipblaslt_6377,0.334404
GemmAndBiasTunableOp_float_TN,tn_1024_598_512_ld_512_512_1024,Gemm_Hipblaslt_6377,0.295795
GemmAndBiasTunableOp_float_TN,tn_1024_680_512_ld_512_512_1024,Gemm_Hipblaslt_6377,0.324032
GemmAndBiasTunableOp_float_TN,tn_1024_600_512_ld_512_512_1024,Default,0.303349
GemmAndBiasTunableOp_float_TN,tn_1024_603_512_ld_512_512_1024,Default,0.297032
GemmAndBiasTunableOp_float_TN,tn_360_232_120_ld_120_120_360,Gemm_Hipblaslt_6376,0.0298477
GemmAndBiasTunableOp_float_TN,tn_1024_605_512_ld_512_512_1024,Gemm_Hipblaslt_6377,0.302873
GemmAndBiasTunableOp_float_TN,tn_1024_607_512_ld_512_512_1024,Gemm_Hipblaslt_6377,0.295119
GemmAndBiasTunableOp_float_TN,tn_1024_770_512_ld_512_512_1024,Gemm_Hipblaslt_6377,0.361652
GemmAndBiasTunableOp_float_TN,tn_1024_608_512_ld_512_512_1024,Gemm_Hipblaslt_6377,0.298162
GemmAndBiasTunableOp_float_TN,tn_1024_404_512_ld_512_512_1024,Gemm_Hipblaslt_6377,0.190698
GemmAndBiasTunableOp_float_TN,tn_1024_615_512_ld_512_512_1024,Gemm_Hipblaslt_6377,0.306224
GemmAndBiasTunableOp_float_TN,tn_1024_869_512_ld_512_512_1024,Default,0.398932
GemmAndBiasTunableOp_float_TN,tn_1024_764_512_ld_512_512_1024,Gemm_Hipblaslt_6377,0.353221
GemmAndBiasTunableOp_float_TN,tn_1024_622_512_ld_512_512_1024,Gemm_Hipblaslt_6377,0.306841
GemmAndBiasTunableOp_float_TN,tn_1024_623_512_ld_512_512_1024,Default,0.307558
GemmAndBiasTunableOp_float_TN,tn_1024_624_512_ld_512_512_1024,Gemm_Hipblaslt_6377,0.307458
GemmAndBiasTunableOp_float_TN,tn_1024_626_512_ld_512_512_1024,Gemm_Hipblaslt_6377,0.317473
GemmAndBiasTunableOp_float_TN,tn_1024_54_512_ld_512_512_1024,Gemm_Hipblaslt_6377,0.0369262
GemmAndBiasTunableOp_float_TN,tn_1024_634_512_ld_512_512_1024,Default,0.316087
GemmAndBiasTunableOp_float_TN,tn_1024_643_512_ld_512_512_1024,Gemm_Hipblaslt_6377,0.315807
GemmAndBiasTunableOp_float_TN,tn_1024_710_512_ld_512_512_1024,Gemm_Hipblaslt_6377,0.334606
GemmAndBiasTunableOp_float_TN,tn_1024_639_512_ld_512_512_1024,Gemm_Hipblaslt_6377,0.310722
GemmAndBiasTunableOp_float_TN,tn_1024_759_512_ld_512_512_1024,Gemm_Hipblaslt_6377,0.352507
GemmAndBiasTunableOp_float_TN,tn_1024_640_512_ld_512_512_1024,Default,0.320694
GemmAndBiasTunableOp_float_TN,tn_120_258_240_ld_240_240_120,Gemm_Hipblaslt_6377,0.014827
GemmAndBiasTunableOp_float_TN,tn_1024_641_512_ld_512_512_1024,Gemm_Hipblaslt_6377,0.316993
GemmAndBiasTunableOp_float_TN,tn_1024_642_512_ld_512_512_1024,Gemm_Hipblaslt_6377,0.318489
GemmAndBiasTunableOp_float_TN,tn_1024_891_512_ld_512_512_1024,Gemm_Hipblaslt_6377,0.403425
GemmAndBiasTunableOp_float_TN,tn_1024_399_512_ld_512_512_1024,Gemm_Hipblaslt_6377,0.183328
GemmAndBiasTunableOp_float_TN,tn_1024_648_512_ld_512_512_1024,Default,0.32808
GemmAndBiasTunableOp_float_TN,tn_120_1050_240_ld_240_240_120,Gemm_Hipblaslt_6377,0.0341395
GemmAndBiasTunableOp_float_TN,tn_1024_479_512_ld_512_512_1024,Gemm_Hipblaslt_6377,0.215351
GemmAndBiasTunableOp_float_TN,tn_1024_649_512_ld_512_512_1024,Gemm_Hipblaslt_6377,0.318864
GemmAndBiasTunableOp_float_TN,tn_1024_574_512_ld_512_512_1024,Gemm_Hipblaslt_6377,0.271668
GemmAndBiasTunableOp_float_TN,tn_1024_825_512_ld_512_512_1024,Gemm_Hipblaslt_6377,0.379928
GemmAndBiasTunableOp_float_TN,tn_1024_650_512_ld_512_512_1024,Gemm_Hipblaslt_6377,0.312087
GemmAndBiasTunableOp_float_TN,tn_1024_587_512_ld_512_512_1024,Default,0.301316
GemmAndBiasTunableOp_float_TN,tn_1024_652_512_ld_512_512_1024,Gemm_Hipblaslt_6377,0.322365
GemmAndBiasTunableOp_float_TN,tn_120_756_120_ld_120_120_120,Gemm_Hipblaslt_6377,0.0165504
GemmAndBiasTunableOp_float_TN,tn_1024_653_512_ld_512_512_1024,Default,0.319428
GemmAndBiasTunableOp_float_TN,tn_1024_654_512_ld_512_512_1024,Gemm_Hipblaslt_6377,0.311249
GemmAndBiasTunableOp_float_TN,tn_1024_657_512_ld_512_512_1024,Gemm_Hipblaslt_6377,0.321326
GemmAndBiasTunableOp_float_TN,tn_1024_655_512_ld_512_512_1024,Gemm_Hipblaslt_6377,0.317024
GemmAndBiasTunableOp_float_TN,tn_1024_659_512_ld_512_512_1024,Default,0.315091
GemmAndBiasTunableOp_float_TN,tn_1024_899_512_ld_512_512_1024,Gemm_Hipblaslt_6377,0.408037
GemmAndBiasTunableOp_float_TN,tn_1024_660_512_ld_512_512_1024,Gemm_Hipblaslt_6377,0.326147
GemmAndBiasTunableOp_float_TN,tn_1024_431_512_ld_512_512_1024,Gemm_Hipblaslt_6377,0.193156
GemmAndBiasTunableOp_float_TN,tn_1024_661_512_ld_512_512_1024,Default,0.329987
GemmAndBiasTunableOp_float_TN,tn_1024_662_512_ld_512_512_1024,Default,0.329195
GemmAndBiasTunableOp_float_TN,tn_1024_663_512_ld_512_512_1024,Gemm_Hipblaslt_6377,0.319662
GemmAndBiasTunableOp_float_TN,tn_1024_613_512_ld_512_512_1024,Gemm_Hipblaslt_6377,0.308126
GemmAndBiasTunableOp_float_TN,tn_1024_664_512_ld_512_512_1024,Gemm_Hipblaslt_6377,0.319209
GemmAndBiasTunableOp_float_TN,tn_1024_666_512_ld_512_512_1024,Gemm_Hipblaslt_6377,0.325948
GemmAndBiasTunableOp_float_TN,tn_1024_667_512_ld_512_512_1024,Gemm_Hipblaslt_6377,0.325772
GemmAndBiasTunableOp_float_TN,tn_240_282_120_ld_120_120_240,Gemm_Hipblaslt_6377,0.0156927
GemmAndBiasTunableOp_float_TN,tn_1024_669_512_ld_512_512_1024,Default,0.328919
GemmAndBiasTunableOp_float_TN,tn_240_342_120_ld_120_120_240,Gemm_Hipblaslt_6377,0.0152799
GemmAndBiasTunableOp_float_TN,tn_1024_670_512_ld_512_512_1024,Gemm_Hipblaslt_6377,0.319969
GemmAndBiasTunableOp_float_TN,tn_1024_95_512_ld_512_512_1024,Gemm_Hipblaslt_6377,0.0510744
GemmAndBiasTunableOp_float_TN,tn_1024_671_512_ld_512_512_1024,Gemm_Hipblaslt_6377,0.32674
GemmAndBiasTunableOp_float_TN,tn_1024_672_512_ld_512_512_1024,Gemm_Hipblaslt_6377,0.319301
GemmAndBiasTunableOp_float_TN,tn_1024_674_512_ld_512_512_1024,Gemm_Hipblaslt_6377,0.323071
GemmAndBiasTunableOp_float_TN,tn_1024_675_512_ld_512_512_1024,Default,0.330317
GemmAndBiasTunableOp_float_TN,tn_1024_678_512_ld_512_512_1024,Gemm_Hipblaslt_6377,0.325151
GemmAndBiasTunableOp_float_TN,tn_120_672_240_ld_240_240_120,Gemm_Hipblaslt_6377,0.0240874
GemmAndBiasTunableOp_float_TN,tn_1024_527_512_ld_512_512_1024,Gemm_Hipblaslt_6377,0.251381
GemmAndBiasTunableOp_float_TN,tn_120_786_240_ld_240_240_120,Gemm_Hipblaslt_6377,0.0268577
GemmAndBiasTunableOp_float_TN,tn_1024_679_512_ld_512_512_1024,Gemm_Hipblaslt_6377,0.331205
GemmAndBiasTunableOp_float_TN,tn_120_240_240_ld_240_240_120,Gemm_Hipblaslt_6377,0.0142648
GemmAndBiasTunableOp_float_TN,tn_1024_681_512_ld_512_512_1024,Gemm_Hipblaslt_6377,0.328711
GemmAndBiasTunableOp_float_TN,tn_1024_897_512_ld_512_512_1024,Gemm_Hipblaslt_6377,0.407424
GemmAndBiasTunableOp_float_TN,tn_120_540_240_ld_240_240_120,Gemm_Hipblaslt_6377,0.0209189
GemmAndBiasTunableOp_float_TN,tn_1024_683_512_ld_512_512_1024,Gemm_Hipblaslt_6377,0.332064
GemmAndBiasTunableOp_float_TN,tn_1024_723_512_ld_512_512_1024,Gemm_Hipblaslt_6377,0.341797
GemmAndBiasTunableOp_float_TN,tn_1024_684_512_ld_512_512_1024,Gemm_Hipblaslt_6377,0.320914
GemmAndBiasTunableOp_float_TN,tn_1024_848_512_ld_512_512_1024,Gemm_Hipblaslt_6377,0.389696
GemmAndBiasTunableOp_float_TN,tn_1024_685_512_ld_512_512_1024,Default,0.331272
GemmAndBiasTunableOp_float_TN,tn_1024_688_512_ld_512_512_1024,Gemm_Hipblaslt_6377,0.328842
GemmAndBiasTunableOp_float_TN,tn_1024_783_512_ld_512_512_1024,Default,0.359083
GemmAndBiasTunableOp_float_TN,tn_1024_153_512_ld_512_512_1024,Gemm_Hipblaslt_6377,0.0824245
GemmAndBiasTunableOp_float_TN,tn_1024_689_512_ld_512_512_1024,Gemm_Hipblaslt_6377,0.333746
GemmAndBiasTunableOp_float_TN,tn_1024_148_512_ld_512_512_1024,Gemm_Hipblaslt_6377,0.0816597
GemmAndBiasTunableOp_float_TN,tn_1024_692_512_ld_512_512_1024,Gemm_Hipblaslt_6377,0.331818
GemmAndBiasTunableOp_float_TN,tn_1024_874_512_ld_512_512_1024,Default,0.403773
GemmAndBiasTunableOp_float_TN,tn_1024_693_512_ld_512_512_1024,Gemm_Hipblaslt_6377,0.33621
GemmAndBiasTunableOp_float_TN,tn_1024_699_512_ld_512_512_1024,Gemm_Hipblaslt_6377,0.334984
GemmAndBiasTunableOp_float_TN,tn_1024_701_512_ld_512_512_1024,Gemm_Hipblaslt_6377,0.333845
GemmAndBiasTunableOp_float_TN,tn_240_738_120_ld_120_120_240,Gemm_Hipblaslt_6377,0.0249168
GemmAndBiasTunableOp_float_TN,tn_1024_703_512_ld_512_512_1024,Default,0.34262
GemmAndBiasTunableOp_float_TN,tn_1024_635_512_ld_512_512_1024,Gemm_Hipblaslt_6377,0.313111
GemmAndBiasTunableOp_float_TN,tn_1024_708_512_ld_512_512_1024,Gemm_Hipblaslt_6377,0.337811
GemmAndBiasTunableOp_float_TN,tn_1024_711_512_ld_512_512_1024,Default,0.335077
GemmAndBiasTunableOp_float_TN,tn_1024_713_512_ld_512_512_1024,Gemm_Hipblaslt_6377,0.336963
GemmAndBiasTunableOp_float_TN,tn_1024_831_512_ld_512_512_1024,Gemm_Hipblaslt_6377,0.377835
GemmAndBiasTunableOp_float_TN,tn_1024_420_512_ld_512_512_1024,Gemm_Hipblaslt_6377,0.193769
GemmAndBiasTunableOp_float_TN,tn_1024_720_512_ld_512_512_1024,Default,0.338386
GemmAndBiasTunableOp_float_TN,tn_1024_721_512_ld_512_512_1024,Gemm_Hipblaslt_6377,0.341326
GemmAndBiasTunableOp_float_TN,tn_1024_722_512_ld_512_512_1024,Gemm_Hipblaslt_6377,0.341118
GemmAndBiasTunableOp_float_TN,tn_1024_943_512_ld_512_512_1024,Gemm_Hipblaslt_6377,0.426449
GemmAndBiasTunableOp_float_TN,tn_1024_173_512_ld_512_512_1024,Gemm_Hipblaslt_6377,0.092415
GemmAndBiasTunableOp_float_TN,tn_1024_730_512_ld_512_512_1024,Gemm_Hipblaslt_6377,0.342653
GemmAndBiasTunableOp_float_TN,tn_1024_445_512_ld_512_512_1024,Gemm_Hipblaslt_6377,0.194595
GemmAndBiasTunableOp_float_TN,tn_1024_732_512_ld_512_512_1024,Default,0.365308
GemmAndBiasTunableOp_float_TN,tn_1024_737_512_ld_512_512_1024,Default,0.343509
GemmAndBiasTunableOp_float_TN,tn_1024_738_512_ld_512_512_1024,Gemm_Hipblaslt_6377,0.349495
GemmAndBiasTunableOp_float_TN,tn_1024_594_512_ld_512_512_1024,Gemm_Hipblaslt_6377,0.301407
GemmAndBiasTunableOp_float_TN,tn_1024_739_512_ld_512_512_1024,Default,0.347451
GemmAndBiasTunableOp_float_TN,tn_1024_819_512_ld_512_512_1024,Default,0.379934
GemmAndBiasTunableOp_float_TN,tn_1024_747_512_ld_512_512_1024,Default,0.349031
GemmAndBiasTunableOp_float_TN,tn_1024_748_512_ld_512_512_1024,Gemm_Hipblaslt_6377,0.346807
GemmAndBiasTunableOp_float_TN,tn_1024_724_512_ld_512_512_1024,Gemm_Hipblaslt_6377,0.345801
GemmAndBiasTunableOp_float_TN,tn_1024_567_512_ld_512_512_1024,Gemm_Hipblaslt_6377,0.286737
GemmAndBiasTunableOp_float_TN,tn_1024_749_512_ld_512_512_1024,Gemm_Hipblaslt_6377,0.347346
GemmAndBiasTunableOp_float_TN,tn_1024_751_512_ld_512_512_1024,Gemm_Hipblaslt_6377,0.346745
GemmAndBiasTunableOp_float_TN,tn_1024_752_512_ld_512_512_1024,Gemm_Hipblaslt_6377,0.348332
GemmAndBiasTunableOp_float_TN,tn_1024_753_512_ld_512_512_1024,Gemm_Hipblaslt_6377,0.357963
GemmAndBiasTunableOp_float_TN,tn_1024_490_512_ld_512_512_1024,Gemm_Hipblaslt_6377,0.220215
GemmAndBiasTunableOp_float_TN,tn_1024_754_512_ld_512_512_1024,Default,0.363126
GemmAndBiasTunableOp_float_TN,tn_360_216_120_ld_120_120_360,Gemm_Hipblaslt_6376,0.0226919
GemmAndBiasTunableOp_float_TN,tn_1024_489_512_ld_512_512_1024,Gemm_Hipblaslt_6377,0.22037
GemmAndBiasTunableOp_float_TN,tn_1024_756_512_ld_512_512_1024,Gemm_Hipblaslt_6377,0.35041
GemmAndBiasTunableOp_float_TN,tn_1024_321_512_ld_512_512_1024,Gemm_Hipblaslt_6377,0.160318
GemmAndBiasTunableOp_float_TN,tn_1024_757_512_ld_512_512_1024,Default,0.359537
GemmAndBiasTunableOp_float_TN,tn_1024_177_512_ld_512_512_1024,Gemm_Hipblaslt_6377,0.101373
GemmAndBiasTunableOp_float_TN,tn_1024_758_512_ld_512_512_1024,Default,0.353336
GemmAndBiasTunableOp_float_TN,tn_1024_763_512_ld_512_512_1024,Default,0.353722
GemmAndBiasTunableOp_float_TN,tn_120_450_120_ld_120_120_120,Gemm_Hipblaslt_6376,0.0201254
GemmAndBiasTunableOp_float_TN,tn_1024_765_512_ld_512_512_1024,Gemm_Hipblaslt_6377,0.35527
GemmAndBiasTunableOp_float_TN,tn_1024_767_512_ld_512_512_1024,Default,0.360064
GemmAndBiasTunableOp_float_TN,tn_1024_774_512_ld_512_512_1024,Gemm_Hipblaslt_6377,0.360469
GemmAndBiasTunableOp_float_TN,tn_1024_775_512_ld_512_512_1024,Gemm_Hipblaslt_6377,0.359844
GemmAndBiasTunableOp_float_TN,tn_1024_441_512_ld_512_512_1024,Gemm_Hipblaslt_6377,0.189845
GemmAndBiasTunableOp_float_TN,tn_1024_203_512_ld_512_512_1024,Gemm_Hipblaslt_6377,0.105989
GemmAndBiasTunableOp_float_TN,tn_1024_785_512_ld_512_512_1024,Default,0.36671
GemmAndBiasTunableOp_float_TN,tn_1024_410_512_ld_512_512_1024,Gemm_Hipblaslt_6377,0.190437
GemmAndBiasTunableOp_float_TN,tn_1024_790_512_ld_512_512_1024,Gemm_Hipblaslt_6377,0.374395
GemmAndBiasTunableOp_float_TN,tn_240_444_120_ld_120_120_240,Gemm_Hipblaslt_6377,0.0175874
GemmAndBiasTunableOp_float_TN,tn_1024_795_512_ld_512_512_1024,Default,0.371011
GemmAndBiasTunableOp_float_TN,tn_1024_297_512_ld_512_512_1024,Gemm_Hipblaslt_6377,0.151611
GemmAndBiasTunableOp_float_TN,tn_1024_741_512_ld_512_512_1024,Gemm_Hipblaslt_6377,0.342576
GemmAndBiasTunableOp_float_TN,tn_1024_761_512_ld_512_512_1024,Default,0.359544
GemmAndBiasTunableOp_float_TN,tn_1024_797_512_ld_512_512_1024,Gemm_Hipblaslt_6377,0.366766
GemmAndBiasTunableOp_float_TN,tn_1024_799_512_ld_512_512_1024,Gemm_Hipblaslt_6377,0.376269
GemmAndBiasTunableOp_float_TN,tn_1024_801_512_ld_512_512_1024,Default,0.373679
GemmAndBiasTunableOp_float_TN,tn_1024_802_512_ld_512_512_1024,Default,0.387811
GemmAndBiasTunableOp_float_TN,tn_240_396_120_ld_120_120_240,Gemm_Hipblaslt_6377,0.0164328
GemmAndBiasTunableOp_float_TN,tn_1024_807_512_ld_512_512_1024,Default,0.379197
GemmAndBiasTunableOp_float_TN,tn_1024_808_512_ld_512_512_1024,Default,0.378164
GemmAndBiasTunableOp_float_TN,tn_1024_426_512_ld_512_512_1024,Gemm_Hipblaslt_6377,0.209475
GemmAndBiasTunableOp_float_TN,tn_1024_810_512_ld_512_512_1024,Gemm_Hipblaslt_6377,0.374007
GemmAndBiasTunableOp_float_TN,tn_1024_812_512_ld_512_512_1024,Default,0.377519
GemmAndBiasTunableOp_float_TN,tn_1024_143_512_ld_512_512_1024,Gemm_Hipblaslt_6377,0.0763328
GemmAndBiasTunableOp_float_TN,tn_120_756_240_ld_240_240_120,Gemm_Hipblaslt_6377,0.0266549
GemmAndBiasTunableOp_float_TN,tn_1024_816_512_ld_512_512_1024,Gemm_Hipblaslt_6377,0.376724
GemmAndBiasTunableOp_float_TN,tn_1024_817_512_ld_512_512_1024,Default,0.384825
GemmAndBiasTunableOp_float_TN,tn_1024_1019_512_ld_512_512_1024,Default,0.469064
GemmAndBiasTunableOp_float_TN,tn_1024_820_512_ld_512_512_1024,Gemm_Hipblaslt_6377,0.377881
GemmAndBiasTunableOp_float_TN,tn_1024_823_512_ld_512_512_1024,Default,0.379302
GemmAndBiasTunableOp_float_TN,tn_1024_824_512_ld_512_512_1024,Default,0.387074
GemmAndBiasTunableOp_float_TN,tn_1024_826_512_ld_512_512_1024,Gemm_Hipblaslt_6377,0.38157
GemmAndBiasTunableOp_float_TN,tn_1024_829_512_ld_512_512_1024,Gemm_Hipblaslt_6377,0.373585
GemmAndBiasTunableOp_float_TN,tn_1024_830_512_ld_512_512_1024,Default,0.380925
GemmAndBiasTunableOp_float_TN,tn_1024_834_512_ld_512_512_1024,Gemm_Hipblaslt_6377,0.388719
GemmAndBiasTunableOp_float_TN,tn_1024_835_512_ld_512_512_1024,Gemm_Hipblaslt_6377,0.38926
GemmStridedBatchedTunableOp_float_TN,tn_297_297_128_B_16_ld_128_2048_297,Gemm_Hipblaslt_6377,0.15556
GemmStridedBatchedTunableOp_float_TN,tn_230_1_128_B_16_ld_128_128_230,Gemm_Rocblas_6377,0.0133054
GemmStridedBatchedTunableOp_float_TN,tn_225_1_128_B_16_ld_128_128_225,Gemm_Hipblaslt_6376,0.0132538
GemmStridedBatchedTunableOp_float_TN,tn_222_1_128_B_16_ld_128_128_222,Gemm_Hipblaslt_6376,0.0131809
GemmStridedBatchedTunableOp_float_TN,tn_221_1_128_B_16_ld_128_128_221,Gemm_Hipblaslt_6376,0.0129932
GemmStridedBatchedTunableOp_float_TN,tn_218_1_128_B_16_ld_128_128_218,Gemm_Rocblas_6377,0.0130501
GemmStridedBatchedTunableOp_float_TN,tn_217_1_128_B_16_ld_128_128_217,Gemm_Rocblas_6377,0.0130293
GemmStridedBatchedTunableOp_float_TN,tn_215_1_128_B_16_ld_128_128_215,Gemm_Rocblas_6377,0.0129111
GemmStridedBatchedTunableOp_float_TN,tn_727_727_128_B_16_ld_128_2048_727,Gemm_Hipblaslt_6377,0.884773
GemmStridedBatchedTunableOp_float_TN,tn_1266_1266_128_B_16_ld_128_2048_1266,Default,2.65977
GemmStridedBatchedTunableOp_float_TN,tn_896_896_128_B_16_ld_128_2048_896,Default,1.30301
GemmStridedBatchedTunableOp_float_TN,tn_757_757_128_B_16_ld_128_2048_757,Default,0.969668
GemmStridedBatchedTunableOp_float_TN,tn_1060_1060_128_B_16_ld_128_2048_1060,Gemm_Hipblaslt_6377,1.86317
GemmStridedBatchedTunableOp_float_TN,tn_1140_1140_128_B_16_ld_128_2048_1140,Default,2.15338
GemmStridedBatchedTunableOp_float_TN,tn_1135_1135_128_B_16_ld_128_2048_1135,Default,2.16383
GemmStridedBatchedTunableOp_float_TN,tn_1117_1117_128_B_16_ld_128_2048_1117,Default,2.07217
GemmStridedBatchedTunableOp_float_TN,tn_953_953_128_B_16_ld_128_2048_953,Gemm_Hipblaslt_6377,1.48853
GemmStridedBatchedTunableOp_float_TN,tn_651_651_128_B_16_ld_128_2048_651,Gemm_Hipblaslt_6377,0.689412
GemmStridedBatchedTunableOp_float_TN,tn_1640_1_128_B_16_ld_128_128_1640,Gemm_Hipblaslt_6376,0.04978
GemmStridedBatchedTunableOp_float_TN,tn_1638_1_128_B_16_ld_128_128_1638,Gemm_Hipblaslt_6376,0.0498352
GemmStridedBatchedTunableOp_float_TN,tn_1636_1_128_B_16_ld_128_128_1636,Gemm_Hipblaslt_6376,0.0475746
GemmStridedBatchedTunableOp_float_TN,tn_1635_1_128_B_16_ld_128_128_1635,Gemm_Hipblaslt_6376,0.0498648
GemmStridedBatchedTunableOp_float_TN,tn_1633_1_128_B_16_ld_128_128_1633,Gemm_Hipblaslt_6376,0.0489103
GemmStridedBatchedTunableOp_float_TN,tn_1631_1_128_B_16_ld_128_128_1631,Gemm_Hipblaslt_6376,0.0485228
GemmStridedBatchedTunableOp_float_TN,tn_1630_1_128_B_16_ld_128_128_1630,Gemm_Hipblaslt_6376,0.0493334
GemmStridedBatchedTunableOp_float_TN,tn_1628_1_128_B_16_ld_128_128_1628,Gemm_Hipblaslt_6376,0.0471201
GemmStridedBatchedTunableOp_float_TN,tn_1627_1_128_B_16_ld_128_128_1627,Gemm_Hipblaslt_6376,0.0495563
GemmStridedBatchedTunableOp_float_TN,tn_1623_1_128_B_16_ld_128_128_1623,Gemm_Hipblaslt_6376,0.049313
GemmStridedBatchedTunableOp_float_TN,tn_1629_1_128_B_16_ld_128_128_1629,Gemm_Hipblaslt_6376,0.048152
GemmStridedBatchedTunableOp_float_TN,tn_1621_1_128_B_16_ld_128_128_1621,Gemm_Hipblaslt_6376,0.0490077
GemmStridedBatchedTunableOp_float_TN,tn_1620_1_128_B_16_ld_128_128_1620,Gemm_Hipblaslt_6376,0.0477454
GemmStridedBatchedTunableOp_float_TN,tn_1619_1_128_B_16_ld_128_128_1619,Gemm_Hipblaslt_6376,0.0496937
GemmStridedBatchedTunableOp_float_TN,tn_1617_1_128_B_16_ld_128_128_1617,Gemm_Hipblaslt_6376,0.0488186
GemmStridedBatchedTunableOp_float_TN,tn_1616_1_128_B_16_ld_128_128_1616,Gemm_Hipblaslt_6378,0.0491617
GemmStridedBatchedTunableOp_float_TN,tn_1614_1_128_B_16_ld_128_128_1614,Gemm_Hipblaslt_6376,0.0498205
GemmStridedBatchedTunableOp_float_TN,tn_1613_1_128_B_16_ld_128_128_1613,Gemm_Hipblaslt_6376,0.0484635
GemmStridedBatchedTunableOp_float_TN,tn_1612_1_128_B_16_ld_128_128_1612,Gemm_Hipblaslt_6376,0.0490462
GemmStridedBatchedTunableOp_float_TN,tn_1611_1_128_B_16_ld_128_128_1611,Gemm_Hipblaslt_6376,0.049366
GemmStridedBatchedTunableOp_float_TN,tn_1609_1_128_B_16_ld_128_128_1609,Gemm_Hipblaslt_6376,0.0503029
GemmStridedBatchedTunableOp_float_TN,tn_1608_1_128_B_16_ld_128_128_1608,Gemm_Hipblaslt_6376,0.0485601
GemmStridedBatchedTunableOp_float_TN,tn_1607_1607_128_B_16_ld_128_2048_1607,Default,4.43051
GemmStridedBatchedTunableOp_float_TN,tn_1195_1195_128_B_16_ld_128_2048_1195,Gemm_Rocblas_6378,2.40842
GemmStridedBatchedTunableOp_float_TN,tn_1134_1134_128_B_16_ld_128_2048_1134,Gemm_Rocblas_6378,2.13466
GemmStridedBatchedTunableOp_float_TN,tn_1179_1179_128_B_16_ld_128_2048_1179,Gemm_Rocblas_6378,2.29791
GemmStridedBatchedTunableOp_float_TN,tn_792_792_128_B_16_ld_128_2048_792,Default,1.03059
GemmStridedBatchedTunableOp_float_TN,tn_1118_1118_128_B_16_ld_128_2048_1118,Gemm_Rocblas_6378,2.04117
GemmStridedBatchedTunableOp_float_TN,tn_944_944_128_B_16_ld_128_2048_944,Default,1.44304
GemmStridedBatchedTunableOp_float_TN,tn_1194_1194_128_B_16_ld_128_2048_1194,Gemm_Rocblas_6378,2.32504
GemmStridedBatchedTunableOp_float_TN,tn_1062_1062_128_B_16_ld_128_2048_1062,Gemm_Hipblaslt_6377,1.8855
GemmStridedBatchedTunableOp_float_TN,tn_481_1_128_B_16_ld_128_128_481,Gemm_Rocblas_6377,0.0199943
GemmStridedBatchedTunableOp_float_TN,tn_480_1_128_B_16_ld_128_128_480,Gemm_Rocblas_6377,0.0200765
GemmStridedBatchedTunableOp_float_TN,tn_477_1_128_B_16_ld_128_128_477,Gemm_Rocblas_6377,0.0195876
GemmStridedBatchedTunableOp_float_TN,tn_476_1_128_B_16_ld_128_128_476,Gemm_Rocblas_6377,0.0187449
GemmStridedBatchedTunableOp_float_TN,tn_475_1_128_B_16_ld_128_128_475,Gemm_Rocblas_6377,0.0197046
GemmStridedBatchedTunableOp_float_TN,tn_473_1_128_B_16_ld_128_128_473,Gemm_Rocblas_6377,0.0198121
GemmStridedBatchedTunableOp_float_TN,tn_472_1_128_B_16_ld_128_128_472,Gemm_Rocblas_6377,0.0196193
GemmStridedBatchedTunableOp_float_TN,tn_471_1_128_B_16_ld_128_128_471,Gemm_Hipblaslt_6376,0.0196181
GemmStridedBatchedTunableOp_float_TN,tn_468_1_128_B_16_ld_128_128_468,Gemm_Rocblas_6377,0.0196934
GemmStridedBatchedTunableOp_float_TN,tn_465_1_128_B_16_ld_128_128_465,Gemm_Rocblas_6377,0.019386
GemmStridedBatchedTunableOp_float_TN,tn_463_1_128_B_16_ld_128_128_463,Gemm_Hipblaslt_6376,0.0195696
GemmStridedBatchedTunableOp_float_TN,tn_459_1_128_B_16_ld_128_128_459,Gemm_Hipblaslt_6376,0.0194357
GemmStridedBatchedTunableOp_float_TN,tn_458_1_128_B_16_ld_128_128_458,Gemm_Rocblas_6377,0.0193512
GemmStridedBatchedTunableOp_float_TN,tn_454_1_128_B_16_ld_128_128_454,Gemm_Hipblaslt_6376,0.019069
GemmStridedBatchedTunableOp_float_TN,tn_451_1_128_B_16_ld_128_128_451,Gemm_Rocblas_6377,0.0191524
GemmStridedBatchedTunableOp_float_TN,tn_448_1_128_B_16_ld_128_128_448,Gemm_Rocblas_6377,0.0191176
GemmStridedBatchedTunableOp_float_TN,tn_447_1_128_B_16_ld_128_128_447,Gemm_Rocblas_6377,0.0189872
GemmStridedBatchedTunableOp_float_TN,tn_402_402_128_B_16_ld_128_2048_402,Gemm_Hipblaslt_6377,0.279587
GemmStridedBatchedTunableOp_float_TN,tn_1247_1247_128_B_16_ld_128_2048_1247,Gemm_Rocblas_6378,2.51631
GemmStridedBatchedTunableOp_float_TN,tn_1343_1343_128_B_16_ld_128_2048_1343,Default,2.99036
GemmStridedBatchedTunableOp_float_TN,tn_965_965_128_B_16_ld_128_2048_965,Default,1.56415
GemmStridedBatchedTunableOp_float_TN,tn_1004_1004_128_B_16_ld_128_2048_1004,Default,1.64847
GemmStridedBatchedTunableOp_float_TN,tn_1034_1034_128_B_16_ld_128_2048_1034,Gemm_Hipblaslt_6377,1.73607
GemmStridedBatchedTunableOp_float_TN,tn_1154_1154_128_B_16_ld_128_2048_1154,Default,2.22877
GemmStridedBatchedTunableOp_float_TN,tn_1087_1087_128_B_16_ld_128_2048_1087,Default,1.92625
GemmStridedBatchedTunableOp_float_TN,tn_1205_1205_128_B_16_ld_128_2048_1205,Default,2.41872
GemmStridedBatchedTunableOp_float_TN,tn_951_951_128_B_16_ld_128_2048_951,Default,1.50558
GemmStridedBatchedTunableOp_float_TN,tn_1264_1264_128_B_16_ld_128_2048_1264,Gemm_Rocblas_6378,2.56327
GemmStridedBatchedTunableOp_float_TN,tn_1224_1224_128_B_16_ld_128_2048_1224,Default,2.43688
GemmStridedBatchedTunableOp_float_TN,tn_1103_1103_128_B_16_ld_128_2048_1103,Default,2.01038
GemmStridedBatchedTunableOp_float_TN,tn_1059_1059_128_B_16_ld_128_2048_1059,Gemm_Hipblaslt_6377,1.88504
GemmStridedBatchedTunableOp_float_TN,tn_961_961_128_B_16_ld_128_2048_961,Default,1.57562
GemmStridedBatchedTunableOp_float_TN,tn_869_869_128_B_16_ld_128_2048_869,Default,1.25636
GemmStridedBatchedTunableOp_float_TN,tn_1073_1073_128_B_16_ld_128_2048_1073,Gemm_Hipblaslt_6377,1.95297
GemmStridedBatchedTunableOp_float_TN,tn_1206_1206_128_B_16_ld_128_2048_1206,Gemm_Rocblas_6378,2.41678
GemmStridedBatchedTunableOp_float_TN,tn_1184_1184_128_B_16_ld_128_2048_1184,Gemm_Rocblas_6378,2.24469
GemmStridedBatchedTunableOp_float_TN,tn_1076_1076_128_B_16_ld_128_2048_1076,Default,1.93084
GemmStridedBatchedTunableOp_float_TN,tn_1067_1067_128_B_16_ld_128_2048_1067,Gemm_Rocblas_6378,1.90621
GemmStridedBatchedTunableOp_float_TN,tn_1063_1063_128_B_16_ld_128_2048_1063,Gemm_Rocblas_6378,1.90332
GemmStridedBatchedTunableOp_float_TN,tn_684_684_128_B_16_ld_128_2048_684,Gemm_Rocblas_6378,0.766933
GemmStridedBatchedTunableOp_float_TN,tn_889_889_128_B_16_ld_128_2048_889,Default,1.34241
GemmStridedBatchedTunableOp_float_TN,tn_1544_1_128_B_16_ld_128_128_1544,Gemm_Hipblaslt_6376,0.0475894
GemmStridedBatchedTunableOp_float_TN,tn_1543_1_128_B_16_ld_128_128_1543,Gemm_Hipblaslt_6376,0.0472592
GemmStridedBatchedTunableOp_float_TN,tn_1542_1_128_B_16_ld_128_128_1542,Gemm_Hipblaslt_6376,0.0466541
GemmStridedBatchedTunableOp_float_TN,tn_1541_1_128_B_16_ld_128_128_1541,Gemm_Hipblaslt_6376,0.0466164
GemmStridedBatchedTunableOp_float_TN,tn_1540_1_128_B_16_ld_128_128_1540,Gemm_Hipblaslt_6376,0.0472993
GemmStridedBatchedTunableOp_float_TN,tn_1536_1_128_B_16_ld_128_128_1536,Gemm_Hipblaslt_6376,0.0466368
GemmStridedBatchedTunableOp_float_TN,tn_1533_1_128_B_16_ld_128_128_1533,Gemm_Hipblaslt_6376,0.0501085
GemmStridedBatchedTunableOp_float_TN,tn_1532_1_128_B_16_ld_128_128_1532,Gemm_Hipblaslt_6376,0.0465278
GemmStridedBatchedTunableOp_float_TN,tn_1527_1_128_B_16_ld_128_128_1527,Gemm_Hipblaslt_6376,0.0465551
GemmStridedBatchedTunableOp_float_TN,tn_1526_1_128_B_16_ld_128_128_1526,Gemm_Hipblaslt_6376,0.0455576
GemmStridedBatchedTunableOp_float_TN,tn_1524_1_128_B_16_ld_128_128_1524,Gemm_Hipblaslt_6376,0.0460233
GemmStridedBatchedTunableOp_float_TN,tn_1521_1_128_B_16_ld_128_128_1521,Gemm_Hipblaslt_6376,0.0466004
GemmStridedBatchedTunableOp_float_TN,tn_1520_1_128_B_16_ld_128_128_1520,Gemm_Hipblaslt_6376,0.0454249
GemmStridedBatchedTunableOp_float_TN,tn_1519_1_128_B_16_ld_128_128_1519,Gemm_Hipblaslt_6376,0.0466725
GemmStridedBatchedTunableOp_float_TN,tn_1518_1_128_B_16_ld_128_128_1518,Gemm_Hipblaslt_6376,0.0467659
GemmStridedBatchedTunableOp_float_TN,tn_1517_1_128_B_16_ld_128_128_1517,Gemm_Hipblaslt_6376,0.0460224
GemmStridedBatchedTunableOp_float_TN,tn_1516_1_128_B_16_ld_128_128_1516,Gemm_Hipblaslt_6376,0.0464248
GemmStridedBatchedTunableOp_float_TN,tn_1634_1_128_B_16_ld_128_128_1634,Gemm_Hipblaslt_6378,0.0501651
GemmStridedBatchedTunableOp_float_TN,tn_1513_1_128_B_16_ld_128_128_1513,Gemm_Hipblaslt_6376,0.0461287
GemmStridedBatchedTunableOp_float_TN,tn_1512_1_128_B_16_ld_128_128_1512,Gemm_Hipblaslt_6376,0.0461146
GemmStridedBatchedTunableOp_float_TN,tn_1511_1_128_B_16_ld_128_128_1511,Gemm_Hipblaslt_6376,0.0473987
GemmStridedBatchedTunableOp_float_TN,tn_1508_1_128_B_16_ld_128_128_1508,Gemm_Hipblaslt_6376,0.0458021
GemmStridedBatchedTunableOp_float_TN,tn_1507_1_128_B_16_ld_128_128_1507,Gemm_Hipblaslt_6376,0.0463439
GemmStridedBatchedTunableOp_float_TN,tn_1506_1_128_B_16_ld_128_128_1506,Gemm_Hipblaslt_6376,0.0452395
GemmStridedBatchedTunableOp_float_TN,tn_1504_1_128_B_16_ld_128_128_1504,Gemm_Hipblaslt_6376,0.045748
GemmStridedBatchedTunableOp_float_TN,tn_1503_1_128_B_16_ld_128_128_1503,Gemm_Hipblaslt_6376,0.0468128
GemmStridedBatchedTunableOp_float_TN,tn_1502_1_128_B_16_ld_128_128_1502,Gemm_Hipblaslt_6376,0.045582
GemmStridedBatchedTunableOp_float_TN,tn_1501_1_128_B_16_ld_128_128_1501,Gemm_Hipblaslt_6376,0.046553
GemmStridedBatchedTunableOp_float_TN,tn_1499_1_128_B_16_ld_128_128_1499,Gemm_Hipblaslt_6376,0.0451785
GemmStridedBatchedTunableOp_float_TN,tn_1498_1_128_B_16_ld_128_128_1498,Gemm_Hipblaslt_6376,0.046293
GemmStridedBatchedTunableOp_float_TN,tn_1496_1_128_B_16_ld_128_128_1496,Gemm_Hipblaslt_6376,0.0455636
GemmStridedBatchedTunableOp_float_TN,tn_1495_1_128_B_16_ld_128_128_1495,Gemm_Hipblaslt_6376,0.0457536
GemmStridedBatchedTunableOp_float_TN,tn_1494_1_128_B_16_ld_128_128_1494,Gemm_Hipblaslt_6376,0.0459905
GemmStridedBatchedTunableOp_float_TN,tn_1493_1_128_B_16_ld_128_128_1493,Gemm_Hipblaslt_6376,0.0457323
GemmStridedBatchedTunableOp_float_TN,tn_1492_1_128_B_16_ld_128_128_1492,Gemm_Hipblaslt_6376,0.0445446
GemmStridedBatchedTunableOp_float_TN,tn_1490_1_128_B_16_ld_128_128_1490,Gemm_Hipblaslt_6376,0.0455108
GemmStridedBatchedTunableOp_float_TN,tn_1489_1_128_B_16_ld_128_128_1489,Gemm_Hipblaslt_6376,0.0449777
GemmStridedBatchedTunableOp_float_TN,tn_1488_1_128_B_16_ld_128_128_1488,Gemm_Hipblaslt_6376,0.0455476
GemmStridedBatchedTunableOp_float_TN,tn_1487_1_128_B_16_ld_128_128_1487,Gemm_Rocblas_6379,0.0462626
GemmStridedBatchedTunableOp_float_TN,tn_1485_1_128_B_16_ld_128_128_1485,Gemm_Hipblaslt_6376,0.0455488
GemmStridedBatchedTunableOp_float_TN,tn_1484_1_128_B_16_ld_128_128_1484,Gemm_Hipblaslt_6376,0.0444452
GemmStridedBatchedTunableOp_float_TN,tn_1482_1_128_B_16_ld_128_128_1482,Gemm_Hipblaslt_6376,0.0454058
GemmStridedBatchedTunableOp_float_TN,tn_1481_1_128_B_16_ld_128_128_1481,Gemm_Hipblaslt_6376,0.0448603
GemmStridedBatchedTunableOp_float_TN,tn_1480_1_128_B_16_ld_128_128_1480,Gemm_Hipblaslt_6376,0.0439715
GemmStridedBatchedTunableOp_float_TN,tn_1479_1_128_B_16_ld_128_128_1479,Gemm_Hipblaslt_6376,0.0456049
GemmStridedBatchedTunableOp_float_TN,tn_1475_1_128_B_16_ld_128_128_1475,Gemm_Hipblaslt_6376,0.0450199
GemmStridedBatchedTunableOp_float_TN,tn_1474_1_128_B_16_ld_128_128_1474,Gemm_Hipblaslt_6376,0.0453052
GemmStridedBatchedTunableOp_float_TN,tn_1472_1_128_B_16_ld_128_128_1472,Gemm_Hipblaslt_6376,0.0443811
GemmStridedBatchedTunableOp_float_TN,tn_1471_1_128_B_16_ld_128_128_1471,Gemm_Hipblaslt_6376,0.0461035
GemmStridedBatchedTunableOp_float_TN,tn_1470_1_128_B_16_ld_128_128_1470,Gemm_Hipblaslt_6376,0.0460746
GemmStridedBatchedTunableOp_float_TN,tn_1469_1_128_B_16_ld_128_128_1469,Gemm_Hipblaslt_6376,0.0449437
GemmStridedBatchedTunableOp_float_TN,tn_1468_1_128_B_16_ld_128_128_1468,Gemm_Hipblaslt_6376,0.0442191
GemmStridedBatchedTunableOp_float_TN,tn_251_251_128_B_16_ld_128_2048_251,Gemm_Hipblaslt_6377,0.121781
GemmStridedBatchedTunableOp_float_TN,tn_686_686_128_B_16_ld_128_2048_686,Gemm_Hipblaslt_6377,0.76994
GemmStridedBatchedTunableOp_float_TN,tn_648_648_128_B_16_ld_128_2048_648,Gemm_Hipblaslt_6377,0.684594
GemmStridedBatchedTunableOp_float_TN,tn_1188_1188_128_B_16_ld_128_2048_1188,Default,2.34009
GemmStridedBatchedTunableOp_float_TN,tn_365_1_128_B_16_ld_128_128_365,Gemm_Hipblaslt_6376,0.0171125
GemmStridedBatchedTunableOp_float_TN,tn_363_1_128_B_16_ld_128_128_363,Gemm_Hipblaslt_6376,0.0170565
GemmStridedBatchedTunableOp_float_TN,tn_362_1_128_B_16_ld_128_128_362,Gemm_Rocblas_6377,0.0170408
GemmStridedBatchedTunableOp_float_TN,tn_361_1_128_B_16_ld_128_128_361,Gemm_Hipblaslt_6376,0.0169811
GemmStridedBatchedTunableOp_float_TN,tn_1523_1_128_B_16_ld_128_128_1523,Gemm_Rocblas_6377,0.0460473
GemmStridedBatchedTunableOp_float_TN,tn_359_1_128_B_16_ld_128_128_359,Gemm_Hipblaslt_6376,0.0168978
GemmStridedBatchedTunableOp_float_TN,tn_357_1_128_B_16_ld_128_128_357,Gemm_Rocblas_6377,0.0166825
GemmStridedBatchedTunableOp_float_TN,tn_356_1_128_B_16_ld_128_128_356,Gemm_Rocblas_6377,0.0168472
GemmStridedBatchedTunableOp_float_TN,tn_355_1_128_B_16_ld_128_128_355,Gemm_Hipblaslt_6376,0.0168909
GemmStridedBatchedTunableOp_float_TN,tn_354_1_128_B_16_ld_128_128_354,Gemm_Hipblaslt_6376,0.0168481
GemmStridedBatchedTunableOp_float_TN,tn_353_1_128_B_16_ld_128_128_353,Gemm_Hipblaslt_6376,0.0157315
GemmStridedBatchedTunableOp_float_TN,tn_352_1_128_B_16_ld_128_128_352,Gemm_Rocblas_6377,0.0155737
GemmStridedBatchedTunableOp_float_TN,tn_351_1_128_B_16_ld_128_128_351,Gemm_Hipblaslt_6376,0.0166973
GemmStridedBatchedTunableOp_float_TN,tn_350_1_128_B_16_ld_128_128_350,Gemm_Hipblaslt_6376,0.0166909
GemmStridedBatchedTunableOp_float_TN,tn_348_1_128_B_16_ld_128_128_348,Gemm_Rocblas_6377,0.0166721
GemmStridedBatchedTunableOp_float_TN,tn_345_1_128_B_16_ld_128_128_345,Gemm_Hipblaslt_6376,0.0165812
GemmStridedBatchedTunableOp_float_TN,tn_344_1_128_B_16_ld_128_128_344,Gemm_Hipblaslt_6376,0.0165146
GemmStridedBatchedTunableOp_float_TN,tn_342_1_128_B_16_ld_128_128_342,Gemm_Rocblas_6377,0.0165419
GemmStridedBatchedTunableOp_float_TN,tn_341_1_128_B_16_ld_128_128_341,Gemm_Rocblas_6377,0.0164918
GemmStridedBatchedTunableOp_float_TN,tn_340_1_128_B_16_ld_128_128_340,Gemm_Rocblas_6377,0.0164862
GemmStridedBatchedTunableOp_float_TN,tn_339_1_128_B_16_ld_128_128_339,Gemm_Rocblas_6377,0.0154134
GemmStridedBatchedTunableOp_float_TN,tn_338_1_128_B_16_ld_128_128_338,Gemm_Rocblas_6377,0.0166064
GemmStridedBatchedTunableOp_float_TN,tn_337_1_128_B_16_ld_128_128_337,Gemm_Hipblaslt_6376,0.0163981
GemmStridedBatchedTunableOp_float_TN,tn_334_1_128_B_16_ld_128_128_334,Gemm_Rocblas_6377,0.0161972
GemmStridedBatchedTunableOp_float_TN,tn_332_1_128_B_16_ld_128_128_332,Gemm_Rocblas_6377,0.0163432
GemmStridedBatchedTunableOp_float_TN,tn_331_1_128_B_16_ld_128_128_331,Gemm_Hipblaslt_6376,0.0162233
GemmStridedBatchedTunableOp_float_TN,tn_329_1_128_B_16_ld_128_128_329,Gemm_Rocblas_6377,0.0162289
GemmStridedBatchedTunableOp_float_TN,tn_327_1_128_B_16_ld_128_128_327,Gemm_Hipblaslt_6376,0.0162149
GemmStridedBatchedTunableOp_float_TN,tn_326_1_128_B_16_ld_128_128_326,Gemm_Hipblaslt_6376,0.0161167
GemmStridedBatchedTunableOp_float_TN,tn_238_1_128_B_16_ld_128_128_238,Gemm_Rocblas_6377,0.01363
GemmStridedBatchedTunableOp_float_TN,tn_237_1_128_B_16_ld_128_128_237,Gemm_Hipblaslt_6376,0.0136028
GemmStridedBatchedTunableOp_float_TN,tn_236_1_128_B_16_ld_128_128_236,Gemm_Rocblas_6377,0.0128675
GemmStridedBatchedTunableOp_float_TN,tn_235_1_128_B_16_ld_128_128_235,Gemm_Hipblaslt_6376,0.012756
GemmStridedBatchedTunableOp_float_TN,tn_233_1_128_B_16_ld_128_128_233,Gemm_Hipblaslt_6376,0.013537
GemmStridedBatchedTunableOp_float_TN,tn_231_1_128_B_16_ld_128_128_231,Gemm_Rocblas_6377,0.0132758
GemmStridedBatchedTunableOp_float_TN,tn_1294_1_128_B_16_ld_128_128_1294,Gemm_Hipblaslt_6376,0.0443381
GemmStridedBatchedTunableOp_float_TN,tn_1293_1_128_B_16_ld_128_128_1293,Gemm_Hipblaslt_6376,0.0446423
GemmStridedBatchedTunableOp_float_TN,tn_1292_1_128_B_16_ld_128_128_1292,Gemm_Hipblaslt_6376,0.0432008
GemmStridedBatchedTunableOp_float_TN,tn_1291_1_128_B_16_ld_128_128_1291,Gemm_Hipblaslt_6376,0.0442391
GemmStridedBatchedTunableOp_float_TN,tn_1290_1_128_B_16_ld_128_128_1290,Gemm_Hipblaslt_6376,0.0444751
GemmStridedBatchedTunableOp_float_TN,tn_1286_1_128_B_16_ld_128_128_1286,Gemm_Hipblaslt_6376,0.0444751
GemmStridedBatchedTunableOp_float_TN,tn_1282_1_128_B_16_ld_128_128_1282,Gemm_Hipblaslt_6376,0.0435911
GemmStridedBatchedTunableOp_float_TN,tn_1281_1_128_B_16_ld_128_128_1281,Gemm_Hipblaslt_6376,0.0442536
GemmStridedBatchedTunableOp_float_TN,tn_1280_1_128_B_16_ld_128_128_1280,Gemm_Hipblaslt_6376,0.0440304
GemmStridedBatchedTunableOp_float_TN,tn_1232_1232_128_B_16_ld_128_2048_1232,Default,2.45092
GemmStridedBatchedTunableOp_float_TN,tn_796_1_128_B_16_ld_128_128_796,Gemm_Rocblas_6379,0.0354382
GemmStridedBatchedTunableOp_float_TN,tn_794_1_128_B_16_ld_128_128_794,Gemm_Rocblas_6379,0.035881
GemmStridedBatchedTunableOp_float_TN,tn_791_1_128_B_16_ld_128_128_791,Gemm_Hipblaslt_6378,0.0353701
GemmStridedBatchedTunableOp_float_TN,tn_789_1_128_B_16_ld_128_128_789,Gemm_Rocblas_6379,0.0356986
GemmStridedBatchedTunableOp_float_TN,tn_1525_1_128_B_16_ld_128_128_1525,Gemm_Hipblaslt_6376,0.047393
GemmStridedBatchedTunableOp_float_TN,tn_787_1_128_B_16_ld_128_128_787,Gemm_Rocblas_6379,0.0353806
GemmStridedBatchedTunableOp_float_TN,tn_786_786_128_B_16_ld_128_2048_786,Gemm_Hipblaslt_6377,1.0062
GemmStridedBatchedTunableOp_float_TN,tn_453_1_128_B_16_ld_128_128_453,Gemm_Rocblas_6377,0.0191596
GemmStridedBatchedTunableOp_float_TN,tn_452_452_128_B_16_ld_128_2048_452,Gemm_Rocblas_6378,0.344183
GemmStridedBatchedTunableOp_float_TN,tn_245_1_128_B_16_ld_128_128_245,Gemm_Rocblas_6377,0.0137017
GemmStridedBatchedTunableOp_float_TN,tn_242_1_128_B_16_ld_128_128_242,Gemm_Rocblas_6377,0.0136965
GemmStridedBatchedTunableOp_float_TN,tn_241_1_128_B_16_ld_128_128_241,Gemm_Rocblas_6377,0.0137811
GemmStridedBatchedTunableOp_float_TN,tn_519_519_128_B_16_ld_128_2048_519,Gemm_Hipblaslt_6377,0.440258
GemmStridedBatchedTunableOp_float_TN,tn_822_822_128_B_16_ld_128_2048_822,Default,1.13264
GemmStridedBatchedTunableOp_float_TN,tn_1378_1_128_B_16_ld_128_128_1378,Gemm_Hipblaslt_6376,0.0436549
GemmStridedBatchedTunableOp_float_TN,tn_1377_1_128_B_16_ld_128_128_1377,Gemm_Hipblaslt_6376,0.0447461
GemmStridedBatchedTunableOp_float_TN,tn_1376_1_128_B_16_ld_128_128_1376,Gemm_Hipblaslt_6376,0.0437771
GemmStridedBatchedTunableOp_float_TN,tn_1375_1_128_B_16_ld_128_128_1375,Gemm_Hipblaslt_6376,0.0457022
GemmStridedBatchedTunableOp_float_TN,tn_1374_1_128_B_16_ld_128_128_1374,Gemm_Hipblaslt_6376,0.0439766
GemmStridedBatchedTunableOp_float_TN,tn_1336_1336_128_B_16_ld_128_2048_1336,Gemm_Rocblas_6378,2.88809
GemmStridedBatchedTunableOp_float_TN,tn_724_724_128_B_16_ld_128_2048_724,Gemm_Hipblaslt_6377,0.851651
GemmStridedBatchedTunableOp_float_TN,tn_1173_1_128_B_16_ld_128_128_1173,Gemm_Hipblaslt_6376,0.0416423
GemmStridedBatchedTunableOp_float_TN,tn_1172_1_128_B_16_ld_128_128_1172,Gemm_Hipblaslt_6378,0.0417296
GemmStridedBatchedTunableOp_float_TN,tn_223_1_128_B_16_ld_128_128_223,Gemm_Hipblaslt_6376,0.013172
GemmStridedBatchedTunableOp_float_TN,tn_381_1_64_B_8_ld_512_64_381,Gemm_Hipblaslt_6376,0.00883699
GemmStridedBatchedTunableOp_float_TN,tn_1432_1_128_B_16_ld_128_128_1432,Gemm_Hipblaslt_6376,0.0469646
GemmStridedBatchedTunableOp_float_TN,tn_1170_1_128_B_16_ld_128_128_1170,Gemm_Rocblas_6379,0.0411184
GemmStridedBatchedTunableOp_float_TN,tn_525_1_128_B_16_ld_128_128_525,Gemm_Rocblas_6377,0.0210467
GemmStridedBatchedTunableOp_float_TN,tn_1158_1_128_B_16_ld_128_128_1158,Gemm_Rocblas_6379,0.0413673
GemmStridedBatchedTunableOp_float_TN,tn_1450_1_128_B_16_ld_128_128_1450,Gemm_Hipblaslt_6376,0.0457645
GemmStridedBatchedTunableOp_float_TN,tn_1162_1_128_B_16_ld_128_128_1162,Gemm_Hipblaslt_6378,0.041633
GemmStridedBatchedTunableOp_float_TN,tn_605_1_64_B_8_ld_512_64_605,Gemm_Rocblas_6377,0.0105838
GemmStridedBatchedTunableOp_float_TN,tn_575_1_128_B_16_ld_128_128_575,Gemm_Rocblas_6377,0.0227868
GemmStridedBatchedTunableOp_float_TN,tn_1154_1_128_B_16_ld_128_128_1154,Gemm_Hipblaslt_6378,0.041274
GemmStridedBatchedTunableOp_float_TN,tn_1144_1_128_B_16_ld_128_128_1144,Gemm_Rocblas_6379,0.0405815
GemmStridedBatchedTunableOp_float_TN,tn_1142_1_128_B_16_ld_128_128_1142,Gemm_Hipblaslt_6378,0.0410852
GemmStridedBatchedTunableOp_float_TN,tn_1138_1_128_B_16_ld_128_128_1138,Gemm_Hipblaslt_6378,0.0386879
GemmStridedBatchedTunableOp_float_TN,tn_1137_1_128_B_16_ld_128_128_1137,Gemm_Rocblas_6379,0.0406565
GemmStridedBatchedTunableOp_float_TN,tn_974_1_64_B_8_ld_512_64_974,Gemm_Hipblaslt_6376,0.0131835
GemmStridedBatchedTunableOp_float_TN,tn_1132_1_128_B_16_ld_128_128_1132,Gemm_Hipblaslt_6378,0.0406801
GemmStridedBatchedTunableOp_float_TN,tn_500_1_64_B_8_ld_512_64_500,Gemm_Hipblaslt_6376,0.00987893
GemmStridedBatchedTunableOp_float_TN,tn_694_1_64_B_8_ld_512_64_694,Gemm_Hipblaslt_6376,0.0110608
GemmStridedBatchedTunableOp_float_TN,tn_1684_1_128_B_16_ld_128_128_1684,Gemm_Hipblaslt_6376,0.0483544
GemmStridedBatchedTunableOp_float_TN,tn_623_1_128_B_16_ld_128_128_623,Gemm_Hipblaslt_6378,0.025102
GemmStridedBatchedTunableOp_float_TN,tn_1126_1_128_B_16_ld_128_128_1126,Gemm_Rocblas_6379,0.0403694
GemmStridedBatchedTunableOp_float_TN,tn_213_1_64_B_8_ld_512_64_213,Gemm_Hipblaslt_6379,0.00950027
GemmStridedBatchedTunableOp_float_TN,tn_1125_1_128_B_16_ld_128_128_1125,Gemm_Rocblas_6379,0.040527
GemmStridedBatchedTunableOp_float_TN,tn_557_1_128_B_16_ld_128_128_557,Gemm_Rocblas_6377,0.0219865
GemmStridedBatchedTunableOp_float_TN,tn_1120_1_128_B_16_ld_128_128_1120,Gemm_Hipblaslt_6378,0.0402941
GemmStridedBatchedTunableOp_float_TN,tn_611_1_64_B_8_ld_512_64_611,Gemm_Hipblaslt_6376,0.0106264
GemmStridedBatchedTunableOp_float_TN,tn_1065_1_128_B_16_ld_128_128_1065,Gemm_Hipblaslt_6378,0.0394701
GemmStridedBatchedTunableOp_float_TN,tn_1434_1_128_B_16_ld_128_128_1434,Gemm_Hipblaslt_6376,0.045183
GemmStridedBatchedTunableOp_float_TN,tn_1119_1_128_B_16_ld_128_128_1119,Gemm_Rocblas_6379,0.0406099
GemmStridedBatchedTunableOp_float_TN,tn_967_1_64_B_8_ld_512_64_967,Gemm_Rocblas_6377,0.0137643
GemmStridedBatchedTunableOp_float_TN,tn_1372_1_128_B_16_ld_128_128_1372,Gemm_Hipblaslt_6376,0.044581
GemmStridedBatchedTunableOp_float_TN,tn_1116_1_128_B_16_ld_128_128_1116,Gemm_Rocblas_6379,0.0405362
GemmStridedBatchedTunableOp_float_TN,tn_1115_1_128_B_16_ld_128_128_1115,Gemm_Hipblaslt_6378,0.0404513
GemmStridedBatchedTunableOp_float_TN,tn_295_1_64_B_8_ld_512_64_295,Gemm_Hipblaslt_6378,0.0085906
GemmStridedBatchedTunableOp_float_TN,tn_1111_1_128_B_16_ld_128_128_1111,Gemm_Rocblas_6379,0.0405619
GemmStridedBatchedTunableOp_float_TN,tn_1101_1_128_B_16_ld_128_128_1101,Gemm_Hipblaslt_6378,0.0396666
GemmStridedBatchedTunableOp_float_TN,tn_1100_1_128_B_16_ld_128_128_1100,Gemm_Hipblaslt_6378,0.0400801
GemmStridedBatchedTunableOp_float_TN,tn_286_1_128_B_16_ld_128_128_286,Gemm_Rocblas_6377,0.0150583
GemmStridedBatchedTunableOp_float_TN,tn_1024_1_64_B_8_ld_512_64_1024,Gemm_Rocblas_6377,0.0141086
GemmStridedBatchedTunableOp_float_TN,tn_947_1_64_B_8_ld_512_64_947,Gemm_Rocblas_6377,0.013444
GemmStridedBatchedTunableOp_float_TN,tn_1022_1_64_B_8_ld_512_64_1022,Gemm_Rocblas_6377,0.0141154
GemmStridedBatchedTunableOp_float_TN,tn_902_1_128_B_16_ld_128_128_902,Gemm_Rocblas_6379,0.0370485
GemmStridedBatchedTunableOp_float_TN,tn_1019_1_64_B_8_ld_512_64_1019,Gemm_Hipblaslt_6376,0.0140284
GemmStridedBatchedTunableOp_float_TN,tn_1018_1_64_B_8_ld_512_64_1018,Gemm_Hipblaslt_6376,0.0140912
GemmStridedBatchedTunableOp_float_TN,tn_903_1_128_B_16_ld_128_128_903,Gemm_Rocblas_6379,0.0368336
GemmStridedBatchedTunableOp_float_TN,tn_642_1_128_B_16_ld_128_128_642,Gemm_Hipblaslt_6378,0.0265339
GemmStridedBatchedTunableOp_float_TN,tn_2004_1_128_B_16_ld_128_128_2004,Gemm_Hipblaslt_6376,0.0575769
GemmStridedBatchedTunableOp_float_TN,tn_1013_1_64_B_8_ld_512_64_1013,Gemm_Rocblas_6377,0.0140123
GemmStridedBatchedTunableOp_float_TN,tn_521_1_64_B_8_ld_512_64_521,Gemm_Rocblas_6377,0.0100958
GemmStridedBatchedTunableOp_float_TN,tn_214_1_128_B_16_ld_128_128_214,Gemm_Hipblaslt_6376,0.0127764
GemmStridedBatchedTunableOp_float_TN,tn_1012_1_64_B_8_ld_512_64_1012,Gemm_Hipblaslt_6376,0.013969
GemmStridedBatchedTunableOp_float_TN,tn_138_1_64_B_8_ld_512_64_138,Gemm_Hipblaslt_6378,0.00871121
GemmStridedBatchedTunableOp_float_TN,tn_414_1_64_B_8_ld_512_64_414,Gemm_Rocblas_6377,0.00926628
GemmStridedBatchedTunableOp_float_TN,tn_1285_1_128_B_16_ld_128_128_1285,Gemm_Hipblaslt_6376,0.0443577
GemmStridedBatchedTunableOp_float_TN,tn_1008_1_64_B_8_ld_512_64_1008,Gemm_Rocblas_6377,0.0139875
GemmStridedBatchedTunableOp_float_TN,tn_1003_1_64_B_8_ld_512_64_1003,Gemm_Hipblaslt_6376,0.0133928
GemmStridedBatchedTunableOp_float_TN,tn_158_158_128_B_16_ld_128_2048_158,Gemm_Rocblas_6378,0.0565727
GemmStridedBatchedTunableOp_float_TN,tn_1357_1_128_B_16_ld_128_128_1357,Gemm_Rocblas_6377,0.043642
GemmStridedBatchedTunableOp_float_TN,tn_1006_1_64_B_8_ld_512_64_1006,Gemm_Rocblas_6377,0.0140324
GemmStridedBatchedTunableOp_float_TN,tn_95_1_64_B_8_ld_512_64_95,Gemm_Hipblaslt_6378,0.00829286
GemmStridedBatchedTunableOp_float_TN,tn_1168_1_128_B_16_ld_128_128_1168,Gemm_Hipblaslt_6378,0.0410278
GemmStridedBatchedTunableOp_float_TN,tn_917_1_128_B_16_ld_128_128_917,Gemm_Rocblas_6379,0.0340384
GemmStridedBatchedTunableOp_float_TN,tn_450_1_128_B_16_ld_128_128_450,Gemm_Hipblaslt_6376,0.0181878
GemmStridedBatchedTunableOp_float_TN,tn_1004_1_64_B_8_ld_512_64_1004,Gemm_Hipblaslt_6376,0.014064
GemmStridedBatchedTunableOp_float_TN,tn_878_1_64_B_8_ld_512_64_878,Gemm_Rocblas_6377,0.0129435
GemmStridedBatchedTunableOp_float_TN,tn_999_1_64_B_8_ld_512_64_999,Gemm_Rocblas_6377,0.0140115
GemmStridedBatchedTunableOp_float_TN,tn_625_1_128_B_16_ld_128_128_625,Gemm_Rocblas_6379,0.0261588
GemmStridedBatchedTunableOp_float_TN,tn_220_1_128_B_16_ld_128_128_220,Gemm_Hipblaslt_6376,0.0122843
GemmStridedBatchedTunableOp_float_TN,tn_993_1_64_B_8_ld_512_64_993,Gemm_Rocblas_6377,0.0139098
GemmStridedBatchedTunableOp_float_TN,tn_1099_1_128_B_16_ld_128_128_1099,Gemm_Hipblaslt_6378,0.0398317
GemmStridedBatchedTunableOp_float_TN,tn_347_1_128_B_16_ld_128_128_347,Gemm_Hipblaslt_6376,0.0165427
GemmStridedBatchedTunableOp_float_TN,tn_1153_1153_128_B_16_ld_128_2048_1153,Gemm_Rocblas_6378,2.21014
GemmStridedBatchedTunableOp_float_TN,tn_1191_1_128_B_16_ld_128_128_1191,Gemm_Rocblas_6379,0.0417116
GemmStridedBatchedTunableOp_float_TN,tn_992_1_64_B_8_ld_512_64_992,Gemm_Rocblas_6377,0.0139069
GemmStridedBatchedTunableOp_float_TN,tn_981_1_64_B_8_ld_512_64_981,Gemm_Hipblaslt_6376,0.0139298
GemmStridedBatchedTunableOp_float_TN,tn_1306_1_128_B_16_ld_128_128_1306,Gemm_Hipblaslt_6376,0.0440604
GemmStridedBatchedTunableOp_float_TN,tn_980_1_64_B_8_ld_512_64_980,Gemm_Hipblaslt_6376,0.0139702
GemmStridedBatchedTunableOp_float_TN,tn_970_1_64_B_8_ld_512_64_970,Gemm_Hipblaslt_6376,0.013749
GemmStridedBatchedTunableOp_float_TN,tn_968_1_64_B_8_ld_512_64_968,Gemm_Rocblas_6377,0.0136761
GemmStridedBatchedTunableOp_float_TN,tn_381_1_128_B_16_ld_128_128_381,Gemm_Rocblas_6377,0.0172857
GemmStridedBatchedTunableOp_float_TN,tn_963_1_64_B_8_ld_512_64_963,Gemm_Hipblaslt_6376,0.0136768
GemmStridedBatchedTunableOp_float_TN,tn_1318_1318_128_B_16_ld_128_2048_1318,Gemm_Rocblas_6378,2.85521
GemmStridedBatchedTunableOp_float_TN,tn_961_1_64_B_8_ld_512_64_961,Gemm_Hipblaslt_6376,0.0138156
GemmStridedBatchedTunableOp_float_TN,tn_997_1_128_B_16_ld_128_128_997,Gemm_Hipblaslt_6378,0.0382543
GemmStridedBatchedTunableOp_float_TN,tn_958_1_64_B_8_ld_512_64_958,Gemm_Rocblas_6377,0.0136977
GemmStridedBatchedTunableOp_float_TN,tn_956_1_64_B_8_ld_512_64_956,Gemm_Hipblaslt_6376,0.0136749
GemmStridedBatchedTunableOp_float_TN,tn_1169_1_128_B_16_ld_128_128_1169,Gemm_Rocblas_6379,0.0415088
GemmStridedBatchedTunableOp_float_TN,tn_960_1_128_B_16_ld_128_128_960,Gemm_Rocblas_6379,0.0370408
GemmStridedBatchedTunableOp_float_TN,tn_954_1_64_B_8_ld_512_64_954,Gemm_Rocblas_6377,0.0137254
GemmStridedBatchedTunableOp_float_TN,tn_949_1_64_B_8_ld_512_64_949,Gemm_Hipblaslt_6376,0.0135555
GemmStridedBatchedTunableOp_float_TN,tn_1476_1_128_B_16_ld_128_128_1476,Gemm_Hipblaslt_6376,0.0441109
GemmStridedBatchedTunableOp_float_TN,tn_569_1_64_B_8_ld_512_64_569,Gemm_Hipblaslt_6376,0.0100412
GemmStridedBatchedTunableOp_float_TN,tn_1342_1_128_B_16_ld_128_128_1342,Gemm_Hipblaslt_6376,0.0438961
GemmStridedBatchedTunableOp_float_TN,tn_940_1_64_B_8_ld_512_64_940,Gemm_Hipblaslt_6376,0.0134661
GemmStridedBatchedTunableOp_float_TN,tn_1127_1_128_B_16_ld_128_128_1127,Gemm_Rocblas_6379,0.039887
GemmStridedBatchedTunableOp_float_TN,tn_260_1_128_B_16_ld_128_128_260,Gemm_Rocblas_6377,0.0142528
GemmStridedBatchedTunableOp_float_TN,tn_939_1_64_B_8_ld_512_64_939,Gemm_Rocblas_6377,0.0134829
GemmStridedBatchedTunableOp_float_TN,tn_935_1_64_B_8_ld_512_64_935,Gemm_Hipblaslt_6376,0.0134397
GemmStridedBatchedTunableOp_float_TN,tn_933_1_64_B_8_ld_512_64_933,Gemm_Rocblas_6377,0.0134144
GemmStridedBatchedTunableOp_float_TN,tn_592_1_64_B_8_ld_512_64_592,Gemm_Rocblas_6377,0.010396
GemmStridedBatchedTunableOp_float_TN,tn_695_1_64_B_8_ld_512_64_695,Gemm_Rocblas_6377,0.0111735
GemmStridedBatchedTunableOp_float_TN,tn_149_1_64_B_8_ld_512_64_149,Gemm_Rocblas_6379,0.00869919
GemmStridedBatchedTunableOp_float_TN,tn_1180_1_128_B_16_ld_128_128_1180,Gemm_Rocblas_6379,0.0418431
GemmStridedBatchedTunableOp_float_TN,tn_1538_1_128_B_16_ld_128_128_1538,Gemm_Hipblaslt_6376,0.0457801
GemmStridedBatchedTunableOp_float_TN,tn_974_1_128_B_16_ld_128_128_974,Gemm_Hipblaslt_6378,0.0379437
GemmStridedBatchedTunableOp_float_TN,tn_369_1_64_B_8_ld_512_64_369,Gemm_Rocblas_6377,0.00880207
GemmStridedBatchedTunableOp_float_TN,tn_926_1_64_B_8_ld_512_64_926,Gemm_Hipblaslt_6376,0.0133808
GemmStridedBatchedTunableOp_float_TN,tn_252_1_64_B_8_ld_512_64_252,Gemm_Hipblaslt_6376,0.0096726
GemmStridedBatchedTunableOp_float_TN,tn_916_1_64_B_8_ld_512_64_916,Gemm_Hipblaslt_6376,0.012766
GemmStridedBatchedTunableOp_float_TN,tn_912_1_64_B_8_ld_512_64_912,Gemm_Hipblaslt_6376,0.0126489
GemmStridedBatchedTunableOp_float_TN,tn_909_1_64_B_8_ld_512_64_909,Gemm_Rocblas_6377,0.0131504
GemmStridedBatchedTunableOp_float_TN,tn_1682_1_128_B_16_ld_128_128_1682,Gemm_Hipblaslt_6376,0.0503494
GemmStridedBatchedTunableOp_float_TN,tn_157_1_128_B_16_ld_128_128_157,Gemm_Hipblaslt_6376,0.0114519
GemmStridedBatchedTunableOp_float_TN,tn_586_1_128_B_16_ld_128_128_586,Gemm_Rocblas_6377,0.0240539
GemmStridedBatchedTunableOp_float_TN,tn_904_1_64_B_8_ld_512_64_904,Gemm_Hipblaslt_6376,0.0131599
GemmStridedBatchedTunableOp_float_TN,tn_899_1_64_B_8_ld_512_64_899,Gemm_Hipblaslt_6376,0.0132245
GemmStridedBatchedTunableOp_float_TN,tn_1198_1_128_B_16_ld_128_128_1198,Gemm_Rocblas_6379,0.0422293
GemmStridedBatchedTunableOp_float_TN,tn_896_1_64_B_8_ld_512_64_896,Gemm_Rocblas_6377,0.0131134
GemmStridedBatchedTunableOp_float_TN,tn_630_1_64_B_8_ld_512_64_630,Gemm_Rocblas_6377,0.0107762
GemmStridedBatchedTunableOp_float_TN,tn_892_1_64_B_8_ld_512_64_892,Gemm_Rocblas_6377,0.013071
GemmStridedBatchedTunableOp_float_TN,tn_1228_1_128_B_16_ld_128_128_1228,Gemm_Rocblas_6379,0.0425387
GemmStridedBatchedTunableOp_float_TN,tn_891_1_64_B_8_ld_512_64_891,Gemm_Hipblaslt_6376,0.0131171
GemmStridedBatchedTunableOp_float_TN,tn_459_1_64_B_8_ld_512_64_459,Gemm_Rocblas_6377,0.00955314
GemmStridedBatchedTunableOp_float_TN,tn_487_1_64_B_8_ld_512_64_487,Gemm_Hipblaslt_6376,0.00942528
GemmStridedBatchedTunableOp_float_TN,tn_262_1_64_B_8_ld_512_64_262,Gemm_Rocblas_6377,0.00959965
GemmStridedBatchedTunableOp_float_TN,tn_711_1_128_B_16_ld_128_128_711,Gemm_Hipblaslt_6378,0.0337034
GemmStridedBatchedTunableOp_float_TN,tn_882_1_64_B_8_ld_512_64_882,Gemm_Rocblas_6377,0.0129067
GemmStridedBatchedTunableOp_float_TN,tn_879_1_64_B_8_ld_512_64_879,Gemm_Hipblaslt_6376,0.0129864
GemmStridedBatchedTunableOp_float_TN,tn_573_1_128_B_16_ld_128_128_573,Gemm_Rocblas_6377,0.02281
GemmStridedBatchedTunableOp_float_TN,tn_875_1_64_B_8_ld_512_64_875,Gemm_Hipblaslt_6376,0.0129664
GemmStridedBatchedTunableOp_float_TN,tn_577_1_64_B_8_ld_512_64_577,Gemm_Rocblas_6377,0.0101294
GemmStridedBatchedTunableOp_float_TN,tn_946_1_64_B_8_ld_512_64_946,Gemm_Hipblaslt_6376,0.0134425
GemmStridedBatchedTunableOp_float_TN,tn_557_1_64_B_8_ld_512_64_557,Gemm_Hipblaslt_6376,0.0101154
GemmStridedBatchedTunableOp_float_TN,tn_869_1_64_B_8_ld_512_64_869,Gemm_Rocblas_6377,0.0129211
GemmStridedBatchedTunableOp_float_TN,tn_1322_1_128_B_16_ld_128_128_1322,Gemm_Hipblaslt_6376,0.0442111
GemmStridedBatchedTunableOp_float_TN,tn_1641_1_128_B_16_ld_128_128_1641,Gemm_Hipblaslt_6376,0.0494894
GemmStridedBatchedTunableOp_float_TN,tn_864_1_64_B_8_ld_512_64_864,Gemm_Rocblas_6377,0.0128209
GemmStridedBatchedTunableOp_float_TN,tn_125_125_128_B_16_ld_128_2048_125,Gemm_Hipblaslt_6377,0.0360654
GemmStridedBatchedTunableOp_float_TN,tn_633_1_128_B_16_ld_128_128_633,Gemm_Rocblas_6379,0.0263732
GemmStridedBatchedTunableOp_float_TN,tn_1268_1268_128_B_16_ld_128_2048_1268,Gemm_Rocblas_6378,2.66612
GemmStridedBatchedTunableOp_float_TN,tn_239_1_128_B_16_ld_128_128_239,Gemm_Hipblaslt_6376,0.0135539
GemmStridedBatchedTunableOp_float_TN,tn_1406_1_128_B_16_ld_128_128_1406,Gemm_Hipblaslt_6376,0.044975
GemmStridedBatchedTunableOp_float_TN,tn_1277_1_128_B_16_ld_128_128_1277,Gemm_Hipblaslt_6376,0.0443461
GemmStridedBatchedTunableOp_float_TN,tn_857_1_64_B_8_ld_512_64_857,Gemm_Rocblas_6377,0.0128061
GemmStridedBatchedTunableOp_float_TN,tn_853_1_64_B_8_ld_512_64_853,Gemm_Rocblas_6377,0.0127467
GemmStridedBatchedTunableOp_float_TN,tn_984_1_64_B_8_ld_512_64_984,Gemm_Hipblaslt_6376,0.0138031
GemmStridedBatchedTunableOp_float_TN,tn_848_1_64_B_8_ld_512_64_848,Gemm_Rocblas_6377,0.0127784
GemmStridedBatchedTunableOp_float_TN,tn_846_1_64_B_8_ld_512_64_846,Gemm_Hipblaslt_6376,0.0127836
GemmStridedBatchedTunableOp_float_TN,tn_954_1_128_B_16_ld_128_128_954,Gemm_Rocblas_6379,0.037121
GemmStridedBatchedTunableOp_float_TN,tn_844_1_64_B_8_ld_512_64_844,Gemm_Hipblaslt_6376,0.0126778
GemmStridedBatchedTunableOp_float_TN,tn_428_1_64_B_8_ld_512_64_428,Gemm_Hipblaslt_6376,0.00944697
GemmStridedBatchedTunableOp_float_TN,tn_843_1_64_B_8_ld_512_64_843,Gemm_Hipblaslt_6376,0.012762
GemmStridedBatchedTunableOp_float_TN,tn_840_1_64_B_8_ld_512_64_840,Gemm_Hipblaslt_6376,0.0126205
GemmStridedBatchedTunableOp_float_TN,tn_274_1_64_B_8_ld_512_64_274,Gemm_Rocblas_6377,0.00962611
GemmStridedBatchedTunableOp_float_TN,tn_868_1_128_B_16_ld_128_128_868,Gemm_Rocblas_6379,0.036561
GemmStridedBatchedTunableOp_float_TN,tn_131_1_128_B_16_ld_128_128_131,Gemm_Hipblaslt_6376,0.0107999
GemmStridedBatchedTunableOp_float_TN,tn_826_1_64_B_8_ld_512_64_826,Gemm_Hipblaslt_6376,0.0124731
GemmStridedBatchedTunableOp_float_TN,tn_1079_1_128_B_16_ld_128_128_1079,Gemm_Rocblas_6379,0.0399747
GemmStridedBatchedTunableOp_float_TN,tn_823_1_64_B_8_ld_512_64_823,Gemm_Hipblaslt_6376,0.012554
GemmStridedBatchedTunableOp_float_TN,tn_1134_1_128_B_16_ld_128_128_1134,Gemm_Hipblaslt_6378,0.0403403
GemmStridedBatchedTunableOp_float_TN,tn_724_1_128_B_16_ld_128_128_724,Gemm_Rocblas_6379,0.0347317
GemmStridedBatchedTunableOp_float_TN,tn_819_1_64_B_8_ld_512_64_819,Gemm_Rocblas_6377,0.0124442
GemmStridedBatchedTunableOp_float_TN,tn_815_1_64_B_8_ld_512_64_815,Gemm_Hipblaslt_6376,0.0125091
GemmStridedBatchedTunableOp_float_TN,tn_435_1_128_B_16_ld_128_128_435,Gemm_Hipblaslt_6376,0.0187961
GemmStridedBatchedTunableOp_float_TN,tn_1283_1_128_B_16_ld_128_128_1283,Gemm_Hipblaslt_6376,0.0440144
GemmStridedBatchedTunableOp_float_TN,tn_814_1_64_B_8_ld_512_64_814,Gemm_Rocblas_6377,0.012441
GemmStridedBatchedTunableOp_float_TN,tn_811_1_64_B_8_ld_512_64_811,Gemm_Rocblas_6377,0.0124422
GemmStridedBatchedTunableOp_float_TN,tn_226_1_64_B_8_ld_512_64_226,Gemm_Hipblaslt_6378,0.00921979
GemmStridedBatchedTunableOp_float_TN,tn_130_1_64_B_8_ld_512_64_130,Gemm_Hipblaslt_6376,0.00869596
GemmStridedBatchedTunableOp_float_TN,tn_920_1_64_B_8_ld_512_64_920,Gemm_Rocblas_6377,0.0129356
GemmStridedBatchedTunableOp_float_TN,tn_914_1_64_B_8_ld_512_64_914,Gemm_Rocblas_6377,0.013291
GemmStridedBatchedTunableOp_float_TN,tn_809_1_64_B_8_ld_512_64_809,Gemm_Hipblaslt_6376,0.0123521
GemmStridedBatchedTunableOp_float_TN,tn_902_1_64_B_8_ld_512_64_902,Gemm_Hipblaslt_6376,0.0132032
GemmStridedBatchedTunableOp_float_TN,tn_808_1_64_B_8_ld_512_64_808,Gemm_Hipblaslt_6376,0.0124061
GemmStridedBatchedTunableOp_float_TN,tn_965_1_64_B_8_ld_512_64_965,Gemm_Rocblas_6377,0.0136468
GemmStridedBatchedTunableOp_float_TN,tn_662_1_128_B_16_ld_128_128_662,Gemm_Rocblas_6379,0.0282948
GemmStridedBatchedTunableOp_float_TN,tn_251_1_128_B_16_ld_128_128_251,Gemm_Rocblas_6377,0.0139471
GemmStridedBatchedTunableOp_float_TN,tn_754_1_64_B_8_ld_512_64_754,Gemm_Hipblaslt_6376,0.0120094
GemmStridedBatchedTunableOp_float_TN,tn_799_1_64_B_8_ld_512_64_799,Gemm_Hipblaslt_6376,0.0121961
GemmStridedBatchedTunableOp_float_TN,tn_764_1_128_B_16_ld_128_128_764,Gemm_Hipblaslt_6378,0.0321701
GemmStridedBatchedTunableOp_float_TN,tn_793_1_64_B_8_ld_512_64_793,Gemm_Rocblas_6377,0.0121553
GemmStridedBatchedTunableOp_float_TN,tn_541_1_128_B_16_ld_128_128_541,Gemm_Rocblas_6377,0.0214202
GemmStridedBatchedTunableOp_float_TN,tn_115_1_64_B_8_ld_512_64_115,Gemm_Hipblaslt_6378,0.00861673
GemmStridedBatchedTunableOp_float_TN,tn_789_1_64_B_8_ld_512_64_789,Gemm_Hipblaslt_6376,0.0121292
GemmStridedBatchedTunableOp_float_TN,tn_788_1_64_B_8_ld_512_64_788,Gemm_Hipblaslt_6376,0.0121624
GemmStridedBatchedTunableOp_float_TN,tn_786_1_64_B_8_ld_512_64_786,Gemm_Rocblas_6377,0.0120791
GemmStridedBatchedTunableOp_float_TN,tn_563_1_128_B_16_ld_128_128_563,Gemm_Hipblaslt_6376,0.0213951
GemmStridedBatchedTunableOp_float_TN,tn_783_1_64_B_8_ld_512_64_783,Gemm_Hipblaslt_6376,0.0120322
GemmStridedBatchedTunableOp_float_TN,tn_781_1_64_B_8_ld_512_64_781,Gemm_Hipblaslt_6376,0.0120514
GemmStridedBatchedTunableOp_float_TN,tn_160_1_64_B_8_ld_512_64_160,Gemm_Hipblaslt_6378,0.00874646
GemmStridedBatchedTunableOp_float_TN,tn_778_1_64_B_8_ld_512_64_778,Gemm_Rocblas_6377,0.0121083
GemmStridedBatchedTunableOp_float_TN,tn_776_1_64_B_8_ld_512_64_776,Gemm_Hipblaslt_6376,0.0119601
GemmStridedBatchedTunableOp_float_TN,tn_1380_1380_128_B_16_ld_128_2048_1380,Default,3.09107
GemmStridedBatchedTunableOp_float_TN,tn_469_1_128_B_16_ld_128_128_469,Gemm_Rocblas_6377,0.0196733
GemmStridedBatchedTunableOp_float_TN,tn_1250_1_128_B_16_ld_128_128_1250,Gemm_Hipblaslt_6378,0.0435197
GemmStridedBatchedTunableOp_float_TN,tn_219_1_128_B_16_ld_128_128_219,Gemm_Hipblaslt_6376,0.0130701
GemmStridedBatchedTunableOp_float_TN,tn_1395_1_128_B_16_ld_128_128_1395,Gemm_Hipblaslt_6376,0.0443229
GemmStridedBatchedTunableOp_float_TN,tn_771_1_64_B_8_ld_512_64_771,Gemm_Rocblas_6377,0.0120522
GemmStridedBatchedTunableOp_float_TN,tn_323_1_64_B_8_ld_512_64_323,Gemm_Hipblaslt_6376,0.00866431
GemmStridedBatchedTunableOp_float_TN,tn_833_1_64_B_8_ld_512_64_833,Gemm_Rocblas_6377,0.0126349
GemmStridedBatchedTunableOp_float_TN,tn_568_1_128_B_16_ld_128_128_568,Gemm_Rocblas_6379,0.0234893
GemmStridedBatchedTunableOp_float_TN,tn_746_1_128_B_16_ld_128_128_746,Gemm_Rocblas_6379,0.0340824
GemmStridedBatchedTunableOp_float_TN,tn_768_1_64_B_8_ld_512_64_768,Gemm_Rocblas_6377,0.0121035
GemmStridedBatchedTunableOp_float_TN,tn_765_1_64_B_8_ld_512_64_765,Gemm_Hipblaslt_6376,0.0120799
GemmStridedBatchedTunableOp_float_TN,tn_1103_1_128_B_16_ld_128_128_1103,Gemm_Rocblas_6379,0.0400618
GemmStridedBatchedTunableOp_float_TN,tn_365_1_64_B_8_ld_512_64_365,Gemm_Hipblaslt_6376,0.00875527
GemmStridedBatchedTunableOp_float_TN,tn_1693_1_128_B_16_ld_128_128_1693,Gemm_Hipblaslt_6376,0.0502303
GemmStridedBatchedTunableOp_float_TN,tn_763_1_64_B_8_ld_512_64_763,Gemm_Hipblaslt_6376,0.0119456
GemmStridedBatchedTunableOp_float_TN,tn_714_1_128_B_16_ld_128_128_714,Gemm_Rocblas_6379,0.0293639
GemmStridedBatchedTunableOp_float_TN,tn_762_1_64_B_8_ld_512_64_762,Gemm_Hipblaslt_6376,0.0120166
GemmStridedBatchedTunableOp_float_TN,tn_258_1_64_B_8_ld_512_64_258,Gemm_Hipblaslt_6376,0.0103246
GemmStridedBatchedTunableOp_float_TN,tn_94_1_64_B_8_ld_512_64_94,Gemm_Rocblas_6379,0.00862696
GemmStridedBatchedTunableOp_float_TN,tn_758_1_64_B_8_ld_512_64_758,Gemm_Hipblaslt_6376,0.0119885
GemmStridedBatchedTunableOp_float_TN,tn_669_1_128_B_16_ld_128_128_669,Gemm_Hipblaslt_6378,0.0264557
GemmStridedBatchedTunableOp_float_TN,tn_756_1_64_B_8_ld_512_64_756,Gemm_Rocblas_6377,0.0119405
GemmStridedBatchedTunableOp_float_TN,tn_937_1_64_B_8_ld_512_64_937,Gemm_Rocblas_6377,0.0135275
GemmStridedBatchedTunableOp_float_TN,tn_122_1_64_B_8_ld_512_64_122,Gemm_Hipblaslt_6378,0.0082984
GemmStridedBatchedTunableOp_float_TN,tn_866_1_64_B_8_ld_512_64_866,Gemm_Rocblas_6377,0.0127836
GemmStridedBatchedTunableOp_float_TN,tn_641_1_128_B_16_ld_128_128_641,Gemm_Hipblaslt_6378,0.0267371
GemmStridedBatchedTunableOp_float_TN,tn_752_1_64_B_8_ld_512_64_752,Gemm_Rocblas_6377,0.0117798
GemmStridedBatchedTunableOp_float_TN,tn_407_1_64_B_8_ld_512_64_407,Gemm_Rocblas_6377,0.00925225
GemmStridedBatchedTunableOp_float_TN,tn_895_1_64_B_8_ld_512_64_895,Gemm_Rocblas_6377,0.0130626
GemmStridedBatchedTunableOp_float_TN,tn_570_1_128_B_16_ld_128_128_570,Gemm_Hipblaslt_6376,0.0226417
GemmStridedBatchedTunableOp_float_TN,tn_1622_1_128_B_16_ld_128_128_1622,Gemm_Hipblaslt_6376,0.0478262
GemmStridedBatchedTunableOp_float_TN,tn_470_1_128_B_16_ld_128_128_470,Gemm_Rocblas_6377,0.0194169
GemmStridedBatchedTunableOp_float_TN,tn_750_1_64_B_8_ld_512_64_750,Gemm_Hipblaslt_6376,0.0117829
GemmStridedBatchedTunableOp_float_TN,tn_749_1_64_B_8_ld_512_64_749,Gemm_Rocblas_6377,0.0117934
GemmStridedBatchedTunableOp_float_TN,tn_446_1_128_B_16_ld_128_128_446,Gemm_Rocblas_6377,0.0189764
GemmStridedBatchedTunableOp_float_TN,tn_346_1_64_B_8_ld_512_64_346,Gemm_Rocblas_6377,0.00879339
GemmStridedBatchedTunableOp_float_TN,tn_748_1_64_B_8_ld_512_64_748,Gemm_Hipblaslt_6376,0.0115312
GemmStridedBatchedTunableOp_float_TN,tn_975_1_64_B_8_ld_512_64_975,Gemm_Hipblaslt_6376,0.0137138
GemmStridedBatchedTunableOp_float_TN,tn_877_1_64_B_8_ld_512_64_877,Gemm_Rocblas_6377,0.0129075
GemmStridedBatchedTunableOp_float_TN,tn_745_1_64_B_8_ld_512_64_745,Gemm_Rocblas_6377,0.0117993
GemmStridedBatchedTunableOp_float_TN,tn_792_1_128_B_16_ld_128_128_792,Gemm_Hipblaslt_6378,0.0342777
GemmStridedBatchedTunableOp_float_TN,tn_1007_1_128_B_16_ld_128_128_1007,Gemm_Rocblas_6379,0.0382294
GemmStridedBatchedTunableOp_float_TN,tn_742_1_64_B_8_ld_512_64_742,Gemm_Hipblaslt_6376,0.0118643
GemmStridedBatchedTunableOp_float_TN,tn_1013_1_128_B_16_ld_128_128_1013,Gemm_Hipblaslt_6378,0.0385324
GemmStridedBatchedTunableOp_float_TN,tn_807_1_64_B_8_ld_512_64_807,Gemm_Rocblas_6377,0.0123652
GemmStridedBatchedTunableOp_float_TN,tn_736_1_64_B_8_ld_512_64_736,Gemm_Hipblaslt_6376,0.0117814
GemmStridedBatchedTunableOp_float_TN,tn_576_1_64_B_8_ld_512_64_576,Gemm_Rocblas_6377,0.0104104
GemmStridedBatchedTunableOp_float_TN,tn_739_1_128_B_16_ld_128_128_739,Gemm_Rocblas_6379,0.0349921
GemmStridedBatchedTunableOp_float_TN,tn_735_1_64_B_8_ld_512_64_735,Gemm_Hipblaslt_6376,0.0116396
GemmStridedBatchedTunableOp_float_TN,tn_734_1_64_B_8_ld_512_64_734,Gemm_Hipblaslt_6376,0.0117372
GemmStridedBatchedTunableOp_float_TN,tn_962_1_64_B_8_ld_512_64_962,Gemm_Hipblaslt_6376,0.0138051
GemmStridedBatchedTunableOp_float_TN,tn_412_1_64_B_8_ld_512_64_412,Gemm_Rocblas_6377,0.00932549
GemmStridedBatchedTunableOp_float_TN,tn_733_1_64_B_8_ld_512_64_733,Gemm_Hipblaslt_6376,0.0117609
GemmStridedBatchedTunableOp_float_TN,tn_445_1_128_B_16_ld_128_128_445,Gemm_Hipblaslt_6376,0.0190835
GemmStridedBatchedTunableOp_float_TN,tn_732_1_64_B_8_ld_512_64_732,Gemm_Hipblaslt_6376,0.0117036
GemmStridedBatchedTunableOp_float_TN,tn_2040_1_128_B_16_ld_128_128_2040,Gemm_Hipblaslt_6376,0.0563282
GemmStridedBatchedTunableOp_float_TN,tn_730_1_64_B_8_ld_512_64_730,Gemm_Rocblas_6377,0.0117645
GemmStridedBatchedTunableOp_float_TN,tn_728_1_64_B_8_ld_512_64_728,Gemm_Rocblas_6377,0.0115917
GemmStridedBatchedTunableOp_float_TN,tn_722_1_64_B_8_ld_512_64_722,Gemm_Hipblaslt_6376,0.0115164
GemmStridedBatchedTunableOp_float_TN,tn_870_1_128_B_16_ld_128_128_870,Gemm_Hipblaslt_6378,0.0365282
GemmStridedBatchedTunableOp_float_TN,tn_829_1_128_B_16_ld_128_128_829,Gemm_Hipblaslt_6378,0.0358654
GemmStridedBatchedTunableOp_float_TN,tn_721_1_64_B_8_ld_512_64_721,Gemm_Hipblaslt_6376,0.0116347
GemmStridedBatchedTunableOp_float_TN,tn_141_1_64_B_8_ld_512_64_141,Gemm_Rocblas_6377,0.0086691
GemmStridedBatchedTunableOp_float_TN,tn_9_1_64_B_8_ld_512_64_9,Gemm_Rocblas_-9,0.00553362
GemmStridedBatchedTunableOp_float_TN,tn_845_1_64_B_8_ld_512_64_845,Gemm_Rocblas_6377,0.0126779
GemmStridedBatchedTunableOp_float_TN,tn_983_1_128_B_16_ld_128_128_983,Gemm_Hipblaslt_6378,0.037737
GemmStridedBatchedTunableOp_float_TN,tn_1212_1_128_B_16_ld_128_128_1212,Gemm_Rocblas_6379,0.0425459
GemmStridedBatchedTunableOp_float_TN,tn_833_1_128_B_16_ld_128_128_833,Gemm_Hipblaslt_6378,0.0364566
GemmStridedBatchedTunableOp_float_TN,tn_704_1_64_B_8_ld_512_64_704,Gemm_Hipblaslt_6376,0.0111982
GemmStridedBatchedTunableOp_float_TN,tn_1535_1_128_B_16_ld_128_128_1535,Gemm_Hipblaslt_6376,0.0471883
GemmStridedBatchedTunableOp_float_TN,tn_703_1_64_B_8_ld_512_64_703,Gemm_Rocblas_6377,0.0113109
GemmStridedBatchedTunableOp_float_TN,tn_414_1_128_B_16_ld_128_128_414,Gemm_Hipblaslt_6376,0.0182255
GemmStridedBatchedTunableOp_float_TN,tn_244_1_64_B_8_ld_512_64_244,Gemm_Hipblaslt_6376,0.0084823
GemmStridedBatchedTunableOp_float_TN,tn_522_1_64_B_8_ld_512_64_522,Gemm_Rocblas_6377,0.00998957
GemmStridedBatchedTunableOp_float_TN,tn_702_1_64_B_8_ld_512_64_702,Gemm_Hipblaslt_6376,0.0111758
GemmStridedBatchedTunableOp_float_TN,tn_188_1_64_B_8_ld_512_64_188,Gemm_Hipblaslt_6378,0.00876368
GemmStridedBatchedTunableOp_float_TN,tn_989_1_128_B_16_ld_128_128_989,Gemm_Rocblas_6379,0.0379978
GemmStridedBatchedTunableOp_float_TN,tn_701_1_64_B_8_ld_512_64_701,Gemm_Hipblaslt_6376,0.0112759
GemmStridedBatchedTunableOp_float_TN,tn_676_1_64_B_8_ld_512_64_676,Gemm_Hipblaslt_6376,0.0110528
GemmStridedBatchedTunableOp_float_TN,tn_421_1_128_B_16_ld_128_128_421,Gemm_Rocblas_6377,0.0175899
GemmStridedBatchedTunableOp_float_TN,tn_1647_1_128_B_16_ld_128_128_1647,Gemm_Hipblaslt_6376,0.050295
GemmStridedBatchedTunableOp_float_TN,tn_851_1_128_B_16_ld_128_128_851,Gemm_Hipblaslt_6378,0.0369374
GemmStridedBatchedTunableOp_float_TN,tn_753_1_64_B_8_ld_512_64_753,Gemm_Rocblas_6377,0.0118462
GemmStridedBatchedTunableOp_float_TN,tn_29_1_64_B_8_ld_512_64_29,Gemm_Rocblas_-9,0.00656916
GemmStridedBatchedTunableOp_float_TN,tn_535_535_128_B_16_ld_128_2048_535,Gemm_Rocblas_6378,0.468643
GemmStridedBatchedTunableOp_float_TN,tn_1031_1_128_B_16_ld_128_128_1031,Gemm_Hipblaslt_6378,0.0386655
GemmStridedBatchedTunableOp_float_TN,tn_213_213_128_B_16_ld_128_2048_213,Gemm_Hipblaslt_6377,0.0955464
GemmStridedBatchedTunableOp_float_TN,tn_194_1_128_B_16_ld_128_128_194,Gemm_Rocblas_6377,0.012465
GemmStridedBatchedTunableOp_float_TN,tn_343_1_128_B_16_ld_128_128_343,Gemm_Hipblaslt_6376,0.0165311
GemmStridedBatchedTunableOp_float_TN,tn_853_1_128_B_16_ld_128_128_853,Gemm_Rocblas_6379,0.0364874
GemmStridedBatchedTunableOp_float_TN,tn_771_1_128_B_16_ld_128_128_771,Gemm_Rocblas_6379,0.0356515
GemmStridedBatchedTunableOp_float_TN,tn_696_1_64_B_8_ld_512_64_696,Gemm_Hipblaslt_6376,0.0110989
GemmStridedBatchedTunableOp_float_TN,tn_693_1_64_B_8_ld_512_64_693,Gemm_Hipblaslt_6376,0.0111778
GemmStridedBatchedTunableOp_float_TN,tn_690_1_64_B_8_ld_512_64_690,Gemm_Hipblaslt_6376,0.0111382
GemmStridedBatchedTunableOp_float_TN,tn_688_1_64_B_8_ld_512_64_688,Gemm_Hipblaslt_6376,0.0112363
GemmStridedBatchedTunableOp_float_TN,tn_2047_1_128_B_16_ld_128_128_2047,Gemm_Hipblaslt_6376,0.0580467
GemmStridedBatchedTunableOp_float_TN,tn_686_1_64_B_8_ld_512_64_686,Gemm_Rocblas_6377,0.0111662
GemmStridedBatchedTunableOp_float_TN,tn_674_1_64_B_8_ld_512_64_674,Gemm_Hipblaslt_6376,0.0111377
GemmStridedBatchedTunableOp_float_TN,tn_685_1_64_B_8_ld_512_64_685,Gemm_Rocblas_6377,0.0111669
GemmStridedBatchedTunableOp_float_TN,tn_1676_1_128_B_16_ld_128_128_1676,Gemm_Hipblaslt_6376,0.0488863
GemmStridedBatchedTunableOp_float_TN,tn_1160_1_128_B_16_ld_128_128_1160,Gemm_Hipblaslt_6376,0.0415681
GemmStridedBatchedTunableOp_float_TN,tn_680_1_64_B_8_ld_512_64_680,Gemm_Hipblaslt_6376,0.010943
GemmStridedBatchedTunableOp_float_TN,tn_227_1_128_B_16_ld_128_128_227,Gemm_Hipblaslt_6376,0.0124386
GemmStridedBatchedTunableOp_float_TN,tn_1019_1_128_B_16_ld_128_128_1019,Gemm_Rocblas_6379,0.0382402
GemmStridedBatchedTunableOp_float_TN,tn_1262_1_128_B_16_ld_128_128_1262,Gemm_Hipblaslt_6376,0.0435145
GemmStridedBatchedTunableOp_float_TN,tn_678_1_64_B_8_ld_512_64_678,Gemm_Hipblaslt_6376,0.01106
GemmStridedBatchedTunableOp_float_TN,tn_677_1_64_B_8_ld_512_64_677,Gemm_Hipblaslt_6376,0.0106865
GemmStridedBatchedTunableOp_float_TN,tn_328_1_128_B_16_ld_128_128_328,Gemm_Hipblaslt_6376,0.0161295
GemmStridedBatchedTunableOp_float_TN,tn_951_1_128_B_16_ld_128_128_951,Gemm_Hipblaslt_6378,0.0372973
GemmStridedBatchedTunableOp_float_TN,tn_711_1_64_B_8_ld_512_64_711,Gemm_Hipblaslt_6376,0.0109462
GemmStridedBatchedTunableOp_float_TN,tn_675_1_64_B_8_ld_512_64_675,Gemm_Rocblas_6377,0.0110623
GemmStridedBatchedTunableOp_float_TN,tn_517_1_64_B_8_ld_512_64_517,Gemm_Rocblas_6377,0.00994512
GemmStridedBatchedTunableOp_float_TN,tn_366_1_128_B_16_ld_128_128_366,Gemm_Rocblas_6377,0.0169258
GemmStridedBatchedTunableOp_float_TN,tn_671_1_64_B_8_ld_512_64_671,Gemm_Rocblas_6377,0.0109249
GemmStridedBatchedTunableOp_float_TN,tn_6_1_64_B_8_ld_512_64_6,Gemm_Rocblas_-9,0.00561498
GemmStridedBatchedTunableOp_float_TN,tn_1201_1201_128_B_16_ld_128_2048_1201,Gemm_Hipblaslt_6377,2.34361
GemmStridedBatchedTunableOp_float_TN,tn_1436_1_128_B_16_ld_128_128_1436,Gemm_Hipblaslt_6376,0.0439771
GemmStridedBatchedTunableOp_float_TN,tn_911_1_64_B_8_ld_512_64_911,Gemm_Hipblaslt_6376,0.0134253
GemmStridedBatchedTunableOp_float_TN,tn_318_1_128_B_16_ld_128_128_318,Gemm_Hipblaslt_6376,0.0158879
GemmStridedBatchedTunableOp_float_TN,tn_691_1_64_B_8_ld_512_64_691,Gemm_Rocblas_6377,0.0112047
GemmStridedBatchedTunableOp_float_TN,tn_881_1_128_B_16_ld_128_128_881,Gemm_Hipblaslt_6378,0.0371201
GemmStridedBatchedTunableOp_float_TN,tn_667_1_64_B_8_ld_512_64_667,Gemm_Hipblaslt_6376,0.0109678
GemmStridedBatchedTunableOp_float_TN,tn_666_1_64_B_8_ld_512_64_666,Gemm_Rocblas_6377,0.0109975
GemmStridedBatchedTunableOp_float_TN,tn_836_1_64_B_8_ld_512_64_836,Gemm_Rocblas_6377,0.0127066
GemmStridedBatchedTunableOp_float_TN,tn_1133_1_128_B_16_ld_128_128_1133,Gemm_Hipblaslt_6378,0.040593
GemmStridedBatchedTunableOp_float_TN,tn_659_1_128_B_16_ld_128_128_659,Gemm_Rocblas_6379,0.0285228
GemmStridedBatchedTunableOp_float_TN,tn_259_1_128_B_16_ld_128_128_259,Gemm_Rocblas_6377,0.0142019
GemmStridedBatchedTunableOp_float_TN,tn_251_1_64_B_8_ld_512_64_251,Gemm_Hipblaslt_6379,0.0110312
GemmStridedBatchedTunableOp_float_TN,tn_664_1_64_B_8_ld_512_64_664,Gemm_Rocblas_6377,0.0109013
GemmStridedBatchedTunableOp_float_TN,tn_760_1_64_B_8_ld_512_64_760,Gemm_Hipblaslt_6376,0.0119075
GemmStridedBatchedTunableOp_float_TN,tn_662_1_64_B_8_ld_512_64_662,Gemm_Hipblaslt_6376,0.0109446
GemmStridedBatchedTunableOp_float_TN,tn_659_1_64_B_8_ld_512_64_659,Gemm_Hipblaslt_6376,0.0109862
GemmStridedBatchedTunableOp_float_TN,tn_607_1_64_B_8_ld_512_64_607,Gemm_Hipblaslt_6376,0.0105502
GemmStridedBatchedTunableOp_float_TN,tn_2030_1_128_B_16_ld_128_128_2030,Gemm_Hipblaslt_6376,0.0568384
GemmStridedBatchedTunableOp_float_TN,tn_244_1_128_B_16_ld_128_128_244,Gemm_Rocblas_6377,0.013737
GemmStridedBatchedTunableOp_float_TN,tn_657_1_64_B_8_ld_512_64_657,Gemm_Hipblaslt_6376,0.0109234
GemmStridedBatchedTunableOp_float_TN,tn_650_1_64_B_8_ld_512_64_650,Gemm_Rocblas_6377,0.0108809
GemmStridedBatchedTunableOp_float_TN,tn_388_1_64_B_8_ld_512_64_388,Gemm_Rocblas_6377,0.0088566
GemmStridedBatchedTunableOp_float_TN,tn_449_1_128_B_16_ld_128_128_449,Gemm_Hipblaslt_6376,0.0191207
GemmStridedBatchedTunableOp_float_TN,tn_585_1_128_B_16_ld_128_128_585,Gemm_Rocblas_6377,0.0237094
GemmStridedBatchedTunableOp_float_TN,tn_788_1_128_B_16_ld_128_128_788,Gemm_Rocblas_6379,0.0354298
GemmStridedBatchedTunableOp_float_TN,tn_649_1_64_B_8_ld_512_64_649,Gemm_Hipblaslt_6376,0.0108259
GemmStridedBatchedTunableOp_float_TN,tn_832_1_128_B_16_ld_128_128_832,Gemm_Rocblas_6379,0.035425
GemmStridedBatchedTunableOp_float_TN,tn_120_1_64_B_8_ld_512_64_120,Gemm_Rocblas_6379,0.00863916
GemmStridedBatchedTunableOp_float_TN,tn_647_1_64_B_8_ld_512_64_647,Gemm_Rocblas_6377,0.0107823
GemmStridedBatchedTunableOp_float_TN,tn_416_1_128_B_16_ld_128_128_416,Gemm_Rocblas_6377,0.0182126
GemmStridedBatchedTunableOp_float_TN,tn_646_1_64_B_8_ld_512_64_646,Gemm_Rocblas_6377,0.0108288
GemmStridedBatchedTunableOp_float_TN,tn_645_1_64_B_8_ld_512_64_645,Gemm_Hipblaslt_6376,0.0108821
GemmStridedBatchedTunableOp_float_TN,tn_1007_1_64_B_8_ld_512_64_1007,Gemm_Hipblaslt_6376,0.0133896
GemmStridedBatchedTunableOp_float_TN,tn_823_1_128_B_16_ld_128_128_823,Gemm_Rocblas_6379,0.0354338
GemmStridedBatchedTunableOp_float_TN,tn_642_1_64_B_8_ld_512_64_642,Gemm_Hipblaslt_6376,0.0107886
GemmStridedBatchedTunableOp_float_TN,tn_1114_1_128_B_16_ld_128_128_1114,Gemm_Hipblaslt_6378,0.0407169
GemmStridedBatchedTunableOp_float_TN,tn_180_1_64_B_8_ld_512_64_180,Gemm_Hipblaslt_6376,0.0088202
GemmStridedBatchedTunableOp_float_TN,tn_30_1_64_B_8_ld_512_64_30,Gemm_Rocblas_-9,0.00673471
GemmStridedBatchedTunableOp_float_TN,tn_640_1_64_B_8_ld_512_64_640,Gemm_Rocblas_6377,0.0108399
GemmStridedBatchedTunableOp_float_TN,tn_637_1_64_B_8_ld_512_64_637,Gemm_Hipblaslt_6376,0.0107895
GemmStridedBatchedTunableOp_float_TN,tn_713_1_128_B_16_ld_128_128_713,Gemm_Rocblas_6379,0.0331587
GemmStridedBatchedTunableOp_float_TN,tn_1135_1_128_B_16_ld_128_128_1135,Gemm_Hipblaslt_6378,0.0408897
GemmStridedBatchedTunableOp_float_TN,tn_360_1_64_B_8_ld_512_64_360,Gemm_Hipblaslt_6376,0.00907867
GemmStridedBatchedTunableOp_float_TN,tn_502_1_64_B_8_ld_512_64_502,Gemm_Rocblas_6377,0.00987497
GemmStridedBatchedTunableOp_float_TN,tn_761_1_64_B_8_ld_512_64_761,Gemm_Rocblas_6377,0.0120082
GemmStridedBatchedTunableOp_float_TN,tn_635_1_64_B_8_ld_512_64_635,Gemm_Rocblas_6377,0.0107005
GemmStridedBatchedTunableOp_float_TN,tn_687_1_128_B_16_ld_128_128_687,Gemm_Rocblas_6379,0.031716
GemmStridedBatchedTunableOp_float_TN,tn_731_1_128_B_16_ld_128_128_731,Gemm_Hipblaslt_6378,0.0343397
GemmStridedBatchedTunableOp_float_TN,tn_1708_1_128_B_16_ld_128_128_1708,Gemm_Hipblaslt_6376,0.0491568
GemmStridedBatchedTunableOp_float_TN,tn_634_1_64_B_8_ld_512_64_634,Gemm_Rocblas_6377,0.0107955
GemmStridedBatchedTunableOp_float_TN,tn_631_1_64_B_8_ld_512_64_631,Gemm_Hipblaslt_6376,0.0106765
GemmStridedBatchedTunableOp_float_TN,tn_265_1_64_B_8_ld_512_64_265,Gemm_Rocblas_-9,0.0162313
GemmStridedBatchedTunableOp_float_TN,tn_136_1_128_B_16_ld_128_128_136,Gemm_Rocblas_6379,0.0109141
GemmStridedBatchedTunableOp_float_TN,tn_232_1_128_B_16_ld_128_128_232,Gemm_Rocblas_6377,0.0132489
GemmStridedBatchedTunableOp_float_TN,tn_826_1_128_B_16_ld_128_128_826,Gemm_Hipblaslt_6378,0.0364662
GemmStridedBatchedTunableOp_float_TN,tn_628_1_64_B_8_ld_512_64_628,Gemm_Rocblas_6377,0.0107322
GemmStridedBatchedTunableOp_float_TN,tn_82_1_64_B_8_ld_512_64_82,Gemm_Rocblas_6379,0.00854729
GemmStridedBatchedTunableOp_float_TN,tn_626_1_64_B_8_ld_512_64_626,Gemm_Hipblaslt_6376,0.010838
GemmStridedBatchedTunableOp_float_TN,tn_751_1_128_B_16_ld_128_128_751,Gemm_Rocblas_6379,0.034262
GemmStridedBatchedTunableOp_float_TN,tn_624_1_64_B_8_ld_512_64_624,Gemm_Rocblas_6377,0.0107967
GemmStridedBatchedTunableOp_float_TN,tn_948_1_128_B_16_ld_128_128_948,Gemm_Hipblaslt_6378,0.0375354
GemmStridedBatchedTunableOp_float_TN,tn_602_1_128_B_16_ld_128_128_602,Gemm_Hipblaslt_6378,0.0252138
GemmStridedBatchedTunableOp_float_TN,tn_682_1_64_B_8_ld_512_64_682,Gemm_Rocblas_6377,0.0111553
GemmStridedBatchedTunableOp_float_TN,tn_800_1_64_B_8_ld_512_64_800,Gemm_Rocblas_6377,0.0122595
GemmStridedBatchedTunableOp_float_TN,tn_981_1_128_B_16_ld_128_128_981,Gemm_Hipblaslt_6378,0.0381184
GemmStridedBatchedTunableOp_float_TN,tn_622_1_64_B_8_ld_512_64_622,Gemm_Rocblas_6377,0.0107975
GemmStridedBatchedTunableOp_float_TN,tn_989_989_128_B_16_ld_128_2048_989,Default,1.63538
GemmStridedBatchedTunableOp_float_TN,tn_621_1_64_B_8_ld_512_64_621,Gemm_Rocblas_6377,0.0106793
GemmStridedBatchedTunableOp_float_TN,tn_620_1_64_B_8_ld_512_64_620,Gemm_Rocblas_6377,0.0107421
GemmStridedBatchedTunableOp_float_TN,tn_618_1_64_B_8_ld_512_64_618,Gemm_Hipblaslt_6376,0.0106032
GemmStridedBatchedTunableOp_float_TN,tn_670_1_64_B_8_ld_512_64_670,Gemm_Hipblaslt_6376,0.0109405
GemmStridedBatchedTunableOp_float_TN,tn_1652_1_128_B_16_ld_128_128_1652,Gemm_Hipblaslt_6376,0.0495267
GemmStridedBatchedTunableOp_float_TN,tn_990_1_64_B_8_ld_512_64_990,Gemm_Hipblaslt_6376,0.0138861
GemmStridedBatchedTunableOp_float_TN,tn_1325_1_128_B_16_ld_128_128_1325,Gemm_Hipblaslt_6376,0.0449285
GemmStridedBatchedTunableOp_float_TN,tn_610_1_64_B_8_ld_512_64_610,Gemm_Rocblas_6377,0.0103199
GemmStridedBatchedTunableOp_float_TN,tn_609_1_64_B_8_ld_512_64_609,Gemm_Rocblas_6377,0.01066
GemmStridedBatchedTunableOp_float_TN,tn_604_1_64_B_8_ld_512_64_604,Gemm_Hipblaslt_6376,0.0106051
GemmStridedBatchedTunableOp_float_TN,tn_603_1_64_B_8_ld_512_64_603,Gemm_Hipblaslt_6376,0.0105635
GemmStridedBatchedTunableOp_float_TN,tn_602_1_64_B_8_ld_512_64_602,Gemm_Rocblas_6377,0.0106644
GemmStridedBatchedTunableOp_float_TN,tn_1311_1_128_B_16_ld_128_128_1311,Gemm_Rocblas_6379,0.0445189
GemmStridedBatchedTunableOp_float_TN,tn_601_1_64_B_8_ld_512_64_601,Gemm_Rocblas_6377,0.0106412
GemmStridedBatchedTunableOp_float_TN,tn_600_1_64_B_8_ld_512_64_600,Gemm_Rocblas_6377,0.0105394
GemmStridedBatchedTunableOp_float_TN,tn_1076_1_128_B_16_ld_128_128_1076,Gemm_Hipblaslt_6378,0.0397484
GemmStridedBatchedTunableOp_float_TN,tn_598_1_64_B_8_ld_512_64_598,Gemm_Hipblaslt_6376,0.0105674
GemmStridedBatchedTunableOp_float_TN,tn_766_1_64_B_8_ld_512_64_766,Gemm_Rocblas_6377,0.0119817
GemmStridedBatchedTunableOp_float_TN,tn_1337_1_128_B_16_ld_128_128_1337,Gemm_Hipblaslt_6376,0.0438004
GemmStridedBatchedTunableOp_float_TN,tn_595_1_64_B_8_ld_512_64_595,Gemm_Hipblaslt_6376,0.0104769
GemmStridedBatchedTunableOp_float_TN,tn_272_1_64_B_8_ld_512_64_272,Gemm_Rocblas_6378,0.011696
GemmStridedBatchedTunableOp_float_TN,tn_336_1_128_B_16_ld_128_128_336,Gemm_Rocblas_6377,0.0163075
GemmStridedBatchedTunableOp_float_TN,tn_1648_1_128_B_16_ld_128_128_1648,Gemm_Hipblaslt_6376,0.0489296
GemmStridedBatchedTunableOp_float_TN,tn_998_1_64_B_8_ld_512_64_998,Gemm_Hipblaslt_6376,0.0139462
GemmStridedBatchedTunableOp_float_TN,tn_526_1_64_B_8_ld_512_64_526,Gemm_Rocblas_6377,0.0100493
GemmStridedBatchedTunableOp_float_TN,tn_1370_1_128_B_16_ld_128_128_1370,Gemm_Hipblaslt_6376,0.0438015
GemmStridedBatchedTunableOp_float_TN,tn_1159_1_128_B_16_ld_128_128_1159,Gemm_Hipblaslt_6378,0.0412387
GemmStridedBatchedTunableOp_float_TN,tn_1000_1_64_B_8_ld_512_64_1000,Gemm_Rocblas_6377,0.0139723
GemmStridedBatchedTunableOp_float_TN,tn_1639_1_128_B_16_ld_128_128_1639,Gemm_Hipblaslt_6376,0.0496858
GemmStridedBatchedTunableOp_float_TN,tn_586_1_64_B_8_ld_512_64_586,Gemm_Hipblaslt_6376,0.0101843
GemmStridedBatchedTunableOp_float_TN,tn_211_1_64_B_8_ld_512_64_211,Gemm_Rocblas_6379,0.00874887
GemmStridedBatchedTunableOp_float_TN,tn_835_1_64_B_8_ld_512_64_835,Gemm_Hipblaslt_6376,0.0122177
GemmStridedBatchedTunableOp_float_TN,tn_1340_1_128_B_16_ld_128_128_1340,Gemm_Hipblaslt_6376,0.0431199
GemmStridedBatchedTunableOp_float_TN,tn_834_1_64_B_8_ld_512_64_834,Gemm_Rocblas_6377,0.0126462
GemmStridedBatchedTunableOp_float_TN,tn_124_1_64_B_8_ld_512_64_124,Gemm_Rocblas_6379,0.00866391
GemmStridedBatchedTunableOp_float_TN,tn_518_1_64_B_8_ld_512_64_518,Gemm_Hipblaslt_6376,0.00994029
GemmStridedBatchedTunableOp_float_TN,tn_45_1_64_B_8_ld_512_64_45,Gemm_Rocblas_-9,0.0074793
GemmStridedBatchedTunableOp_float_TN,tn_234_1_128_B_16_ld_128_128_234,Gemm_Hipblaslt_6376,0.0135338
GemmStridedBatchedTunableOp_float_TN,tn_1107_1_128_B_16_ld_128_128_1107,Gemm_Rocblas_6379,0.0404501
GemmStridedBatchedTunableOp_float_TN,tn_514_1_64_B_8_ld_512_64_514,Gemm_Rocblas_6377,0.00960488
GemmStridedBatchedTunableOp_float_TN,tn_535_1_64_B_8_ld_512_64_535,Gemm_Rocblas_6377,0.0101086
GemmStridedBatchedTunableOp_float_TN,tn_508_1_64_B_8_ld_512_64_508,Gemm_Hipblaslt_6376,0.00988017
GemmStridedBatchedTunableOp_float_TN,tn_1529_1_128_B_16_ld_128_128_1529,Gemm_Hipblaslt_6376,0.0463126
GemmStridedBatchedTunableOp_float_TN,tn_309_1_128_B_16_ld_128_128_309,Gemm_Rocblas_6377,0.0156755
GemmStridedBatchedTunableOp_float_TN,tn_1149_1_128_B_16_ld_128_128_1149,Gemm_Hipblaslt_6378,0.0395195
GemmStridedBatchedTunableOp_float_TN,tn_944_1_64_B_8_ld_512_64_944,Gemm_Hipblaslt_6376,0.0135474
GemmStridedBatchedTunableOp_float_TN,tn_1223_1_128_B_16_ld_128_128_1223,Gemm_Rocblas_6379,0.0427383
GemmStridedBatchedTunableOp_float_TN,tn_790_1_64_B_8_ld_512_64_790,Gemm_Hipblaslt_6376,0.0121221
GemmStridedBatchedTunableOp_float_TN,tn_860_1_64_B_8_ld_512_64_860,Gemm_Rocblas_6377,0.0127062
GemmStridedBatchedTunableOp_float_TN,tn_507_1_64_B_8_ld_512_64_507,Gemm_Rocblas_6377,0.00980846
GemmStridedBatchedTunableOp_float_TN,tn_812_1_128_B_16_ld_128_128_812,Gemm_Rocblas_6379,0.0361078
GemmStridedBatchedTunableOp_float_TN,tn_827_1_64_B_8_ld_512_64_827,Gemm_Hipblaslt_6376,0.0125231
GemmStridedBatchedTunableOp_float_TN,tn_434_1_64_B_8_ld_512_64_434,Gemm_Hipblaslt_6376,0.00945137
GemmStridedBatchedTunableOp_float_TN,tn_505_1_64_B_8_ld_512_64_505,Gemm_Rocblas_6377,0.00958558
GemmStridedBatchedTunableOp_float_TN,tn_503_1_64_B_8_ld_512_64_503,Gemm_Hipblaslt_6376,0.00952718
GemmStridedBatchedTunableOp_float_TN,tn_881_1_64_B_8_ld_512_64_881,Gemm_Rocblas_6377,0.0130525
GemmStridedBatchedTunableOp_float_TN,tn_942_1_64_B_8_ld_512_64_942,Gemm_Rocblas_6377,0.0134601
GemmStridedBatchedTunableOp_float_TN,tn_1187_1_128_B_16_ld_128_128_1187,Gemm_Hipblaslt_6378,0.0420943
GemmStridedBatchedTunableOp_float_TN,tn_841_1_64_B_8_ld_512_64_841,Gemm_Hipblaslt_6376,0.0126579
GemmStridedBatchedTunableOp_float_TN,tn_1486_1_128_B_16_ld_128_128_1486,Gemm_Hipblaslt_6376,0.0466862
GemmStridedBatchedTunableOp_float_TN,tn_515_1_64_B_8_ld_512_64_515,Gemm_Rocblas_6377,0.00949828
GemmStridedBatchedTunableOp_float_TN,tn_225_1_64_B_8_ld_512_64_225,Gemm_Rocblas_6379,0.0100064
GemmStridedBatchedTunableOp_float_TN,tn_1014_1_64_B_8_ld_512_64_1014,Gemm_Rocblas_6377,0.0140107
GemmStridedBatchedTunableOp_float_TN,tn_480_1_64_B_8_ld_512_64_480,Gemm_Rocblas_6377,0.00932825
GemmStridedBatchedTunableOp_float_TN,tn_1139_1_128_B_16_ld_128_128_1139,Gemm_Rocblas_6379,0.041005
GemmStridedBatchedTunableOp_float_TN,tn_583_1_64_B_8_ld_512_64_583,Gemm_Rocblas_6377,0.0104308
GemmStridedBatchedTunableOp_float_TN,tn_175_1_64_B_8_ld_512_64_175,Gemm_Hipblaslt_6378,0.00875527
GemmStridedBatchedTunableOp_float_TN,tn_738_1_64_B_8_ld_512_64_738,Gemm_Rocblas_6377,0.0119348
GemmStridedBatchedTunableOp_float_TN,tn_1118_1_128_B_16_ld_128_128_1118,Gemm_Rocblas_6379,0.0403458
GemmStridedBatchedTunableOp_float_TN,tn_92_1_64_B_8_ld_512_64_92,Gemm_Hipblaslt_6378,0.00822915
GemmStridedBatchedTunableOp_float_TN,tn_551_1_64_B_8_ld_512_64_551,Gemm_Hipblaslt_6376,0.00979278
GemmStridedBatchedTunableOp_float_TN,tn_250_1_64_B_8_ld_512_64_250,Gemm_Rocblas_6379,0.00946149
GemmStridedBatchedTunableOp_float_TN,tn_1703_1_128_B_16_ld_128_128_1703,Gemm_Hipblaslt_6376,0.0511401
GemmStridedBatchedTunableOp_float_TN,tn_1023_1_64_B_8_ld_512_64_1023,Gemm_Rocblas_6377,0.013967
GemmStridedBatchedTunableOp_float_TN,tn_499_1_64_B_8_ld_512_64_499,Gemm_Rocblas_6377,0.00949229
GemmStridedBatchedTunableOp_float_TN,tn_255_1_64_B_8_ld_512_64_255,Gemm_Hipblaslt_6377,0.0101648
GemmStridedBatchedTunableOp_float_TN,tn_889_1_128_B_16_ld_128_128_889,Gemm_Hipblaslt_6378,0.0370012
GemmStridedBatchedTunableOp_float_TN,tn_1491_1_128_B_16_ld_128_128_1491,Gemm_Hipblaslt_6376,0.0451012
GemmStridedBatchedTunableOp_float_TN,tn_929_1_64_B_8_ld_512_64_929,Gemm_Rocblas_6377,0.0134817
GemmStridedBatchedTunableOp_float_TN,tn_1418_1_128_B_16_ld_128_128_1418,Gemm_Hipblaslt_6376,0.0451717
GemmStridedBatchedTunableOp_float_TN,tn_498_1_64_B_8_ld_512_64_498,Gemm_Rocblas_6377,0.00948345
GemmStridedBatchedTunableOp_float_TN,tn_1411_1_128_B_16_ld_128_128_1411,Gemm_Rocblas_6377,0.0460145
GemmStridedBatchedTunableOp_float_TN,tn_469_1_64_B_8_ld_512_64_469,Gemm_Hipblaslt_6376,0.00966501
GemmStridedBatchedTunableOp_float_TN,tn_212_212_15_B_8_ld_360_120_212,Gemm_Hipblaslt_6377,0.0146945
GemmStridedBatchedTunableOp_float_TN,tn_493_1_64_B_8_ld_512_64_493,Gemm_Rocblas_6377,0.00953393
GemmStridedBatchedTunableOp_float_TN,tn_654_1_64_B_8_ld_512_64_654,Gemm_Rocblas_6377,0.0108817
GemmStridedBatchedTunableOp_float_TN,tn_552_1_128_B_16_ld_128_128_552,Gemm_Rocblas_6377,0.0228437
GemmStridedBatchedTunableOp_float_TN,tn_529_1_64_B_8_ld_512_64_529,Gemm_Rocblas_6377,0.00976436
GemmStridedBatchedTunableOp_float_TN,tn_1108_1108_128_B_16_ld_128_2048_1108,Gemm_Hipblaslt_6377,2.00127
GemmStridedBatchedTunableOp_float_TN,tn_1701_1_128_B_16_ld_128_128_1701,Gemm_Hipblaslt_6376,0.0512311
GemmStridedBatchedTunableOp_float_TN,tn_481_1_64_B_8_ld_512_64_481,Gemm_Rocblas_6377,0.00940169
GemmStridedBatchedTunableOp_float_TN,tn_838_1_64_B_8_ld_512_64_838,Gemm_Hipblaslt_6376,0.0126465
GemmStridedBatchedTunableOp_float_TN,tn_88_1_64_B_8_ld_512_64_88,Gemm_Rocblas_6379,0.00855169
GemmStridedBatchedTunableOp_float_TN,tn_319_1_64_B_8_ld_512_64_319,Gemm_Rocblas_6379,0.00902575
GemmStridedBatchedTunableOp_float_TN,tn_31_1_64_B_8_ld_512_64_31,Gemm_Rocblas_-9,0.0068432
GemmStridedBatchedTunableOp_float_TN,tn_615_1_64_B_8_ld_512_64_615,Gemm_Rocblas_6377,0.010624
GemmStridedBatchedTunableOp_float_TN,tn_614_1_64_B_8_ld_512_64_614,Gemm_Hipblaslt_6376,0.0106901
GemmStridedBatchedTunableOp_float_TN,tn_608_1_64_B_8_ld_512_64_608,Gemm_Rocblas_6377,0.010684
GemmStridedBatchedTunableOp_float_TN,tn_2038_1_128_B_16_ld_128_128_2038,Gemm_Hipblaslt_6376,0.0573679
GemmStridedBatchedTunableOp_float_TN,tn_474_1_128_B_16_ld_128_128_474,Gemm_Hipblaslt_6376,0.0196742
GemmStridedBatchedTunableOp_float_TN,tn_494_1_64_B_8_ld_512_64_494,Gemm_Rocblas_6377,0.0094874
GemmStridedBatchedTunableOp_float_TN,tn_691_1_128_B_16_ld_128_128_691,Gemm_Hipblaslt_6378,0.0327981
GemmStridedBatchedTunableOp_float_TN,tn_476_1_64_B_8_ld_512_64_476,Gemm_Hipblaslt_6376,0.00936926
GemmStridedBatchedTunableOp_float_TN,tn_865_1_64_B_8_ld_512_64_865,Gemm_Hipblaslt_6376,0.0129832
GemmStridedBatchedTunableOp_float_TN,tn_139_1_128_B_16_ld_128_128_139,Gemm_Rocblas_6377,0.0109618
GemmStridedBatchedTunableOp_float_TN,tn_474_1_64_B_8_ld_512_64_474,Gemm_Hipblaslt_6376,0.00969382
GemmStridedBatchedTunableOp_float_TN,tn_147_1_128_B_16_ld_128_128_147,Gemm_Rocblas_6377,0.0110937
GemmStridedBatchedTunableOp_float_TN,tn_877_1_128_B_16_ld_128_128_877,Gemm_Rocblas_6379,0.0364557
GemmStridedBatchedTunableOp_float_TN,tn_91_1_64_B_8_ld_512_64_91,Gemm_Rocblas_6377,0.00871553
GemmStridedBatchedTunableOp_float_TN,tn_542_1_64_B_8_ld_512_64_542,Gemm_Rocblas_6377,0.0098638
GemmStridedBatchedTunableOp_float_TN,tn_774_1_64_B_8_ld_512_64_774,Gemm_Rocblas_6377,0.012061
GemmStridedBatchedTunableOp_float_TN,tn_619_1_64_B_8_ld_512_64_619,Gemm_Rocblas_6377,0.0107254
GemmStridedBatchedTunableOp_float_TN,tn_218_1_64_B_8_ld_512_64_218,Gemm_Hipblaslt_6376,0.00932049
GemmStridedBatchedTunableOp_float_TN,tn_472_1_64_B_8_ld_512_64_472,Gemm_Rocblas_6377,0.0092718
GemmStridedBatchedTunableOp_float_TN,tn_410_1_128_B_16_ld_128_128_410,Gemm_Rocblas_6377,0.0179654
GemmStridedBatchedTunableOp_float_TN,tn_968_1_128_B_16_ld_128_128_968,Gemm_Hipblaslt_6378,0.036616
GemmStridedBatchedTunableOp_float_TN,tn_2032_1_128_B_16_ld_128_128_2032,Gemm_Hipblaslt_6376,0.0561046
GemmStridedBatchedTunableOp_float_TN,tn_977_1_64_B_8_ld_512_64_977,Gemm_Rocblas_6377,0.01383
GemmStridedBatchedTunableOp_float_TN,tn_200_1_128_B_16_ld_128_128_200,Gemm_Hipblaslt_6376,0.0126013
GemmStridedBatchedTunableOp_float_TN,tn_720_1_64_B_8_ld_512_64_720,Gemm_Rocblas_6377,0.0114739
GemmStridedBatchedTunableOp_float_TN,tn_468_1_64_B_8_ld_512_64_468,Gemm_Rocblas_6377,0.00991468
GemmStridedBatchedTunableOp_float_TN,tn_165_1_64_B_8_ld_512_64_165,Gemm_Hipblaslt_6378,0.00870196
GemmStridedBatchedTunableOp_float_TN,tn_463_1_64_B_8_ld_512_64_463,Gemm_Hipblaslt_6376,0.00963413
GemmStridedBatchedTunableOp_float_TN,tn_400_400_32_B_8_ld_32_32_400,Gemm_Hipblaslt_6377,0.043705
GemmStridedBatchedTunableOp_float_TN,tn_1041_1_128_B_16_ld_128_128_1041,Gemm_Rocblas_6379,0.0390999
GemmStridedBatchedTunableOp_float_TN,tn_724_1_64_B_8_ld_512_64_724,Gemm_Hipblaslt_6376,0.0117172
GemmStridedBatchedTunableOp_float_TN,tn_590_1_64_B_8_ld_512_64_590,Gemm_Rocblas_6377,0.0101014
GemmStridedBatchedTunableOp_float_TN,tn_1384_1_128_B_16_ld_128_128_1384,Gemm_Hipblaslt_6376,0.0444231
GemmStridedBatchedTunableOp_float_TN,tn_460_1_64_B_8_ld_512_64_460,Gemm_Rocblas_6377,0.00927987
GemmStridedBatchedTunableOp_float_TN,tn_930_1_64_B_8_ld_512_64_930,Gemm_Hipblaslt_6376,0.0133967
GemmStridedBatchedTunableOp_float_TN,tn_165_1_128_B_16_ld_128_128_165,Gemm_Hipblaslt_6376,0.0115858
GemmStridedBatchedTunableOp_float_TN,tn_735_1_128_B_16_ld_128_128_735,Gemm_Hipblaslt_6378,0.0340648
GemmStridedBatchedTunableOp_float_TN,tn_1680_1_128_B_16_ld_128_128_1680,Gemm_Hipblaslt_6376,0.0501239
GemmStridedBatchedTunableOp_float_TN,tn_454_1_64_B_8_ld_512_64_454,Gemm_Rocblas_6377,0.00919734
GemmStridedBatchedTunableOp_float_TN,tn_354_1_64_B_8_ld_512_64_354,Gemm_Rocblas_6377,0.00913877
GemmStridedBatchedTunableOp_float_TN,tn_453_1_64_B_8_ld_512_64_453,Gemm_Hipblaslt_6376,0.00958762
GemmStridedBatchedTunableOp_float_TN,tn_1260_1_128_B_16_ld_128_128_1260,Gemm_Rocblas_6377,0.0427928
GemmStridedBatchedTunableOp_float_TN,tn_448_1_64_B_8_ld_512_64_448,Gemm_Rocblas_6377,0.00955106
GemmStridedBatchedTunableOp_float_TN,tn_931_1_128_B_16_ld_128_128_931,Gemm_Rocblas_6379,0.0371558
GemmStridedBatchedTunableOp_float_TN,tn_513_1_64_B_8_ld_512_64_513,Gemm_Hipblaslt_6376,0.00996557
GemmStridedBatchedTunableOp_float_TN,tn_729_1_128_B_16_ld_128_128_729,Gemm_Hipblaslt_6378,0.0349777
GemmStridedBatchedTunableOp_float_TN,tn_925_1_64_B_8_ld_512_64_925,Gemm_Hipblaslt_6376,0.0134917
GemmStridedBatchedTunableOp_float_TN,tn_267_1_64_B_8_ld_512_64_267,Gemm_Hipblaslt_6378,0.00918804
GemmStridedBatchedTunableOp_float_TN,tn_441_1_64_B_8_ld_512_64_441,Gemm_Rocblas_6377,0.00950665
GemmStridedBatchedTunableOp_float_TN,tn_1267_1_128_B_16_ld_128_128_1267,Gemm_Hipblaslt_6376,0.0435799
GemmStridedBatchedTunableOp_float_TN,tn_786_1_128_B_16_ld_128_128_786,Gemm_Rocblas_6379,0.0317132
GemmStridedBatchedTunableOp_float_TN,tn_439_1_64_B_8_ld_512_64_439,Gemm_Hipblaslt_6376,0.00946456
GemmStridedBatchedTunableOp_float_TN,tn_1011_1_64_B_8_ld_512_64_1011,Gemm_Hipblaslt_6376,0.0134201
GemmStridedBatchedTunableOp_float_TN,tn_437_1_64_B_8_ld_512_64_437,Gemm_Hipblaslt_6376,0.00911079
GemmStridedBatchedTunableOp_float_TN,tn_873_1_64_B_8_ld_512_64_873,Gemm_Rocblas_6377,0.0130021
GemmStridedBatchedTunableOp_float_TN,tn_1011_1_128_B_16_ld_128_128_1011,Gemm_Hipblaslt_6378,0.0384378
GemmStridedBatchedTunableOp_float_TN,tn_41_1_64_B_8_ld_512_64_41,Gemm_Rocblas_-9,0.00712702
GemmStridedBatchedTunableOp_float_TN,tn_201_1_64_B_8_ld_512_64_201,Gemm_Hipblaslt_6378,0.00846475
GemmStridedBatchedTunableOp_float_TN,tn_58_1_64_B_8_ld_512_64_58,Gemm_Rocblas_-9,0.00771493
GemmStridedBatchedTunableOp_float_TN,tn_23_1_64_B_8_ld_512_64_23,Gemm_Rocblas_-9,0.00667655
GemmStridedBatchedTunableOp_float_TN,tn_254_1_64_B_8_ld_512_64_254,Gemm_Hipblaslt_6376,0.00956239
GemmStridedBatchedTunableOp_float_TN,tn_161_1_128_B_16_ld_128_128_161,Gemm_Rocblas_6377,0.0114803
GemmStridedBatchedTunableOp_float_TN,tn_447_1_64_B_8_ld_512_64_447,Gemm_Rocblas_6377,0.00956002
GemmStridedBatchedTunableOp_float_TN,tn_741_1_64_B_8_ld_512_64_741,Gemm_Rocblas_6377,0.0117265
GemmStridedBatchedTunableOp_float_TN,tn_105_1_64_B_8_ld_512_64_105,Gemm_Rocblas_6377,0.00864021
GemmStridedBatchedTunableOp_float_TN,tn_528_1_128_B_16_ld_128_128_528,Gemm_Hipblaslt_6376,0.0209318
GemmStridedBatchedTunableOp_float_TN,tn_22_1_64_B_8_ld_512_64_22,Gemm_Rocblas_-9,0.00654318
GemmStridedBatchedTunableOp_float_TN,tn_315_1_64_B_8_ld_512_64_315,Gemm_Hipblaslt_6376,0.00899616
GemmStridedBatchedTunableOp_float_TN,tn_988_1_64_B_8_ld_512_64_988,Gemm_Rocblas_6377,0.0139551
GemmStridedBatchedTunableOp_float_TN,tn_13_1_64_B_8_ld_512_64_13,Gemm_Rocblas_-9,0.00569668
GemmStridedBatchedTunableOp_float_TN,tn_1657_1_128_B_16_ld_128_128_1657,Gemm_Hipblaslt_6376,0.0495143
GemmStridedBatchedTunableOp_float_TN,tn_387_387_128_B_16_ld_128_2048_387,Gemm_Hipblaslt_6377,0.257177
GemmStridedBatchedTunableOp_float_TN,tn_475_1_64_B_8_ld_512_64_475,Gemm_Hipblaslt_6376,0.00968061
GemmStridedBatchedTunableOp_float_TN,tn_937_1_128_B_16_ld_128_128_937,Gemm_Rocblas_6379,0.0374352
GemmStridedBatchedTunableOp_float_TN,tn_464_1_128_B_16_ld_128_128_464,Gemm_Rocblas_6377,0.0193151
GemmStridedBatchedTunableOp_float_TN,tn_132_1_64_B_8_ld_512_64_132,Gemm_Rocblas_6379,0.00873321
GemmStridedBatchedTunableOp_float_TN,tn_806_1_64_B_8_ld_512_64_806,Gemm_Hipblaslt_6376,0.0123576
GemmStridedBatchedTunableOp_float_TN,tn_103_1_64_B_8_ld_512_64_103,Gemm_Rocblas_6379,0.00856772
GemmStridedBatchedTunableOp_float_TN,tn_78_1_64_B_8_ld_512_64_78,Gemm_Rocblas_-9,0.00848318
GemmStridedBatchedTunableOp_float_TN,tn_325_1_128_B_16_ld_128_128_325,Gemm_Hipblaslt_6376,0.0161319
GemmStridedBatchedTunableOp_float_TN,tn_71_1_64_B_8_ld_512_64_71,Gemm_Rocblas_-9,0.00829243
GemmStridedBatchedTunableOp_float_TN,tn_155_1_128_B_16_ld_128_128_155,Gemm_Rocblas_6377,0.0113822
GemmStridedBatchedTunableOp_float_TN,tn_243_1_128_B_16_ld_128_128_243,Gemm_Rocblas_6377,0.0138119
GemmStridedBatchedTunableOp_float_TN,tn_705_1_64_B_8_ld_512_64_705,Gemm_Rocblas_6377,0.0113164
GemmStridedBatchedTunableOp_float_TN,tn_1422_1_128_B_16_ld_128_128_1422,Gemm_Hipblaslt_6376,0.0452939
GemmStridedBatchedTunableOp_float_TN,tn_32_1_64_B_8_ld_512_64_32,Gemm_Rocblas_-9,0.0067126
GemmStridedBatchedTunableOp_float_TN,tn_536_1_64_B_8_ld_512_64_536,Gemm_Hipblaslt_6376,0.0100893
GemmStridedBatchedTunableOp_float_TN,tn_312_1_64_B_8_ld_512_64_312,Gemm_Rocblas_6377,0.00868756
GemmStridedBatchedTunableOp_float_TN,tn_116_1_64_B_8_ld_512_64_116,Gemm_Rocblas_6379,0.00862537
GemmStridedBatchedTunableOp_float_TN,tn_462_1_64_B_8_ld_512_64_462,Gemm_Hipblaslt_6376,0.00962454
GemmStridedBatchedTunableOp_float_TN,tn_631_1_128_B_16_ld_128_128_631,Gemm_Hipblaslt_6378,0.0263876
GemmStridedBatchedTunableOp_float_TN,tn_1993_1993_128_B_16_ld_128_2048_1993,Gemm_Rocblas_6378,6.31132
GemmStridedBatchedTunableOp_float_TN,tn_1279_1_128_B_16_ld_128_128_1279,Gemm_Hipblaslt_6378,0.0447734
GemmStridedBatchedTunableOp_float_TN,tn_190_1_64_B_8_ld_512_64_190,Gemm_Hipblaslt_6378,0.00878974
GemmStridedBatchedTunableOp_float_TN,tn_137_1_64_B_8_ld_512_64_137,Gemm_Rocblas_6379,0.00872646
GemmStridedBatchedTunableOp_float_TN,tn_524_1_64_B_8_ld_512_64_524,Gemm_Hipblaslt_6376,0.00974074
GemmStridedBatchedTunableOp_float_TN,tn_839_1_64_B_8_ld_512_64_839,Gemm_Hipblaslt_6376,0.0123897
GemmStridedBatchedTunableOp_float_TN,tn_131_1_64_B_8_ld_512_64_131,Gemm_Rocblas_6379,0.00865026
GemmStridedBatchedTunableOp_float_TN,tn_51_1_64_B_8_ld_512_64_51,Gemm_Rocblas_-9,0.00761067
GemmStridedBatchedTunableOp_float_TN,tn_977_1_128_B_16_ld_128_128_977,Gemm_Rocblas_6379,0.0380154
GemmStridedBatchedTunableOp_float_TN,tn_1522_1_128_B_16_ld_128_128_1522,Gemm_Hipblaslt_6376,0.0458149
GemmStridedBatchedTunableOp_float_TN,tn_1269_1_128_B_16_ld_128_128_1269,Gemm_Hipblaslt_6376,0.0436461
GemmStridedBatchedTunableOp_float_TN,tn_179_1_64_B_8_ld_512_64_179,Gemm_Hipblaslt_6378,0.00880738
GemmStridedBatchedTunableOp_float_TN,tn_266_1_64_B_8_ld_512_64_266,Gemm_Rocblas_-9,0.0156836
GemmStridedBatchedTunableOp_float_TN,tn_153_1_64_B_8_ld_512_64_153,Gemm_Hipblaslt_6378,0.00874083
GemmStridedBatchedTunableOp_float_TN,tn_528_1_64_B_8_ld_512_64_528,Gemm_Rocblas_6377,0.0100689
GemmStridedBatchedTunableOp_float_TN,tn_591_1_64_B_8_ld_512_64_591,Gemm_Hipblaslt_6376,0.0100345
GemmStridedBatchedTunableOp_float_TN,tn_596_1_128_B_16_ld_128_128_596,Gemm_Hipblaslt_6376,0.0244375
GemmStridedBatchedTunableOp_float_TN,tn_330_1_128_B_16_ld_128_128_330,Gemm_Hipblaslt_6376,0.0162534
GemmStridedBatchedTunableOp_float_TN,tn_958_1_128_B_16_ld_128_128_958,Gemm_Rocblas_6379,0.0376723
GemmStridedBatchedTunableOp_float_TN,tn_2023_1_128_B_16_ld_128_128_2023,Gemm_Hipblaslt_6376,0.0581364
GemmStridedBatchedTunableOp_float_TN,tn_362_1_64_B_8_ld_512_64_362,Gemm_Rocblas_6377,0.00913159
GemmStridedBatchedTunableOp_float_TN,tn_640_1_128_B_16_ld_128_128_640,Gemm_Rocblas_6379,0.026596
GemmStridedBatchedTunableOp_float_TN,tn_783_1_128_B_16_ld_128_128_783,Gemm_Hipblaslt_6378,0.0352262
GemmStridedBatchedTunableOp_float_TN,tn_1641_1641_128_B_16_ld_128_2048_1641,Default,4.42079
GemmStridedBatchedTunableOp_float_TN,tn_461_1_64_B_8_ld_512_64_461,Gemm_Hipblaslt_6376,0.00924227
GemmStridedBatchedTunableOp_float_TN,tn_76_1_64_B_8_ld_512_64_76,Gemm_Rocblas_-9,0.0084463
GemmStridedBatchedTunableOp_float_TN,tn_1097_1_128_B_16_ld_128_128_1097,Gemm_Rocblas_6379,0.0399274
GemmStridedBatchedTunableOp_float_TN,tn_261_1_64_B_8_ld_512_64_261,Gemm_Rocblas_6377,0.0100981
GemmStridedBatchedTunableOp_float_TN,tn_997_1_64_B_8_ld_512_64_997,Gemm_Hipblaslt_6376,0.0139341
GemmStridedBatchedTunableOp_float_TN,tn_186_1_64_B_8_ld_512_64_186,Gemm_Rocblas_6379,0.0087308
GemmStridedBatchedTunableOp_float_TN,tn_1117_1_128_B_16_ld_128_128_1117,Gemm_Hipblaslt_6378,0.04002
GemmStridedBatchedTunableOp_float_TN,tn_163_1_64_B_8_ld_512_64_163,Gemm_Rocblas_6379,0.00872608
GemmStridedBatchedTunableOp_float_TN,tn_780_1_64_B_8_ld_512_64_780,Gemm_Hipblaslt_6376,0.0120775
GemmStridedBatchedTunableOp_float_TN,tn_290_1_64_B_8_ld_512_64_290,Gemm_Hipblaslt_6378,0.00971951
GemmStridedBatchedTunableOp_float_TN,tn_1341_1_128_B_16_ld_128_128_1341,Gemm_Hipblaslt_6376,0.0453672
GemmStridedBatchedTunableOp_float_TN,tn_570_1_64_B_8_ld_512_64_570,Gemm_Hipblaslt_6376,0.0101599
GemmStridedBatchedTunableOp_float_TN,tn_849_1_64_B_8_ld_512_64_849,Gemm_Rocblas_6377,0.0127304
GemmStridedBatchedTunableOp_float_TN,tn_386_1_64_B_8_ld_512_64_386,Gemm_Hipblaslt_6376,0.00883863
GemmStridedBatchedTunableOp_float_TN,tn_294_1_64_B_8_ld_512_64_294,Gemm_Rocblas_-9,0.0292539
GemmStridedBatchedTunableOp_float_TN,tn_46_1_64_B_8_ld_512_64_46,Gemm_Rocblas_-9,0.00715413
GemmStridedBatchedTunableOp_float_TN,tn_293_1_64_B_8_ld_512_64_293,Gemm_Hipblaslt_6378,0.0109514
GemmStridedBatchedTunableOp_float_TN,tn_1354_1_128_B_16_ld_128_128_1354,Gemm_Hipblaslt_6376,0.0451993
GemmStridedBatchedTunableOp_float_TN,tn_787_787_128_B_16_ld_128_2048_787,Default,1.046
GemmStridedBatchedTunableOp_float_TN,tn_357_1_64_B_8_ld_512_64_357,Gemm_Rocblas_6377,0.00910551
GemmStridedBatchedTunableOp_float_TN,tn_239_1_64_B_8_ld_512_64_239,Gemm_Hipblaslt_6376,0.00932222
GemmStridedBatchedTunableOp_float_TN,tn_862_1_64_B_8_ld_512_64_862,Gemm_Rocblas_6377,0.012776
GemmStridedBatchedTunableOp_float_TN,tn_999_1_128_B_16_ld_128_128_999,Gemm_Hipblaslt_6378,0.0380162
GemmStridedBatchedTunableOp_float_TN,tn_627_1_128_B_16_ld_128_128_627,Gemm_Rocblas_6379,0.0263243
GemmStridedBatchedTunableOp_float_TN,tn_288_1_64_B_8_ld_512_64_288,Gemm_Rocblas_-9,0.0297007
GemmStridedBatchedTunableOp_float_TN,tn_884_1_64_B_8_ld_512_64_884,Gemm_Rocblas_6377,0.0129912
GemmStridedBatchedTunableOp_float_TN,tn_285_1_64_B_8_ld_512_64_285,Gemm_Hipblaslt_6379,0.0164106
GemmStridedBatchedTunableOp_float_TN,tn_1188_1_128_B_16_ld_128_128_1188,Gemm_Rocblas_6379,0.041623
GemmStridedBatchedTunableOp_float_TN,tn_803_1_64_B_8_ld_512_64_803,Gemm_Hipblaslt_6376,0.0123412
GemmStridedBatchedTunableOp_float_TN,tn_216_1_64_B_8_ld_512_64_216,Gemm_Hipblaslt_6378,0.00846435
GemmStridedBatchedTunableOp_float_TN,tn_1319_1_128_B_16_ld_128_128_1319,Gemm_Hipblaslt_6378,0.0448203
GemmStridedBatchedTunableOp_float_TN,tn_922_1_64_B_8_ld_512_64_922,Gemm_Rocblas_6377,0.0134437
GemmStridedBatchedTunableOp_float_TN,tn_235_1_64_B_8_ld_512_64_235,Gemm_Rocblas_-9,0.020164
GemmStridedBatchedTunableOp_float_TN,tn_872_1_64_B_8_ld_512_64_872,Gemm_Hipblaslt_6376,0.0128446
GemmStridedBatchedTunableOp_float_TN,tn_842_1_64_B_8_ld_512_64_842,Gemm_Rocblas_6377,0.0126694
GemmStridedBatchedTunableOp_float_TN,tn_594_1_64_B_8_ld_512_64_594,Gemm_Rocblas_6377,0.0105098
GemmStridedBatchedTunableOp_float_TN,tn_107_1_64_B_8_ld_512_64_107,Gemm_Hipblaslt_6378,0.00858407
GemmStridedBatchedTunableOp_float_TN,tn_75_1_64_B_8_ld_512_64_75,Gemm_Rocblas_-9,0.00820828
GemmStridedBatchedTunableOp_float_TN,tn_90_1_64_B_8_ld_512_64_90,Gemm_Hipblaslt_6378,0.00856328
GemmStridedBatchedTunableOp_float_TN,tn_236_1_64_B_8_ld_512_64_236,Gemm_Hipblaslt_6379,0.0119156
GemmStridedBatchedTunableOp_float_TN,tn_969_1_64_B_8_ld_512_64_969,Gemm_Hipblaslt_6376,0.0137899
GemmStridedBatchedTunableOp_float_TN,tn_1241_1_128_B_16_ld_128_128_1241,Gemm_Hipblaslt_6376,0.0429243
GemmStridedBatchedTunableOp_float_TN,tn_971_1_64_B_8_ld_512_64_971,Gemm_Rocblas_6377,0.0138504
GemmStridedBatchedTunableOp_float_TN,tn_1080_1_128_B_16_ld_128_128_1080,Gemm_Rocblas_6379,0.040103
GemmStridedBatchedTunableOp_float_TN,tn_1338_1_128_B_16_ld_128_128_1338,Gemm_Hipblaslt_6376,0.0434849
GemmStridedBatchedTunableOp_float_TN,tn_364_1_64_B_8_ld_512_64_364,Gemm_Rocblas_6377,0.0087853
GemmStridedBatchedTunableOp_float_TN,tn_886_886_128_B_16_ld_128_2048_886,Default,1.29945
GemmStridedBatchedTunableOp_float_TN,tn_276_1_64_B_8_ld_512_64_276,Gemm_Hipblaslt_6378,0.00926224
GemmStridedBatchedTunableOp_float_TN,tn_1237_1_128_B_16_ld_128_128_1237,Gemm_Hipblaslt_6378,0.0431054
GemmStridedBatchedTunableOp_float_TN,tn_1401_1_128_B_16_ld_128_128_1401,Gemm_Hipblaslt_6376,0.0443927
GemmStridedBatchedTunableOp_float_TN,tn_150_1_64_B_8_ld_512_64_150,Gemm_Rocblas_6379,0.00877339
GemmStridedBatchedTunableOp_float_TN,tn_752_1_128_B_16_ld_128_128_752,Gemm_Hipblaslt_6378,0.0338111
GemmStridedBatchedTunableOp_float_TN,tn_169_1_64_B_8_ld_512_64_169,Gemm_Rocblas_6379,0.0087441
GemmStridedBatchedTunableOp_float_TN,tn_936_1_128_B_16_ld_128_128_936,Gemm_Rocblas_6379,0.0363876
GemmStridedBatchedTunableOp_float_TN,tn_1315_1_128_B_16_ld_128_128_1315,Gemm_Hipblaslt_6376,0.0433899
GemmStridedBatchedTunableOp_float_TN,tn_270_1_64_B_8_ld_512_64_270,Gemm_Rocblas_6377,0.00955239
GemmStridedBatchedTunableOp_float_TN,tn_1660_1_128_B_16_ld_128_128_1660,Gemm_Hipblaslt_6376,0.0481874
GemmStridedBatchedTunableOp_float_TN,tn_233_1_64_B_8_ld_512_64_233,Gemm_Rocblas_6378,0.00956113
GemmStridedBatchedTunableOp_float_TN,tn_636_1_64_B_8_ld_512_64_636,Gemm_Rocblas_6377,0.0107618
GemmStridedBatchedTunableOp_float_TN,tn_298_1_128_B_16_ld_128_128_298,Gemm_Hipblaslt_6376,0.0154174
GemmStridedBatchedTunableOp_float_TN,tn_227_1_64_B_8_ld_512_64_227,Gemm_Rocblas_6377,0.00959002
GemmStridedBatchedTunableOp_float_TN,tn_751_1_64_B_8_ld_512_64_751,Gemm_Rocblas_6377,0.0118142
GemmStridedBatchedTunableOp_float_TN,tn_321_1_64_B_8_ld_512_64_321,Gemm_Hipblaslt_6376,0.0090474
GemmStridedBatchedTunableOp_float_TN,tn_395_1_64_B_8_ld_512_64_395,Gemm_Hipblaslt_6376,0.00943781
GemmStridedBatchedTunableOp_float_TN,tn_897_1_64_B_8_ld_512_64_897,Gemm_Rocblas_6377,0.0131387
GemmStridedBatchedTunableOp_float_TN,tn_626_1_128_B_16_ld_128_128_626,Gemm_Hipblaslt_6378,0.0261491
GemmStridedBatchedTunableOp_float_TN,tn_85_1_64_B_8_ld_512_64_85,Gemm_Rocblas_6377,0.00856572
GemmStridedBatchedTunableOp_float_TN,tn_587_1_64_B_8_ld_512_64_587,Gemm_Rocblas_6377,0.0101358
GemmStridedBatchedTunableOp_float_TN,tn_246_1_64_B_8_ld_512_64_246,Gemm_Rocblas_6377,0.0268485
GemmStridedBatchedTunableOp_float_TN,tn_327_1_64_B_8_ld_512_64_327,Gemm_Hipblaslt_6376,0.00902622
GemmStridedBatchedTunableOp_float_TN,tn_908_1_128_B_16_ld_128_128_908,Gemm_Rocblas_6379,0.0369751
GemmStridedBatchedTunableOp_float_TN,tn_106_1_64_B_8_ld_512_64_106,Gemm_Rocblas_6379,0.00858694
GemmStridedBatchedTunableOp_float_TN,tn_945_1_64_B_8_ld_512_64_945,Gemm_Rocblas_6377,0.0135391
GemmStridedBatchedTunableOp_float_TN,tn_378_1_64_B_8_ld_512_64_378,Gemm_Hipblaslt_6376,0.0091063
GemmStridedBatchedTunableOp_float_TN,tn_292_1_64_B_8_ld_512_64_292,Gemm_Rocblas_6377,0.0112352
GemmStridedBatchedTunableOp_float_TN,tn_291_1_64_B_8_ld_512_64_291,Gemm_Rocblas_-9,0.0166834
GemmStridedBatchedTunableOp_float_TN,tn_26_1_64_B_8_ld_512_64_26,Gemm_Rocblas_-9,0.00665215
GemmStridedBatchedTunableOp_float_TN,tn_1448_1_128_B_16_ld_128_128_1448,Gemm_Hipblaslt_6376,0.0452546
GemmStridedBatchedTunableOp_float_TN,tn_1005_1_128_B_16_ld_128_128_1005,Gemm_Rocblas_6379,0.0387251
GemmStridedBatchedTunableOp_float_TN,tn_1669_1_128_B_16_ld_128_128_1669,Gemm_Hipblaslt_6376,0.0500244
GemmStridedBatchedTunableOp_float_TN,tn_932_1_64_B_8_ld_512_64_932,Gemm_Hipblaslt_6376,0.0134725
GemmStridedBatchedTunableOp_float_TN,tn_715_1_64_B_8_ld_512_64_715,Gemm_Rocblas_6377,0.0114853
GemmStridedBatchedTunableOp_float_TN,tn_97_1_64_B_8_ld_512_64_97,Gemm_Hipblaslt_6376,0.00861263
GemmStridedBatchedTunableOp_float_TN,tn_64_1_1_B_3_ld_1_1_1,Gemm_Hipblaslt_6378,0.0149021
GemmStridedBatchedTunableOp_float_TN,tn_996_1_64_B_8_ld_512_64_996,Gemm_Hipblaslt_6376,0.0139129
GemmStridedBatchedTunableOp_float_TN,tn_2008_1_128_B_16_ld_128_128_2008,Gemm_Hipblaslt_6376,0.0553877
GemmStridedBatchedTunableOp_float_TN,tn_1_1_64_B_8_ld_64_64_1,Gemm_Rocblas_-9,0.00564141
GemmStridedBatchedTunableOp_float_TN,tn_772_1_64_B_8_ld_512_64_772,Gemm_Rocblas_6377,0.0120702
GemmStridedBatchedTunableOp_float_TN,tn_883_1_64_B_8_ld_512_64_883,Gemm_Hipblaslt_6376,0.0129583
GemmStridedBatchedTunableOp_float_TN,tn_438_1_64_B_8_ld_512_64_438,Gemm_Rocblas_6377,0.00912426
GemmStridedBatchedTunableOp_float_TN,tn_399_1_64_B_8_ld_512_64_399,Gemm_Rocblas_6377,0.00894917
GemmStridedBatchedTunableOp_float_TN,tn_344_1_64_B_8_ld_512_64_344,Gemm_Hipblaslt_6376,0.00908866
GemmStridedBatchedTunableOp_float_TN,tn_613_1_64_B_8_ld_512_64_613,Gemm_Rocblas_6377,0.0105362
GemmStridedBatchedTunableOp_float_TN,tn_99_1_64_B_8_ld_512_64_99,Gemm_Rocblas_6379,0.00863705
GemmStridedBatchedTunableOp_float_TN,tn_972_1_64_B_8_ld_512_64_972,Gemm_Rocblas_6377,0.0138131
GemmStridedBatchedTunableOp_float_TN,tn_1444_1_128_B_16_ld_128_128_1444,Gemm_Hipblaslt_6376,0.0448911
GemmStridedBatchedTunableOp_float_TN,tn_893_1_64_B_8_ld_512_64_893,Gemm_Rocblas_6377,0.0130313
GemmStridedBatchedTunableOp_float_TN,tn_86_1_64_B_8_ld_512_64_86,Gemm_Rocblas_6379,0.0085821
GemmStridedBatchedTunableOp_float_TN,tn_979_1_128_B_16_ld_128_128_979,Gemm_Hipblaslt_6378,0.0380179
GemmStridedBatchedTunableOp_float_TN,tn_511_1_64_B_8_ld_512_64_511,Gemm_Rocblas_6377,0.00964373
GemmStridedBatchedTunableOp_float_TN,tn_747_1_64_B_8_ld_512_64_747,Gemm_Rocblas_6377,0.0118514
GemmStridedBatchedTunableOp_float_TN,tn_1121_1_128_B_16_ld_128_128_1121,Gemm_Hipblaslt_6378,0.0404552
GemmStridedBatchedTunableOp_float_TN,tn_702_1_128_B_16_ld_128_128_702,Gemm_Hipblaslt_6378,0.0296165
GemmStridedBatchedTunableOp_float_TN,tn_810_1_64_B_8_ld_512_64_810,Gemm_Rocblas_6377,0.0123997
GemmStridedBatchedTunableOp_float_TN,tn_608_1_128_B_16_ld_128_128_608,Gemm_Rocblas_6379,0.0250398
GemmStridedBatchedTunableOp_float_TN,tn_306_1_64_B_8_ld_512_64_306,Gemm_Hipblaslt_6378,0.00866027
GemmStridedBatchedTunableOp_float_TN,tn_580_1_64_B_8_ld_512_64_580,Gemm_Hipblaslt_6376,0.0103595
GemmStridedBatchedTunableOp_float_TN,tn_737_1_64_B_8_ld_512_64_737,Gemm_Rocblas_6377,0.0117564
GemmStridedBatchedTunableOp_float_TN,tn_1251_1_128_B_16_ld_128_128_1251,Gemm_Rocblas_6379,0.0434328
GemmStridedBatchedTunableOp_float_TN,tn_419_1_128_B_16_ld_128_128_419,Gemm_Rocblas_6377,0.0182912
GemmStridedBatchedTunableOp_float_TN,tn_917_1_64_B_8_ld_512_64_917,Gemm_Hipblaslt_6376,0.0132224
GemmStridedBatchedTunableOp_float_TN,tn_1465_1465_128_B_16_ld_128_2048_1465,Default,3.60074
GemmStridedBatchedTunableOp_float_TN,tn_655_1_64_B_8_ld_512_64_655,Gemm_Rocblas_6377,0.0109149
GemmStridedBatchedTunableOp_float_TN,tn_471_1_64_B_8_ld_512_64_471,Gemm_Rocblas_6377,0.00932278
GemmStridedBatchedTunableOp_float_TN,tn_707_1_64_B_8_ld_512_64_707,Gemm_Rocblas_6377,0.0113549
GemmStridedBatchedTunableOp_float_TN,tn_56_1_64_B_8_ld_512_64_56,Gemm_Rocblas_-9,0.00779788
GemmStridedBatchedTunableOp_float_TN,tn_553_1_64_B_8_ld_512_64_553,Gemm_Hipblaslt_6376,0.0101588
GemmStridedBatchedTunableOp_float_TN,tn_993_993_128_B_16_ld_128_2048_993,Gemm_Rocblas_6378,1.61348
GemmStridedBatchedTunableOp_float_TN,tn_982_1_64_B_8_ld_512_64_982,Gemm_Hipblaslt_6376,0.0138688
GemmStridedBatchedTunableOp_float_TN,tn_329_1_64_B_8_ld_512_64_329,Gemm_Rocblas_6377,0.00872847
GemmStridedBatchedTunableOp_float_TN,tn_61_1_64_B_8_ld_512_64_61,Gemm_Rocblas_-9,0.00788845
GemmStridedBatchedTunableOp_float_TN,tn_590_1_128_B_16_ld_128_128_590,Gemm_Rocblas_6377,0.0232161
GemmStridedBatchedTunableOp_float_TN,tn_563_1_64_B_8_ld_512_64_563,Gemm_Rocblas_6377,0.0103603
GemmStridedBatchedTunableOp_float_TN,tn_832_1_64_B_8_ld_512_64_832,Gemm_Rocblas_6377,0.0124863
GemmStridedBatchedTunableOp_float_TN,tn_417_1_64_B_8_ld_512_64_417,Gemm_Hipblaslt_6376,0.0093072
GemmStridedBatchedTunableOp_float_TN,tn_622_1_128_B_16_ld_128_128_622,Gemm_Rocblas_6379,0.0257573
GemmStridedBatchedTunableOp_float_TN,tn_632_1_128_B_16_ld_128_128_632,Gemm_Hipblaslt_6378,0.026461
GemmStridedBatchedTunableOp_float_TN,tn_413_1_64_B_8_ld_512_64_413,Gemm_Rocblas_6377,0.00929423
GemmStridedBatchedTunableOp_float_TN,tn_66_1_64_B_8_ld_512_64_66,Gemm_Rocblas_-9,0.00844027
GemmStridedBatchedTunableOp_float_TN,tn_723_1_128_B_16_ld_128_128_723,Gemm_Rocblas_6379,0.0342435
GemmStridedBatchedTunableOp_float_TN,tn_880_1_64_B_8_ld_512_64_880,Gemm_Rocblas_6377,0.0128971
GemmStridedBatchedTunableOp_float_TN,tn_784_784_64_B_8_ld_512_512_784,Gemm_Hipblaslt_6379,0.373033
GemmStridedBatchedTunableOp_float_TN,tn_1473_1_128_B_16_ld_128_128_1473,Gemm_Hipblaslt_6376,0.0465723
GemmStridedBatchedTunableOp_float_TN,tn_1167_1_128_B_16_ld_128_128_1167,Gemm_Hipblaslt_6378,0.0413673
GemmStridedBatchedTunableOp_float_TN,tn_939_1_128_B_16_ld_128_128_939,Gemm_Rocblas_6379,0.0373919
GemmStridedBatchedTunableOp_float_TN,tn_706_1_128_B_16_ld_128_128_706,Gemm_Rocblas_6379,0.0336215
GemmStridedBatchedTunableOp_float_TN,tn_184_1_64_B_8_ld_512_64_184,Gemm_Hipblaslt_6378,0.0087617
GemmStridedBatchedTunableOp_float_TN,tn_1131_1_128_B_16_ld_128_128_1131,Gemm_Hipblaslt_6378,0.0409637
GemmStridedBatchedTunableOp_float_TN,tn_835_1_128_B_16_ld_128_128_835,Gemm_Hipblaslt_6378,0.0365379
GemmStridedBatchedTunableOp_float_TN,tn_531_1_64_B_8_ld_512_64_531,Gemm_Hipblaslt_6376,0.0101406
GemmStridedBatchedTunableOp_float_TN,tn_1024_1_128_B_16_ld_128_128_1024,Gemm_Rocblas_6379,0.0380147
GemmStridedBatchedTunableOp_float_TN,tn_158_1_64_B_8_ld_512_64_158,Gemm_Hipblaslt_6378,0.00877566
GemmStridedBatchedTunableOp_float_TN,tn_855_1_64_B_8_ld_512_64_855,Gemm_Hipblaslt_6376,0.0126044
GemmStridedBatchedTunableOp_float_TN,tn_845_1_128_B_16_ld_128_128_845,Gemm_Rocblas_6379,0.0361767
GemmStridedBatchedTunableOp_float_TN,tn_2001_1_128_B_16_ld_128_128_2001,Gemm_Hipblaslt_6376,0.0563727
GemmStridedBatchedTunableOp_float_TN,tn_496_1_64_B_8_ld_512_64_496,Gemm_Hipblaslt_6376,0.00984285
GemmStridedBatchedTunableOp_float_TN,tn_560_1_128_B_16_ld_128_128_560,Gemm_Hipblaslt_6378,0.0231623
GemmStridedBatchedTunableOp_float_TN,tn_2_1_64_B_8_ld_512_64_2,Gemm_Rocblas_-9,0.00550959
GemmStridedBatchedTunableOp_float_TN,tn_490_1_64_B_8_ld_512_64_490,Gemm_Hipblaslt_6376,0.00944216
GemmStridedBatchedTunableOp_float_TN,tn_1287_1_128_B_16_ld_128_128_1287,Gemm_Hipblaslt_6378,0.0446949
GemmStridedBatchedTunableOp_float_TN,tn_264_1_64_B_8_ld_512_64_264,Gemm_Rocblas_6377,0.0104316
GemmStridedBatchedTunableOp_float_TN,tn_442_1_64_B_8_ld_512_64_442,Gemm_Hipblaslt_6376,0.00948665
GemmStridedBatchedTunableOp_float_TN,tn_4_1_64_B_8_ld_512_64_4,Gemm_Rocblas_-9,0.00565225
GemmStridedBatchedTunableOp_float_TN,tn_1678_1_128_B_16_ld_128_128_1678,Gemm_Hipblaslt_6376,0.0502292
GemmStridedBatchedTunableOp_float_TN,tn_869_1_128_B_16_ld_128_128_869,Gemm_Hipblaslt_6378,0.0365222
GemmStridedBatchedTunableOp_float_TN,tn_59_1_64_B_8_ld_512_64_59,Gemm_Rocblas_-9,0.00795182
GemmStridedBatchedTunableOp_float_TN,tn_333_1_128_B_16_ld_128_128_333,Gemm_Rocblas_6377,0.0163611
GemmStridedBatchedTunableOp_float_TN,tn_2031_1_128_B_16_ld_128_128_2031,Gemm_Hipblaslt_6376,0.0580708
GemmStridedBatchedTunableOp_float_TN,tn_193_1_64_B_8_ld_512_64_193,Gemm_Rocblas_6379,0.00873759
GemmStridedBatchedTunableOp_float_TN,tn_159_1_64_B_8_ld_512_64_159,Gemm_Hipblaslt_6378,0.00862501
GemmStridedBatchedTunableOp_float_TN,tn_197_1_64_B_8_ld_512_64_197,Gemm_Hipblaslt_6378,0.00880341
GemmStridedBatchedTunableOp_float_TN,tn_767_1_64_B_8_ld_512_64_767,Gemm_Rocblas_6377,0.0119802
GemmStridedBatchedTunableOp_float_TN,tn_1069_1_128_B_16_ld_128_128_1069,Gemm_Rocblas_6379,0.0393784
GemmStridedBatchedTunableOp_float_TN,tn_763_1_128_B_16_ld_128_128_763,Gemm_Rocblas_6379,0.0353874
GemmStridedBatchedTunableOp_float_TN,tn_760_1_128_B_16_ld_128_128_760,Gemm_Hipblaslt_6378,0.0336897
GemmStridedBatchedTunableOp_float_TN,tn_1122_1_128_B_16_ld_128_128_1122,Gemm_Hipblaslt_6378,0.0404492
GemmStridedBatchedTunableOp_float_TN,tn_80_1_64_B_8_ld_512_64_80,Gemm_Rocblas_-9,0.00840901
GemmStridedBatchedTunableOp_float_TN,tn_545_1_64_B_8_ld_512_64_545,Gemm_Rocblas_6377,0.0102144
GemmStridedBatchedTunableOp_float_TN,tn_334_1_64_B_8_ld_512_64_334,Gemm_Rocblas_6377,0.00867349
GemmStridedBatchedTunableOp_float_TN,tn_396_1_64_B_8_ld_512_64_396,Gemm_Rocblas_6377,0.00922574
GemmStridedBatchedTunableOp_float_TN,tn_144_1_64_B_8_ld_512_64_144,Gemm_Hipblaslt_6378,0.00870202
GemmStridedBatchedTunableOp_float_TN,tn_172_1_64_B_8_ld_512_64_172,Gemm_Hipblaslt_6378,0.00879652
GemmStridedBatchedTunableOp_float_TN,tn_192_1_64_B_8_ld_512_64_192,Gemm_Hipblaslt_6378,0.00884585
GemmStridedBatchedTunableOp_float_TN,tn_793_1_128_B_16_ld_128_128_793,Gemm_Hipblaslt_6378,0.0355268
GemmStridedBatchedTunableOp_float_TN,tn_1258_1_128_B_16_ld_128_128_1258,Gemm_Rocblas_6377,0.0427696
GemmStridedBatchedTunableOp_float_TN,tn_575_1_64_B_8_ld_512_64_575,Gemm_Rocblas_6377,0.0103871
GemmStridedBatchedTunableOp_float_TN,tn_393_1_64_B_8_ld_512_64_393,Gemm_Hipblaslt_6376,0.00894241
GemmStridedBatchedTunableOp_float_TN,tn_1245_1_128_B_16_ld_128_128_1245,Gemm_Rocblas_6379,0.0433134
GemmStridedBatchedTunableOp_float_TN,tn_651_1_64_B_8_ld_512_64_651,Gemm_Hipblaslt_6376,0.0108848
GemmStridedBatchedTunableOp_float_TN,tn_199_1_64_B_8_ld_512_64_199,Gemm_Rocblas_6379,0.00882907
GemmStridedBatchedTunableOp_float_TN,tn_663_1_64_B_8_ld_512_64_663,Gemm_Rocblas_6377,0.0109097
GemmStridedBatchedTunableOp_float_TN,tn_987_1_64_B_8_ld_512_64_987,Gemm_Rocblas_6377,0.0138271
GemmStridedBatchedTunableOp_float_TN,tn_729_729_128_B_16_ld_128_2048_729,Gemm_Hipblaslt_6377,0.872199
GemmStridedBatchedTunableOp_float_TN,tn_666_1_128_B_16_ld_128_128_666,Gemm_Hipblaslt_6378,0.0298509
GemmStridedBatchedTunableOp_float_TN,tn_931_1_64_B_8_ld_512_64_931,Gemm_Hipblaslt_6376,0.0134016
GemmStridedBatchedTunableOp_float_TN,tn_679_1_64_B_8_ld_512_64_679,Gemm_Hipblaslt_6376,0.0111097
GemmStridedBatchedTunableOp_float_TN,tn_279_1_64_B_8_ld_512_64_279,Gemm_Hipblaslt_6378,0.00891515
GemmStridedBatchedTunableOp_float_TN,tn_112_1_64_B_8_ld_512_64_112,Gemm_Rocblas_6379,0.00869077
GemmStridedBatchedTunableOp_float_TN,tn_719_1_128_B_16_ld_128_128_719,Gemm_Rocblas_6379,0.0333772
GemmStridedBatchedTunableOp_float_TN,tn_822_1_64_B_8_ld_512_64_822,Gemm_Hipblaslt_6376,0.0125344
GemmStridedBatchedTunableOp_float_TN,tn_653_1_64_B_8_ld_512_64_653,Gemm_Hipblaslt_6376,0.0109137
GemmStridedBatchedTunableOp_float_TN,tn_959_1_64_B_8_ld_512_64_959,Gemm_Rocblas_6377,0.0137042
GemmStridedBatchedTunableOp_float_TN,tn_301_1_64_B_8_ld_512_64_301,Gemm_Rocblas_6377,0.00860933
GemmStridedBatchedTunableOp_float_TN,tn_1204_1_128_B_16_ld_128_128_1204,Gemm_Hipblaslt_6378,0.042255
GemmStridedBatchedTunableOp_float_TN,tn_259_1_64_B_8_ld_512_64_259,Gemm_Hipblaslt_6378,0.00975961
GemmStridedBatchedTunableOp_float_TN,tn_458_1_64_B_8_ld_512_64_458,Gemm_Rocblas_6377,0.00973635
GemmStridedBatchedTunableOp_float_TN,tn_117_1_64_B_8_ld_512_64_117,Gemm_Rocblas_6379,0.00861624
GemmStridedBatchedTunableOp_float_TN,tn_194_1_64_B_8_ld_512_64_194,Gemm_Hipblaslt_6378,0.00880375
GemmStridedBatchedTunableOp_float_TN,tn_176_1_64_B_8_ld_512_64_176,Gemm_Hipblaslt_6376,0.00881019
GemmStridedBatchedTunableOp_float_TN,tn_368_1_64_B_8_ld_512_64_368,Gemm_Rocblas_6377,0.00922375
GemmStridedBatchedTunableOp_float_TN,tn_410_1_64_B_8_ld_512_64_410,Gemm_Rocblas_6377,0.00899247
GemmStridedBatchedTunableOp_float_TN,tn_678_1_128_B_16_ld_128_128_678,Gemm_Rocblas_6379,0.0302854
GemmStridedBatchedTunableOp_float_TN,tn_96_1_64_B_8_ld_512_64_96,Gemm_Rocblas_6379,0.0082479
GemmStridedBatchedTunableOp_float_TN,tn_924_1_128_B_16_ld_128_128_924,Gemm_Hipblaslt_6378,0.0366569
GemmStridedBatchedTunableOp_float_TN,tn_978_1_128_B_16_ld_128_128_978,Gemm_Rocblas_6379,0.037902
GemmStridedBatchedTunableOp_float_TN,tn_54_1_64_B_8_ld_512_64_54,Gemm_Rocblas_-9,0.00762237
GemmStridedBatchedTunableOp_float_TN,tn_1092_1_128_B_16_ld_128_128_1092,Gemm_Rocblas_6379,0.0396914
GemmStridedBatchedTunableOp_float_TN,tn_955_1_64_B_8_ld_512_64_955,Gemm_Hipblaslt_6376,0.0137996
GemmStridedBatchedTunableOp_float_TN,tn_532_1_64_B_8_ld_512_64_532,Gemm_Rocblas_6377,0.01002
GemmStridedBatchedTunableOp_float_TN,tn_134_1_64_B_8_ld_512_64_134,Gemm_Rocblas_6377,0.00864145
GemmStridedBatchedTunableOp_float_TN,tn_1679_1_128_B_16_ld_128_128_1679,Gemm_Hipblaslt_6376,0.049283
GemmStridedBatchedTunableOp_float_TN,tn_1104_1104_128_B_16_ld_128_2048_1104,Gemm_Hipblaslt_6377,1.94219
GemmStridedBatchedTunableOp_float_TN,tn_903_1_64_B_8_ld_512_64_903,Gemm_Hipblaslt_6376,0.0133872
GemmStridedBatchedTunableOp_float_TN,tn_1510_1_128_B_16_ld_128_128_1510,Gemm_Hipblaslt_6376,0.0456782
GemmStridedBatchedTunableOp_float_TN,tn_219_1_64_B_8_ld_512_64_219,Gemm_Hipblaslt_6376,0.0109361
GemmStridedBatchedTunableOp_float_TN,tn_571_1_64_B_8_ld_512_64_571,Gemm_Rocblas_6377,0.0103863
GemmStridedBatchedTunableOp_float_TN,tn_574_1_64_B_8_ld_512_64_574,Gemm_Rocblas_6377,0.0100285
GemmStridedBatchedTunableOp_float_TN,tn_543_1_64_B_8_ld_512_64_543,Gemm_Hipblaslt_6376,0.00982009
GemmStridedBatchedTunableOp_float_TN,tn_812_1_64_B_8_ld_512_64_812,Gemm_Hipblaslt_6376,0.0124466
GemmStridedBatchedTunableOp_float_TN,tn_538_1_64_B_8_ld_512_64_538,Gemm_Rocblas_6377,0.00983489
GemmStridedBatchedTunableOp_float_TN,tn_1029_1_128_B_16_ld_128_128_1029,Gemm_Hipblaslt_6378,0.0384991
GemmStridedBatchedTunableOp_float_TN,tn_14_1_64_B_8_ld_512_64_14,Gemm_Rocblas_-9,0.00565139
GemmStridedBatchedTunableOp_float_TN,tn_516_1_64_B_8_ld_512_64_516,Gemm_Rocblas_6377,0.0099106
GemmStridedBatchedTunableOp_float_TN,tn_561_1_64_B_8_ld_512_64_561,Gemm_Rocblas_6377,0.00995162
GemmStridedBatchedTunableOp_float_TN,tn_537_1_64_B_8_ld_512_64_537,Gemm_Hipblaslt_6376,0.010008
GemmStridedBatchedTunableOp_float_TN,tn_847_1_64_B_8_ld_512_64_847,Gemm_Rocblas_6377,0.0126726
GemmStridedBatchedTunableOp_float_TN,tn_143_1_64_B_8_ld_512_64_143,Gemm_Hipblaslt_6376,0.0087456
GemmStridedBatchedTunableOp_float_TN,tn_375_1_64_B_8_ld_512_64_375,Gemm_Rocblas_6377,0.00871841
GemmStridedBatchedTunableOp_float_TN,tn_239_239_128_B_16_ld_128_2048_239,Gemm_Hipblaslt_6377,0.113752
GemmStridedBatchedTunableOp_float_TN,tn_143_1_128_B_16_ld_128_128_143,Gemm_Hipblaslt_6376,0.0110031
GemmStridedBatchedTunableOp_float_TN,tn_123_1_64_B_8_ld_512_64_123,Gemm_Rocblas_6379,0.00865707
GemmStridedBatchedTunableOp_float_TN,tn_1027_1_128_B_16_ld_128_128_1027,Gemm_Hipblaslt_6378,0.0383408
GemmStridedBatchedTunableOp_float_TN,tn_841_1_128_B_16_ld_128_128_841,Gemm_Hipblaslt_6378,0.0368312
GemmStridedBatchedTunableOp_float_TN,tn_325_1_64_B_8_ld_512_64_325,Gemm_Hipblaslt_6376,0.00905226
GemmStridedBatchedTunableOp_float_TN,tn_1017_1_64_B_8_ld_512_64_1017,Gemm_Rocblas_6377,0.0141225
GemmStridedBatchedTunableOp_float_TN,tn_573_1_64_B_8_ld_512_64_573,Gemm_Hipblaslt_6376,0.0100397
GemmStridedBatchedTunableOp_float_TN,tn_991_1_128_B_16_ld_128_128_991,Gemm_Rocblas_6379,0.0375771
GemmStridedBatchedTunableOp_float_TN,tn_804_1_64_B_8_ld_512_64_804,Gemm_Hipblaslt_6376,0.0123436
GemmStridedBatchedTunableOp_float_TN,tn_302_1_64_B_8_ld_512_64_302,Gemm_Hipblaslt_6376,0.0089897
GemmStridedBatchedTunableOp_float_TN,tn_433_1_64_B_8_ld_512_64_433,Gemm_Rocblas_6377,0.00916044
GemmStridedBatchedTunableOp_float_TN,tn_921_1_128_B_16_ld_128_128_921,Gemm_Hipblaslt_6378,0.0377041
GemmStridedBatchedTunableOp_float_TN,tn_83_1_64_B_8_ld_512_64_83,Gemm_Hipblaslt_6378,0.00863058
GemmStridedBatchedTunableOp_float_TN,tn_451_1_64_B_8_ld_512_64_451,Gemm_Rocblas_6377,0.00960965
GemmStridedBatchedTunableOp_float_TN,tn_437_1_128_B_16_ld_128_128_437,Gemm_Rocblas_6377,0.018958
GemmStridedBatchedTunableOp_float_TN,tn_40_1_64_B_8_ld_512_64_40,Gemm_Rocblas_-9,0.0081417
GemmStridedBatchedTunableOp_float_TN,tn_1231_1_128_B_16_ld_128_128_1231,Gemm_Rocblas_6379,0.042822
GemmStridedBatchedTunableOp_float_TN,tn_159_1_128_B_16_ld_128_128_159,Gemm_Rocblas_6379,0.0114479
GemmStridedBatchedTunableOp_float_TN,tn_161_1_64_B_8_ld_512_64_161,Gemm_Hipblaslt_6378,0.00869144
GemmStridedBatchedTunableOp_float_TN,tn_1497_1_128_B_16_ld_128_128_1497,Gemm_Hipblaslt_6376,0.0464168
GemmStridedBatchedTunableOp_float_TN,tn_547_1_64_B_8_ld_512_64_547,Gemm_Hipblaslt_6376,0.00992917
GemmStridedBatchedTunableOp_float_TN,tn_995_1_64_B_8_ld_512_64_995,Gemm_Hipblaslt_6376,0.0138207
GemmStridedBatchedTunableOp_float_TN,tn_567_1_64_B_8_ld_512_64_567,Gemm_Rocblas_6377,0.0103102
GemmStridedBatchedTunableOp_float_TN,tn_1417_1_128_B_16_ld_128_128_1417,Gemm_Hipblaslt_6376,0.044337
GemmStridedBatchedTunableOp_float_TN,tn_534_1_64_B_8_ld_512_64_534,Gemm_Rocblas_6377,0.00993434
GemmStridedBatchedTunableOp_float_TN,tn_167_1_64_B_8_ld_512_64_167,Gemm_Rocblas_6379,0.00872321
GemmStridedBatchedTunableOp_float_TN,tn_1089_1_128_B_16_ld_128_128_1089,Gemm_Rocblas_6379,0.0396501
GemmStridedBatchedTunableOp_float_TN,tn_1208_1_128_B_16_ld_128_128_1208,Gemm_Rocblas_6379,0.0421171
GemmStridedBatchedTunableOp_float_TN,tn_890_1_64_B_8_ld_512_64_890,Gemm_Rocblas_6377,0.0131559
GemmStridedBatchedTunableOp_float_TN,tn_728_1_128_B_16_ld_128_128_728,Gemm_Hipblaslt_6378,0.0335752
GemmStridedBatchedTunableOp_float_TN,tn_1637_1_128_B_16_ld_128_128_1637,Gemm_Hipblaslt_6376,0.0493563
GemmStridedBatchedTunableOp_float_TN,tn_1119_1119_128_B_16_ld_128_2048_1119,Gemm_Rocblas_6378,2.02019
GemmStridedBatchedTunableOp_float_TN,tn_554_1_64_B_8_ld_512_64_554,Gemm_Hipblaslt_6376,0.0101411
GemmStridedBatchedTunableOp_float_TN,tn_1618_1_128_B_16_ld_128_128_1618,Gemm_Hipblaslt_6376,0.0489804
GemmStridedBatchedTunableOp_float_TN,tn_185_1_64_B_8_ld_512_64_185,Gemm_Rocblas_6379,0.00879214
GemmStridedBatchedTunableOp_float_TN,tn_876_1_64_B_8_ld_512_64_876,Gemm_Hipblaslt_6376,0.0127784
GemmStridedBatchedTunableOp_float_TN,tn_588_1_64_B_8_ld_512_64_588,Gemm_Rocblas_6377,0.0103823
GemmStridedBatchedTunableOp_float_TN,tn_12_1_64_B_8_ld_512_64_12,Gemm_Rocblas_-9,0.00569949
GemmStridedBatchedTunableOp_float_TN,tn_200_1_64_B_8_ld_512_64_200,Gemm_Rocblas_6379,0.00874244
GemmStridedBatchedTunableOp_float_TN,tn_125_1_64_B_8_ld_512_64_125,Gemm_Rocblas_6377,0.00871601
GemmStridedBatchedTunableOp_float_TN,tn_928_1_64_B_8_ld_512_64_928,Gemm_Rocblas_6377,0.0128962
GemmStridedBatchedTunableOp_float_TN,tn_1030_1_128_B_16_ld_128_128_1030,Gemm_Rocblas_6379,0.0388643
GemmStridedBatchedTunableOp_float_TN,tn_385_1_64_B_8_ld_512_64_385,Gemm_Hipblaslt_6376,0.00923253
GemmStridedBatchedTunableOp_float_TN,tn_43_1_64_B_8_ld_512_64_43,Gemm_Rocblas_-9,0.00715502
GemmStridedBatchedTunableOp_float_TN,tn_801_1_64_B_8_ld_512_64_801,Gemm_Rocblas_6377,0.0123829
GemmStridedBatchedTunableOp_float_TN,tn_555_1_64_B_8_ld_512_64_555,Gemm_Hipblaslt_6376,0.00987705
GemmStridedBatchedTunableOp_float_TN,tn_11_1_64_B_8_ld_512_64_11,Gemm_Rocblas_-9,0.0056077
GemmStridedBatchedTunableOp_float_TN,tn_629_1_64_B_8_ld_512_64_629,Gemm_Rocblas_6377,0.0107623
GemmStridedBatchedTunableOp_float_TN,tn_940_1_128_B_16_ld_128_128_940,Gemm_Hipblaslt_6378,0.0338632
GemmStridedBatchedTunableOp_float_TN,tn_852_1_64_B_8_ld_512_64_852,Gemm_Rocblas_6377,0.0127159
GemmStridedBatchedTunableOp_float_TN,tn_617_1_64_B_8_ld_512_64_617,Gemm_Rocblas_6377,0.0107858
GemmStridedBatchedTunableOp_float_TN,tn_1034_1_128_B_16_ld_128_128_1034,Gemm_Rocblas_6379,0.038835
GemmStridedBatchedTunableOp_float_TN,tn_856_1_128_B_16_ld_128_128_856,Gemm_Hipblaslt_6378,0.0354523
GemmStridedBatchedTunableOp_float_TN,tn_539_1_64_B_8_ld_512_64_539,Gemm_Rocblas_6377,0.0101503
GemmStridedBatchedTunableOp_float_TN,tn_589_1_64_B_8_ld_512_64_589,Gemm_Rocblas_6377,0.0103976
GemmStridedBatchedTunableOp_float_TN,tn_862_862_128_B_16_ld_128_2048_862,Default,1.19641
GemmStridedBatchedTunableOp_float_TN,tn_714_1_64_B_8_ld_512_64_714,Gemm_Hipblaslt_6376,0.0114736
GemmStridedBatchedTunableOp_float_TN,tn_1015_1_64_B_8_ld_512_64_1015,Gemm_Rocblas_6377,0.0139995
GemmStridedBatchedTunableOp_float_TN,tn_303_1_64_B_8_ld_512_64_303,Gemm_Rocblas_6377,0.00899373
GemmStridedBatchedTunableOp_float_TN,tn_342_1_64_B_8_ld_512_64_342,Gemm_Rocblas_6377,0.00877969
GemmStridedBatchedTunableOp_float_TN,tn_1276_1_128_B_16_ld_128_128_1276,Gemm_Rocblas_6377,0.0428898
GemmStridedBatchedTunableOp_float_TN,tn_862_1_128_B_16_ld_128_128_862,Gemm_Hipblaslt_6378,0.0365053
GemmStridedBatchedTunableOp_float_TN,tn_1308_1_128_B_16_ld_128_128_1308,Gemm_Hipblaslt_6376,0.043325
GemmStridedBatchedTunableOp_float_TN,tn_128_1_64_B_8_ld_512_64_128,Gemm_Rocblas_6379,0.00870243
GemmStridedBatchedTunableOp_float_TN,tn_582_1_64_B_8_ld_512_64_582,Gemm_Hipblaslt_6376,0.0100581
GemmStridedBatchedTunableOp_float_TN,tn_805_1_64_B_8_ld_512_64_805,Gemm_Hipblaslt_6376,0.0123035
GemmStridedBatchedTunableOp_float_TN,tn_830_1_64_B_8_ld_512_64_830,Gemm_Hipblaslt_6376,0.0125268
GemmStridedBatchedTunableOp_float_TN,tn_1070_1_128_B_16_ld_128_128_1070,Gemm_Rocblas_6379,0.0392562
GemmStridedBatchedTunableOp_float_TN,tn_212_1_64_B_8_ld_512_64_212,Gemm_Hipblaslt_6378,0.00889925
GemmStridedBatchedTunableOp_float_TN,tn_154_1_64_B_8_ld_512_64_154,Gemm_Hipblaslt_6378,0.00874283
GemmStridedBatchedTunableOp_float_TN,tn_550_1_64_B_8_ld_512_64_550,Gemm_Rocblas_6377,0.0101531
GemmStridedBatchedTunableOp_float_TN,tn_770_1_64_B_8_ld_512_64_770,Gemm_Hipblaslt_6376,0.0120226
GemmStridedBatchedTunableOp_float_TN,tn_402_1_128_B_16_ld_128_128_402,Gemm_Hipblaslt_6376,0.0180828
GemmStridedBatchedTunableOp_float_TN,tn_178_1_64_B_8_ld_512_64_178,Gemm_Hipblaslt_6378,0.00880937
GemmStridedBatchedTunableOp_float_TN,tn_1670_1_128_B_16_ld_128_128_1670,Gemm_Hipblaslt_6376,0.0495239
GemmStridedBatchedTunableOp_float_TN,tn_34_1_64_B_8_ld_512_64_34,Gemm_Rocblas_-9,0.00682162
GemmStridedBatchedTunableOp_float_TN,tn_871_1_128_B_16_ld_128_128_871,Gemm_Rocblas_6379,0.0366036
GemmStridedBatchedTunableOp_float_TN,tn_202_1_64_B_8_ld_512_64_202,Gemm_Rocblas_6379,0.00843029
GemmStridedBatchedTunableOp_float_TN,tn_440_1_128_B_16_ld_128_128_440,Gemm_Hipblaslt_6376,0.0176896
GemmStridedBatchedTunableOp_float_TN,tn_799_1_128_B_16_ld_128_128_799,Gemm_Rocblas_6379,0.0354838
GemmStridedBatchedTunableOp_float_TN,tn_906_1_64_B_8_ld_512_64_906,Gemm_Hipblaslt_6376,0.0132321
GemmStridedBatchedTunableOp_float_TN,tn_526_1_128_B_16_ld_128_128_526,Gemm_Rocblas_6377,0.0210351
GemmStridedBatchedTunableOp_float_TN,tn_785_1_64_B_8_ld_512_64_785,Gemm_Hipblaslt_6376,0.012106
GemmStridedBatchedTunableOp_float_TN,tn_330_1_64_B_8_ld_512_64_330,Gemm_Rocblas_6377,0.00867633
GemmStridedBatchedTunableOp_float_TN,tn_477_1_64_B_8_ld_512_64_477,Gemm_Hipblaslt_6376,0.0094157
GemmStridedBatchedTunableOp_float_TN,tn_818_1_64_B_8_ld_512_64_818,Gemm_Rocblas_6377,0.0125123
GemmStridedBatchedTunableOp_float_TN,tn_871_1_64_B_8_ld_512_64_871,Gemm_Hipblaslt_6376,0.0129282
GemmStridedBatchedTunableOp_float_TN,tn_25_1_64_B_8_ld_512_64_25,Gemm_Rocblas_-9,0.00644487
GemmStridedBatchedTunableOp_float_TN,tn_1156_1_128_B_16_ld_128_128_1156,Gemm_Rocblas_6379,0.0412323
GemmStridedBatchedTunableOp_float_TN,tn_1398_1_128_B_16_ld_128_128_1398,Gemm_Hipblaslt_6376,0.0455633
GemmStridedBatchedTunableOp_float_TN,tn_658_1_64_B_8_ld_512_64_658,Gemm_Hipblaslt_6376,0.0109447
GemmStridedBatchedTunableOp_float_TN,tn_198_1_64_B_8_ld_512_64_198,Gemm_Hipblaslt_6378,0.00850281
GemmStridedBatchedTunableOp_float_TN,tn_787_1_64_B_8_ld_512_64_787,Gemm_Hipblaslt_6376,0.0122209
GemmStridedBatchedTunableOp_float_TN,tn_768_1_128_B_16_ld_128_128_768,Gemm_Rocblas_6379,0.034203
GemmStridedBatchedTunableOp_float_TN,tn_964_1_64_B_8_ld_512_64_964,Gemm_Rocblas_6377,0.0136986
GemmStridedBatchedTunableOp_float_TN,tn_322_1_128_B_16_ld_128_128_322,Gemm_Hipblaslt_6376,0.01598
GemmStridedBatchedTunableOp_float_TN,tn_1009_1_64_B_8_ld_512_64_1009,Gemm_Rocblas_6377,0.0141354
GemmStridedBatchedTunableOp_float_TN,tn_166_1_64_B_8_ld_512_64_166,Gemm_Hipblaslt_6378,0.0087773
GemmStridedBatchedTunableOp_float_TN,tn_1689_1_128_B_16_ld_128_128_1689,Gemm_Hipblaslt_6376,0.0511577
GemmStridedBatchedTunableOp_float_TN,tn_28_1_64_B_8_ld_512_64_28,Gemm_Rocblas_-9,0.00653988
GemmStridedBatchedTunableOp_float_TN,tn_806_1_128_B_16_ld_128_128_806,Gemm_Hipblaslt_6378,0.0353333
GemmStridedBatchedTunableOp_float_TN,tn_566_1_64_B_8_ld_512_64_566,Gemm_Hipblaslt_6376,0.010258
GemmStridedBatchedTunableOp_float_TN,tn_828_1_64_B_8_ld_512_64_828,Gemm_Rocblas_6377,0.0125877
GemmStridedBatchedTunableOp_float_TN,tn_928_1_128_B_16_ld_128_128_928,Gemm_Hipblaslt_6378,0.0364013
GemmStridedBatchedTunableOp_float_TN,tn_196_1_64_B_8_ld_512_64_196,Gemm_Hipblaslt_6378,0.00883702
GemmStridedBatchedTunableOp_float_TN,tn_428_1_128_B_16_ld_128_128_428,Gemm_Hipblaslt_6376,0.018449
GemmStridedBatchedTunableOp_float_TN,tn_153_1_128_B_16_ld_128_128_153,Gemm_Rocblas_6379,0.0113437
GemmStridedBatchedTunableOp_float_TN,tn_435_1_64_B_8_ld_512_64_435,Gemm_Hipblaslt_6376,0.00943852
GemmStridedBatchedTunableOp_float_TN,tn_1147_1_128_B_16_ld_128_128_1147,Gemm_Hipblaslt_6378,0.041268
GemmStridedBatchedTunableOp_float_TN,tn_1047_1_128_B_16_ld_128_128_1047,Gemm_Hipblaslt_6378,0.0391051
GemmStridedBatchedTunableOp_float_TN,tn_687_1_64_B_8_ld_512_64_687,Gemm_Hipblaslt_6376,0.0111377
GemmStridedBatchedTunableOp_float_TN,tn_1305_1_128_B_16_ld_128_128_1305,Gemm_Hipblaslt_6376,0.0444952
GemmStridedBatchedTunableOp_float_TN,tn_170_1_64_B_8_ld_512_64_170,Gemm_Hipblaslt_6378,0.00869589
GemmStridedBatchedTunableOp_float_TN,tn_168_1_64_B_8_ld_512_64_168,Gemm_Hipblaslt_6378,0.00834406
GemmStridedBatchedTunableOp_float_TN,tn_1189_1_128_B_16_ld_128_128_1189,Gemm_Hipblaslt_6378,0.041956
GemmStridedBatchedTunableOp_float_TN,tn_560_1_64_B_8_ld_512_64_560,Gemm_Rocblas_6377,0.0098213
GemmStridedBatchedTunableOp_float_TN,tn_118_1_64_B_8_ld_512_64_118,Gemm_Rocblas_6379,0.0087028
GemmStridedBatchedTunableOp_float_TN,tn_450_1_64_B_8_ld_512_64_450,Gemm_Hipblaslt_6376,0.00916409
GemmStridedBatchedTunableOp_float_TN,tn_240_1_128_B_16_ld_128_128_240,Gemm_Hipblaslt_6376,0.0129684
GemmStridedBatchedTunableOp_float_TN,tn_562_1_64_B_8_ld_512_64_562,Gemm_Hipblaslt_6376,0.0102777
GemmStridedBatchedTunableOp_float_TN,tn_1263_1_128_B_16_ld_128_128_1263,Gemm_Hipblaslt_6378,0.0439125
GemmStridedBatchedTunableOp_float_TN,tn_352_1_64_B_8_ld_512_64_352,Gemm_Rocblas_6377,0.00870152
GemmStridedBatchedTunableOp_float_TN,tn_672_1_128_B_16_ld_128_128_672,Gemm_Hipblaslt_6378,0.0306375
GemmStridedBatchedTunableOp_float_TN,tn_962_1_128_B_16_ld_128_128_962,Gemm_Hipblaslt_6378,0.0375614
GemmStridedBatchedTunableOp_float_TN,tn_546_1_64_B_8_ld_512_64_546,Gemm_Hipblaslt_6376,0.00986134
GemmStridedBatchedTunableOp_float_TN,tn_748_1_128_B_16_ld_128_128_748,Gemm_Rocblas_6379,0.0354238
GemmStridedBatchedTunableOp_float_TN,tn_886_1_64_B_8_ld_512_64_886,Gemm_Rocblas_6377,0.0130946
GemmStridedBatchedTunableOp_float_TN,tn_409_1_64_B_8_ld_512_64_409,Gemm_Hipblaslt_6376,0.00896324
GemmStridedBatchedTunableOp_float_TN,tn_1148_1_128_B_16_ld_128_128_1148,Gemm_Rocblas_6377,0.0398097
GemmStridedBatchedTunableOp_float_TN,tn_568_1_64_B_8_ld_512_64_568,Gemm_Hipblaslt_6376,0.0101078
GemmStridedBatchedTunableOp_float_TN,tn_335_1_64_B_8_ld_512_64_335,Gemm_Rocblas_6377,0.00870675
GemmStridedBatchedTunableOp_float_TN,tn_585_1_64_B_8_ld_512_64_585,Gemm_Rocblas_6377,0.0104753
GemmStridedBatchedTunableOp_float_TN,tn_541_1_64_B_8_ld_512_64_541,Gemm_Hipblaslt_6376,0.0101207
GemmStridedBatchedTunableOp_float_TN,tn_371_1_64_B_8_ld_512_64_371,Gemm_Rocblas_6377,0.00911915
GemmStridedBatchedTunableOp_float_TN,tn_151_1_64_B_8_ld_512_64_151,Gemm_Rocblas_6377,0.00875207
GemmStridedBatchedTunableOp_float_TN,tn_404_1_64_B_8_ld_512_64_404,Gemm_Rocblas_6377,0.00895323
GemmStridedBatchedTunableOp_float_TN,tn_638_1_128_B_16_ld_128_128_638,Gemm_Rocblas_6379,0.0264717
GemmStridedBatchedTunableOp_float_TN,tn_405_1_64_B_8_ld_512_64_405,Gemm_Rocblas_6377,0.00901738
GemmStridedBatchedTunableOp_float_TN,tn_726_1_64_B_8_ld_512_64_726,Gemm_Hipblaslt_6376,0.0116839
GemmStridedBatchedTunableOp_float_TN,tn_305_1_64_B_8_ld_512_64_305,Gemm_Rocblas_6377,0.00867592
GemmStridedBatchedTunableOp_float_TN,tn_2007_1_128_B_16_ld_128_128_2007,Gemm_Hipblaslt_6376,0.0577959
GemmStridedBatchedTunableOp_float_TN,tn_802_1_64_B_8_ld_512_64_802,Gemm_Hipblaslt_6376,0.0123604
GemmStridedBatchedTunableOp_float_TN,tn_140_1_64_B_8_ld_512_64_140,Gemm_Hipblaslt_6378,0.00865112
GemmStridedBatchedTunableOp_float_TN,tn_987_1_128_B_16_ld_128_128_987,Gemm_Rocblas_6379,0.0374456
GemmStridedBatchedTunableOp_float_TN,tn_716_1_64_B_8_ld_512_64_716,Gemm_Rocblas_6377,0.0114988
GemmStridedBatchedTunableOp_float_TN,tn_5_1_64_B_8_ld_512_64_5,Gemm_Rocblas_-9,0.00592425
GemmStridedBatchedTunableOp_float_TN,tn_672_1_64_B_8_ld_512_64_672,Gemm_Rocblas_6377,0.0109534
GemmStridedBatchedTunableOp_float_TN,tn_139_1_64_B_8_ld_512_64_139,Gemm_Hipblaslt_6376,0.00874009
GemmStridedBatchedTunableOp_float_TN,tn_238_1_64_B_8_ld_512_64_238,Gemm_Rocblas_6379,0.00874856
GemmStridedBatchedTunableOp_float_TN,tn_781_1_128_B_16_ld_128_128_781,Gemm_Rocblas_6379,0.0357785
GemmStridedBatchedTunableOp_float_TN,tn_918_1_64_B_8_ld_512_64_918,Gemm_Rocblas_6377,0.0132954
GemmStridedBatchedTunableOp_float_TN,tn_1362_1_128_B_16_ld_128_128_1362,Gemm_Hipblaslt_6376,0.0445738
GemmStridedBatchedTunableOp_float_TN,tn_559_1_64_B_8_ld_512_64_559,Gemm_Rocblas_6377,0.0102312
GemmStridedBatchedTunableOp_float_TN,tn_146_1_64_B_8_ld_512_64_146,Gemm_Hipblaslt_6378,0.00845387
GemmStridedBatchedTunableOp_float_TN,tn_1141_1_128_B_16_ld_128_128_1141,Gemm_Rocblas_6379,0.0409794
GemmStridedBatchedTunableOp_float_TN,tn_8_1_64_B_8_ld_512_64_8,Gemm_Rocblas_-9,0.00563186
GemmStridedBatchedTunableOp_float_TN,tn_829_1_64_B_8_ld_512_64_829,Gemm_Hipblaslt_6376,0.0126061
GemmStridedBatchedTunableOp_float_TN,tn_151_1_128_B_16_ld_128_128_151,Gemm_Rocblas_6377,0.0112139
GemmStridedBatchedTunableOp_float_TN,tn_1165_1_128_B_16_ld_128_128_1165,Gemm_Hipblaslt_6378,0.0412644
GemmStridedBatchedTunableOp_float_TN,tn_720_1_128_B_16_ld_128_128_720,Gemm_Hipblaslt_6378,0.0334321
GemmStridedBatchedTunableOp_float_TN,tn_976_1_64_B_8_ld_512_64_976,Gemm_Rocblas_6377,0.0138681
GemmStridedBatchedTunableOp_float_TN,tn_652_1_64_B_8_ld_512_64_652,Gemm_Rocblas_6377,0.0109105
GemmStridedBatchedTunableOp_float_TN,tn_948_1_64_B_8_ld_512_64_948,Gemm_Rocblas_6377,0.0136135
GemmStridedBatchedTunableOp_float_TN,tn_1200_1200_128_B_16_ld_128_2048_1200,Gemm_Rocblas_6378,2.22998
GemmStridedBatchedTunableOp_float_TN,tn_861_1_64_B_8_ld_512_64_861,Gemm_Hipblaslt_6376,0.0126365
GemmStridedBatchedTunableOp_float_TN,tn_253_1_128_B_16_ld_128_128_253,Gemm_Rocblas_6377,0.0140011
GemmStridedBatchedTunableOp_float_TN,tn_135_1_64_B_8_ld_512_64_135,Gemm_Rocblas_6379,0.00872643
GemmStridedBatchedTunableOp_float_TN,tn_1166_1_128_B_16_ld_128_128_1166,Gemm_Hipblaslt_6378,0.0413646
GemmStridedBatchedTunableOp_float_TN,tn_2022_1_128_B_16_ld_128_128_2022,Gemm_Hipblaslt_6376,0.0568809
GemmStridedBatchedTunableOp_float_TN,tn_276_1_128_B_16_ld_128_128_276,Gemm_Hipblaslt_6376,0.0147674
GemmStridedBatchedTunableOp_float_TN,tn_888_1_64_B_8_ld_512_64_888,Gemm_Rocblas_6377,0.013014
GemmStridedBatchedTunableOp_float_TN,tn_204_1_64_B_8_ld_512_64_204,Gemm_Rocblas_6379,0.00875125
GemmStridedBatchedTunableOp_float_TN,tn_1020_1_64_B_8_ld_512_64_1020,Gemm_Hipblaslt_6376,0.0140328
GemmStridedBatchedTunableOp_float_TN,tn_427_1_64_B_8_ld_512_64_427,Gemm_Rocblas_6377,0.00904502
GemmStridedBatchedTunableOp_float_TN,tn_398_1_64_B_8_ld_512_64_398,Gemm_Hipblaslt_6376,0.00896677
GemmStridedBatchedTunableOp_float_TN,tn_558_1_64_B_8_ld_512_64_558,Gemm_Rocblas_6377,0.0102036
GemmStridedBatchedTunableOp_float_TN,tn_544_1_64_B_8_ld_512_64_544,Gemm_Rocblas_6377,0.0101495
GemmStridedBatchedTunableOp_float_TN,tn_639_1_64_B_8_ld_512_64_639,Gemm_Hipblaslt_6376,0.0108432
GemmStridedBatchedTunableOp_float_TN,tn_1218_1_128_B_16_ld_128_128_1218,Gemm_Hipblaslt_6378,0.0426666
GemmStridedBatchedTunableOp_float_TN,tn_478_1_128_B_16_ld_128_128_478,Gemm_Hipblaslt_6376,0.0197976
GemmStridedBatchedTunableOp_float_TN,tn_755_1_64_B_8_ld_512_64_755,Gemm_Rocblas_6377,0.0119846
GemmStridedBatchedTunableOp_float_TN,tn_798_1_64_B_8_ld_512_64_798,Gemm_Hipblaslt_6376,0.0117822
GemmStridedBatchedTunableOp_float_TN,tn_593_1_64_B_8_ld_512_64_593,Gemm_Rocblas_6377,0.0105422
GemmStridedBatchedTunableOp_float_TN,tn_891_1_128_B_16_ld_128_128_891,Gemm_Hipblaslt_6378,0.036723
GemmStridedBatchedTunableOp_float_TN,tn_1036_1_128_B_16_ld_128_128_1036,Gemm_Rocblas_6379,0.0391352
GemmStridedBatchedTunableOp_float_TN,tn_1110_1_128_B_16_ld_128_128_1110,Gemm_Rocblas_6379,0.040295
GemmStridedBatchedTunableOp_float_TN,tn_431_1_128_B_16_ld_128_128_431,Gemm_Hipblaslt_6376,0.0184379
GemmStridedBatchedTunableOp_float_TN,tn_1428_1_128_B_16_ld_128_128_1428,Gemm_Hipblaslt_6376,0.0441498
GemmStridedBatchedTunableOp_float_TN,tn_1365_1_128_B_16_ld_128_128_1365,Gemm_Hipblaslt_6376,0.0425283
GemmStridedBatchedTunableOp_float_TN,tn_257_1_64_B_8_ld_512_64_257,Gemm_Hipblaslt_6377,0.0101451
GemmStridedBatchedTunableOp_float_TN,tn_689_1_64_B_8_ld_512_64_689,Gemm_Hipblaslt_6376,0.0111205
GemmStridedBatchedTunableOp_float_TN,tn_1001_1_64_B_8_ld_512_64_1001,Gemm_Rocblas_6377,0.0139178
GemmStridedBatchedTunableOp_float_TN,tn_446_1_64_B_8_ld_512_64_446,Gemm_Rocblas_6377,0.0095724
GemmStridedBatchedTunableOp_float_TN,tn_187_1_64_B_8_ld_512_64_187,Gemm_Hipblaslt_6378,0.00872121
GemmStridedBatchedTunableOp_float_TN,tn_317_1_64_B_8_ld_512_64_317,Gemm_Rocblas_6377,0.00875685
GemmStridedBatchedTunableOp_float_TN,tn_635_1_128_B_16_ld_128_128_635,Gemm_Rocblas_6379,0.0264878
GemmStridedBatchedTunableOp_float_TN,tn_1397_1_128_B_16_ld_128_128_1397,Gemm_Hipblaslt_6378,0.044928
GemmStridedBatchedTunableOp_float_TN,tn_510_1_64_B_8_ld_512_64_510,Gemm_Hipblaslt_6376,0.00963849
GemmStridedBatchedTunableOp_float_TN,tn_883_1_128_B_16_ld_128_128_883,Gemm_Rocblas_6379,0.0369919
GemmStridedBatchedTunableOp_float_TN,tn_42_1_64_B_8_ld_512_64_42,Gemm_Rocblas_-9,0.00727293
GemmStridedBatchedTunableOp_float_TN,tn_77_1_64_B_8_ld_512_64_77,Gemm_Hipblaslt_6378,0.00824822
GemmStridedBatchedTunableOp_float_TN,tn_222_1_64_B_8_ld_512_64_222,Gemm_Hipblaslt_6376,0.00888311
GemmStridedBatchedTunableOp_float_TN,tn_229_1_128_B_16_ld_128_128_229,Gemm_Hipblaslt_6376,0.0133336
GemmStridedBatchedTunableOp_float_TN,tn_337_1_64_B_8_ld_512_64_337,Gemm_Rocblas_6377,0.00901052
GemmStridedBatchedTunableOp_float_TN,tn_697_1_128_B_16_ld_128_128_697,Gemm_Hipblaslt_6378,0.0328649
GemmStridedBatchedTunableOp_float_TN,tn_549_1_64_B_8_ld_512_64_549,Gemm_Hipblaslt_6376,0.0102004
GemmStridedBatchedTunableOp_float_TN,tn_416_1_64_B_8_ld_512_64_416,Gemm_Rocblas_6377,0.00895211
GemmStridedBatchedTunableOp_float_TN,tn_1106_1_128_B_16_ld_128_128_1106,Gemm_Rocblas_6379,0.0398674
GemmStridedBatchedTunableOp_float_TN,tn_175_1_128_B_16_ld_128_128_175,Gemm_Hipblaslt_6376,0.0114443
GemmStridedBatchedTunableOp_float_TN,tn_57_1_64_B_8_ld_512_64_57,Gemm_Rocblas_-9,0.00754854
GemmStridedBatchedTunableOp_float_TN,tn_1224_1_128_B_16_ld_128_128_1224,Gemm_Rocblas_6379,0.042582
GemmStridedBatchedTunableOp_float_TN,tn_375_1_128_B_16_ld_128_128_375,Gemm_Rocblas_6377,0.0172292
GemmStridedBatchedTunableOp_float_TN,tn_894_1_64_B_8_ld_512_64_894,Gemm_Hipblaslt_6376,0.0132008
GemmStridedBatchedTunableOp_float_TN,tn_831_1_64_B_8_ld_512_64_831,Gemm_Hipblaslt_6376,0.0119974
GemmStridedBatchedTunableOp_float_TN,tn_349_1_128_B_16_ld_128_128_349,Gemm_Rocblas_6377,0.0166252
GemmStridedBatchedTunableOp_float_TN,tn_278_1_64_B_8_ld_512_64_278,Gemm_Hipblaslt_6376,0.0090025
GemmStridedBatchedTunableOp_float_TN,tn_978_1_64_B_8_ld_512_64_978,Gemm_Rocblas_6377,0.0138364
GemmStridedBatchedTunableOp_float_TN,tn_247_1_64_B_8_ld_512_64_247,Gemm_Rocblas_6377,0.00964121
GemmStridedBatchedTunableOp_float_TN,tn_237_1_64_B_8_ld_512_64_237,Gemm_Hipblaslt_6376,0.00875964
GemmStridedBatchedTunableOp_float_TN,tn_462_1_128_B_16_ld_128_128_462,Gemm_Rocblas_6377,0.0194389
GemmStridedBatchedTunableOp_float_TN,tn_1129_1_128_B_16_ld_128_128_1129,Gemm_Rocblas_6379,0.0405883
GemmStridedBatchedTunableOp_float_TN,tn_824_1_64_B_8_ld_512_64_824,Gemm_Hipblaslt_6376,0.0124133
GemmStridedBatchedTunableOp_float_TN,tn_271_1_64_B_8_ld_512_64_271,Gemm_Hipblaslt_6376,0.0103771
GemmStridedBatchedTunableOp_float_TN,tn_915_1_64_B_8_ld_512_64_915,Gemm_Rocblas_6377,0.0133891
GemmStridedBatchedTunableOp_float_TN,tn_373_1_128_B_16_ld_128_128_373,Gemm_Rocblas_6377,0.0171815
GemmStridedBatchedTunableOp_float_TN,tn_820_1_64_B_8_ld_512_64_820,Gemm_Rocblas_6377,0.0123577
GemmStridedBatchedTunableOp_float_TN,tn_887_1_64_B_8_ld_512_64_887,Gemm_Hipblaslt_6376,0.0129996
GemmStridedBatchedTunableOp_float_TN,tn_2026_1_128_B_16_ld_128_128_2026,Gemm_Hipblaslt_6376,0.0565951
GemmStridedBatchedTunableOp_float_TN,tn_540_1_64_B_8_ld_512_64_540,Gemm_Rocblas_6377,0.0101414
GemmStridedBatchedTunableOp_float_TN,tn_1219_1_128_B_16_ld_128_128_1219,Gemm_Hipblaslt_6378,0.0427307
GemmStridedBatchedTunableOp_float_TN,tn_1289_1_128_B_16_ld_128_128_1289,Gemm_Hipblaslt_6376,0.0440011
GemmStridedBatchedTunableOp_float_TN,tn_425_1_64_B_8_ld_512_64_425,Gemm_Rocblas_6377,0.0094646
GemmStridedBatchedTunableOp_float_TN,tn_403_1_64_B_8_ld_512_64_403,Gemm_Hipblaslt_6376,0.00926422
GemmStridedBatchedTunableOp_float_TN,tn_280_1_64_B_8_ld_512_64_280,Gemm_Hipblaslt_6376,0.00890072
GemmStridedBatchedTunableOp_float_TN,tn_2020_1_128_B_16_ld_128_128_2020,Gemm_Hipblaslt_6376,0.0563511
GemmStridedBatchedTunableOp_float_TN,tn_488_1_64_B_8_ld_512_64_488,Gemm_Rocblas_6377,0.00947934
GemmStridedBatchedTunableOp_float_TN,tn_126_1_64_B_8_ld_512_64_126,Gemm_Rocblas_6379,0.00867034
GemmStridedBatchedTunableOp_float_TN,tn_927_1_64_B_8_ld_512_64_927,Gemm_Rocblas_6377,0.0133523
GemmStridedBatchedTunableOp_float_TN,tn_965_1_128_B_16_ld_128_128_965,Gemm_Rocblas_6379,0.0374688
GemmStridedBatchedTunableOp_float_TN,tn_641_1_64_B_8_ld_512_64_641,Gemm_Rocblas_6377,0.0107915
GemmStridedBatchedTunableOp_float_TN,tn_1615_1_128_B_16_ld_128_128_1615,Gemm_Hipblaslt_6376,0.0488899
GemmStridedBatchedTunableOp_float_TN,tn_811_1_128_B_16_ld_128_128_811,Gemm_Rocblas_6379,0.0363183
GemmStridedBatchedTunableOp_float_TN,tn_404_1_128_B_16_ld_128_128_404,Gemm_Rocblas_6377,0.0180707
GemmStridedBatchedTunableOp_float_TN,tn_423_1_128_B_16_ld_128_128_423,Gemm_Hipblaslt_6376,0.0183761
GemmStridedBatchedTunableOp_float_TN,tn_523_1_64_B_8_ld_512_64_523,Gemm_Hipblaslt_6376,0.00999847
GemmStridedBatchedTunableOp_float_TN,tn_70_1_64_B_8_ld_512_64_70,Gemm_Rocblas_-9,0.00810974
GemmStridedBatchedTunableOp_float_TN,tn_156_1_64_B_8_ld_512_64_156,Gemm_Hipblaslt_6378,0.00836933
GemmStridedBatchedTunableOp_float_TN,tn_582_1_128_B_16_ld_128_128_582,Gemm_Hipblaslt_6376,0.0230437
GemmStridedBatchedTunableOp_float_TN,tn_320_1_64_B_8_ld_512_64_320,Gemm_Hipblaslt_6376,0.00906305
GemmStridedBatchedTunableOp_float_TN,tn_743_1_64_B_8_ld_512_64_743,Gemm_Hipblaslt_6376,0.0118041
GemmStridedBatchedTunableOp_float_TN,tn_242_1_64_B_8_ld_512_64_242,Gemm_Rocblas_6379,0.00942825
GemmStridedBatchedTunableOp_float_TN,tn_552_1_64_B_8_ld_512_64_552,Gemm_Hipblaslt_6376,0.00985976
GemmStridedBatchedTunableOp_float_TN,tn_186_1_128_B_16_ld_128_128_186,Gemm_Rocblas_6377,0.012185
GemmStridedBatchedTunableOp_float_TN,tn_27_1_64_B_8_ld_512_64_27,Gemm_Rocblas_-9,0.00670102
GemmStridedBatchedTunableOp_float_TN,tn_293_1_128_B_16_ld_128_128_293,Gemm_Rocblas_6377,0.0153272
GemmStridedBatchedTunableOp_float_TN,tn_64_1_64_B_8_ld_512_64_64,Gemm_Rocblas_-9,0.00814285
GemmStridedBatchedTunableOp_float_TN,tn_596_1_64_B_8_ld_512_64_596,Gemm_Rocblas_6377,0.0104352
GemmStridedBatchedTunableOp_float_TN,tn_150_1_128_B_16_ld_128_128_150,Gemm_Rocblas_6377,0.0111326
GemmStridedBatchedTunableOp_float_TN,tn_324_1_128_B_16_ld_128_128_324,Gemm_Hipblaslt_6376,0.0161251
GemmStridedBatchedTunableOp_float_TN,tn_111_1_64_B_8_ld_512_64_111,Gemm_Hipblaslt_6376,0.00865747
GemmStridedBatchedTunableOp_float_TN,tn_953_1_64_B_8_ld_512_64_953,Gemm_Rocblas_6377,0.0136593
GemmStridedBatchedTunableOp_float_TN,tn_1407_1_128_B_16_ld_128_128_1407,Gemm_Hipblaslt_6376,0.0460044
GemmStridedBatchedTunableOp_float_TN,tn_68_1_64_B_8_ld_512_64_68,Gemm_Rocblas_-9,0.00815097
GemmStridedBatchedTunableOp_float_TN,tn_304_1_64_B_8_ld_512_64_304,Gemm_Hipblaslt_6376,0.00897768
GemmStridedBatchedTunableOp_float_TN,tn_2000_1_128_B_16_ld_128_128_2000,Gemm_Hipblaslt_6376,0.0562846
GemmStridedBatchedTunableOp_float_TN,tn_452_1_128_B_16_ld_128_128_452,Gemm_Rocblas_6377,0.0192226
GemmStridedBatchedTunableOp_float_TN,tn_228_1_64_B_8_ld_512_64_228,Gemm_Rocblas_-9,0.026247
GemmStridedBatchedTunableOp_float_TN,tn_81_1_64_B_8_ld_512_64_81,Gemm_Rocblas_-9,0.00855414
GemmStridedBatchedTunableOp_float_TN,tn_283_1_64_B_8_ld_512_64_283,Gemm_Hipblaslt_6376,0.00858291
GemmStridedBatchedTunableOp_float_TN,tn_317_1_128_B_16_ld_128_128_317,Gemm_Hipblaslt_6376,0.0159055
GemmStridedBatchedTunableOp_float_TN,tn_55_1_64_B_8_ld_512_64_55,Gemm_Rocblas_-9,0.00777866
GemmStridedBatchedTunableOp_float_TN,tn_50_1_64_B_8_ld_512_64_50,Gemm_Rocblas_-9,0.00761592
GemmStridedBatchedTunableOp_float_TN,tn_708_1_64_B_8_ld_512_64_708,Gemm_Rocblas_6377,0.0112936
GemmStridedBatchedTunableOp_float_TN,tn_228_1_128_B_16_ld_128_128_228,Gemm_Rocblas_6377,0.0134056
GemmStridedBatchedTunableOp_float_TN,tn_817_1_64_B_8_ld_512_64_817,Gemm_Hipblaslt_6376,0.0125593
GemmStridedBatchedTunableOp_float_TN,tn_230_1_64_B_8_ld_512_64_230,Gemm_Hipblaslt_6376,0.00971864
GemmStridedBatchedTunableOp_float_TN,tn_643_1_64_B_8_ld_512_64_643,Gemm_Hipblaslt_6376,0.0108604
GemmStridedBatchedTunableOp_float_TN,tn_704_1_128_B_16_ld_128_128_704,Gemm_Rocblas_6379,0.0329126
GemmStridedBatchedTunableOp_float_TN,tn_1105_1105_128_B_16_ld_128_2048_1105,Gemm_Rocblas_6378,2.04997
GemmStridedBatchedTunableOp_float_TN,tn_69_1_64_B_8_ld_512_64_69,Gemm_Rocblas_-9,0.0080984
GemmStridedBatchedTunableOp_float_TN,tn_1123_1_128_B_16_ld_128_128_1123,Gemm_Rocblas_6379,0.0406058
GemmStridedBatchedTunableOp_float_TN,tn_1157_1_128_B_16_ld_128_128_1157,Gemm_Rocblas_6379,0.0411213
GemmStridedBatchedTunableOp_float_TN,tn_113_1_64_B_8_ld_512_64_113,Gemm_Rocblas_6377,0.00860334
GemmStridedBatchedTunableOp_float_TN,tn_133_1_64_B_8_ld_512_64_133,Gemm_Hipblaslt_6378,0.00832244
GemmStridedBatchedTunableOp_float_TN,tn_210_1_64_B_8_ld_512_64_210,Gemm_Rocblas_6379,0.00887668
GemmStridedBatchedTunableOp_float_TN,tn_816_1_64_B_8_ld_512_64_816,Gemm_Hipblaslt_6376,0.0123953
GemmStridedBatchedTunableOp_float_TN,tn_483_1_64_B_8_ld_512_64_483,Gemm_Rocblas_6377,0.00955633
GemmStridedBatchedTunableOp_float_TN,tn_84_1_64_B_8_ld_512_64_84,Gemm_Rocblas_6379,0.00826914
GemmStridedBatchedTunableOp_float_TN,tn_955_1_128_B_16_ld_128_128_955,Gemm_Rocblas_6379,0.0372396
GemmStridedBatchedTunableOp_float_TN,tn_698_1_64_B_8_ld_512_64_698,Gemm_Hipblaslt_6376,0.0110215
GemmStridedBatchedTunableOp_float_TN,tn_408_1_64_B_8_ld_512_64_408,Gemm_Hipblaslt_6376,0.00928663
GemmStridedBatchedTunableOp_float_TN,tn_715_1_128_B_16_ld_128_128_715,Gemm_Rocblas_6379,0.0340576
GemmStridedBatchedTunableOp_float_TN,tn_333_1_64_B_8_ld_512_64_333,Gemm_Rocblas_6379,0.00904861
GemmStridedBatchedTunableOp_float_TN,tn_885_1_128_B_16_ld_128_128_885,Gemm_Hipblaslt_6378,0.0371655
GemmStridedBatchedTunableOp_float_TN,tn_727_1_64_B_8_ld_512_64_727,Gemm_Hipblaslt_6376,0.0115657
GemmStridedBatchedTunableOp_float_TN,tn_457_1_128_B_16_ld_128_128_457,Gemm_Hipblaslt_6376,0.0187789
GemmStridedBatchedTunableOp_float_TN,tn_934_1_64_B_8_ld_512_64_934,Gemm_Rocblas_6377,0.013521
GemmStridedBatchedTunableOp_float_TN,tn_415_1_64_B_8_ld_512_64_415,Gemm_Hipblaslt_6376,0.00901255
GemmStridedBatchedTunableOp_float_TN,tn_191_1_64_B_8_ld_512_64_191,Gemm_Hipblaslt_6378,0.00839944
GemmStridedBatchedTunableOp_float_TN,tn_326_1_64_B_8_ld_512_64_326,Gemm_Rocblas_6377,0.00903658
GemmStridedBatchedTunableOp_float_TN,tn_72_1_64_B_8_ld_512_64_72,Gemm_Rocblas_-9,0.00838054
GemmStridedBatchedTunableOp_float_TN,tn_867_1_64_B_8_ld_512_64_867,Gemm_Hipblaslt_6376,0.0128309
GemmStridedBatchedTunableOp_float_TN,tn_53_1_64_B_8_ld_512_64_53,Gemm_Rocblas_-9,0.00759629
GemmStridedBatchedTunableOp_float_TN,tn_532_1_128_B_16_ld_128_128_532,Gemm_Hipblaslt_6376,0.0203439
GemmStridedBatchedTunableOp_float_TN,tn_100_1_64_B_8_ld_512_64_100,Gemm_Rocblas_6377,0.00863991
GemmStridedBatchedTunableOp_float_TN,tn_854_854_128_B_16_ld_128_2048_854,Default,1.21163
GemmStridedBatchedTunableOp_float_TN,tn_1130_1_128_B_16_ld_128_128_1130,Gemm_Hipblaslt_6378,0.0409558
GemmStridedBatchedTunableOp_float_TN,tn_813_1_64_B_8_ld_512_64_813,Gemm_Hipblaslt_6376,0.0124118
GemmStridedBatchedTunableOp_float_TN,tn_17_1_64_B_8_ld_512_64_17,Gemm_Rocblas_-9,0.00597602
GemmStridedBatchedTunableOp_float_TN,tn_1996_1_128_B_16_ld_128_128_1996,Gemm_Rocblas_6377,0.0590313
GemmStridedBatchedTunableOp_float_TN,tn_470_1_64_B_8_ld_512_64_470,Gemm_Hipblaslt_6376,0.00963932
GemmStridedBatchedTunableOp_float_TN,tn_762_1_128_B_16_ld_128_128_762,Gemm_Rocblas_6379,0.0355432
GemmStridedBatchedTunableOp_float_TN,tn_79_1_64_B_8_ld_512_64_79,Gemm_Hipblaslt_6376,0.00858696
GemmStridedBatchedTunableOp_float_TN,tn_195_1_64_B_8_ld_512_64_195,Gemm_Rocblas_6379,0.00874445
GemmStridedBatchedTunableOp_float_TN,tn_445_1_64_B_8_ld_512_64_445,Gemm_Rocblas_6377,0.00953873
GemmStridedBatchedTunableOp_float_TN,tn_717_1_64_B_8_ld_512_64_717,Gemm_Rocblas_6377,0.0115209
GemmStridedBatchedTunableOp_float_TN,tn_1381_1_128_B_16_ld_128_128_1381,Gemm_Hipblaslt_6376,0.0437422
GemmStridedBatchedTunableOp_float_TN,tn_33_1_64_B_8_ld_512_64_33,Gemm_Rocblas_-9,0.0066036
GemmStridedBatchedTunableOp_float_TN,tn_439_1_128_B_16_ld_128_128_439,Gemm_Rocblas_6377,0.0188242
GemmStridedBatchedTunableOp_float_TN,tn_905_1_64_B_8_ld_512_64_905,Gemm_Rocblas_6377,0.0132598
GemmStridedBatchedTunableOp_float_TN,tn_63_1_64_B_8_ld_512_64_63,Gemm_Rocblas_-9,0.00803505
GemmStridedBatchedTunableOp_float_TN,tn_1057_1_128_B_16_ld_128_128_1057,Gemm_Rocblas_6379,0.0391547
GemmStridedBatchedTunableOp_float_TN,tn_779_1_64_B_8_ld_512_64_779,Gemm_Rocblas_6377,0.0120326
GemmStridedBatchedTunableOp_float_TN,tn_89_1_64_B_8_ld_512_64_89,Gemm_Rocblas_6379,0.00863943
GemmStridedBatchedTunableOp_float_TN,tn_282_1_64_B_8_ld_512_64_282,Gemm_Hipblaslt_6378,0.00893438
GemmStridedBatchedTunableOp_float_TN,tn_951_1_64_B_8_ld_512_64_951,Gemm_Hipblaslt_6376,0.0135555
GemmStridedBatchedTunableOp_float_TN,tn_486_1_64_B_8_ld_512_64_486,Gemm_Hipblaslt_6376,0.00948506
GemmStridedBatchedTunableOp_float_TN,tn_540_1_128_B_16_ld_128_128_540,Gemm_Rocblas_6377,0.0214647
GemmStridedBatchedTunableOp_float_TN,tn_697_1_64_B_8_ld_512_64_697,Gemm_Rocblas_6377,0.0113136
GemmStridedBatchedTunableOp_float_TN,tn_164_1_64_B_8_ld_512_64_164,Gemm_Rocblas_6379,0.00872475
GemmStridedBatchedTunableOp_float_TN,tn_621_1_128_B_16_ld_128_128_621,Gemm_Rocblas_6379,0.0259383
GemmStridedBatchedTunableOp_float_TN,tn_119_1_64_B_8_ld_512_64_119,Gemm_Rocblas_6379,0.00860737
GemmStridedBatchedTunableOp_float_TN,tn_594_1_128_B_16_ld_128_128_594,Gemm_Rocblas_6379,0.0244904
GemmStridedBatchedTunableOp_float_TN,tn_73_1_64_B_8_ld_512_64_73,Gemm_Rocblas_-9,0.00829841
GemmStridedBatchedTunableOp_float_TN,tn_1232_1_128_B_16_ld_128_128_1232,Gemm_Hipblaslt_6378,0.041373
GemmStridedBatchedTunableOp_float_TN,tn_39_1_64_B_8_ld_512_64_39,Gemm_Rocblas_-9,0.00697873
GemmStridedBatchedTunableOp_float_TN,tn_797_1_64_B_8_ld_512_64_797,Gemm_Rocblas_6377,0.0121905
GemmStridedBatchedTunableOp_float_TN,tn_429_1_128_B_16_ld_128_128_429,Gemm_Rocblas_6377,0.0185368
GemmStridedBatchedTunableOp_float_TN,tn_456_1_64_B_8_ld_512_64_456,Gemm_Hipblaslt_6376,0.00956482
GemmStridedBatchedTunableOp_float_TN,tn_370_1_128_B_16_ld_128_128_370,Gemm_Hipblaslt_6376,0.0172492
GemmStridedBatchedTunableOp_float_TN,tn_421_1_64_B_8_ld_512_64_421,Gemm_Rocblas_6377,0.00899014
GemmStridedBatchedTunableOp_float_TN,tn_1421_1_128_B_16_ld_128_128_1421,Gemm_Hipblaslt_6376,0.0445746
GemmStridedBatchedTunableOp_float_TN,tn_1257_1_128_B_16_ld_128_128_1257,Gemm_Rocblas_6377,0.043577
GemmStridedBatchedTunableOp_float_TN,tn_2005_1_128_B_16_ld_128_128_2005,Gemm_Hipblaslt_6376,0.0574484
GemmStridedBatchedTunableOp_float_TN,tn_345_1_64_B_8_ld_512_64_345,Gemm_Rocblas_6377,0.00903533
GemmStridedBatchedTunableOp_float_TN,tn_461_1_128_B_16_ld_128_128_461,Gemm_Hipblaslt_6376,0.0194265
GemmStridedBatchedTunableOp_float_TN,tn_1531_1_128_B_16_ld_128_128_1531,Gemm_Hipblaslt_6376,0.0466027
GemmStridedBatchedTunableOp_float_TN,tn_188_1_128_B_16_ld_128_128_188,Gemm_Rocblas_6377,0.0123324
GemmStridedBatchedTunableOp_float_TN,tn_400_1_64_B_8_ld_512_64_400,Gemm_Rocblas_6377,0.00922294
