tunableop_results0.csv
Validator,PT_VERSION,2.9.1
Validator,HIP_VERSION,702
Validator,HIPBLASLT_VERSION,100201-5b515cf1bc
Validator,GCN_ARCH_NAME,gfx1151
Validator,ROCBLAS_VERSION,5.2.0.5b515cf1bc
GemmTunableOp_float_TT,tt_512_784_512_ld_512_784_512,Gemm_Rocblas_6374,0.175388
GemmTunableOp_float_TT,tt_1536_784_512_ld_512_784_1536,Gemm_Rocblas_6376,0.552386
GemmTunableOp_float_TT,tt_256_400_256_ld_256_400_256,Gemm_Hipblaslt_6373,0.0254326
GemmTunableOp_float_TT,tt_6625_212_120_ld_120_212_6625,Gemm_Rocblas_6374,0.145561
GemmTunableOp_float_TN,tn_1024_1_256_ld_256_147200_1024,Gemm_Rocblas_-9,0.0105017
GemmTunableOp_float_TN,tn_1024_1_256_ld_256_184064_1024,Gemm_Rocblas_-9,0.0105751
GemmTunableOp_float_TN,tn_1024_1_256_ld_256_122624_1024,Gemm_Rocblas_-9,0.0108104
GemmTunableOp_float_TN,tn_1024_1_256_ld_256_159488_1024,Gemm_Rocblas_-9,0.0106885
GemmTunableOp_float_TN,tn_1024_1_256_ld_256_114432_1024,Gemm_Rocblas_-9,0.0110404
GemmTunableOp_float_TN,tn_1024_1_256_ld_256_126720_1024,Gemm_Rocblas_-9,0.0108352
GemmTunableOp_float_TN,tn_1024_1_256_ld_256_171776_1024,Gemm_Rocblas_-9,0.0107679
GemmTunableOp_float_TN,tn_1024_1_256_ld_256_85760_1024,Gemm_Rocblas_-9,0.0112119
GemmTunableOp_float_TN,tn_6625_268_120_ld_120_120_6625,Gemm_Rocblas_6378,0.204694
GemmTunableOp_float_TN,tn_6625_468_120_ld_120_120_6625,Gemm_Rocblas_6378,0.336266
GemmTunableOp_float_TN,tn_1024_1_256_ld_256_106240_1024,Gemm_Rocblas_-9,0.0107827
GemmTunableOp_float_TN,tn_6625_930_120_ld_120_120_6625,Gemm_Rocblas_6378,0.672448
GemmTunableOp_float_TN,tn_192_2_576_ld_576_576_192,Gemm_Hipblaslt_6378,0.0193888
GemmTunableOp_float_TN,tn_1024_1_256_ld_256_130816_1024,Gemm_Rocblas_-9,0.0109025
GemmTunableOp_float_TN,tn_1024_1_256_ld_256_110336_1024,Gemm_Rocblas_-9,0.0107415
GemmTunableOp_float_TN,tn_1024_1_256_ld_256_118528_1024,Gemm_Rocblas_-9,0.0109615
GemmTunableOp_float_TN,tn_6625_402_120_ld_120_120_6625,Gemm_Rocblas_6378,0.300531
GemmTunableOp_float_TN,tn_1024_1_256_ld_256_151296_1024,Gemm_Rocblas_-9,0.0109041
GemmTunableOp_float_TN,tn_6625_591_120_ld_120_120_6625,Gemm_Hipblaslt_6377,0.377724
GemmTunableOp_float_TN,tn_6625_594_120_ld_120_120_6625,Gemm_Rocblas_6378,0.447915
GemmTunableOp_float_TN,tn_6625_528_120_ld_120_120_6625,Gemm_Hipblaslt_6377,0.376318
GemmTunableOp_float_TN,tn_6625_540_120_ld_120_120_6625,Gemm_Hipblaslt_6377,0.408405
GemmTunableOp_float_TN,tn_6625_745_120_ld_120_120_6625,Gemm_Rocblas_6378,0.541528
GemmTunableOp_float_TN,tn_6625_264_120_ld_120_120_6625,Gemm_Rocblas_6378,0.205306
GemmTunableOp_float_TN,tn_6625_282_120_ld_120_120_6625,Gemm_Hipblaslt_6377,0.19839
GemmTunableOp_float_TN,tn_576_1770_1536_ld_1536_1536_576,Gemm_Hipblaslt_6377,1.3195
GemmTunableOp_float_TN,tn_100352_2_576_ld_576_509760_100352,Gemm_Hipblaslt_6379,1.05075
GemmTunableOp_float_TN,tn_6625_354_120_ld_120_120_6625,Gemm_Hipblaslt_6377,0.264539
GemmTunableOp_float_TN,tn_1024_1_256_ld_256_32512_1024,Gemm_Hipblaslt_6376,0.0152928
GemmTunableOp_float_TN,tn_6625_216_120_ld_120_120_6625,Gemm_Hipblaslt_6377,0.147911
GemmTunableOp_float_TN,tn_1024_1_256_ld_256_102144_1024,Gemm_Rocblas_-9,0.0109506
GemmTunableOp_float_TN,tn_6625_342_120_ld_120_120_6625,Gemm_Rocblas_6378,0.258798
GemmTunableOp_float_TN,tn_6625_738_120_ld_120_120_6625,Gemm_Rocblas_6378,0.537821
GemmTunableOp_float_TN,tn_6625_570_120_ld_120_120_6625,Gemm_Rocblas_6378,0.415427
GemmTunableOp_float_TN,tn_1024_1_256_ld_256_98048_1024,Gemm_Rocblas_-9,0.0109939
GemmTunableOp_float_TN,tn_6625_392_120_ld_120_120_6625,Gemm_Rocblas_6378,0.289957
GemmTunableOp_float_TN,tn_1536_2_576_ld_576_576_1536,Gemm_Rocblas_6377,0.020638
GemmTunableOp_float_TN,tn_6625_462_120_ld_120_120_6625,Gemm_Hipblaslt_6377,0.346269
GemmTunableOp_float_TN,tn_1536_1770_576_ld_576_576_1536,Gemm_Rocblas_6378,1.15251
GemmTunableOp_float_TN,tn_1024_1_256_ld_256_256_1024,Gemm_Rocblas_-9,0.0111138
GemmTunableOp_float_TN,tn_6625_624_120_ld_120_120_6625,Gemm_Rocblas_6378,0.399814
GemmTunableOp_float_TN,tn_1024_1_256_ld_256_20224_1024,Gemm_Rocblas_6377,0.0139795
GemmTunableOp_float_TN,tn_6625_1050_120_ld_120_120_6625,Gemm_Rocblas_6378,0.789083
GemmTunableOp_float_TN,tn_1024_1_256_ld_256_40704_1024,Gemm_Rocblas_-9,0.0111943
GemmTunableOp_float_TN,tn_6625_252_120_ld_120_120_6625,Gemm_Rocblas_6378,0.192285
GemmTunableOp_float_TN,tn_576_1664_12288_ld_12288_12288_576,Gemm_Rocblas_6380,11.0598
GemmTunableOp_float_TN,tn_1024_1_256_ld_256_52992_1024,Gemm_Rocblas_-9,0.0108332
GemmTunableOp_float_TN,tn_6625_258_120_ld_120_120_6625,Gemm_Rocblas_6378,0.205136
GemmTunableOp_float_TN,tn_6625_246_120_ld_120_120_6625,Gemm_Hipblaslt_6377,0.187582
GemmTunableOp_float_TN,tn_1024_1_256_ld_256_36608_1024,Gemm_Rocblas_-9,0.011129
GemmTunableOp_float_TN,tn_1024_1_256_ld_256_28416_1024,Gemm_Rocblas_-9,0.010848
GemmTunableOp_float_TN,tn_6625_606_120_ld_120_120_6625,Gemm_Hipblaslt_6377,0.388809
GemmTunableOp_float_TN,tn_64_1_1_ld_1_1_1,Gemm_Hipblaslt_6376,0.00747248
GemmTunableOp_float_TN,tn_1024_1_256_ld_256_57088_1024,Gemm_Rocblas_-9,0.0160293
GemmTunableOp_float_TN,tn_576_2_576_ld_576_576_576,Gemm_Hipblaslt_6378,0.01952
GemmTunableOp_float_TN,tn_6625_384_120_ld_120_120_6625,Gemm_Hipblaslt_6377,0.252337
GemmTunableOp_float_TN,tn_1024_1_256_ld_256_77568_1024,Gemm_Rocblas_6378,0.0149461
GemmTunableOp_float_TN,tn_6625_564_120_ld_120_120_6625,Gemm_Hipblaslt_6377,0.365201
GemmTunableOp_float_TN,tn_6625_756_120_ld_120_120_6625,Gemm_Rocblas_6378,0.542847
GemmTunableOp_float_TN,tn_6625_432_120_ld_120_120_6625,Gemm_Rocblas_6378,0.317812
GemmTunableOp_float_TN,tn_6625_426_120_ld_120_120_6625,Gemm_Hipblaslt_6377,0.309359
GemmTunableOp_float_TN,tn_6625_336_120_ld_120_120_6625,Gemm_Rocblas_6378,0.249932
GemmTunableOp_float_TN,tn_1024_1_256_ld_256_48896_1024,Gemm_Rocblas_-9,0.0141535
GemmTunableOp_float_TN,tn_100352_2_576_ld_576_576_100352,Default,1.05047
GemmTunableOp_float_TN,tn_1024_1_256_ld_256_155392_1024,Gemm_Rocblas_-9,0.0107414
GemmTunableOp_float_TN,tn_1024_1_256_ld_256_81664_1024,Gemm_Rocblas_-9,0.0106813
GemmTunableOp_float_TN,tn_6625_240_120_ld_120_120_6625,Gemm_Hipblaslt_6377,0.181919
GemmTunableOp_float_TN,tn_1024_1_256_ld_256_12032_1024,Gemm_Rocblas_-9,0.0110769
GemmTunableOp_float_TN,tn_6625_372_120_ld_120_120_6625,Gemm_Rocblas_6378,0.273679
GemmTunableOp_float_TN,tn_1024_1_256_ld_256_175872_1024,Gemm_Rocblas_-9,0.0111185
GemmTunableOp_float_TN,tn_6625_864_120_ld_120_120_6625,Gemm_Hipblaslt_6377,0.550284
GemmTunableOp_float_TN,tn_6625_750_120_ld_120_120_6625,Gemm_Hipblaslt_6377,0.502833
GemmTunableOp_float_TN,tn_6625_360_120_ld_120_120_6625,Gemm_Hipblaslt_6377,0.270765
GemmTunableOp_float_TN,tn_576_2_1536_ld_1536_1536_576,Gemm_Hipblaslt_6378,0.0412773
GemmTunableOp_float_TN,tn_6625_702_120_ld_120_120_6625,Gemm_Hipblaslt_6377,0.428664
GemmTunableOp_float_TN,tn_6625_672_120_ld_120_120_6625,Gemm_Hipblaslt_6377,0.458938
GemmTunableOp_float_TN,tn_6625_444_120_ld_120_120_6625,Gemm_Hipblaslt_6377,0.338619
GemmTunableOp_float_TN,tn_6625_516_120_ld_120_120_6625,Gemm_Hipblaslt_6377,0.399361
GemmTunableOp_float_TN,tn_6625_276_120_ld_120_120_6625,Gemm_Hipblaslt_6377,0.185591
GemmTunableOp_float_TN,tn_6625_450_120_ld_120_120_6625,Gemm_Hipblaslt_6377,0.298846
GemmTunableOp_float_TN,tn_6625_306_120_ld_120_120_6625,Gemm_Rocblas_6378,0.24403
GemmTunableOp_float_TN,tn_576_1770_576_ld_576_576_576,Gemm_Rocblas_6378,0.465882
GemmTunableOp_float_TN,tn_6625_894_120_ld_120_120_6625,Gemm_Hipblaslt_6377,0.575549
GemmTunableOp_float_TN,tn_6625_330_120_ld_120_120_6625,Gemm_Rocblas_6378,0.261804
GemmTunableOp_float_TN,tn_1024_1_256_ld_256_61184_1024,Gemm_Rocblas_-9,0.0106697
GemmTunableOp_float_TN,tn_6625_780_120_ld_120_120_6625,Gemm_Rocblas_6378,0.478012
GemmTunableOp_float_TN,tn_6625_408_120_ld_120_120_6625,Gemm_Hipblaslt_6377,0.311836
GemmTunableOp_float_TN,tn_6625_786_120_ld_120_120_6625,Gemm_Rocblas_6378,0.584451
GemmTunableOp_float_TN,tn_1024_1_256_ld_256_3840_1024,Gemm_Rocblas_-9,0.0111073
GemmTunableOp_float_TN,tn_1024_1_256_ld_256_93952_1024,Gemm_Rocblas_-9,0.0105174
GemmTunableOp_float_TN,tn_1024_1_256_ld_256_7936_1024,Gemm_Rocblas_-9,0.0111215
GemmTunableOp_float_TN,tn_6625_1374_120_ld_120_120_6625,Gemm_Rocblas_6378,0.889281
GemmTunableOp_float_TN,tn_256_800_256_ld_256_256_256,Gemm_Hipblaslt_6377,0.0497111
GemmTunableOp_float_TN,tn_6625_1074_120_ld_120_120_6625,Gemm_Hipblaslt_6377,0.814986
GemmTunableOp_float_TN,tn_6625_492_120_ld_120_120_6625,Gemm_Rocblas_6378,0.333315
GemmTunableOp_float_TN,tn_6625_288_120_ld_120_120_6625,Gemm_Rocblas_6378,0.209356
GemmTunableOp_float_TN,tn_6625_576_120_ld_120_120_6625,Gemm_Hipblaslt_6377,0.423684
GemmTunableOp_float_TN,tn_6625_318_120_ld_120_120_6625,Gemm_Rocblas_6378,0.248401
GemmTunableOp_float_TN,tn_6625_396_120_ld_120_120_6625,Gemm_Rocblas_6378,0.290317
GemmTunableOp_float_TN,tn_6625_390_120_ld_120_120_6625,Gemm_Rocblas_6378,0.308698
GemmTunableOp_float_TN,tn_192_1770_576_ld_576_576_192,Gemm_Rocblas_6378,0.168377
GemmTunableOp_float_TN,tn_1024_1_256_ld_256_44800_1024,Gemm_Hipblaslt_6379,0.0162181
GemmTunableOp_float_TN,tn_6625_510_120_ld_120_120_6625,Gemm_Rocblas_6378,0.358445
GemmTunableOp_float_TN,tn_1024_1_256_ld_256_24320_1024,Gemm_Rocblas_-9,0.0118138
GemmTunableOp_float_TN,tn_6625_420_120_ld_120_120_6625,Gemm_Hipblaslt_6377,0.330292
GemmTunableOp_float_TN,tn_1024_1_256_ld_256_134912_1024,Gemm_Rocblas_-9,0.0108227
GemmTunableOp_float_TN,tn_1024_1_256_ld_256_139008_1024,Gemm_Rocblas_-9,0.0109378
GemmTunableOp_float_TN,tn_6625_810_120_ld_120_120_6625,Gemm_Hipblaslt_6377,0.597095
GemmTunableOp_float_TN,tn_1024_1_256_ld_256_65280_1024,Gemm_Rocblas_-9,0.0125288
GemmTunableOp_float_TN,tn_1024_1_256_ld_256_89856_1024,Gemm_Rocblas_-9,0.0139242
GemmTunableOp_float_TN,tn_1024_1_256_ld_256_73472_1024,Gemm_Rocblas_-9,0.0111616
GemmTunableOp_float_TN,tn_1024_1_256_ld_256_69376_1024,Gemm_Rocblas_-9,0.010822
GemmTunableOp_float_TN,tn_6625_618_120_ld_120_120_6625,Gemm_Rocblas_6378,0.447396
GemmTunableOp_float_TN,tn_1024_1_256_ld_256_16128_1024,Gemm_Rocblas_-9,0.010709
GemmAndBiasTunableOp_float_TN,tn_97_575_256_ld_256_256_97,Gemm_Hipblaslt_6377,0.0207931
GemmAndBiasTunableOp_float_TN,tn_97_687_256_ld_256_256_97,Gemm_Hipblaslt_6377,0.0236192
GemmAndBiasTunableOp_float_TN,tn_97_591_256_ld_256_256_97,Gemm_Hipblaslt_6377,0.0209302
GemmAndBiasTunableOp_float_TN,tn_256_591_512_ld_512_512_256,Gemm_Hipblaslt_6377,0.0745257
GemmAndBiasTunableOp_float_TN,tn_97_719_256_ld_256_256_97,Gemm_Hipblaslt_6377,0.0240452
GemmAndBiasTunableOp_float_TN,tn_256_719_512_ld_512_512_256,Gemm_Hipblaslt_6377,0.0877323
GemmAndBiasTunableOp_float_TN,tn_97_623_256_ld_256_256_97,Gemm_Hipblaslt_6377,0.0214052
GemmAndBiasTunableOp_float_TN,tn_256_623_512_ld_512_512_256,Gemm_Hipblaslt_6377,0.0788055
GemmAndBiasTunableOp_float_TN,tn_256_527_512_ld_512_512_256,Gemm_Hipblaslt_6377,0.0644189
GemmAndBiasTunableOp_float_TN,tn_256_479_512_ld_512_512_256,Gemm_Hipblaslt_6377,0.0581355
GemmAndBiasTunableOp_float_TN,tn_97_511_256_ld_256_256_97,Gemm_Hipblaslt_6377,0.0195881
GemmAndBiasTunableOp_float_TN,tn_256_511_512_ld_512_512_256,Gemm_Hipblaslt_6377,0.0623694
GemmAndBiasTunableOp_float_TN,tn_256_431_512_ld_512_512_256,Gemm_Hipblaslt_6377,0.0540598
GemmAndBiasTunableOp_float_TN,tn_97_415_256_ld_256_256_97,Gemm_Hipblaslt_6377,0.0174545
GemmAndBiasTunableOp_float_TN,tn_256_415_512_ld_512_512_256,Gemm_Hipblaslt_6377,0.0530006
GemmAndBiasTunableOp_float_TN,tn_256_495_512_ld_512_512_256,Gemm_Hipblaslt_6377,0.0610621
GemmAndBiasTunableOp_float_TN,tn_97_463_256_ld_256_256_97,Gemm_Hipblaslt_6377,0.018423
GemmAndBiasTunableOp_float_TN,tn_256_463_512_ld_512_512_256,Gemm_Hipblaslt_6377,0.0576401
GemmAndBiasTunableOp_float_TN,tn_97_383_256_ld_256_256_97,Gemm_Hipblaslt_6377,0.0166154
GemmAndBiasTunableOp_float_TN,tn_97_671_256_ld_256_256_97,Gemm_Hipblaslt_6377,0.0229581
GemmAndBiasTunableOp_float_TN,tn_97_543_256_ld_256_256_97,Gemm_Hipblaslt_6377,0.0196575
GemmAndBiasTunableOp_float_TN,tn_97_399_256_ld_256_256_97,Gemm_Hipblaslt_6377,0.0168677
GemmAndBiasTunableOp_float_TN,tn_256_399_512_ld_512_512_256,Gemm_Hipblaslt_6377,0.0500395
GemmAndBiasTunableOp_float_TN,tn_97_335_256_ld_256_256_97,Gemm_Hipblaslt_6377,0.0156229
GemmAndBiasTunableOp_float_TN,tn_256_335_512_ld_512_512_256,Gemm_Hipblaslt_6377,0.0441404
GemmAndBiasTunableOp_float_TN,tn_1024_318_512_ld_512_512_1024,Gemm_Hipblaslt_6377,0.15996
GemmAndBiasTunableOp_float_TN,tn_360_372_120_ld_120_120_360,Gemm_Hipblaslt_6377,0.0207963
GemmAndBiasTunableOp_float_TN,tn_1024_100_512_ld_512_512_1024,Gemm_Hipblaslt_6377,0.0575405
GemmAndBiasTunableOp_float_TN,tn_1024_497_512_ld_512_512_1024,Gemm_Hipblaslt_6377,0.224552
GemmAndBiasTunableOp_float_TN,tn_1024_728_512_ld_512_512_1024,Default,0.351707
GemmAndBiasTunableOp_float_TN,tn_1024_158_512_ld_512_512_1024,Gemm_Hipblaslt_6377,0.0805524
GemmAndBiasTunableOp_float_TN,tn_1024_66_512_ld_512_512_1024,Gemm_Hipblaslt_6377,0.0425191
GemmAndBiasTunableOp_float_TN,tn_240_570_120_ld_120_120_240,Gemm_Hipblaslt_6377,0.0207583
GemmAndBiasTunableOp_float_TN,tn_1024_1009_512_ld_512_512_1024,Gemm_Hipblaslt_6377,0.465484
GemmAndBiasTunableOp_float_TN,tn_1024_1023_512_ld_512_512_1024,Default,0.470452
GemmAndBiasTunableOp_float_TN,tn_1024_288_512_ld_512_512_1024,Gemm_Hipblaslt_6377,0.141866
GemmAndBiasTunableOp_float_TN,tn_1024_960_512_ld_512_512_1024,Default,0.440277
GemmAndBiasTunableOp_float_TN,tn_1024_1020_512_ld_512_512_1024,Gemm_Hipblaslt_6377,0.465011
GemmAndBiasTunableOp_float_TN,tn_1024_78_512_ld_512_512_1024,Gemm_Hipblaslt_6377,0.0420069
GemmAndBiasTunableOp_float_TN,tn_1024_401_512_ld_512_512_1024,Gemm_Hipblaslt_6377,0.187996
GemmAndBiasTunableOp_float_TN,tn_1024_451_512_ld_512_512_1024,Gemm_Hipblaslt_6377,0.199882
GemmAndBiasTunableOp_float_TN,tn_1024_437_512_ld_512_512_1024,Gemm_Hipblaslt_6377,0.202694
GemmAndBiasTunableOp_float_TN,tn_120_392_240_ld_240_240_120,Gemm_Hipblaslt_6377,0.0169314
GemmAndBiasTunableOp_float_TN,tn_120_240_120_ld_120_120_120,Gemm_Hipblaslt_6377,0.0109013
GemmAndBiasTunableOp_float_TN,tn_1024_627_512_ld_512_512_1024,Default,0.328113
GemmAndBiasTunableOp_float_TN,tn_1024_118_512_ld_512_512_1024,Gemm_Hipblaslt_6377,0.0636645
GemmAndBiasTunableOp_float_TN,tn_1024_815_512_ld_512_512_1024,Default,0.385894
GemmAndBiasTunableOp_float_TN,tn_360_594_120_ld_120_120_360,Gemm_Hipblaslt_6377,0.0312166
GemmAndBiasTunableOp_float_TN,tn_1024_355_512_ld_512_512_1024,Gemm_Hipblaslt_6377,0.167445
GemmAndBiasTunableOp_float_TN,tn_1024_268_512_ld_512_512_1024,Gemm_Hipblaslt_6377,0.134164
GemmAndBiasTunableOp_float_TN,tn_1024_348_512_ld_512_512_1024,Gemm_Hipblaslt_6377,0.171424
GemmAndBiasTunableOp_float_TN,tn_1024_589_512_ld_512_512_1024,Default,0.295933
GemmAndBiasTunableOp_float_TN,tn_1024_14_512_ld_512_512_1024,Gemm_Hipblaslt_6378,0.0242035
GemmAndBiasTunableOp_float_TN,tn_1024_771_512_ld_512_512_1024,Gemm_Hipblaslt_6377,0.364328
GemmAndBiasTunableOp_float_TN,tn_1024_115_512_ld_512_512_1024,Gemm_Hipblaslt_6377,0.0644415
GemmAndBiasTunableOp_float_TN,tn_1024_985_512_ld_512_512_1024,Gemm_Hipblaslt_6377,0.445821
GemmAndBiasTunableOp_float_TN,tn_120_516_240_ld_240_240_120,Gemm_Hipblaslt_6377,0.0207642
GemmAndBiasTunableOp_float_TN,tn_1024_333_512_ld_512_512_1024,Gemm_Hipblaslt_6377,0.154145
GemmAndBiasTunableOp_float_TN,tn_1024_290_512_ld_512_512_1024,Gemm_Hipblaslt_6377,0.146551
GemmAndBiasTunableOp_float_TN,tn_1024_558_512_ld_512_512_1024,Gemm_Hipblaslt_6377,0.271457
GemmAndBiasTunableOp_float_TN,tn_1024_253_512_ld_512_512_1024,Gemm_Hipblaslt_6377,0.123824
GemmAndBiasTunableOp_float_TN,tn_120_276_240_ld_240_240_120,Gemm_Hipblaslt_6379,0.0192614
GemmAndBiasTunableOp_float_TN,tn_1024_963_512_ld_512_512_1024,Default,0.450264
GemmAndBiasTunableOp_float_TN,tn_1024_653_512_ld_512_512_1024,Default,0.319428
GemmAndBiasTunableOp_float_TN,tn_120_756_120_ld_120_120_120,Gemm_Hipblaslt_6377,0.0165504
GemmAndBiasTunableOp_float_TN,tn_360_756_120_ld_120_120_360,Gemm_Hipblaslt_6377,0.0364778
GemmAndBiasTunableOp_float_TN,tn_1024_1000_512_ld_512_512_1024,Gemm_Hipblaslt_6377,0.456997
GemmAndBiasTunableOp_float_TN,tn_120_591_240_ld_240_240_120,Gemm_Hipblaslt_6377,0.0228057
GemmAndBiasTunableOp_float_TN,tn_1024_962_512_ld_512_512_1024,Default,0.448335
GemmAndBiasTunableOp_float_TN,tn_1024_838_512_ld_512_512_1024,Gemm_Hipblaslt_6377,0.389377
GemmAndBiasTunableOp_float_TN,tn_1024_266_512_ld_512_512_1024,Gemm_Hipblaslt_6377,0.133914
GemmAndBiasTunableOp_float_TN,tn_1024_941_512_ld_512_512_1024,Default,0.425649
GemmAndBiasTunableOp_float_TN,tn_1024_134_512_ld_512_512_1024,Gemm_Hipblaslt_6377,0.0751906
GemmAndBiasTunableOp_float_TN,tn_120_420_240_ld_240_240_120,Gemm_Hipblaslt_6377,0.0180708
GemmAndBiasTunableOp_float_TN,tn_1024_912_512_ld_512_512_1024,Gemm_Hipblaslt_6377,0.41696
GemmAndBiasTunableOp_float_TN,tn_1024_660_512_ld_512_512_1024,Gemm_Hipblaslt_6377,0.326147
GemmAndBiasTunableOp_float_TN,tn_1024_899_512_ld_512_512_1024,Gemm_Hipblaslt_6377,0.408037
GemmAndBiasTunableOp_float_TN,tn_1024_722_512_ld_512_512_1024,Gemm_Hipblaslt_6377,0.341118
GemmAndBiasTunableOp_float_TN,tn_1024_109_512_ld_512_512_1024,Gemm_Hipblaslt_6377,0.0571975
GemmAndBiasTunableOp_float_TN,tn_240_930_120_ld_120_120_240,Gemm_Hipblaslt_6377,0.0299347
GemmAndBiasTunableOp_float_TN,tn_1024_840_512_ld_512_512_1024,Gemm_Hipblaslt_6377,0.388587
GemmAndBiasTunableOp_float_TN,tn_256_127_512_ld_512_512_256,Gemm_Hipblaslt_6377,0.0237471
GemmAndBiasTunableOp_float_TN,tn_97_79_256_ld_256_256_97,Gemm_Hipblaslt_6376,0.0126622
GemmAndBiasTunableOp_float_TN,tn_1024_605_512_ld_512_512_1024,Gemm_Hipblaslt_6377,0.302873
GemmAndBiasTunableOp_float_TN,tn_360_232_120_ld_120_120_360,Gemm_Hipblaslt_6376,0.0298477
GemmAndBiasTunableOp_float_TN,tn_1024_829_512_ld_512_512_1024,Gemm_Hipblaslt_6377,0.373585
GemmAndBiasTunableOp_float_TN,tn_1024_789_512_ld_512_512_1024,Gemm_Hipblaslt_6377,0.361046
GemmAndBiasTunableOp_float_TN,tn_1024_271_512_ld_512_512_1024,Gemm_Hipblaslt_6377,0.134744
GemmAndBiasTunableOp_float_TN,tn_1024_957_512_ld_512_512_1024,Gemm_Hipblaslt_6377,0.433641
GemmAndBiasTunableOp_float_TN,tn_1024_313_512_ld_512_512_1024,Gemm_Hipblaslt_6377,0.157818
GemmAndBiasTunableOp_float_TN,tn_1024_950_512_ld_512_512_1024,Gemm_Hipblaslt_6377,0.436964
GemmAndBiasTunableOp_float_TN,tn_1024_866_512_ld_512_512_1024,Gemm_Hipblaslt_6377,0.413332
GemmAndBiasTunableOp_float_TN,tn_1024_283_512_ld_512_512_1024,Gemm_Hipblaslt_6377,0.157691
GemmAndBiasTunableOp_float_TN,tn_1024_474_512_ld_512_512_1024,Gemm_Hipblaslt_6377,0.209361
GemmAndBiasTunableOp_float_TN,tn_120_258_240_ld_240_240_120,Gemm_Hipblaslt_6377,0.014827
GemmAndBiasTunableOp_float_TN,tn_1024_641_512_ld_512_512_1024,Gemm_Hipblaslt_6377,0.316993
GemmAndBiasTunableOp_float_TN,tn_256_400_1024_ld_1024_1024_256,Gemm_Hipblaslt_6377,0.0962442
GemmAndBiasTunableOp_float_TN,tn_1024_123_512_ld_512_512_1024,Gemm_Hipblaslt_6377,0.0639179
GemmAndBiasTunableOp_float_TN,tn_97_63_256_ld_256_256_97,Gemm_Hipblaslt_6378,0.0123308
GemmAndBiasTunableOp_float_TN,tn_1024_916_512_ld_512_512_1024,Default,0.423185
GemmAndBiasTunableOp_float_TN,tn_1024_503_512_ld_512_512_1024,Gemm_Hipblaslt_6377,0.222147
GemmAndBiasTunableOp_float_TN,tn_1024_692_512_ld_512_512_1024,Gemm_Hipblaslt_6377,0.331818
GemmAndBiasTunableOp_float_TN,tn_1024_148_512_ld_512_512_1024,Gemm_Hipblaslt_6377,0.0816597
GemmAndBiasTunableOp_float_TN,tn_1024_316_512_ld_512_512_1024,Gemm_Hipblaslt_6377,0.156566
GemmAndBiasTunableOp_float_TN,tn_240_468_120_ld_120_120_240,Gemm_Hipblaslt_6377,0.0188983
GemmAndBiasTunableOp_float_TN,tn_1024_366_512_ld_512_512_1024,Gemm_Hipblaslt_6377,0.169097
GemmAndBiasTunableOp_float_TN,tn_1024_644_512_ld_512_512_1024,Default,0.329143
GemmAndBiasTunableOp_float_TN,tn_256_95_512_ld_512_512_256,Gemm_Hipblaslt_6377,0.022348
GemmAndBiasTunableOp_float_TN,tn_1024_475_512_ld_512_512_1024,Gemm_Hipblaslt_6377,0.210707
GemmAndBiasTunableOp_float_TN,tn_1024_873_512_ld_512_512_1024,Gemm_Hipblaslt_6377,0.398172
GemmAndBiasTunableOp_float_TN,tn_1024_278_512_ld_512_512_1024,Gemm_Hipblaslt_6377,0.143894
GemmAndBiasTunableOp_float_TN,tn_1024_629_512_ld_512_512_1024,Gemm_Hipblaslt_6377,0.312518
GemmAndBiasTunableOp_float_TN,tn_1024_704_512_ld_512_512_1024,Gemm_Hipblaslt_6377,0.334158
GemmAndBiasTunableOp_float_TN,tn_512_600_4_ld_4_4_512,Gemm_Hipblaslt_6377,0.011058
GemmAndBiasTunableOp_float_TN,tn_1024_455_512_ld_512_512_1024,Gemm_Hipblaslt_6377,0.208273
GemmAndBiasTunableOp_float_TN,tn_1024_868_512_ld_512_512_1024,Default,0.406153
GemmAndBiasTunableOp_float_TN,tn_1024_880_512_ld_512_512_1024,Default,0.414628
GemmAndBiasTunableOp_float_TN,tn_1024_315_512_ld_512_512_1024,Gemm_Hipblaslt_6377,0.156841
GemmAndBiasTunableOp_float_TN,tn_1024_673_512_ld_512_512_1024,Gemm_Hipblaslt_6377,0.328552
GemmAndBiasTunableOp_float_TN,tn_1024_204_512_ld_512_512_1024,Gemm_Hipblaslt_6377,0.10596
GemmAndBiasTunableOp_float_TN,tn_360_240_120_ld_120_120_360,Gemm_Hipblaslt_6377,0.0157043
GemmAndBiasTunableOp_float_TN,tn_1024_509_512_ld_512_512_1024,Gemm_Hipblaslt_6377,0.229435
GemmAndBiasTunableOp_float_TN,tn_120_246_240_ld_240_240_120,Gemm_Hipblaslt_6377,0.0157389
GemmAndBiasTunableOp_float_TN,tn_1024_855_512_ld_512_512_1024,Gemm_Hipblaslt_6377,0.391323
GemmAndBiasTunableOp_float_TN,tn_1024_494_512_ld_512_512_1024,Gemm_Hipblaslt_6377,0.219674
GemmAndBiasTunableOp_float_TN,tn_256_111_512_ld_512_512_256,Gemm_Hipblaslt_6377,0.0227292
GemmAndBiasTunableOp_float_TN,tn_1024_821_512_ld_512_512_1024,Default,0.382778
GemmAndBiasTunableOp_float_TN,tn_1024_160_512_ld_512_512_1024,Gemm_Hipblaslt_6377,0.0818255
GemmAndBiasTunableOp_float_TN,tn_1024_964_512_ld_512_512_1024,Gemm_Hipblaslt_6377,0.453306
GemmAndBiasTunableOp_float_TN,tn_1024_233_512_ld_512_512_1024,Gemm_Hipblaslt_6377,0.120939
GemmAndBiasTunableOp_float_TN,tn_1024_344_512_ld_512_512_1024,Gemm_Hipblaslt_6377,0.163819
GemmAndBiasTunableOp_float_TN,tn_1024_844_512_ld_512_512_1024,Gemm_Hipblaslt_6377,0.386863
GemmAndBiasTunableOp_float_TN,tn_1024_826_512_ld_512_512_1024,Gemm_Hipblaslt_6377,0.38157
GemmAndBiasTunableOp_float_TN,tn_1024_311_512_ld_512_512_1024,Gemm_Hipblaslt_6377,0.173347
GemmAndBiasTunableOp_float_TN,tn_1024_599_512_ld_512_512_1024,Gemm_Hipblaslt_6377,0.298675
GemmAndBiasTunableOp_float_TN,tn_1024_42_512_ld_512_512_1024,Gemm_Hipblaslt_6377,0.0304954
GemmAndBiasTunableOp_float_TN,tn_1024_595_512_ld_512_512_1024,Gemm_Hipblaslt_6377,0.296524
GemmAndBiasTunableOp_float_TN,tn_1024_565_512_ld_512_512_1024,Gemm_Hipblaslt_6377,0.29243
GemmAndBiasTunableOp_float_TN,tn_1024_765_512_ld_512_512_1024,Gemm_Hipblaslt_6377,0.35527
GemmAndBiasTunableOp_float_TN,tn_120_450_120_ld_120_120_120,Gemm_Hipblaslt_6376,0.0201254
GemmAndBiasTunableOp_float_TN,tn_360_576_120_ld_120_120_360,Gemm_Hipblaslt_6377,0.0281037
GemmAndBiasTunableOp_float_TN,tn_1024_1018_512_ld_512_512_1024,Default,0.477042
GemmAndBiasTunableOp_float_TN,tn_1024_257_512_ld_512_512_1024,Gemm_Hipblaslt_6377,0.161991
GemmAndBiasTunableOp_float_TN,tn_360_1374_120_ld_120_120_360,Gemm_Hipblaslt_6379,0.0720342
GemmAndBiasTunableOp_float_TN,tn_1024_817_512_ld_512_512_1024,Default,0.384825
GemmAndBiasTunableOp_float_TN,tn_1024_517_512_ld_512_512_1024,Gemm_Hipblaslt_6377,0.247702
GemmAndBiasTunableOp_float_TN,tn_1024_714_512_ld_512_512_1024,Gemm_Hipblaslt_6377,0.33829
GemmAndBiasTunableOp_float_TN,tn_1024_672_512_ld_512_512_1024,Gemm_Hipblaslt_6377,0.319301
GemmAndBiasTunableOp_float_TN,tn_1024_445_512_ld_512_512_1024,Gemm_Hipblaslt_6377,0.194595
GemmAndBiasTunableOp_float_TN,tn_1024_732_512_ld_512_512_1024,Default,0.365308
GemmAndBiasTunableOp_float_TN,tn_1024_812_512_ld_512_512_1024,Default,0.377519
GemmAndBiasTunableOp_float_TN,tn_240_396_120_ld_120_120_240,Gemm_Hipblaslt_6377,0.0164328
GemmAndBiasTunableOp_float_TN,tn_1024_807_512_ld_512_512_1024,Default,0.379197
GemmAndBiasTunableOp_float_TN,tn_1024_689_512_ld_512_512_1024,Gemm_Hipblaslt_6377,0.333746
GemmAndBiasTunableOp_float_TN,tn_1024_153_512_ld_512_512_1024,Gemm_Hipblaslt_6377,0.0824245
GemmAndBiasTunableOp_float_TN,tn_1024_898_512_ld_512_512_1024,Gemm_Hipblaslt_6377,0.417104
GemmAndBiasTunableOp_float_TN,tn_1024_816_512_ld_512_512_1024,Gemm_Hipblaslt_6377,0.376724
GemmAndBiasTunableOp_float_TN,tn_120_756_240_ld_240_240_120,Gemm_Hipblaslt_6377,0.0266549
GemmAndBiasTunableOp_float_TN,tn_1024_143_512_ld_512_512_1024,Gemm_Hipblaslt_6377,0.0763328
GemmAndBiasTunableOp_float_TN,tn_1024_369_512_ld_512_512_1024,Gemm_Hipblaslt_6377,0.18416
GemmAndBiasTunableOp_float_TN,tn_120_510_240_ld_240_240_120,Gemm_Hipblaslt_6377,0.02022
GemmAndBiasTunableOp_float_TN,tn_1024_842_512_ld_512_512_1024,Gemm_Hipblaslt_6377,0.393267
GemmAndBiasTunableOp_float_TN,tn_1024_980_512_ld_512_512_1024,Default,0.465869
GemmAndBiasTunableOp_float_TN,tn_1024_226_512_ld_512_512_1024,Gemm_Hipblaslt_6377,0.135244
GemmAndBiasTunableOp_float_TN,tn_1024_411_512_ld_512_512_1024,Gemm_Hipblaslt_6377,0.204292
GemmAndBiasTunableOp_float_TN,tn_1024_310_512_ld_512_512_1024,Gemm_Hipblaslt_6377,0.157127
GemmAndBiasTunableOp_float_TN,tn_1024_797_512_ld_512_512_1024,Gemm_Hipblaslt_6377,0.366766
GemmAndBiasTunableOp_float_TN,tn_1024_761_512_ld_512_512_1024,Default,0.359544
GemmAndBiasTunableOp_float_TN,tn_1024_297_512_ld_512_512_1024,Gemm_Hipblaslt_6377,0.151611
GemmAndBiasTunableOp_float_TN,tn_1024_741_512_ld_512_512_1024,Gemm_Hipblaslt_6377,0.342576
GemmAndBiasTunableOp_float_TN,tn_768_26624_768_ld_768_768_768,Gemm_Hipblaslt_6377,11.2865
GemmAndBiasTunableOp_float_TN,tn_240_216_120_ld_120_120_240,Gemm_Hipblaslt_6379,0.014983
GemmAndBiasTunableOp_float_TN,tn_1024_573_512_ld_512_512_1024,Gemm_Hipblaslt_6377,0.288962
GemmAndBiasTunableOp_float_TN,tn_1024_786_512_ld_512_512_1024,Gemm_Hipblaslt_6377,0.369792
GemmAndBiasTunableOp_float_TN,tn_192_600_256_ld_256_256_192,Gemm_Hipblaslt_6377,0.0316263
GemmAndBiasTunableOp_float_TN,tn_1024_1017_512_ld_512_512_1024,Gemm_Hipblaslt_6377,0.464337
GemmAndBiasTunableOp_float_TN,tn_4_8400_256_ld_256_256_4,Gemm_Hipblaslt_6376,0.031064
GemmAndBiasTunableOp_float_TN,tn_1024_1019_512_ld_512_512_1024,Default,0.469064
GemmAndBiasTunableOp_float_TN,tn_1024_820_512_ld_512_512_1024,Gemm_Hipblaslt_6377,0.377881
GemmAndBiasTunableOp_float_TN,tn_768_26624_3072_ld_3072_3072_768,Gemm_Hipblaslt_6377,53.3021
GemmAndBiasTunableOp_float_TN,tn_1024_843_512_ld_512_512_1024,Default,0.384616
GemmAndBiasTunableOp_float_TN,tn_1024_418_512_ld_512_512_1024,Gemm_Hipblaslt_6377,0.192722
GemmAndBiasTunableOp_float_TN,tn_1024_753_512_ld_512_512_1024,Gemm_Hipblaslt_6377,0.357963
GemmAndBiasTunableOp_float_TN,tn_1024_498_512_ld_512_512_1024,Gemm_Hipblaslt_6377,0.235079
GemmAndBiasTunableOp_float_TN,tn_1024_384_512_ld_512_512_1024,Gemm_Hipblaslt_6377,0.175146
GemmAndBiasTunableOp_float_TN,tn_1024_638_512_ld_512_512_1024,Gemm_Hipblaslt_6377,0.31432
GemmAndBiasTunableOp_float_TN,tn_1024_230_512_ld_512_512_1024,Gemm_Hipblaslt_6377,0.147544
GemmAndBiasTunableOp_float_TN,tn_256_303_512_ld_512_512_256,Gemm_Hipblaslt_6377,0.0410396
GemmAndBiasTunableOp_float_TN,tn_1024_472_512_ld_512_512_1024,Gemm_Hipblaslt_6377,0.218427
GemmAndBiasTunableOp_float_TN,tn_1024_720_512_ld_512_512_1024,Default,0.338386
GemmAndBiasTunableOp_float_TN,tn_1024_420_512_ld_512_512_1024,Gemm_Hipblaslt_6377,0.193769
GemmAndBiasTunableOp_float_TN,tn_1024_624_512_ld_512_512_1024,Gemm_Hipblaslt_6377,0.307458
GemmAndBiasTunableOp_float_TN,tn_1024_757_512_ld_512_512_1024,Default,0.359537
GemmAndBiasTunableOp_float_TN,tn_1024_321_512_ld_512_512_1024,Gemm_Hipblaslt_6377,0.160318
GemmAndBiasTunableOp_float_TN,tn_1024_769_512_ld_512_512_1024,Gemm_Hipblaslt_6377,0.360033
GemmAndBiasTunableOp_float_TN,tn_97_159_256_ld_256_256_97,Gemm_Hipblaslt_6376,0.0132793
GemmAndBiasTunableOp_float_TN,tn_1024_429_512_ld_512_512_1024,Gemm_Hipblaslt_6377,0.192041
GemmAndBiasTunableOp_float_TN,tn_1024_284_512_ld_512_512_1024,Gemm_Hipblaslt_6377,0.178666
GemmAndBiasTunableOp_float_TN,tn_1024_715_512_ld_512_512_1024,Gemm_Hipblaslt_6377,0.338182
GemmAndBiasTunableOp_float_TN,tn_1024_113_512_ld_512_512_1024,Gemm_Hipblaslt_6377,0.0642027
GemmAndBiasTunableOp_float_TN,tn_1024_755_512_ld_512_512_1024,Gemm_Hipblaslt_6377,0.35479
GemmAndBiasTunableOp_float_TN,tn_1024_827_512_ld_512_512_1024,Gemm_Hipblaslt_6377,0.380676
GemmAndBiasTunableOp_float_TN,tn_1024_785_512_ld_512_512_1024,Default,0.36671
GemmAndBiasTunableOp_float_TN,tn_1024_441_512_ld_512_512_1024,Gemm_Hipblaslt_6377,0.189845
GemmAndBiasTunableOp_float_TN,tn_1024_203_512_ld_512_512_1024,Gemm_Hipblaslt_6377,0.105989
GemmAndBiasTunableOp_float_TN,tn_120_594_120_ld_120_120_120,Gemm_Hipblaslt_6377,0.0146323
GemmAndBiasTunableOp_float_TN,tn_1024_730_512_ld_512_512_1024,Gemm_Hipblaslt_6377,0.342653
GemmAndBiasTunableOp_float_TN,tn_1024_943_512_ld_512_512_1024,Gemm_Hipblaslt_6377,0.426449
GemmAndBiasTunableOp_float_TN,tn_1024_173_512_ld_512_512_1024,Gemm_Hipblaslt_6377,0.092415
GemmAndBiasTunableOp_float_TN,tn_256_671_512_ld_512_512_256,Gemm_Hipblaslt_6377,0.0841076
GemmAndBiasTunableOp_float_TN,tn_1024_622_512_ld_512_512_1024,Gemm_Hipblaslt_6377,0.306841
GemmAndBiasTunableOp_float_TN,tn_1024_869_512_ld_512_512_1024,Default,0.398932
GemmAndBiasTunableOp_float_TN,tn_1024_764_512_ld_512_512_1024,Gemm_Hipblaslt_6377,0.353221
GemmAndBiasTunableOp_float_TN,tn_1024_513_512_ld_512_512_1024,Gemm_Hipblaslt_6377,0.250657
GemmAndBiasTunableOp_float_TN,tn_256_300_1024_ld_1024_1024_256,Gemm_Hipblaslt_6377,0.0814311
GemmAndBiasTunableOp_float_TN,tn_1024_937_512_ld_512_512_1024,Gemm_Hipblaslt_6377,0.42695
GemmAndBiasTunableOp_float_TN,tn_1024_703_512_ld_512_512_1024,Default,0.34262
GemmAndBiasTunableOp_float_TN,tn_240_738_120_ld_120_120_240,Gemm_Hipblaslt_6377,0.0249168
GemmAndBiasTunableOp_float_TN,tn_1024_374_512_ld_512_512_1024,Gemm_Hipblaslt_6377,0.174637
GemmAndBiasTunableOp_float_TN,tn_1024_554_512_ld_512_512_1024,Gemm_Hipblaslt_6377,0.27657
GemmAndBiasTunableOp_float_TN,tn_1024_910_512_ld_512_512_1024,Default,0.415884
GemmAndBiasTunableOp_float_TN,tn_1024_626_512_ld_512_512_1024,Gemm_Hipblaslt_6377,0.317473
GemmAndBiasTunableOp_float_TN,tn_120_264_120_ld_120_120_120,Gemm_Hipblaslt_6377,0.0109795
GemmAndBiasTunableOp_float_TN,tn_1024_216_512_ld_512_512_1024,Gemm_Hipblaslt_6379,0.149381
GemmAndBiasTunableOp_float_TN,tn_240_318_120_ld_120_120_240,Gemm_Hipblaslt_6377,0.014684
GemmAndBiasTunableOp_float_TN,tn_1024_462_512_ld_512_512_1024,Gemm_Hipblaslt_6377,0.198477
GemmAndBiasTunableOp_float_TN,tn_1024_889_512_ld_512_512_1024,Gemm_Hipblaslt_6377,0.406871
GemmAndBiasTunableOp_float_TN,tn_1024_370_512_ld_512_512_1024,Gemm_Hipblaslt_6377,0.177722
GemmAndBiasTunableOp_float_TN,tn_1024_24_512_ld_512_512_1024,Gemm_Hipblaslt_6377,0.026806
GemmAndBiasTunableOp_float_TN,tn_1024_39_512_ld_512_512_1024,Gemm_Hipblaslt_6377,0.0303182
GemmAndBiasTunableOp_float_TN,tn_1024_179_512_ld_512_512_1024,Gemm_Hipblaslt_6377,0.0983566
GemmAndBiasTunableOp_float_TN,tn_1024_727_512_ld_512_512_1024,Gemm_Hipblaslt_6377,0.336086
GemmAndBiasTunableOp_float_TN,tn_1024_112_512_ld_512_512_1024,Gemm_Hipblaslt_6377,0.0579353
GemmAndBiasTunableOp_float_TN,tn_1024_686_512_ld_512_512_1024,Default,0.333822
GemmAndBiasTunableOp_float_TN,tn_1024_615_512_ld_512_512_1024,Gemm_Hipblaslt_6377,0.306224
GemmAndBiasTunableOp_float_TN,tn_1024_404_512_ld_512_512_1024,Gemm_Hipblaslt_6377,0.190698
GemmAndBiasTunableOp_float_TN,tn_97_143_256_ld_256_256_97,Gemm_Hipblaslt_6376,0.0131067
GemmAndBiasTunableOp_float_TN,tn_1024_164_512_ld_512_512_1024,Gemm_Hipblaslt_6377,0.0903279
GemmAndBiasTunableOp_float_TN,tn_1024_410_512_ld_512_512_1024,Gemm_Hipblaslt_6377,0.190437
GemmAndBiasTunableOp_float_TN,tn_1024_790_512_ld_512_512_1024,Gemm_Hipblaslt_6377,0.374395
GemmAndBiasTunableOp_float_TN,tn_1024_335_512_ld_512_512_1024,Gemm_Hipblaslt_6377,0.162048
GemmAndBiasTunableOp_float_TN,tn_1024_858_512_ld_512_512_1024,Gemm_Hipblaslt_6377,0.396452
GemmAndBiasTunableOp_float_TN,tn_1024_339_512_ld_512_512_1024,Gemm_Hipblaslt_6377,0.164919
GemmAndBiasTunableOp_float_TN,tn_1024_58_512_ld_512_512_1024,Gemm_Hipblaslt_6377,0.0368913
GemmAndBiasTunableOp_float_TN,tn_360_450_120_ld_120_120_360,Gemm_Hipblaslt_6377,0.0253048
GemmAndBiasTunableOp_float_TN,tn_1024_642_512_ld_512_512_1024,Gemm_Hipblaslt_6377,0.318489
GemmAndBiasTunableOp_float_TN,tn_1024_857_512_ld_512_512_1024,Default,0.392651
GemmAndBiasTunableOp_float_TN,tn_1024_802_512_ld_512_512_1024,Default,0.387811
GemmAndBiasTunableOp_float_TN,tn_1024_669_512_ld_512_512_1024,Default,0.328919
GemmAndBiasTunableOp_float_TN,tn_240_282_120_ld_120_120_240,Gemm_Hipblaslt_6377,0.0156927
GemmAndBiasTunableOp_float_TN,tn_17_8400_256_ld_256_256_17,Gemm_Hipblaslt_6377,0.0747766
GemmAndBiasTunableOp_float_TN,tn_1024_245_512_ld_512_512_1024,Gemm_Hipblaslt_6377,0.135649
GemmAndBiasTunableOp_float_TN,tn_97_319_256_ld_256_256_97,Gemm_Hipblaslt_6377,0.0153649
GemmAndBiasTunableOp_float_TN,tn_1024_623_512_ld_512_512_1024,Default,0.307558
GemmAndBiasTunableOp_float_TN,tn_256_191_512_ld_512_512_256,Gemm_Hipblaslt_6377,0.0287501
GemmAndBiasTunableOp_float_TN,tn_1024_640_512_ld_512_512_1024,Default,0.320694
GemmAndBiasTunableOp_float_TN,tn_17_16800_256_ld_256_256_17,Gemm_Hipblaslt_6377,0.12391
GemmAndBiasTunableOp_float_TN,tn_1024_159_512_ld_512_512_1024,Gemm_Hipblaslt_6377,0.0818996
GemmAndBiasTunableOp_float_TN,tn_256_15_512_ld_512_512_256,Gemm_Hipblaslt_6378,0.0180547
GemmAndBiasTunableOp_float_TN,tn_97_31_256_ld_256_256_97,Gemm_Hipblaslt_6378,0.0123152
GemmAndBiasTunableOp_float_TN,tn_1024_389_512_ld_512_512_1024,Gemm_Hipblaslt_6377,0.17879
GemmAndBiasTunableOp_float_TN,tn_1024_168_512_ld_512_512_1024,Gemm_Hipblaslt_6377,0.0923509
GemmAndBiasTunableOp_float_TN,tn_256_223_512_ld_512_512_256,Gemm_Hipblaslt_6377,0.0322832
GemmAndBiasTunableOp_float_TN,tn_1024_903_512_ld_512_512_1024,Gemm_Hipblaslt_6377,0.41499
GemmAndBiasTunableOp_float_TN,tn_1024_915_512_ld_512_512_1024,Default,0.417723
GemmAndBiasTunableOp_float_TN,tn_1024_414_512_ld_512_512_1024,Gemm_Hipblaslt_6377,0.186133
GemmAndBiasTunableOp_float_TN,tn_1024_256_512_ld_512_512_1024,Gemm_Hipblaslt_6377,0.12631
GemmAndBiasTunableOp_float_TN,tn_120_745_240_ld_240_240_120,Gemm_Hipblaslt_6377,0.0263119
GemmAndBiasTunableOp_float_TN,tn_1024_507_512_ld_512_512_1024,Gemm_Hipblaslt_6377,0.226052
GemmAndBiasTunableOp_float_TN,tn_97_303_256_ld_256_256_97,Gemm_Hipblaslt_6377,0.0155328
GemmAndBiasTunableOp_float_TN,tn_1024_574_512_ld_512_512_1024,Gemm_Hipblaslt_6377,0.271668
GemmAndBiasTunableOp_float_TN,tn_1024_825_512_ld_512_512_1024,Gemm_Hipblaslt_6377,0.379928
GemmAndBiasTunableOp_float_TN,tn_256_31_512_ld_512_512_256,Gemm_Hipblaslt_6376,0.0186447
GemmAndBiasTunableOp_float_TN,tn_1024_795_512_ld_512_512_1024,Default,0.371011
GemmAndBiasTunableOp_float_TN,tn_240_444_120_ld_120_120_240,Gemm_Hipblaslt_6377,0.0175874
GemmAndBiasTunableOp_float_TN,tn_1024_106_512_ld_512_512_1024,Gemm_Hipblaslt_6377,0.057723
GemmAndBiasTunableOp_float_TN,tn_1024_32_512_ld_512_512_1024,Gemm_Hipblaslt_6377,0.0267768
GemmAndBiasTunableOp_float_TN,tn_1024_547_512_ld_512_512_1024,Gemm_Hipblaslt_6377,0.282899
GemmAndBiasTunableOp_float_TN,tn_120_738_120_ld_120_120_120,Gemm_Hipblaslt_6377,0.0162609
GemmAndBiasTunableOp_float_TN,tn_1024_707_512_ld_512_512_1024,Default,0.34578
GemmAndBiasTunableOp_float_TN,tn_360_606_120_ld_120_120_360,Gemm_Hipblaslt_6376,0.0427913
GemmAndBiasTunableOp_float_TN,tn_120_252_120_ld_120_120_120,Gemm_Hipblaslt_6377,0.0108752
GemmAndBiasTunableOp_float_TN,tn_1024_469_512_ld_512_512_1024,Gemm_Hipblaslt_6377,0.237925
GemmAndBiasTunableOp_float_TN,tn_1024_211_512_ld_512_512_1024,Gemm_Hipblaslt_6377,0.114871
GemmAndBiasTunableOp_float_TN,tn_1024_102_512_ld_512_512_1024,Gemm_Hipblaslt_6377,0.057527
GemmAndBiasTunableOp_float_TN,tn_1024_617_512_ld_512_512_1024,Gemm_Hipblaslt_6377,0.31146
GemmAndBiasTunableOp_float_TN,tn_1024_22_512_ld_512_512_1024,Gemm_Hipblaslt_6376,0.0266738
GemmAndBiasTunableOp_float_TN,tn_1024_439_512_ld_512_512_1024,Gemm_Hipblaslt_6377,0.196378
GemmAndBiasTunableOp_float_TN,tn_1024_122_512_ld_512_512_1024,Gemm_Hipblaslt_6377,0.0640444
GemmAndBiasTunableOp_float_TN,tn_1024_725_512_ld_512_512_1024,Gemm_Hipblaslt_6377,0.340485
GemmAndBiasTunableOp_float_TN,tn_97_287_256_ld_256_256_97,Gemm_Hipblaslt_6377,0.0151353
GemmAndBiasTunableOp_float_TN,tn_1024_131_512_ld_512_512_1024,Gemm_Hipblaslt_6377,0.0744072
GemmAndBiasTunableOp_float_TN,tn_1024_1007_512_ld_512_512_1024,Gemm_Hipblaslt_6377,0.453906
GemmAndBiasTunableOp_float_TN,tn_120_390_240_ld_240_240_120,Gemm_Hipblaslt_6376,0.0234722
GemmAndBiasTunableOp_float_TN,tn_1024_218_512_ld_512_512_1024,Gemm_Hipblaslt_6377,0.124701
GemmAndBiasTunableOp_float_TN,tn_360_492_120_ld_120_120_360,Gemm_Hipblaslt_6377,0.025205
GemmAndBiasTunableOp_float_TN,tn_1024_851_512_ld_512_512_1024,Gemm_Hipblaslt_6377,0.391776
GemmAndBiasTunableOp_float_TN,tn_1024_819_512_ld_512_512_1024,Default,0.379934
GemmAndBiasTunableOp_float_TN,tn_256_351_512_ld_512_512_256,Gemm_Hipblaslt_6377,0.0452267
GemmAndBiasTunableOp_float_TN,tn_1024_834_512_ld_512_512_1024,Gemm_Hipblaslt_6377,0.388719
GemmAndBiasTunableOp_float_TN,tn_1024_955_512_ld_512_512_1024,Gemm_Hipblaslt_6377,0.443625
GemmAndBiasTunableOp_float_TN,tn_1024_735_512_ld_512_512_1024,Gemm_Hipblaslt_6377,0.337545
GemmAndBiasTunableOp_float_TN,tn_360_462_120_ld_120_120_360,Gemm_Hipblaslt_6377,0.0238826
GemmAndBiasTunableOp_float_TN,tn_1024_480_512_ld_512_512_1024,Gemm_Hipblaslt_6377,0.20844
GemmAndBiasTunableOp_float_TN,tn_1024_968_512_ld_512_512_1024,Default,0.455745
GemmAndBiasTunableOp_float_TN,tn_1024_896_512_ld_512_512_1024,Gemm_Hipblaslt_6377,0.431091
GemmAndBiasTunableOp_float_TN,tn_1024_18_512_ld_512_512_1024,Gemm_Hipblaslt_6376,0.0267391
GemmAndBiasTunableOp_float_TN,tn_1024_292_512_ld_512_512_1024,Gemm_Hipblaslt_6377,0.178319
GemmAndBiasTunableOp_float_TN,tn_1024_721_512_ld_512_512_1024,Gemm_Hipblaslt_6377,0.341326
GemmAndBiasTunableOp_float_TN,tn_1024_999_512_ld_512_512_1024,Gemm_Hipblaslt_6377,0.452501
GemmAndBiasTunableOp_float_TN,tn_1024_331_512_ld_512_512_1024,Gemm_Hipblaslt_6377,0.159746
GemmAndBiasTunableOp_float_TN,tn_120_810_120_ld_120_120_120,Gemm_Hipblaslt_6377,0.0174055
GemmAndBiasTunableOp_float_TN,tn_1024_383_512_ld_512_512_1024,Gemm_Hipblaslt_6377,0.175298
GemmAndBiasTunableOp_float_TN,tn_1024_612_512_ld_512_512_1024,Gemm_Hipblaslt_6377,0.307444
GemmAndBiasTunableOp_float_TN,tn_1024_779_512_ld_512_512_1024,Gemm_Hipblaslt_6377,0.362962
GemmAndBiasTunableOp_float_TN,tn_97_271_256_ld_256_256_97,Gemm_Hipblaslt_6377,0.0147037
GemmAndBiasTunableOp_float_TN,tn_256_300_256_ld_256_256_256,Gemm_Hipblaslt_6377,0.0238561
GemmAndBiasTunableOp_float_TN,tn_1024_718_512_ld_512_512_1024,Gemm_Hipblaslt_6377,0.336978
GemmAndBiasTunableOp_float_TN,tn_1024_322_512_ld_512_512_1024,Gemm_Hipblaslt_6377,0.161144
GemmAndBiasTunableOp_float_TN,tn_1024_647_512_ld_512_512_1024,Gemm_Hipblaslt_6377,0.315524
GemmAndBiasTunableOp_float_TN,tn_1024_581_512_ld_512_512_1024,Default,0.294507
GemmAndBiasTunableOp_float_TN,tn_1024_737_512_ld_512_512_1024,Default,0.343509
GemmAndBiasTunableOp_float_TN,tn_1024_254_512_ld_512_512_1024,Gemm_Hipblaslt_6377,0.155207
GemmAndBiasTunableOp_float_TN,tn_1024_818_512_ld_512_512_1024,Gemm_Hipblaslt_6377,0.378986
GemmAndBiasTunableOp_float_TN,tn_1024_731_512_ld_512_512_1024,Default,0.342306
GemmAndBiasTunableOp_float_TN,tn_1536_784_512_ld_512_512_1536,Gemm_Hipblaslt_6377,0.51415
GemmAndBiasTunableOp_float_TN,tn_1024_477_512_ld_512_512_1024,Gemm_Hipblaslt_6377,0.213291
GemmAndBiasTunableOp_float_TN,tn_120_564_240_ld_240_240_120,Gemm_Hipblaslt_6376,0.0310552
GemmAndBiasTunableOp_float_TN,tn_1024_905_512_ld_512_512_1024,Gemm_Hipblaslt_6377,0.414761
GemmAndBiasTunableOp_float_TN,tn_1024_258_512_ld_512_512_1024,Gemm_Hipblaslt_6377,0.154073
GemmAndBiasTunableOp_float_TN,tn_1024_172_512_ld_512_512_1024,Gemm_Hipblaslt_6377,0.0923929
GemmAndBiasTunableOp_float_TN,tn_1024_415_512_ld_512_512_1024,Gemm_Hipblaslt_6377,0.192361
GemmAndBiasTunableOp_float_TN,tn_97_255_256_ld_256_256_97,Gemm_Hipblaslt_6377,0.0148267
GemmAndBiasTunableOp_float_TN,tn_120_390_120_ld_120_120_120,Gemm_Hipblaslt_6379,0.0143706
GemmAndBiasTunableOp_float_TN,tn_1024_879_512_ld_512_512_1024,Default,0.395185
GemmAndBiasTunableOp_float_TN,tn_1024_142_512_ld_512_512_1024,Gemm_Hipblaslt_6377,0.0749834
GemmAndBiasTunableOp_float_TN,tn_1024_994_512_ld_512_512_1024,Gemm_Hipblaslt_6377,0.463607
GemmAndBiasTunableOp_float_TN,tn_1024_691_512_ld_512_512_1024,Gemm_Hipblaslt_6377,0.335601
GemmAndBiasTunableOp_float_TN,tn_1024_385_512_ld_512_512_1024,Gemm_Hipblaslt_6377,0.176659
GemmAndBiasTunableOp_float_TN,tn_1024_224_512_ld_512_512_1024,Gemm_Hipblaslt_6377,0.135109
GemmAndBiasTunableOp_float_TN,tn_1024_893_512_ld_512_512_1024,Gemm_Hipblaslt_6377,0.407037
GemmAndBiasTunableOp_float_TN,tn_240_246_120_ld_120_120_240,Gemm_Hipblaslt_6377,0.0134424
GemmAndBiasTunableOp_float_TN,tn_1024_293_512_ld_512_512_1024,Gemm_Hipblaslt_6377,0.143577
GemmAndBiasTunableOp_float_TN,tn_120_246_120_ld_120_120_120,Gemm_Hipblaslt_6379,0.0125581
GemmAndBiasTunableOp_float_TN,tn_1024_998_512_ld_512_512_1024,Default,0.464708
GemmAndBiasTunableOp_float_TN,tn_1024_782_512_ld_512_512_1024,Default,0.365398
GemmAndBiasTunableOp_float_TN,tn_360_246_120_ld_120_120_360,Gemm_Hipblaslt_6377,0.0228389
GemmAndBiasTunableOp_float_TN,tn_1024_376_512_ld_512_512_1024,Gemm_Hipblaslt_6377,0.175779
GemmAndBiasTunableOp_float_TN,tn_1024_948_512_ld_512_512_1024,Gemm_Hipblaslt_6377,0.436064
GemmAndBiasTunableOp_float_TN,tn_1024_140_512_ld_512_512_1024,Gemm_Hipblaslt_6377,0.0755224
GemmAndBiasTunableOp_float_TN,tn_1024_174_512_ld_512_512_1024,Gemm_Hipblaslt_6377,0.0901102
GemmAndBiasTunableOp_float_TN,tn_1024_528_512_ld_512_512_1024,Gemm_Hipblaslt_6377,0.248089
GemmAndBiasTunableOp_float_TN,tn_240_384_120_ld_120_120_240,Gemm_Hipblaslt_6379,0.0229188
GemmAndBiasTunableOp_float_TN,tn_120_606_120_ld_120_120_120,Gemm_Hipblaslt_6377,0.0278075
GemmAndBiasTunableOp_float_TN,tn_240_516_120_ld_120_120_240,Gemm_Hipblaslt_6377,0.0195032
GemmAndBiasTunableOp_float_TN,tn_1024_110_512_ld_512_512_1024,Gemm_Hipblaslt_6377,0.0578263
GemmAndBiasTunableOp_float_TN,tn_1024_296_512_ld_512_512_1024,Gemm_Hipblaslt_6377,0.150513
GemmAndBiasTunableOp_float_TN,tn_1024_906_512_ld_512_512_1024,Default,0.42056
GemmAndBiasTunableOp_float_TN,tn_1024_195_512_ld_512_512_1024,Gemm_Hipblaslt_6377,0.105488
GemmAndBiasTunableOp_float_TN,tn_120_420_120_ld_120_120_120,Gemm_Hipblaslt_6377,0.0125364
GemmAndBiasTunableOp_float_TN,tn_240_745_120_ld_120_120_240,Gemm_Hipblaslt_6377,0.0249914
GemmAndBiasTunableOp_float_TN,tn_120_252_240_ld_240_240_120,Gemm_Hipblaslt_6377,0.0146876
GemmAndBiasTunableOp_float_TN,tn_256_79_512_ld_512_512_256,Gemm_Hipblaslt_6376,0.0215678
GemmAndBiasTunableOp_float_TN,tn_1024_1012_512_ld_512_512_1024,Gemm_Hipblaslt_6377,0.462335
GemmAndBiasTunableOp_float_TN,tn_1024_442_512_ld_512_512_1024,Gemm_Hipblaslt_6377,0.190621
GemmAndBiasTunableOp_float_TN,tn_1024_213_512_ld_512_512_1024,Gemm_Hipblaslt_6377,0.11638
GemmAndBiasTunableOp_float_TN,tn_1024_739_512_ld_512_512_1024,Default,0.347451
GemmAndBiasTunableOp_float_TN,tn_1024_594_512_ld_512_512_1024,Gemm_Hipblaslt_6377,0.301407
GemmAndBiasTunableOp_float_TN,tn_1024_949_512_ld_512_512_1024,Gemm_Hipblaslt_6377,0.434057
GemmAndBiasTunableOp_float_TN,tn_1024_248_512_ld_512_512_1024,Gemm_Hipblaslt_6377,0.149256
GemmAndBiasTunableOp_float_TN,tn_1024_64_512_ld_512_512_1024,Gemm_Hipblaslt_6377,0.0376299
GemmAndBiasTunableOp_float_TN,tn_1024_978_512_ld_512_512_1024,Gemm_Hipblaslt_6377,0.453894
GemmAndBiasTunableOp_float_TN,tn_1024_147_512_ld_512_512_1024,Gemm_Hipblaslt_6377,0.0800658
GemmAndBiasTunableOp_float_TN,tn_97_495_256_ld_256_256_97,Gemm_Hipblaslt_6377,0.0184851
GemmAndBiasTunableOp_float_TN,tn_1024_523_512_ld_512_512_1024,Gemm_Hipblaslt_6377,0.251017
GemmAndBiasTunableOp_float_TN,tn_240_786_120_ld_120_120_240,Gemm_Hipblaslt_6377,0.0262357
GemmAndBiasTunableOp_float_TN,tn_1024_421_512_ld_512_512_1024,Gemm_Hipblaslt_6377,0.197183
GemmAndBiasTunableOp_float_TN,tn_1024_645_512_ld_512_512_1024,Gemm_Hipblaslt_6377,0.316197
GemmAndBiasTunableOp_float_TN,tn_1024_295_512_ld_512_512_1024,Gemm_Hipblaslt_6377,0.154026
GemmAndBiasTunableOp_float_TN,tn_1024_337_512_ld_512_512_1024,Gemm_Hipblaslt_6377,0.160969
GemmAndBiasTunableOp_float_TN,tn_1024_556_512_ld_512_512_1024,Gemm_Hipblaslt_6377,0.285834
GemmAndBiasTunableOp_float_TN,tn_120_1374_240_ld_240_240_120,Gemm_Hipblaslt_6377,0.0477759
GemmAndBiasTunableOp_float_TN,tn_97_15_256_ld_256_256_97,Gemm_Hipblaslt_6378,0.0121132
GemmAndBiasTunableOp_float_TN,tn_1024_277_512_ld_512_512_1024,Gemm_Hipblaslt_6377,0.153459
GemmAndBiasTunableOp_float_TN,tn_256_575_512_ld_512_512_256,Gemm_Hipblaslt_6377,0.0748418
GemmAndBiasTunableOp_float_TN,tn_1024_387_512_ld_512_512_1024,Gemm_Hipblaslt_6377,0.180593
GemmAndBiasTunableOp_float_TN,tn_120_432_240_ld_240_240_120,Gemm_Hipblaslt_6377,0.0179393
GemmAndBiasTunableOp_float_TN,tn_1024_705_512_ld_512_512_1024,Gemm_Hipblaslt_6377,0.340987
GemmAndBiasTunableOp_float_TN,tn_1024_362_512_ld_512_512_1024,Gemm_Hipblaslt_6377,0.169204
GemmAndBiasTunableOp_float_TN,tn_1024_301_512_ld_512_512_1024,Gemm_Hipblaslt_6377,0.151676
GemmAndBiasTunableOp_float_TN,tn_1024_373_512_ld_512_512_1024,Gemm_Hipblaslt_6377,0.174172
GemmAndBiasTunableOp_float_TN,tn_1024_308_512_ld_512_512_1024,Gemm_Hipblaslt_6377,0.156629
GemmAndBiasTunableOp_float_TN,tn_1024_894_512_ld_512_512_1024,Default,0.414682
GemmAndBiasTunableOp_float_TN,tn_2_2_200_ld_200_200_2,Gemm_Hipblaslt_6376,0.0117838
GemmAndBiasTunableOp_float_TN,tn_1024_104_512_ld_512_512_1024,Gemm_Hipblaslt_6377,0.0576617
GemmAndBiasTunableOp_float_TN,tn_120_318_120_ld_120_120_120,Gemm_Hipblaslt_6377,0.0113173
GemmAndBiasTunableOp_float_TN,tn_1024_1001_512_ld_512_512_1024,Gemm_Hipblaslt_6377,0.457014
GemmAndBiasTunableOp_float_TN,tn_1024_488_512_ld_512_512_1024,Gemm_Hipblaslt_6377,0.230328
GemmAndBiasTunableOp_float_TN,tn_1024_365_512_ld_512_512_1024,Gemm_Hipblaslt_6377,0.173875
GemmAndBiasTunableOp_float_TN,tn_120_1050_120_ld_120_120_120,Gemm_Hipblaslt_6377,0.0203547
GemmAndBiasTunableOp_float_TN,tn_1024_189_512_ld_512_512_1024,Gemm_Hipblaslt_6377,0.100127
GemmAndBiasTunableOp_float_TN,tn_1024_267_512_ld_512_512_1024,Gemm_Hipblaslt_6377,0.135498
GemmAndBiasTunableOp_float_TN,tn_1024_185_512_ld_512_512_1024,Gemm_Hipblaslt_6377,0.0958831
GemmAndBiasTunableOp_float_TN,tn_1024_88_512_ld_512_512_1024,Gemm_Hipblaslt_6377,0.0506004
GemmAndBiasTunableOp_float_TN,tn_1024_261_512_ld_512_512_1024,Gemm_Hipblaslt_6377,0.163276
GemmAndBiasTunableOp_float_TN,tn_1024_19_512_ld_512_512_1024,Gemm_Hipblaslt_6376,0.0266713
GemmAndBiasTunableOp_float_TN,tn_1024_433_512_ld_512_512_1024,Gemm_Hipblaslt_6377,0.200078
GemmAndBiasTunableOp_float_TN,tn_512_784_1024_ld_1024_1024_512,Gemm_Hipblaslt_6377,0.360793
GemmAndBiasTunableOp_float_TN,tn_1024_566_512_ld_512_512_1024,Gemm_Hipblaslt_6377,0.28828
GemmAndBiasTunableOp_float_TN,tn_1024_99_512_ld_512_512_1024,Gemm_Hipblaslt_6377,0.0579337
GemmAndBiasTunableOp_float_TN,tn_1024_382_512_ld_512_512_1024,Gemm_Hipblaslt_6377,0.175303
GemmAndBiasTunableOp_float_TN,tn_360_864_120_ld_120_120_360,Gemm_Hipblaslt_6377,0.0433604
GemmAndBiasTunableOp_float_TN,tn_256_143_512_ld_512_512_256,Gemm_Hipblaslt_6377,0.0248937
GemmAndBiasTunableOp_float_TN,tn_1024_646_512_ld_512_512_1024,Gemm_Hipblaslt_6377,0.313398
GemmAndBiasTunableOp_float_TN,tn_1024_161_512_ld_512_512_1024,Gemm_Hipblaslt_6377,0.0910817
GemmAndBiasTunableOp_float_TN,tn_1024_674_512_ld_512_512_1024,Gemm_Hipblaslt_6377,0.323071
GemmAndBiasTunableOp_float_TN,tn_1024_828_512_ld_512_512_1024,Gemm_Hipblaslt_6377,0.383665
GemmAndBiasTunableOp_float_TN,tn_120_570_120_ld_120_120_120,Gemm_Hipblaslt_6377,0.0142789
GemmAndBiasTunableOp_float_TN,tn_1024_682_512_ld_512_512_1024,Gemm_Hipblaslt_6377,0.324349
GemmAndBiasTunableOp_float_TN,tn_1024_588_512_ld_512_512_1024,Default,0.294989
GemmAndBiasTunableOp_float_TN,tn_120_510_120_ld_120_120_120,Gemm_Hipblaslt_6377,0.01346
GemmAndBiasTunableOp_float_TN,tn_1024_876_512_ld_512_512_1024,Default,0.428618
GemmAndBiasTunableOp_float_TN,tn_1024_184_512_ld_512_512_1024,Gemm_Hipblaslt_6377,0.0987621
GemmAndBiasTunableOp_float_TN,tn_240_212_120_ld_120_120_240,Gemm_Hipblaslt_6377,0.0122602
GemmAndBiasTunableOp_float_TN,tn_360_360_120_ld_120_120_360,Gemm_Hipblaslt_6377,0.0205459
GemmAndBiasTunableOp_float_TN,tn_1024_438_512_ld_512_512_1024,Gemm_Hipblaslt_6377,0.19682
GemmAndBiasTunableOp_float_TN,tn_1024_250_512_ld_512_512_1024,Gemm_Hipblaslt_6377,0.124684
GemmAndBiasTunableOp_float_TN,tn_1024_862_512_ld_512_512_1024,Default,0.401015
GemmAndBiasTunableOp_float_TN,tn_1024_976_512_ld_512_512_1024,Default,0.445814
GemmAndBiasTunableOp_float_TN,tn_1024_584_512_ld_512_512_1024,Default,0.297778
GemmAndBiasTunableOp_float_TN,tn_1024_194_512_ld_512_512_1024,Gemm_Hipblaslt_6377,0.10512
GemmAndBiasTunableOp_float_TN,tn_1024_349_512_ld_512_512_1024,Gemm_Hipblaslt_6377,0.166559
GemmAndBiasTunableOp_float_TN,tn_1024_804_512_ld_512_512_1024,Default,0.37623
GemmAndBiasTunableOp_float_TN,tn_1024_822_512_ld_512_512_1024,Gemm_Hipblaslt_6377,0.382031
GemmAndBiasTunableOp_float_TN,tn_1024_784_512_ld_512_512_1024,Gemm_Hipblaslt_6377,0.317215
GemmAndBiasTunableOp_float_TN,tn_1024_171_512_ld_512_512_1024,Gemm_Hipblaslt_6377,0.0886022
GemmAndBiasTunableOp_float_TN,tn_512_784_512_ld_512_512_512,Gemm_Hipblaslt_6377,0.161532
GemmAndBiasTunableOp_float_TN,tn_1024_444_512_ld_512_512_1024,Gemm_Hipblaslt_6377,0.191482
GemmAndBiasTunableOp_float_TN,tn_1024_658_512_ld_512_512_1024,Gemm_Hipblaslt_6377,0.31619
GemmAndBiasTunableOp_float_TN,tn_1024_396_512_ld_512_512_1024,Gemm_Hipblaslt_6377,0.177323
GemmAndBiasTunableOp_float_TN,tn_2_4_200_ld_200_200_2,Gemm_Hipblaslt_6378,0.0123728
GemmAndBiasTunableOp_float_TN,tn_1024_700_512_ld_512_512_1024,Gemm_Hipblaslt_6377,0.331317
GemmAndBiasTunableOp_float_TN,tn_1024_587_512_ld_512_512_1024,Default,0.301316
GemmAndBiasTunableOp_float_TN,tn_1024_652_512_ld_512_512_1024,Gemm_Hipblaslt_6377,0.322365
GemmAndBiasTunableOp_float_TN,tn_256_255_512_ld_512_512_256,Gemm_Hipblaslt_6377,0.0350519
GemmAndBiasTunableOp_float_TN,tn_1024_481_512_ld_512_512_1024,Gemm_Hipblaslt_6377,0.221396
GemmAndBiasTunableOp_float_TN,tn_1024_409_512_ld_512_512_1024,Gemm_Hipblaslt_6377,0.186563
GemmAndBiasTunableOp_float_TN,tn_1024_832_512_ld_512_512_1024,Default,0.389689
GemmAndBiasTunableOp_float_TN,tn_360_252_120_ld_120_120_360,Gemm_Hipblaslt_6377,0.0161977
GemmAndBiasTunableOp_float_TN,tn_1024_243_512_ld_512_512_1024,Gemm_Hipblaslt_6377,0.137425
GemmAndBiasTunableOp_float_TN,tn_1024_987_512_ld_512_512_1024,Default,0.452801
GemmAndBiasTunableOp_float_TN,tn_1024_776_512_ld_512_512_1024,Default,0.364711
GemmAndBiasTunableOp_float_TN,tn_1024_709_512_ld_512_512_1024,Gemm_Hipblaslt_6377,0.339423
GemmAndBiasTunableOp_float_TN,tn_4_16800_256_ld_256_256_4,Gemm_Hipblaslt_6376,0.0554635
GemmAndBiasTunableOp_float_TN,tn_120_282_120_ld_120_120_120,Gemm_Hipblaslt_6379,0.0127263
GemmAndBiasTunableOp_float_TN,tn_1024_86_512_ld_512_512_1024,Gemm_Hipblaslt_6377,0.0507947
GemmAndBiasTunableOp_float_TN,tn_1024_845_512_ld_512_512_1024,Gemm_Hipblaslt_6377,0.403945
GemmAndBiasTunableOp_float_TN,tn_1024_611_512_ld_512_512_1024,Gemm_Hipblaslt_6377,0.301097
GemmAndBiasTunableOp_float_TN,tn_1024_860_512_ld_512_512_1024,Default,0.404248
GemmAndBiasTunableOp_float_TN,tn_1024_368_512_ld_512_512_1024,Gemm_Hipblaslt_6377,0.165928
GemmAndBiasTunableOp_float_TN,tn_1024_740_512_ld_512_512_1024,Gemm_Hipblaslt_6377,0.345787
GemmAndBiasTunableOp_float_TN,tn_1024_965_512_ld_512_512_1024,Gemm_Hipblaslt_6377,0.43951
GemmAndBiasTunableOp_float_TN,tn_360_258_120_ld_120_120_360,Gemm_Hipblaslt_6377,0.0168456
GemmAndBiasTunableOp_float_TN,tn_1024_356_512_ld_512_512_1024,Gemm_Hipblaslt_6377,0.169244
GemmAndBiasTunableOp_float_TN,tn_1024_357_512_ld_512_512_1024,Gemm_Hipblaslt_6377,0.166259
GemmAndBiasTunableOp_float_TN,tn_1024_16_512_ld_512_512_1024,Gemm_Hipblaslt_6378,0.0239775
GemmAndBiasTunableOp_float_TN,tn_1024_742_512_ld_512_512_1024,Gemm_Hipblaslt_6377,0.346736
GemmAndBiasTunableOp_float_TN,tn_256_300_512_ld_512_512_256,Gemm_Hipblaslt_6377,0.0419782
GemmAndBiasTunableOp_float_TN,tn_1024_398_512_ld_512_512_1024,Gemm_Hipblaslt_6377,0.186918
GemmAndBiasTunableOp_float_TN,tn_1024_306_512_ld_512_512_1024,Gemm_Hipblaslt_6377,0.157458
GemmAndBiasTunableOp_float_TN,tn_1024_618_512_ld_512_512_1024,Default,0.310412
GemmAndBiasTunableOp_float_TN,tn_1024_92_512_ld_512_512_1024,Gemm_Hipblaslt_6377,0.0505679
GemmAndBiasTunableOp_float_TN,tn_1024_286_512_ld_512_512_1024,Gemm_Hipblaslt_6377,0.138138
GemmAndBiasTunableOp_float_TN,tn_1024_806_512_ld_512_512_1024,Gemm_Hipblaslt_6377,0.379086
GemmAndBiasTunableOp_float_TN,tn_1024_166_512_ld_512_512_1024,Gemm_Hipblaslt_6377,0.0906906
GemmAndBiasTunableOp_float_TN,tn_1024_895_512_ld_512_512_1024,Default,0.407157
GemmAndBiasTunableOp_float_TN,tn_1024_772_512_ld_512_512_1024,Gemm_Hipblaslt_6377,0.35807
GemmAndBiasTunableOp_float_TN,tn_1024_534_512_ld_512_512_1024,Gemm_Hipblaslt_6377,0.274395
GemmAndBiasTunableOp_float_TN,tn_120_618_120_ld_120_120_120,Gemm_Hipblaslt_6377,0.0147694
GemmAndBiasTunableOp_float_TN,tn_1024_979_512_ld_512_512_1024,Gemm_Hipblaslt_6377,0.445915
GemmAndBiasTunableOp_float_TN,tn_120_330_120_ld_120_120_120,Gemm_Hipblaslt_6377,0.0112248
GemmAndBiasTunableOp_float_TN,tn_1024_294_512_ld_512_512_1024,Gemm_Hipblaslt_6377,0.151723
GemmAndBiasTunableOp_float_TN,tn_240_432_120_ld_120_120_240,Gemm_Hipblaslt_6377,0.017488
GemmAndBiasTunableOp_float_TN,tn_1024_145_512_ld_512_512_1024,Gemm_Hipblaslt_6377,0.0829768
GemmAndBiasTunableOp_float_TN,tn_1024_625_512_ld_512_512_1024,Gemm_Hipblaslt_6377,0.311532
GemmAndBiasTunableOp_float_TN,tn_1024_532_512_ld_512_512_1024,Gemm_Hipblaslt_6377,0.258908
GemmAndBiasTunableOp_float_TN,tn_1024_922_512_ld_512_512_1024,Gemm_Hipblaslt_6377,0.425688
GemmAndBiasTunableOp_float_TN,tn_1024_363_512_ld_512_512_1024,Gemm_Hipblaslt_6377,0.167659
GemmAndBiasTunableOp_float_TN,tn_1024_37_512_ld_512_512_1024,Gemm_Hipblaslt_6377,0.030372
GemmAndBiasTunableOp_float_TN,tn_120_606_240_ld_240_240_120,Gemm_Hipblaslt_6379,0.0286739
GemmAndBiasTunableOp_float_TN,tn_1024_781_512_ld_512_512_1024,Gemm_Hipblaslt_6377,0.365348
GemmAndBiasTunableOp_float_TN,tn_1024_562_512_ld_512_512_1024,Gemm_Hipblaslt_6377,0.288277
GemmAndBiasTunableOp_float_TN,tn_1024_944_512_ld_512_512_1024,Gemm_Hipblaslt_6377,0.428566
GemmAndBiasTunableOp_float_TN,tn_1024_222_512_ld_512_512_1024,Gemm_Hipblaslt_6377,0.124694
GemmAndBiasTunableOp_float_TN,tn_1024_602_512_ld_512_512_1024,Default,0.303208
GemmAndBiasTunableOp_float_TN,tn_120_342_240_ld_240_240_120,Gemm_Hipblaslt_6377,0.0163512
GemmAndBiasTunableOp_float_TN,tn_1024_298_512_ld_512_512_1024,Gemm_Hipblaslt_6377,0.150006
GemmAndBiasTunableOp_float_TN,tn_1024_139_512_ld_512_512_1024,Gemm_Hipblaslt_6377,0.0757083
GemmAndBiasTunableOp_float_TN,tn_1024_881_512_ld_512_512_1024,Default,0.405803
GemmAndBiasTunableOp_float_TN,tn_1024_590_512_ld_512_512_1024,Gemm_Hipblaslt_6377,0.300344
GemmAndBiasTunableOp_float_TN,tn_120_360_120_ld_120_120_120,Gemm_Hipblaslt_6377,0.0117243
GemmAndBiasTunableOp_float_TN,tn_17_600_256_ld_256_256_17,Gemm_Hipblaslt_6376,0.0128189
GemmAndBiasTunableOp_float_TN,tn_120_330_240_ld_240_240_120,Gemm_Hipblaslt_6377,0.0163795
GemmAndBiasTunableOp_float_TN,tn_1024_156_512_ld_512_512_1024,Gemm_Hipblaslt_6377,0.0820447
GemmAndBiasTunableOp_float_TN,tn_1024_252_512_ld_512_512_1024,Gemm_Hipblaslt_6377,0.125275
GemmAndBiasTunableOp_float_TN,tn_1024_762_512_ld_512_512_1024,Default,0.359689
GemmAndBiasTunableOp_float_TN,tn_1024_923_512_ld_512_512_1024,Gemm_Hipblaslt_6377,0.419085
GemmAndBiasTunableOp_float_TN,tn_1024_506_512_ld_512_512_1024,Gemm_Hipblaslt_6377,0.227371
GemmAndBiasTunableOp_float_TN,tn_360_402_120_ld_120_120_360,Gemm_Hipblaslt_6377,0.0222045
GemmAndBiasTunableOp_float_TN,tn_1024_351_512_ld_512_512_1024,Gemm_Hipblaslt_6377,0.164889
GemmAndBiasTunableOp_float_TN,tn_1024_379_512_ld_512_512_1024,Gemm_Hipblaslt_6377,0.17344
GemmAndBiasTunableOp_float_TN,tn_1024_780_512_ld_512_512_1024,Gemm_Hipblaslt_6377,0.38467
GemmAndBiasTunableOp_float_TN,tn_1024_232_512_ld_512_512_1024,Gemm_Hipblaslt_6377,0.117953
GemmAndBiasTunableOp_float_TN,tn_360_306_120_ld_120_120_360,Gemm_Hipblaslt_6377,0.0181766
GemmAndBiasTunableOp_float_TN,tn_1024_367_512_ld_512_512_1024,Gemm_Hipblaslt_6377,0.168437
GemmAndBiasTunableOp_float_TN,tn_1024_744_512_ld_512_512_1024,Gemm_Hipblaslt_6377,0.345492
GemmAndBiasTunableOp_float_TN,tn_1024_799_512_ld_512_512_1024,Gemm_Hipblaslt_6377,0.376269
GemmAndBiasTunableOp_float_TN,tn_1024_747_512_ld_512_512_1024,Default,0.349031
GemmAndBiasTunableOp_float_TN,tn_1024_352_512_ld_512_512_1024,Gemm_Hipblaslt_6377,0.167516
GemmAndBiasTunableOp_float_TN,tn_120_738_240_ld_240_240_120,Gemm_Hipblaslt_6377,0.0262874
GemmAndBiasTunableOp_float_TN,tn_1024_515_512_ld_512_512_1024,Gemm_Hipblaslt_6377,0.260136
GemmAndBiasTunableOp_float_TN,tn_120_576_120_ld_120_120_120,Gemm_Hipblaslt_6377,0.0140866
GemmAndBiasTunableOp_float_TN,tn_1024_995_512_ld_512_512_1024,Gemm_Hipblaslt_6377,0.458321
GemmAndBiasTunableOp_float_TN,tn_1024_251_512_ld_512_512_1024,Gemm_Hipblaslt_6377,0.136446
GemmAndBiasTunableOp_float_TN,tn_1024_917_512_ld_512_512_1024,Default,0.425592
GemmAndBiasTunableOp_float_TN,tn_1024_746_512_ld_512_512_1024,Default,0.350089
GemmAndBiasTunableOp_float_TN,tn_120_450_240_ld_240_240_120,Gemm_Hipblaslt_6377,0.0312091
GemmAndBiasTunableOp_float_TN,tn_1024_402_512_ld_512_512_1024,Gemm_Hipblaslt_6377,0.184368
GemmAndBiasTunableOp_float_TN,tn_1024_651_512_ld_512_512_1024,Gemm_Hipblaslt_6377,0.318181
GemmAndBiasTunableOp_float_TN,tn_120_894_240_ld_240_240_120,Gemm_Hipblaslt_6377,0.0308392
GemmAndBiasTunableOp_float_TN,tn_1024_60_512_ld_512_512_1024,Gemm_Hipblaslt_6377,0.0371037
GemmAndBiasTunableOp_float_TN,tn_120_570_240_ld_240_240_120,Gemm_Hipblaslt_6377,0.0218503
GemmAndBiasTunableOp_float_TN,tn_120_492_120_ld_120_120_120,Gemm_Hipblaslt_6377,0.0133495
GemmAndBiasTunableOp_float_TN,tn_1024_582_512_ld_512_512_1024,Default,0.298883
GemmAndBiasTunableOp_float_TN,tn_1024_614_512_ld_512_512_1024,Gemm_Hipblaslt_6377,0.301199
GemmAndBiasTunableOp_float_TN,tn_1024_778_512_ld_512_512_1024,Gemm_Hipblaslt_6377,0.365245
GemmAndBiasTunableOp_float_TN,tn_1024_824_512_ld_512_512_1024,Default,0.387074
GemmAndBiasTunableOp_float_TN,tn_1024_1010_512_ld_512_512_1024,Default,0.47261
GemmAndBiasTunableOp_float_TN,tn_1024_977_512_ld_512_512_1024,Gemm_Hipblaslt_6377,0.446651
GemmAndBiasTunableOp_float_TN,tn_120_392_120_ld_120_120_120,Gemm_Hipblaslt_6377,0.0116419
GemmAndBiasTunableOp_float_TN,tn_1024_443_512_ld_512_512_1024,Gemm_Hipblaslt_6377,0.190951
GemmAndBiasTunableOp_float_TN,tn_360_1050_120_ld_120_120_360,Gemm_Hipblaslt_6377,0.0446885
GemmAndBiasTunableOp_float_TN,tn_1024_264_512_ld_512_512_1024,Gemm_Hipblaslt_6377,0.132778
GemmAndBiasTunableOp_float_TN,tn_1024_238_512_ld_512_512_1024,Gemm_Hipblaslt_6377,0.135646
GemmAndBiasTunableOp_float_TN,tn_240_606_120_ld_120_120_240,Gemm_Hipblaslt_6376,0.0323733
GemmAndBiasTunableOp_float_TN,tn_1024_447_512_ld_512_512_1024,Gemm_Hipblaslt_6377,0.19501
GemmAndBiasTunableOp_float_TN,tn_1024_616_512_ld_512_512_1024,Gemm_Hipblaslt_6377,0.309915
GemmAndBiasTunableOp_float_TN,tn_1024_719_512_ld_512_512_1024,Default,0.33782
GemmAndBiasTunableOp_float_TN,tn_1024_604_512_ld_512_512_1024,Gemm_Hipblaslt_6377,0.296095
GemmAndBiasTunableOp_float_TN,tn_1024_27_512_ld_512_512_1024,Gemm_Hipblaslt_6377,0.0267844
GemmAndBiasTunableOp_float_TN,tn_1024_650_512_ld_512_512_1024,Gemm_Hipblaslt_6377,0.312087
GemmAndBiasTunableOp_float_TN,tn_1024_712_512_ld_512_512_1024,Gemm_Hipblaslt_6377,0.334404
GemmAndBiasTunableOp_float_TN,tn_1024_598_512_ld_512_512_1024,Gemm_Hipblaslt_6377,0.295795
GemmAndBiasTunableOp_float_TN,tn_1024_680_512_ld_512_512_1024,Gemm_Hipblaslt_6377,0.324032
GemmAndBiasTunableOp_float_TN,tn_1024_552_512_ld_512_512_1024,Gemm_Hipblaslt_6377,0.288702
GemmAndBiasTunableOp_float_TN,tn_120_930_240_ld_240_240_120,Gemm_Hipblaslt_6377,0.0312704
GemmAndBiasTunableOp_float_TN,tn_1024_372_512_ld_512_512_1024,Gemm_Hipblaslt_6377,0.173588
GemmAndBiasTunableOp_float_TN,tn_240_288_120_ld_120_120_240,Gemm_Hipblaslt_6377,0.0134914
GemmAndBiasTunableOp_float_TN,tn_240_624_120_ld_120_120_240,Gemm_Hipblaslt_6377,0.0273738
GemmAndBiasTunableOp_float_TN,tn_120_618_240_ld_240_240_120,Gemm_Hipblaslt_6377,0.0227531
GemmAndBiasTunableOp_float_TN,tn_1024_1021_512_ld_512_512_1024,Gemm_Hipblaslt_6377,0.467418
GemmAndBiasTunableOp_float_TN,tn_1024_849_512_ld_512_512_1024,Gemm_Hipblaslt_6377,0.394067
GemmAndBiasTunableOp_float_TN,tn_1024_454_512_ld_512_512_1024,Gemm_Hipblaslt_6377,0.19748
GemmAndBiasTunableOp_float_TN,tn_1024_787_512_ld_512_512_1024,Default,0.370276
GemmAndBiasTunableOp_float_TN,tn_1024_235_512_ld_512_512_1024,Gemm_Hipblaslt_6377,0.127368
GemmAndBiasTunableOp_float_TN,tn_240_780_120_ld_120_120_240,Gemm_Hipblaslt_6377,0.0268857
GemmAndBiasTunableOp_float_TN,tn_1024_59_512_ld_512_512_1024,Gemm_Hipblaslt_6377,0.0373426
GemmAndBiasTunableOp_float_TN,tn_120_240_240_ld_240_240_120,Gemm_Hipblaslt_6377,0.0142648
GemmAndBiasTunableOp_float_TN,tn_1024_681_512_ld_512_512_1024,Gemm_Hipblaslt_6377,0.328711
GemmAndBiasTunableOp_float_TN,tn_1024_281_512_ld_512_512_1024,Gemm_Hipblaslt_6377,0.137381
GemmAndBiasTunableOp_float_TN,tn_1024_920_512_ld_512_512_1024,Gemm_Hipblaslt_6377,0.424204
GemmAndBiasTunableOp_float_TN,tn_360_570_120_ld_120_120_360,Gemm_Hipblaslt_6377,0.0287797
GemmAndBiasTunableOp_float_TN,tn_120_672_120_ld_120_120_120,Gemm_Hipblaslt_6377,0.0153468
GemmAndBiasTunableOp_float_TN,tn_1024_128_512_ld_512_512_1024,Gemm_Hipblaslt_6377,0.0642608
GemmAndBiasTunableOp_float_TN,tn_120_372_120_ld_120_120_120,Gemm_Hipblaslt_6377,0.0119168
GemmAndBiasTunableOp_float_TN,tn_1024_783_512_ld_512_512_1024,Default,0.359083
GemmAndBiasTunableOp_float_TN,tn_1024_688_512_ld_512_512_1024,Gemm_Hipblaslt_6377,0.328842
GemmAndBiasTunableOp_float_TN,tn_360_564_120_ld_120_120_360,Gemm_Hipblaslt_6377,0.0308925
GemmAndBiasTunableOp_float_TN,tn_240_1374_120_ld_120_120_240,Gemm_Hipblaslt_6379,0.0540524
GemmAndBiasTunableOp_float_TN,tn_240_372_120_ld_120_120_240,Gemm_Hipblaslt_6377,0.0158634
GemmAndBiasTunableOp_float_TN,tn_1024_223_512_ld_512_512_1024,Gemm_Hipblaslt_6377,0.122052
GemmAndBiasTunableOp_float_TN,tn_1024_236_512_ld_512_512_1024,Gemm_Hipblaslt_6377,0.115936
GemmAndBiasTunableOp_float_TN,tn_360_420_120_ld_120_120_360,Gemm_Hipblaslt_6377,0.0228725
GemmAndBiasTunableOp_float_TN,tn_1024_199_512_ld_512_512_1024,Gemm_Hipblaslt_6377,0.108749
GemmAndBiasTunableOp_float_TN,tn_1024_800_512_ld_512_512_1024,Gemm_Hipblaslt_6377,0.36982
GemmAndBiasTunableOp_float_TN,tn_1024_121_512_ld_512_512_1024,Gemm_Hipblaslt_6377,0.0761095
GemmAndBiasTunableOp_float_TN,tn_1024_531_512_ld_512_512_1024,Gemm_Hipblaslt_6377,0.251576
GemmAndBiasTunableOp_float_TN,tn_360_618_120_ld_120_120_360,Gemm_Hipblaslt_6377,0.0300173
GemmAndBiasTunableOp_float_TN,tn_120_591_120_ld_120_120_120,Gemm_Hipblaslt_6377,0.0246993
GemmAndBiasTunableOp_float_TN,tn_1024_324_512_ld_512_512_1024,Gemm_Hipblaslt_6377,0.162398
GemmAndBiasTunableOp_float_TN,tn_1024_892_512_ld_512_512_1024,Gemm_Hipblaslt_6377,0.410886
GemmAndBiasTunableOp_float_TN,tn_1024_272_512_ld_512_512_1024,Gemm_Hipblaslt_6377,0.130976
GemmAndBiasTunableOp_float_TN,tn_1024_400_256_ld_256_256_1024,Gemm_Hipblaslt_6377,0.0916396
GemmAndBiasTunableOp_float_TN,tn_1024_966_512_ld_512_512_1024,Gemm_Hipblaslt_6377,0.450692
GemmAndBiasTunableOp_float_TN,tn_1024_11_512_ld_512_512_1024,Gemm_Hipblaslt_6378,0.0241097
GemmAndBiasTunableOp_float_TN,tn_4_300_256_ld_256_256_4,Gemm_Hipblaslt_6378,0.0126434
GemmAndBiasTunableOp_float_TN,tn_1024_522_512_ld_512_512_1024,Gemm_Hipblaslt_6377,0.243646
GemmAndBiasTunableOp_float_TN,tn_1024_465_512_ld_512_512_1024,Gemm_Hipblaslt_6377,0.208327
GemmAndBiasTunableOp_float_TN,tn_1024_423_512_ld_512_512_1024,Gemm_Hipblaslt_6377,0.189604
GemmAndBiasTunableOp_float_TN,tn_1024_34_512_ld_512_512_1024,Gemm_Hipblaslt_6377,0.0301863
GemmAndBiasTunableOp_float_TN,tn_1024_67_512_ld_512_512_1024,Gemm_Hipblaslt_6377,0.0424382
GemmAndBiasTunableOp_float_TN,tn_1024_228_512_ld_512_512_1024,Gemm_Hipblaslt_6377,0.154004
GemmAndBiasTunableOp_float_TN,tn_1024_609_512_ld_512_512_1024,Gemm_Hipblaslt_6377,0.307118
GemmAndBiasTunableOp_float_TN,tn_240_240_120_ld_120_120_240,Gemm_Hipblaslt_6377,0.0124362
GemmAndBiasTunableOp_float_TN,tn_360_384_120_ld_120_120_360,Gemm_Hipblaslt_6377,0.0297488
GemmAndBiasTunableOp_float_TN,tn_1024_936_512_ld_512_512_1024,Default,0.426336
GemmAndBiasTunableOp_float_TN,tn_240_276_120_ld_120_120_240,Gemm_Hipblaslt_6377,0.014492
GemmAndBiasTunableOp_float_TN,tn_120_1374_120_ld_120_120_120,Gemm_Hipblaslt_6379,0.0330048
GemmAndBiasTunableOp_float_TN,tn_1024_593_512_ld_512_512_1024,Default,0.307092
GemmAndBiasTunableOp_float_TN,tn_1024_805_512_ld_512_512_1024,Default,0.373336
GemmAndBiasTunableOp_float_TN,tn_1024_459_512_ld_512_512_1024,Gemm_Hipblaslt_6377,0.199121
GemmAndBiasTunableOp_float_TN,tn_1024_347_512_ld_512_512_1024,Gemm_Hipblaslt_6377,0.168415
GemmAndBiasTunableOp_float_TN,tn_1024_1013_512_ld_512_512_1024,Gemm_Hipblaslt_6377,0.466296
GemmAndBiasTunableOp_float_TN,tn_1024_201_512_ld_512_512_1024,Gemm_Hipblaslt_6377,0.115847
GemmAndBiasTunableOp_float_TN,tn_1024_835_512_ld_512_512_1024,Gemm_Hipblaslt_6377,0.38926
GemmAndBiasTunableOp_float_TN,tn_1024_848_512_ld_512_512_1024,Gemm_Hipblaslt_6377,0.389696
GemmAndBiasTunableOp_float_TN,tn_1024_685_512_ld_512_512_1024,Default,0.331272
GemmAndBiasTunableOp_float_TN,tn_120_444_240_ld_240_240_120,Gemm_Hipblaslt_6377,0.0185152
GemmAndBiasTunableOp_float_TN,tn_1024_619_512_ld_512_512_1024,Gemm_Hipblaslt_6377,0.307929
GemmAndBiasTunableOp_float_TN,tn_120_780_240_ld_240_240_120,Gemm_Hipblaslt_6379,0.0337911
GemmAndBiasTunableOp_float_TN,tn_1024_548_512_ld_512_512_1024,Gemm_Hipblaslt_6377,0.282838
GemmAndBiasTunableOp_float_TN,tn_1024_452_512_ld_512_512_1024,Gemm_Hipblaslt_6377,0.208894
GemmAndBiasTunableOp_float_TN,tn_240_354_120_ld_120_120_240,Gemm_Hipblaslt_6377,0.0157768
GemmAndBiasTunableOp_float_TN,tn_1024_205_512_ld_512_512_1024,Gemm_Hipblaslt_6377,0.108084
GemmAndBiasTunableOp_float_TN,tn_360_810_120_ld_120_120_360,Gemm_Hipblaslt_6377,0.0406276
GemmAndBiasTunableOp_float_TN,tn_120_444_120_ld_120_120_120,Gemm_Hipblaslt_6377,0.0127536
GemmAndBiasTunableOp_float_TN,tn_1024_193_512_ld_512_512_1024,Gemm_Hipblaslt_6377,0.116032
GemmAndBiasTunableOp_float_TN,tn_1024_5_512_ld_512_512_1024,Gemm_Hipblaslt_6378,0.0219718
GemmAndBiasTunableOp_float_TN,tn_1024_45_512_ld_512_512_1024,Gemm_Hipblaslt_6377,0.0305126
GemmAndBiasTunableOp_float_TN,tn_1024_492_512_ld_512_512_1024,Gemm_Hipblaslt_6377,0.22147
GemmAndBiasTunableOp_float_TN,tn_1024_621_512_ld_512_512_1024,Gemm_Hipblaslt_6377,0.307026
GemmAndBiasTunableOp_float_TN,tn_1024_560_512_ld_512_512_1024,Gemm_Hipblaslt_6377,0.279163
GemmAndBiasTunableOp_float_TN,tn_1024_152_512_ld_512_512_1024,Gemm_Hipblaslt_6377,0.0798551
GemmAndBiasTunableOp_float_TN,tn_1024_990_512_ld_512_512_1024,Gemm_Hipblaslt_6377,0.45435
GemmAndBiasTunableOp_float_TN,tn_1024_114_512_ld_512_512_1024,Gemm_Hipblaslt_6377,0.0641511
GemmAndBiasTunableOp_float_TN,tn_1024_263_512_ld_512_512_1024,Gemm_Hipblaslt_6377,0.159395
GemmAndBiasTunableOp_float_TN,tn_1024_31_512_ld_512_512_1024,Gemm_Hipblaslt_6377,0.026913
GemmAndBiasTunableOp_float_TN,tn_1024_75_512_ld_512_512_1024,Gemm_Hipblaslt_6377,0.0425981
GemmAndBiasTunableOp_float_TN,tn_1024_428_512_ld_512_512_1024,Gemm_Hipblaslt_6377,0.208624
GemmAndBiasTunableOp_float_TN,tn_1024_206_512_ld_512_512_1024,Gemm_Hipblaslt_6377,0.106855
GemmAndBiasTunableOp_float_TN,tn_1024_353_512_ld_512_512_1024,Gemm_Hipblaslt_6377,0.168352
GemmAndBiasTunableOp_float_TN,tn_1024_35_512_ld_512_512_1024,Gemm_Hipblaslt_6377,0.0305847
GemmAndBiasTunableOp_float_TN,tn_1024_77_512_ld_512_512_1024,Gemm_Hipblaslt_6377,0.0430141
GemmAndBiasTunableOp_float_TN,tn_1024_852_512_ld_512_512_1024,Default,0.397381
GemmAndBiasTunableOp_float_TN,tn_1024_275_512_ld_512_512_1024,Gemm_Hipblaslt_6377,0.163504
GemmAndBiasTunableOp_float_TN,tn_1024_504_512_ld_512_512_1024,Gemm_Hipblaslt_6377,0.229903
GemmAndBiasTunableOp_float_TN,tn_120_1074_120_ld_120_120_120,Gemm_Hipblaslt_6377,0.0207996
GemmAndBiasTunableOp_float_TN,tn_97_367_256_ld_256_256_97,Gemm_Hipblaslt_6377,0.0165023
GemmAndBiasTunableOp_float_TN,tn_1024_628_512_ld_512_512_1024,Gemm_Hipblaslt_6377,0.313898
GemmAndBiasTunableOp_float_TN,tn_1024_72_512_ld_512_512_1024,Gemm_Hipblaslt_6377,0.0422719
GemmAndBiasTunableOp_float_TN,tn_120_268_120_ld_120_120_120,Gemm_Hipblaslt_6377,0.0110484
GemmAndBiasTunableOp_float_TN,tn_1024_330_512_ld_512_512_1024,Gemm_Hipblaslt_6377,0.16312
GemmAndBiasTunableOp_float_TN,tn_1024_767_512_ld_512_512_1024,Default,0.360064
GemmAndBiasTunableOp_float_TN,tn_1024_136_512_ld_512_512_1024,Gemm_Hipblaslt_6377,0.0759764
GemmAndBiasTunableOp_float_TN,tn_1024_854_512_ld_512_512_1024,Gemm_Hipblaslt_6377,0.395495
GemmAndBiasTunableOp_float_TN,tn_1024_788_512_ld_512_512_1024,Default,0.373531
GemmAndBiasTunableOp_float_TN,tn_240_330_120_ld_120_120_240,Gemm_Hipblaslt_6377,0.0147321
GemmAndBiasTunableOp_float_TN,tn_1024_986_512_ld_512_512_1024,Default,0.459144
GemmAndBiasTunableOp_float_TN,tn_1024_1003_512_ld_512_512_1024,Gemm_Hipblaslt_6377,0.458658
GemmAndBiasTunableOp_float_TN,tn_1024_3_512_ld_512_512_1024,Gemm_Hipblaslt_6378,0.0219397
GemmAndBiasTunableOp_float_TN,tn_1024_684_512_ld_512_512_1024,Gemm_Hipblaslt_6377,0.320914
GemmAndBiasTunableOp_float_TN,tn_1024_20_512_ld_512_512_1024,Gemm_Hipblaslt_6377,0.0268316
GemmAndBiasTunableOp_float_TN,tn_240_864_120_ld_120_120_240,Gemm_Hipblaslt_6377,0.0397031
GemmAndBiasTunableOp_float_TN,tn_1024_419_512_ld_512_512_1024,Gemm_Hipblaslt_6377,0.193856
GemmAndBiasTunableOp_float_TN,tn_1024_44_512_ld_512_512_1024,Gemm_Hipblaslt_6377,0.0304849
GemmAndBiasTunableOp_float_TN,tn_1024_82_512_ld_512_512_1024,Gemm_Hipblaslt_6377,0.0504657
GemmAndBiasTunableOp_float_TN,tn_120_594_240_ld_240_240_120,Gemm_Hipblaslt_6377,0.0227071
GemmAndBiasTunableOp_float_TN,tn_1024_340_512_ld_512_512_1024,Gemm_Hipblaslt_6377,0.165551
GemmAndBiasTunableOp_float_TN,tn_1024_580_512_ld_512_512_1024,Gemm_Hipblaslt_6377,0.290665
GemmAndBiasTunableOp_float_TN,tn_1024_111_512_ld_512_512_1024,Gemm_Hipblaslt_6377,0.0582711
GemmAndBiasTunableOp_float_TN,tn_2_1_200_ld_200_200_2,Gemm_Hipblaslt_6376,0.0123195
GemmAndBiasTunableOp_float_TN,tn_1024_1022_512_ld_512_512_1024,Default,0.4768
GemmAndBiasTunableOp_float_TN,tn_1024_425_512_ld_512_512_1024,Gemm_Hipblaslt_6377,0.194308
GemmAndBiasTunableOp_float_TN,tn_360_396_120_ld_120_120_360,Gemm_Hipblaslt_6377,0.0214414
GemmAndBiasTunableOp_float_TN,tn_1024_141_512_ld_512_512_1024,Gemm_Hipblaslt_6377,0.075203
GemmAndBiasTunableOp_float_TN,tn_2_6_200_ld_200_200_2,Gemm_Hipblaslt_6378,0.0119813
GemmAndBiasTunableOp_float_TN,tn_1024_36_512_ld_512_512_1024,Gemm_Hipblaslt_6377,0.030539
GemmAndBiasTunableOp_float_TN,tn_1024_482_512_ld_512_512_1024,Gemm_Hipblaslt_6377,0.221002
GemmAndBiasTunableOp_float_TN,tn_256_1_256_ld_256_256_256,Gemm_Hipblaslt_6378,0.0127223
GemmAndBiasTunableOp_float_TN,tn_256_367_512_ld_512_512_256,Gemm_Hipblaslt_6377,0.0479747
GemmAndBiasTunableOp_float_TN,tn_1024_341_512_ld_512_512_1024,Gemm_Hipblaslt_6377,0.168083
GemmAndBiasTunableOp_float_TN,tn_1024_326_512_ld_512_512_1024,Gemm_Hipblaslt_6377,0.16197
GemmAndBiasTunableOp_float_TN,tn_1024_575_512_ld_512_512_1024,Gemm_Hipblaslt_6377,0.278497
GemmAndBiasTunableOp_float_TN,tn_360_390_120_ld_120_120_360,Gemm_Hipblaslt_6377,0.0242716
GemmAndBiasTunableOp_float_TN,tn_1024_416_512_ld_512_512_1024,Gemm_Hipblaslt_6377,0.193811
GemmAndBiasTunableOp_float_TN,tn_1024_56_512_ld_512_512_1024,Gemm_Hipblaslt_6377,0.0370913
GemmAndBiasTunableOp_float_TN,tn_97_431_256_ld_256_256_97,Gemm_Hipblaslt_6377,0.017681
GemmAndBiasTunableOp_float_TN,tn_1024_500_512_ld_512_512_1024,Gemm_Hipblaslt_6377,0.25647
GemmAndBiasTunableOp_float_TN,tn_1024_984_512_ld_512_512_1024,Default,0.460639
GemmAndBiasTunableOp_float_TN,tn_1024_571_512_ld_512_512_1024,Gemm_Hipblaslt_6377,0.290092
GemmAndBiasTunableOp_float_TN,tn_1024_988_512_ld_512_512_1024,Default,0.452026
GemmAndBiasTunableOp_float_TN,tn_1024_30_512_ld_512_512_1024,Gemm_Hipblaslt_6377,0.0267803
GemmAndBiasTunableOp_float_TN,tn_1024_9_512_ld_512_512_1024,Gemm_Hipblaslt_6376,0.0221641
GemmAndBiasTunableOp_float_TN,tn_1024_913_512_ld_512_512_1024,Gemm_Hipblaslt_6377,0.425393
GemmAndBiasTunableOp_float_TN,tn_1024_1_512_ld_512_512_1024,Gemm_Hipblaslt_6378,0.0219982
GemmAndBiasTunableOp_float_TN,tn_1024_403_512_ld_512_512_1024,Gemm_Hipblaslt_6377,0.185257
GemmAndBiasTunableOp_float_TN,tn_96_600_256_ld_256_256_96,Gemm_Hipblaslt_6377,0.0196209
GemmAndBiasTunableOp_float_TN,tn_120_492_240_ld_240_240_120,Gemm_Hipblaslt_6377,0.01983
GemmAndBiasTunableOp_float_TN,tn_1024_717_512_ld_512_512_1024,Gemm_Hipblaslt_6377,0.335692
GemmAndBiasTunableOp_float_TN,tn_1024_568_512_ld_512_512_1024,Gemm_Hipblaslt_6377,0.293804
GemmAndBiasTunableOp_float_TN,tn_120_750_120_ld_120_120_120,Gemm_Hipblaslt_6376,0.0273815
GemmAndBiasTunableOp_float_TN,tn_1024_221_512_ld_512_512_1024,Gemm_Hipblaslt_6377,0.125647
GemmAndBiasTunableOp_float_TN,tn_1024_706_512_ld_512_512_1024,Default,0.340417
GemmAndBiasTunableOp_float_TN,tn_1024_41_512_ld_512_512_1024,Gemm_Hipblaslt_6377,0.0304485
GemmAndBiasTunableOp_float_TN,tn_240_360_120_ld_120_120_240,Gemm_Hipblaslt_6377,0.0155132
GemmAndBiasTunableOp_float_TN,tn_240_306_120_ld_120_120_240,Gemm_Hipblaslt_6377,0.014468
GemmAndBiasTunableOp_float_TN,tn_1024_942_512_ld_512_512_1024,Default,0.435687
GemmAndBiasTunableOp_float_TN,tn_1024_911_512_ld_512_512_1024,Gemm_Hipblaslt_6377,0.41408
GemmAndBiasTunableOp_float_TN,tn_1024_320_512_ld_512_512_1024,Gemm_Hipblaslt_6377,0.157605
GemmAndBiasTunableOp_float_TN,tn_1024_289_512_ld_512_512_1024,Gemm_Hipblaslt_6377,0.169668
GemmAndBiasTunableOp_float_TN,tn_1024_833_512_ld_512_512_1024,Default,0.383314
GemmAndBiasTunableOp_float_TN,tn_1024_300_256_ld_256_256_1024,Gemm_Hipblaslt_6377,0.0839571
GemmAndBiasTunableOp_float_TN,tn_1024_190_512_ld_512_512_1024,Gemm_Hipblaslt_6377,0.0964671
GemmAndBiasTunableOp_float_TN,tn_120_516_120_ld_120_120_120,Gemm_Hipblaslt_6377,0.0136084
GemmAndBiasTunableOp_float_TN,tn_1024_74_512_ld_512_512_1024,Gemm_Hipblaslt_6377,0.042455
GemmAndBiasTunableOp_float_TN,tn_1024_921_512_ld_512_512_1024,Default,0.423818
GemmAndBiasTunableOp_float_TN,tn_1024_375_512_ld_512_512_1024,Gemm_Hipblaslt_6377,0.177088
GemmAndBiasTunableOp_float_TN,tn_1024_993_512_ld_512_512_1024,Gemm_Hipblaslt_6377,0.458134
GemmAndBiasTunableOp_float_TN,tn_120_396_240_ld_240_240_120,Gemm_Hipblaslt_6377,0.0170381
GemmAndBiasTunableOp_float_TN,tn_1024_768_512_ld_512_512_1024,Default,0.351885
GemmAndBiasTunableOp_float_TN,tn_256_687_512_ld_512_512_256,Gemm_Hipblaslt_6377,0.0858145
GemmAndBiasTunableOp_float_TN,tn_1024_377_512_ld_512_512_1024,Gemm_Hipblaslt_6377,0.185178
GemmAndBiasTunableOp_float_TN,tn_256_8400_256_ld_256_256_256,Gemm_Hipblaslt_6377,0.454785
GemmAndBiasTunableOp_float_TN,tn_120_528_120_ld_120_120_120,Gemm_Hipblaslt_6377,0.0134745
GemmAndBiasTunableOp_float_TN,tn_1024_202_512_ld_512_512_1024,Gemm_Hipblaslt_6377,0.106908
GemmAndBiasTunableOp_float_TN,tn_240_336_120_ld_120_120_240,Gemm_Hipblaslt_6377,0.0147653
GemmAndBiasTunableOp_float_TN,tn_120_894_120_ld_120_120_120,Gemm_Hipblaslt_6377,0.019509
GemmAndBiasTunableOp_float_TN,tn_1024_360_512_ld_512_512_1024,Gemm_Hipblaslt_6377,0.167165
GemmAndBiasTunableOp_float_TN,tn_240_510_120_ld_120_120_240,Gemm_Hipblaslt_6377,0.018724
GemmAndBiasTunableOp_float_TN,tn_120_1050_240_ld_240_240_120,Gemm_Hipblaslt_6377,0.0341395
GemmAndBiasTunableOp_float_TN,tn_1024_479_512_ld_512_512_1024,Gemm_Hipblaslt_6377,0.215351
GemmAndBiasTunableOp_float_TN,tn_1024_649_512_ld_512_512_1024,Gemm_Hipblaslt_6377,0.318864
GemmAndBiasTunableOp_float_TN,tn_120_624_240_ld_240_240_120,Gemm_Hipblaslt_6377,0.023487
GemmAndBiasTunableOp_float_TN,tn_360_408_120_ld_120_120_360,Gemm_Hipblaslt_6377,0.0220931
GemmAndBiasTunableOp_float_TN,tn_1024_212_512_ld_512_512_1024,Gemm_Hipblaslt_6377,0.114695
GemmAndBiasTunableOp_float_TN,tn_1024_633_512_ld_512_512_1024,Gemm_Hipblaslt_6377,0.314403
GemmAndBiasTunableOp_float_TN,tn_1024_543_512_ld_512_512_1024,Gemm_Hipblaslt_6377,0.278802
GemmAndBiasTunableOp_float_TN,tn_1024_208_512_ld_512_512_1024,Gemm_Hipblaslt_6377,0.106929
GemmAndBiasTunableOp_float_TN,tn_1024_996_512_ld_512_512_1024,Default,0.466426
GemmAndBiasTunableOp_float_TN,tn_97_479_256_ld_256_256_97,Gemm_Hipblaslt_6377,0.0185457
GemmAndBiasTunableOp_float_TN,tn_1024_269_512_ld_512_512_1024,Gemm_Hipblaslt_6379,0.16598
GemmAndBiasTunableOp_float_TN,tn_1024_525_512_ld_512_512_1024,Gemm_Hipblaslt_6377,0.257302
GemmAndBiasTunableOp_float_TN,tn_1024_65_512_ld_512_512_1024,Gemm_Hipblaslt_6377,0.0420575
GemmAndBiasTunableOp_float_TN,tn_1024_745_512_ld_512_512_1024,Gemm_Hipblaslt_6377,0.342746
GemmAndBiasTunableOp_float_TN,tn_1024_519_512_ld_512_512_1024,Gemm_Hipblaslt_6377,0.262519
GemmAndBiasTunableOp_float_TN,tn_360_330_120_ld_120_120_360,Gemm_Hipblaslt_6377,0.0191588
GemmAndBiasTunableOp_float_TN,tn_1024_585_512_ld_512_512_1024,Gemm_Hipblaslt_6377,0.299276
GemmAndBiasTunableOp_float_TN,tn_256_447_512_ld_512_512_256,Gemm_Hipblaslt_6377,0.0562242
GemmAndBiasTunableOp_float_TN,tn_1024_282_512_ld_512_512_1024,Gemm_Hipblaslt_6377,0.150544
GemmAndBiasTunableOp_float_TN,tn_1024_85_512_ld_512_512_1024,Gemm_Hipblaslt_6377,0.0508203
GemmAndBiasTunableOp_float_TN,tn_1024_550_512_ld_512_512_1024,Gemm_Hipblaslt_6377,0.262985
GemmAndBiasTunableOp_float_TN,tn_1024_518_512_ld_512_512_1024,Gemm_Hipblaslt_6377,0.253863
GemmAndBiasTunableOp_float_TN,tn_1024_231_512_ld_512_512_1024,Gemm_Hipblaslt_6377,0.117253
GemmAndBiasTunableOp_float_TN,tn_256_159_512_ld_512_512_256,Gemm_Hipblaslt_6377,0.0251822
GemmAndBiasTunableOp_float_TN,tn_1024_535_512_ld_512_512_1024,Gemm_Hipblaslt_6377,0.272466
GemmAndBiasTunableOp_float_TN,tn_1024_291_512_ld_512_512_1024,Gemm_Hipblaslt_6377,0.147209
GemmAndBiasTunableOp_float_TN,tn_1024_677_512_ld_512_512_1024,Gemm_Hipblaslt_6377,0.327597
GemmAndBiasTunableOp_float_TN,tn_1024_68_512_ld_512_512_1024,Gemm_Hipblaslt_6377,0.0422218
GemmAndBiasTunableOp_float_TN,tn_1024_476_512_ld_512_512_1024,Gemm_Hipblaslt_6377,0.207694
GemmAndBiasTunableOp_float_TN,tn_1024_491_512_ld_512_512_1024,Gemm_Hipblaslt_6377,0.222763
GemmAndBiasTunableOp_float_TN,tn_1024_716_512_ld_512_512_1024,Gemm_Hipblaslt_6377,0.337274
GemmAndBiasTunableOp_float_TN,tn_1024_484_512_ld_512_512_1024,Gemm_Hipblaslt_6377,0.241086
GemmAndBiasTunableOp_float_TN,tn_1024_332_512_ld_512_512_1024,Gemm_Hipblaslt_6377,0.161006
GemmAndBiasTunableOp_float_TN,tn_1024_861_512_ld_512_512_1024,Gemm_Hipblaslt_6377,0.391403
GemmAndBiasTunableOp_float_TN,tn_1024_52_512_ld_512_512_1024,Gemm_Hipblaslt_6377,0.0369555
GemmAndBiasTunableOp_float_TN,tn_1024_597_512_ld_512_512_1024,Gemm_Hipblaslt_6377,0.299393
GemmAndBiasTunableOp_float_TN,tn_1024_430_512_ld_512_512_1024,Gemm_Hipblaslt_6377,0.194569
GemmAndBiasTunableOp_float_TN,tn_256_271_512_ld_512_512_256,Gemm_Hipblaslt_6377,0.0370789
GemmAndBiasTunableOp_float_TN,tn_1024_909_512_ld_512_512_1024,Gemm_Hipblaslt_6377,0.408564
GemmAndBiasTunableOp_float_TN,tn_1024_48_512_ld_512_512_1024,Gemm_Hipblaslt_6377,0.0301499
GemmAndBiasTunableOp_float_TN,tn_240_258_120_ld_120_120_240,Gemm_Hipblaslt_6377,0.0131644
GemmAndBiasTunableOp_float_TN,tn_1024_549_512_ld_512_512_1024,Gemm_Hipblaslt_6377,0.280576
GemmAndBiasTunableOp_float_TN,tn_1024_1015_512_ld_512_512_1024,Default,0.474675
GemmAndBiasTunableOp_float_TN,tn_1024_967_512_ld_512_512_1024,Default,0.447192
GemmAndBiasTunableOp_float_TN,tn_1024_336_512_ld_512_512_1024,Gemm_Hipblaslt_6377,0.161394
GemmAndBiasTunableOp_float_TN,tn_1024_440_512_ld_512_512_1024,Gemm_Hipblaslt_6377,0.190875
GemmAndBiasTunableOp_float_TN,tn_120_318_240_ld_240_240_120,Gemm_Hipblaslt_6377,0.0153926
GemmAndBiasTunableOp_float_TN,tn_360_702_120_ld_120_120_360,Gemm_Hipblaslt_6379,0.0433163
GemmAndBiasTunableOp_float_TN,tn_1024_270_512_ld_512_512_1024,Gemm_Hipblaslt_6377,0.131279
GemmAndBiasTunableOp_float_TN,tn_120_576_240_ld_240_240_120,Gemm_Hipblaslt_6377,0.0219893
GemmAndBiasTunableOp_float_TN,tn_1024_408_512_ld_512_512_1024,Gemm_Hipblaslt_6377,0.184366
GemmAndBiasTunableOp_float_TN,tn_1024_285_512_ld_512_512_1024,Gemm_Hipblaslt_6377,0.213167
GemmAndBiasTunableOp_float_TN,tn_1024_859_512_ld_512_512_1024,Gemm_Hipblaslt_6377,0.391549
GemmAndBiasTunableOp_float_TN,tn_1024_13_512_ld_512_512_1024,Gemm_Hipblaslt_6378,0.0241526
GemmAndBiasTunableOp_float_TN,tn_120_268_240_ld_240_240_120,Gemm_Hipblaslt_6377,0.0147057
GemmAndBiasTunableOp_float_TN,tn_1024_397_512_ld_512_512_1024,Gemm_Hipblaslt_6377,0.179814
GemmAndBiasTunableOp_float_TN,tn_1024_342_512_ld_512_512_1024,Gemm_Hipblaslt_6377,0.166403
GemmAndBiasTunableOp_float_TN,tn_240_342_120_ld_120_120_240,Gemm_Hipblaslt_6377,0.0152799
GemmAndBiasTunableOp_float_TN,tn_1024_670_512_ld_512_512_1024,Gemm_Hipblaslt_6377,0.319969
GemmAndBiasTunableOp_float_TN,tn_1024_124_512_ld_512_512_1024,Gemm_Hipblaslt_6377,0.0635804
GemmAndBiasTunableOp_float_TN,tn_1024_242_512_ld_512_512_1024,Gemm_Hipblaslt_6377,0.142363
GemmAndBiasTunableOp_float_TN,tn_240_576_120_ld_120_120_240,Gemm_Hipblaslt_6377,0.0203162
GemmAndBiasTunableOp_float_TN,tn_1024_70_512_ld_512_512_1024,Gemm_Hipblaslt_6377,0.0421028
GemmAndBiasTunableOp_float_TN,tn_1024_929_512_ld_512_512_1024,Gemm_Hipblaslt_6377,0.42847
GemmAndBiasTunableOp_float_TN,tn_1024_918_512_ld_512_512_1024,Gemm_Hipblaslt_6377,0.426211
GemmAndBiasTunableOp_float_TN,tn_2_3_200_ld_200_200_2,Gemm_Hipblaslt_6378,0.0118021
GemmAndBiasTunableOp_float_TN,tn_1024_508_512_ld_512_512_1024,Gemm_Hipblaslt_6377,0.22587
GemmAndBiasTunableOp_float_TN,tn_1024_951_512_ld_512_512_1024,Gemm_Hipblaslt_6377,0.434995
GemmAndBiasTunableOp_float_TN,tn_1024_234_512_ld_512_512_1024,Gemm_Hipblaslt_6377,0.12225
GemmAndBiasTunableOp_float_TN,tn_1024_431_512_ld_512_512_1024,Gemm_Hipblaslt_6377,0.193156
GemmAndBiasTunableOp_float_TN,tn_1024_661_512_ld_512_512_1024,Default,0.329987
GemmAndBiasTunableOp_float_TN,tn_256_607_512_ld_512_512_256,Gemm_Hipblaslt_6377,0.0770412
GemmAndBiasTunableOp_float_TN,tn_1024_343_512_ld_512_512_1024,Gemm_Hipblaslt_6377,0.165393
GemmAndBiasTunableOp_float_TN,tn_1024_76_512_ld_512_512_1024,Gemm_Hipblaslt_6377,0.0423003
GemmAndBiasTunableOp_float_TN,tn_1024_391_512_ld_512_512_1024,Gemm_Hipblaslt_6377,0.177679
GemmAndBiasTunableOp_float_TN,tn_240_492_120_ld_120_120_240,Gemm_Hipblaslt_6377,0.0188066
GemmAndBiasTunableOp_float_TN,tn_1024_665_512_ld_512_512_1024,Default,0.329644
GemmAndBiasTunableOp_float_TN,tn_1024_886_512_ld_512_512_1024,Default,0.420485
GemmAndBiasTunableOp_float_TN,tn_1024_144_512_ld_512_512_1024,Gemm_Hipblaslt_6377,0.0844808
GemmAndBiasTunableOp_float_TN,tn_1024_7_512_ld_512_512_1024,Gemm_Hipblaslt_6378,0.0220855
GemmAndBiasTunableOp_float_TN,tn_1024_388_512_ld_512_512_1024,Gemm_Hipblaslt_6377,0.182879
GemmAndBiasTunableOp_float_TN,tn_1024_520_512_ld_512_512_1024,Gemm_Hipblaslt_6377,0.256454
GemmAndBiasTunableOp_float_TN,tn_1024_947_512_ld_512_512_1024,Gemm_Hipblaslt_6377,0.434312
GemmAndBiasTunableOp_float_TN,tn_240_450_120_ld_120_120_240,Gemm_Hipblaslt_6379,0.0257088
GemmAndBiasTunableOp_float_TN,tn_1024_931_512_ld_512_512_1024,Gemm_Hipblaslt_6377,0.42163
GemmAndBiasTunableOp_float_TN,tn_360_528_120_ld_120_120_360,Gemm_Hipblaslt_6377,0.0261989
GemmAndBiasTunableOp_float_TN,tn_1024_694_512_ld_512_512_1024,Gemm_Hipblaslt_6377,0.330821
GemmAndBiasTunableOp_float_TN,tn_360_212_120_ld_120_120_360,Gemm_Hipblaslt_6377,0.0150948
GemmAndBiasTunableOp_float_TN,tn_1024_982_512_ld_512_512_1024,Gemm_Hipblaslt_6377,0.460651
GemmAndBiasTunableOp_float_TN,tn_1024_309_512_ld_512_512_1024,Gemm_Hipblaslt_6377,0.156615
GemmAndBiasTunableOp_float_TN,tn_1024_940_512_ld_512_512_1024,Default,0.430566
GemmAndBiasTunableOp_float_TN,tn_1024_1011_512_ld_512_512_1024,Gemm_Hipblaslt_6377,0.462108
GemmAndBiasTunableOp_float_TN,tn_120_702_240_ld_240_240_120,Gemm_Hipblaslt_6379,0.0310439
GemmAndBiasTunableOp_float_TN,tn_1024_1008_512_ld_512_512_1024,Gemm_Hipblaslt_6377,0.459664
GemmAndBiasTunableOp_float_TN,tn_512_300_4_ld_4_4_512,Gemm_Hipblaslt_6377,0.00890918
GemmAndBiasTunableOp_float_TN,tn_1024_259_512_ld_512_512_1024,Gemm_Hipblaslt_6377,0.131336
GemmAndBiasTunableOp_float_TN,tn_1024_354_512_ld_512_512_1024,Gemm_Hipblaslt_6377,0.17137
GemmAndBiasTunableOp_float_TN,tn_360_216_120_ld_120_120_360,Gemm_Hipblaslt_6376,0.0226919
GemmAndBiasTunableOp_float_TN,tn_1024_756_512_ld_512_512_1024,Gemm_Hipblaslt_6377,0.35041
GemmAndBiasTunableOp_float_TN,tn_1024_489_512_ld_512_512_1024,Gemm_Hipblaslt_6377,0.22037
GemmAndBiasTunableOp_float_TN,tn_1024_774_512_ld_512_512_1024,Gemm_Hipblaslt_6377,0.360469
GemmAndBiasTunableOp_float_TN,tn_1024_775_512_ld_512_512_1024,Gemm_Hipblaslt_6377,0.359844
GemmAndBiasTunableOp_float_TN,tn_256_600_512_ld_512_512_256,Gemm_Hipblaslt_6377,0.0771391
GemmAndBiasTunableOp_float_TN,tn_1024_888_512_ld_512_512_1024,Default,0.420014
GemmAndBiasTunableOp_float_TN,tn_1024_900_512_ld_512_512_1024,Gemm_Hipblaslt_6377,0.416846
GemmAndBiasTunableOp_float_TN,tn_1024_956_512_ld_512_512_1024,Default,0.446199
GemmAndBiasTunableOp_float_TN,tn_1024_750_512_ld_512_512_1024,Gemm_Hipblaslt_6377,0.344324
GemmAndBiasTunableOp_float_TN,tn_1024_726_512_ld_512_512_1024,Gemm_Hipblaslt_6377,0.341565
GemmAndBiasTunableOp_float_TN,tn_1024_483_512_ld_512_512_1024,Gemm_Hipblaslt_6377,0.222232
GemmAndBiasTunableOp_float_TN,tn_1024_545_512_ld_512_512_1024,Gemm_Hipblaslt_6377,0.27934
GemmAndBiasTunableOp_float_TN,tn_1024_210_512_ld_512_512_1024,Gemm_Hipblaslt_6377,0.121624
GemmAndBiasTunableOp_float_TN,tn_256_319_512_ld_512_512_256,Gemm_Hipblaslt_6377,0.041228
GemmAndBiasTunableOp_float_TN,tn_1024_381_512_ld_512_512_1024,Gemm_Hipblaslt_6377,0.176251
GemmAndBiasTunableOp_float_TN,tn_1024_837_512_ld_512_512_1024,Gemm_Hipblaslt_6377,0.391534
GemmAndBiasTunableOp_float_TN,tn_120_432_120_ld_120_120_120,Gemm_Hipblaslt_6377,0.0121553
GemmAndBiasTunableOp_float_TN,tn_1024_814_512_ld_512_512_1024,Gemm_Hipblaslt_6377,0.377456
GemmAndBiasTunableOp_float_TN,tn_1024_540_512_ld_512_512_1024,Gemm_Hipblaslt_6377,0.254606
GemmAndBiasTunableOp_float_TN,tn_1024_12_512_ld_512_512_1024,Gemm_Hipblaslt_6378,0.0242941
GemmAndBiasTunableOp_float_TN,tn_2_5_200_ld_200_200_2,Gemm_Hipblaslt_6378,0.011779
GemmAndBiasTunableOp_float_TN,tn_1024_572_512_ld_512_512_1024,Gemm_Hipblaslt_6377,0.279045
GemmAndBiasTunableOp_float_TN,tn_1024_961_512_ld_512_512_1024,Gemm_Hipblaslt_6377,0.443411
GemmAndBiasTunableOp_float_TN,tn_1024_307_512_ld_512_512_1024,Gemm_Hipblaslt_6377,0.159349
GemmAndBiasTunableOp_float_TN,tn_1024_591_512_ld_512_512_1024,Gemm_Hipblaslt_6377,0.303081
GemmAndBiasTunableOp_float_TN,tn_1024_119_512_ld_512_512_1024,Gemm_Hipblaslt_6377,0.064214
GemmAndBiasTunableOp_float_TN,tn_1024_146_512_ld_512_512_1024,Gemm_Hipblaslt_6377,0.0816175
GemmAndBiasTunableOp_float_TN,tn_120_354_120_ld_120_120_120,Gemm_Hipblaslt_6377,0.011846
GemmAndBiasTunableOp_float_TN,tn_360_432_120_ld_120_120_360,Gemm_Hipblaslt_6377,0.0227312
GemmAndBiasTunableOp_float_TN,tn_1024_569_512_ld_512_512_1024,Gemm_Hipblaslt_6377,0.294571
GemmAndBiasTunableOp_float_TN,tn_360_624_120_ld_120_120_360,Gemm_Hipblaslt_6377,0.0318055
GemmAndBiasTunableOp_float_TN,tn_1024_766_512_ld_512_512_1024,Gemm_Hipblaslt_6377,0.354288
GemmAndBiasTunableOp_float_TN,tn_1024_51_512_ld_512_512_1024,Gemm_Hipblaslt_6377,0.0369054
GemmAndBiasTunableOp_float_TN,tn_1024_23_512_ld_512_512_1024,Gemm_Hipblaslt_6377,0.0268886
GemmAndBiasTunableOp_float_TN,tn_120_336_240_ld_240_240_120,Gemm_Hipblaslt_6377,0.016283
GemmAndBiasTunableOp_float_TN,tn_1024_713_512_ld_512_512_1024,Gemm_Hipblaslt_6377,0.336963
GemmAndBiasTunableOp_float_TN,tn_1024_831_512_ld_512_512_1024,Gemm_Hipblaslt_6377,0.377835
GemmAndBiasTunableOp_float_TN,tn_1024_499_512_ld_512_512_1024,Gemm_Hipblaslt_6377,0.229676
GemmAndBiasTunableOp_float_TN,tn_1024_654_512_ld_512_512_1024,Gemm_Hipblaslt_6377,0.311249
GemmAndBiasTunableOp_float_TN,tn_1024_83_512_ld_512_512_1024,Gemm_Hipblaslt_6377,0.0505695
GemmAndBiasTunableOp_float_TN,tn_360_336_120_ld_120_120_360,Gemm_Hipblaslt_6377,0.0193671
GemmAndBiasTunableOp_float_TN,tn_1024_63_512_ld_512_512_1024,Gemm_Hipblaslt_6377,0.0367583
GemmAndBiasTunableOp_float_TN,tn_120_672_240_ld_240_240_120,Gemm_Hipblaslt_6377,0.0240874
GemmAndBiasTunableOp_float_TN,tn_1024_679_512_ld_512_512_1024,Gemm_Hipblaslt_6377,0.331205
GemmAndBiasTunableOp_float_TN,tn_1024_527_512_ld_512_512_1024,Gemm_Hipblaslt_6377,0.251381
GemmAndBiasTunableOp_float_TN,tn_120_786_240_ld_240_240_120,Gemm_Hipblaslt_6377,0.0268577
GemmAndBiasTunableOp_float_TN,tn_1024_890_512_ld_512_512_1024,Gemm_Hipblaslt_6377,0.413367
GemmAndBiasTunableOp_float_TN,tn_1024_220_512_ld_512_512_1024,Gemm_Hipblaslt_6377,0.125566
GemmAndBiasTunableOp_float_TN,tn_240_420_120_ld_120_120_240,Gemm_Hipblaslt_6377,0.0171575
GemmAndBiasTunableOp_float_TN,tn_1024_952_512_ld_512_512_1024,Gemm_Hipblaslt_6377,0.436593
GemmAndBiasTunableOp_float_TN,tn_1024_149_512_ld_512_512_1024,Gemm_Hipblaslt_6377,0.0822415
GemmAndBiasTunableOp_float_TN,tn_1024_512_512_ld_512_512_1024,Gemm_Hipblaslt_6377,0.223341
GemmAndBiasTunableOp_float_TN,tn_1024_959_512_ld_512_512_1024,Default,0.436977
GemmAndBiasTunableOp_float_TN,tn_1024_108_512_ld_512_512_1024,Gemm_Hipblaslt_6377,0.0572649
GemmAndBiasTunableOp_float_TN,tn_1024_830_512_ld_512_512_1024,Default,0.380925
GemmAndBiasTunableOp_float_TN,tn_1024_555_512_ld_512_512_1024,Gemm_Hipblaslt_6377,0.279608
GemmAndBiasTunableOp_float_TN,tn_1024_933_512_ld_512_512_1024,Default,0.423433
GemmAndBiasTunableOp_float_TN,tn_1024_84_512_ld_512_512_1024,Gemm_Hipblaslt_6377,0.0504669
GemmAndBiasTunableOp_float_TN,tn_120_624_120_ld_120_120_120,Gemm_Hipblaslt_6377,0.0156222
GemmAndBiasTunableOp_float_TN,tn_1024_791_512_ld_512_512_1024,Default,0.370636
GemmAndBiasTunableOp_float_TN,tn_1024_583_512_ld_512_512_1024,Default,0.302317
GemmAndBiasTunableOp_float_TN,tn_240_252_120_ld_120_120_240,Gemm_Hipblaslt_6377,0.0127884
GemmAndBiasTunableOp_float_TN,tn_1024_699_512_ld_512_512_1024,Gemm_Hipblaslt_6377,0.334984
GemmAndBiasTunableOp_float_TN,tn_1024_529_512_ld_512_512_1024,Gemm_Hipblaslt_6377,0.273105
GemmAndBiasTunableOp_float_TN,tn_1024_93_512_ld_512_512_1024,Gemm_Hipblaslt_6377,0.0511205
GemmAndBiasTunableOp_float_TN,tn_1024_91_512_ld_512_512_1024,Gemm_Hipblaslt_6377,0.0506111
GemmAndBiasTunableOp_float_TN,tn_1024_793_512_ld_512_512_1024,Default,0.368511
GemmAndBiasTunableOp_float_TN,tn_1024_417_512_ld_512_512_1024,Gemm_Hipblaslt_6377,0.1914
GemmAndBiasTunableOp_float_TN,tn_1024_865_512_ld_512_512_1024,Gemm_Hipblaslt_6377,0.397993
GemmAndBiasTunableOp_float_TN,tn_120_336_120_ld_120_120_120,Gemm_Hipblaslt_6377,0.0115182
GemmAndBiasTunableOp_float_TN,tn_1024_449_512_ld_512_512_1024,Gemm_Hipblaslt_6377,0.202362
GemmAndBiasTunableOp_float_TN,tn_1024_247_512_ld_512_512_1024,Gemm_Hipblaslt_6377,0.128029
GemmAndBiasTunableOp_float_TN,tn_512_1_512_ld_512_512_512,Gemm_Hipblaslt_6378,0.0183084
GemmAndBiasTunableOp_float_TN,tn_1024_533_512_ld_512_512_1024,Gemm_Hipblaslt_6377,0.253316
GemmAndBiasTunableOp_float_TN,tn_1024_117_512_ld_512_512_1024,Gemm_Hipblaslt_6377,0.0635006
GemmAndBiasTunableOp_float_TN,tn_1024_690_512_ld_512_512_1024,Default,0.348125
GemmAndBiasTunableOp_float_TN,tn_1024_319_512_ld_512_512_1024,Gemm_Hipblaslt_6377,0.160001
GemmAndBiasTunableOp_float_TN,tn_1024_551_512_ld_512_512_1024,Gemm_Hipblaslt_6377,0.280347
GemmAndBiasTunableOp_float_TN,tn_1024_567_512_ld_512_512_1024,Gemm_Hipblaslt_6377,0.286737
GemmAndBiasTunableOp_float_TN,tn_1024_724_512_ld_512_512_1024,Gemm_Hipblaslt_6377,0.345801
GemmAndBiasTunableOp_float_TN,tn_1024_749_512_ld_512_512_1024,Gemm_Hipblaslt_6377,0.347346
GemmAndBiasTunableOp_float_TN,tn_97_351_256_ld_256_256_97,Gemm_Hipblaslt_6377,0.0158867
GemmAndBiasTunableOp_float_TN,tn_1024_752_512_ld_512_512_1024,Gemm_Hipblaslt_6377,0.348332
GemmAndBiasTunableOp_float_TN,tn_1024_938_512_ld_512_512_1024,Default,0.440547
GemmAndBiasTunableOp_float_TN,tn_1024_668_512_ld_512_512_1024,Default,0.324274
GemmAndBiasTunableOp_float_TN,tn_1024_777_512_ld_512_512_1024,Gemm_Hipblaslt_6377,0.363125
GemmAndBiasTunableOp_float_TN,tn_1024_95_512_ld_512_512_1024,Gemm_Hipblaslt_6377,0.0510744
GemmAndBiasTunableOp_float_TN,tn_1024_671_512_ld_512_512_1024,Gemm_Hipblaslt_6377,0.32674
GemmAndBiasTunableOp_float_TN,tn_1024_676_512_ld_512_512_1024,Gemm_Hipblaslt_6377,0.32632
GemmAndBiasTunableOp_float_TN,tn_120_372_240_ld_240_240_120,Gemm_Hipblaslt_6377,0.0168925
GemmAndBiasTunableOp_float_TN,tn_1024_934_512_ld_512_512_1024,Gemm_Hipblaslt_6377,0.436068
GemmAndBiasTunableOp_float_TN,tn_1024_636_512_ld_512_512_1024,Gemm_Hipblaslt_6377,0.317031
GemmAndBiasTunableOp_float_TN,tn_1024_656_512_ld_512_512_1024,Gemm_Hipblaslt_6377,0.320956
GemmAndBiasTunableOp_float_TN,tn_1024_327_512_ld_512_512_1024,Gemm_Hipblaslt_6377,0.154303
GemmAndBiasTunableOp_float_TN,tn_1024_919_512_ld_512_512_1024,Gemm_Hipblaslt_6377,0.417487
GemmAndBiasTunableOp_float_TN,tn_1024_836_512_ld_512_512_1024,Gemm_Hipblaslt_6377,0.383761
GemmAndBiasTunableOp_float_TN,tn_1024_461_512_ld_512_512_1024,Gemm_Hipblaslt_6377,0.204078
GemmAndBiasTunableOp_float_TN,tn_1024_904_512_ld_512_512_1024,Gemm_Hipblaslt_6377,0.415831
GemmAndBiasTunableOp_float_TN,tn_1024_79_512_ld_512_512_1024,Gemm_Hipblaslt_6377,0.042526
GemmAndBiasTunableOp_float_TN,tn_240_1074_120_ld_120_120_240,Gemm_Hipblaslt_6377,0.0331596
GemmAndBiasTunableOp_float_TN,tn_1024_600_256_ld_256_256_1024,Gemm_Hipblaslt_6377,0.136579
GemmAndBiasTunableOp_float_TN,tn_256_239_512_ld_512_512_256,Gemm_Hipblaslt_6377,0.0328194
GemmAndBiasTunableOp_float_TN,tn_1024_273_512_ld_512_512_1024,Gemm_Hipblaslt_6377,0.146879
GemmAndBiasTunableOp_float_TN,tn_360_426_120_ld_120_120_360,Gemm_Hipblaslt_6377,0.0227732
GemmAndBiasTunableOp_float_TN,tn_1024_413_512_ld_512_512_1024,Gemm_Hipblaslt_6377,0.18834
GemmAndBiasTunableOp_float_TN,tn_360_894_120_ld_120_120_360,Gemm_Hipblaslt_6379,0.0717208
GemmAndBiasTunableOp_float_TN,tn_120_212_240_ld_240_240_120,Gemm_Hipblaslt_6377,0.0143149
GemmAndBiasTunableOp_float_TN,tn_1024_800_256_ld_256_256_1024,Gemm_Hipblaslt_6377,0.162609
GemmAndBiasTunableOp_float_TN,tn_1024_380_512_ld_512_512_1024,Gemm_Hipblaslt_6377,0.172372
GemmAndBiasTunableOp_float_TN,tn_1024_225_512_ld_512_512_1024,Gemm_Hipblaslt_6377,0.134171
GemmAndBiasTunableOp_float_TN,tn_1024_539_512_ld_512_512_1024,Gemm_Hipblaslt_6377,0.275027
GemmAndBiasTunableOp_float_TN,tn_1024_564_512_ld_512_512_1024,Gemm_Hipblaslt_6377,0.288167
GemmAndBiasTunableOp_float_TN,tn_1024_884_512_ld_512_512_1024,Default,0.415036
GemmAndBiasTunableOp_float_TN,tn_1024_592_512_ld_512_512_1024,Gemm_Hipblaslt_6377,0.295192
GemmAndBiasTunableOp_float_TN,tn_17_300_256_ld_256_256_17,Gemm_Hipblaslt_6378,0.0124855
GemmAndBiasTunableOp_float_TN,tn_1024_471_512_ld_512_512_1024,Gemm_Hipblaslt_6377,0.214216
GemmAndBiasTunableOp_float_TN,tn_240_564_120_ld_120_120_240,Gemm_Hipblaslt_6379,0.0259444
GemmAndBiasTunableOp_float_TN,tn_1024_809_512_ld_512_512_1024,Gemm_Hipblaslt_6377,0.36836
GemmAndBiasTunableOp_float_TN,tn_120_750_240_ld_240_240_120,Gemm_Hipblaslt_6377,0.0265447
GemmAndBiasTunableOp_float_TN,tn_1024_541_512_ld_512_512_1024,Gemm_Hipblaslt_6377,0.258574
GemmAndBiasTunableOp_float_TN,tn_1024_406_512_ld_512_512_1024,Gemm_Hipblaslt_6377,0.187096
GemmAndBiasTunableOp_float_TN,tn_1024_696_512_ld_512_512_1024,Gemm_Hipblaslt_6377,0.326339
GemmAndBiasTunableOp_float_TN,tn_1024_850_512_ld_512_512_1024,Default,0.396393
GemmAndBiasTunableOp_float_TN,tn_1024_538_512_ld_512_512_1024,Gemm_Hipblaslt_6377,0.266253
GemmAndBiasTunableOp_float_TN,tn_1024_422_512_ld_512_512_1024,Gemm_Hipblaslt_6377,0.201221
GemmAndBiasTunableOp_float_TN,tn_120_402_120_ld_120_120_120,Gemm_Hipblaslt_6377,0.0123893
GemmAndBiasTunableOp_float_TN,tn_1024_314_512_ld_512_512_1024,Gemm_Hipblaslt_6377,0.156516
GemmAndBiasTunableOp_float_TN,tn_1024_463_512_ld_512_512_1024,Gemm_Hipblaslt_6377,0.199326
GemmAndBiasTunableOp_float_TN,tn_1024_217_512_ld_512_512_1024,Gemm_Hipblaslt_6379,0.168536
GemmAndBiasTunableOp_float_TN,tn_1024_155_512_ld_512_512_1024,Gemm_Hipblaslt_6377,0.0819513
GemmAndBiasTunableOp_float_TN,tn_360_540_120_ld_120_120_360,Gemm_Hipblaslt_6377,0.0271723
GemmAndBiasTunableOp_float_TN,tn_1024_847_512_ld_512_512_1024,Gemm_Hipblaslt_6377,0.382915
GemmAndBiasTunableOp_float_TN,tn_1024_632_512_ld_512_512_1024,Gemm_Hipblaslt_6377,0.317315
GemmAndBiasTunableOp_float_TN,tn_1024_485_512_ld_512_512_1024,Gemm_Hipblaslt_6377,0.223001
GemmAndBiasTunableOp_float_TN,tn_1024_43_512_ld_512_512_1024,Gemm_Hipblaslt_6377,0.0304986
GemmAndBiasTunableOp_float_TN,tn_256_1_512_ld_512_512_256,Gemm_Hipblaslt_6378,0.0180295
GemmAndBiasTunableOp_float_TN,tn_120_468_240_ld_240_240_120,Gemm_Hipblaslt_6377,0.0196671
GemmAndBiasTunableOp_float_TN,tn_1024_695_512_ld_512_512_1024,Gemm_Hipblaslt_6377,0.330812
GemmAndBiasTunableOp_float_TN,tn_1024_186_512_ld_512_512_1024,Gemm_Hipblaslt_6377,0.0998409
GemmAndBiasTunableOp_float_TN,tn_1024_412_512_ld_512_512_1024,Gemm_Hipblaslt_6377,0.197869
GemmAndBiasTunableOp_float_TN,tn_120_564_120_ld_120_120_120,Gemm_Hipblaslt_6377,0.0221203
GemmAndBiasTunableOp_float_TN,tn_1024_97_512_ld_512_512_1024,Gemm_Hipblaslt_6377,0.057876
GemmAndBiasTunableOp_float_TN,tn_1024_997_512_ld_512_512_1024,Default,0.461173
GemmAndBiasTunableOp_float_TN,tn_256_400_256_ld_256_256_256,Gemm_Hipblaslt_6377,0.0279269
GemmAndBiasTunableOp_float_TN,tn_1024_702_512_ld_512_512_1024,Gemm_Hipblaslt_6377,0.331538
GemmAndBiasTunableOp_float_TN,tn_1024_71_512_ld_512_512_1024,Gemm_Hipblaslt_6377,0.0423598
GemmAndBiasTunableOp_float_TN,tn_1024_748_512_ld_512_512_1024,Gemm_Hipblaslt_6377,0.346807
GemmAndBiasTunableOp_float_TN,tn_1024_10_512_ld_512_512_1024,Gemm_Hipblaslt_6378,0.0239454
GemmAndBiasTunableOp_float_TN,tn_1024_359_512_ld_512_512_1024,Gemm_Hipblaslt_6377,0.170957
GemmAndBiasTunableOp_float_TN,tn_120_864_120_ld_120_120_120,Gemm_Hipblaslt_6377,0.0297219
GemmAndBiasTunableOp_float_TN,tn_1024_675_512_ld_512_512_1024,Default,0.330317
GemmAndBiasTunableOp_float_TN,tn_1024_33_512_ld_512_512_1024,Gemm_Hipblaslt_6377,0.0302212
GemmAndBiasTunableOp_float_TN,tn_1024_89_512_ld_512_512_1024,Gemm_Hipblaslt_6377,0.0506537
GemmAndBiasTunableOp_float_TN,tn_120_282_240_ld_240_240_120,Gemm_Hipblaslt_6377,0.0250635
GemmAndBiasTunableOp_float_TN,tn_1024_655_512_ld_512_512_1024,Gemm_Hipblaslt_6377,0.317024
GemmAndBiasTunableOp_float_TN,tn_1024_657_512_ld_512_512_1024,Gemm_Hipblaslt_6377,0.321326
GemmAndBiasTunableOp_float_TN,tn_1024_511_512_ld_512_512_1024,Gemm_Hipblaslt_6377,0.230419
GemmAndBiasTunableOp_float_TN,tn_240_540_120_ld_120_120_240,Gemm_Hipblaslt_6377,0.0196718
GemmAndBiasTunableOp_float_TN,tn_1024_576_512_ld_512_512_1024,Gemm_Hipblaslt_6377,0.281999
GemmAndBiasTunableOp_float_TN,tn_1024_198_512_ld_512_512_1024,Gemm_Hipblaslt_6377,0.104869
GemmAndBiasTunableOp_float_TN,tn_360_282_120_ld_120_120_360,Gemm_Hipblaslt_6377,0.0193175
GemmAndBiasTunableOp_float_TN,tn_1024_4_512_ld_512_512_1024,Gemm_Hipblaslt_6378,0.022189
GemmAndBiasTunableOp_float_TN,tn_1024_620_512_ld_512_512_1024,Gemm_Hipblaslt_6377,0.306093
GemmAndBiasTunableOp_float_TN,tn_120_930_120_ld_120_120_120,Gemm_Hipblaslt_6377,0.0188391
GemmAndBiasTunableOp_float_TN,tn_1024_57_512_ld_512_512_1024,Gemm_Hipblaslt_6377,0.0370244
GemmAndBiasTunableOp_float_TN,tn_1024_501_512_ld_512_512_1024,Gemm_Hipblaslt_6377,0.238271
GemmAndBiasTunableOp_float_TN,tn_1024_887_512_ld_512_512_1024,Gemm_Hipblaslt_6377,0.40454
GemmAndBiasTunableOp_float_TN,tn_1024_207_512_ld_512_512_1024,Gemm_Hipblaslt_6377,0.108691
GemmAndBiasTunableOp_float_TN,tn_360_780_120_ld_120_120_360,Gemm_Hipblaslt_6377,0.0373358
GemmAndBiasTunableOp_float_TN,tn_1024_299_512_ld_512_512_1024,Gemm_Hipblaslt_6377,0.151127
GemmAndBiasTunableOp_float_TN,tn_1024_801_512_ld_512_512_1024,Default,0.373679
GemmAndBiasTunableOp_float_TN,tn_1024_902_512_ld_512_512_1024,Gemm_Hipblaslt_6377,0.426062
GemmAndBiasTunableOp_float_TN,tn_1024_361_512_ld_512_512_1024,Gemm_Hipblaslt_6377,0.168693
GemmAndBiasTunableOp_float_TN,tn_1024_40_512_ld_512_512_1024,Gemm_Hipblaslt_6377,0.0305615
GemmAndBiasTunableOp_float_TN,tn_1024_464_512_ld_512_512_1024,Gemm_Hipblaslt_6377,0.203325
GemmAndBiasTunableOp_float_TN,tn_360_318_120_ld_120_120_360,Gemm_Hipblaslt_6377,0.0182259
GemmAndBiasTunableOp_float_TN,tn_1024_188_512_ld_512_512_1024,Gemm_Hipblaslt_6377,0.0985578
GemmAndBiasTunableOp_float_TN,tn_1024_853_512_ld_512_512_1024,Gemm_Hipblaslt_6377,0.388296
GemmAndBiasTunableOp_float_TN,tn_1024_946_512_ld_512_512_1024,Gemm_Hipblaslt_6377,0.439607
GemmAndBiasTunableOp_float_TN,tn_1024_514_512_ld_512_512_1024,Gemm_Hipblaslt_6377,0.251657
GemmAndBiasTunableOp_float_TN,tn_120_402_240_ld_240_240_120,Gemm_Hipblaslt_6377,0.0180019
GemmAndBiasTunableOp_float_TN,tn_120_342_120_ld_120_120_120,Gemm_Hipblaslt_6377,0.0115025
GemmAndBiasTunableOp_float_TN,tn_1024_794_512_ld_512_512_1024,Default,0.377711
GemmAndBiasTunableOp_float_TN,tn_240_618_120_ld_120_120_240,Gemm_Hipblaslt_6377,0.0223015
GemmAndBiasTunableOp_float_TN,tn_1024_87_512_ld_512_512_1024,Gemm_Hipblaslt_6377,0.0505971
GemmAndBiasTunableOp_float_TN,tn_1024_90_512_ld_512_512_1024,Gemm_Hipblaslt_6377,0.0520876
GemmAndBiasTunableOp_float_TN,tn_1024_935_512_ld_512_512_1024,Default,0.425643
GemmAndBiasTunableOp_float_TN,tn_1024_1024_512_ld_512_512_1024,Gemm_Hipblaslt_6377,0.46037
GemmAndBiasTunableOp_float_TN,tn_1024_196_512_ld_512_512_1024,Gemm_Hipblaslt_6377,0.105514
GemmAndBiasTunableOp_float_TN,tn_1024_970_512_ld_512_512_1024,Gemm_Hipblaslt_6377,0.451496
GemmAndBiasTunableOp_float_TN,tn_1024_537_512_ld_512_512_1024,Gemm_Hipblaslt_6377,0.254583
GemmAndBiasTunableOp_float_TN,tn_1024_17_512_ld_512_512_1024,Gemm_Hipblaslt_6376,0.0267283
GemmAndBiasTunableOp_float_TN,tn_1024_810_512_ld_512_512_1024,Gemm_Hipblaslt_6377,0.374007
GemmAndBiasTunableOp_float_TN,tn_1024_426_512_ld_512_512_1024,Gemm_Hipblaslt_6377,0.209475
GemmAndBiasTunableOp_float_TN,tn_1024_989_512_ld_512_512_1024,Gemm_Hipblaslt_6377,0.449478
GemmAndBiasTunableOp_float_TN,tn_360_354_120_ld_120_120_360,Gemm_Hipblaslt_6377,0.0202344
GemmAndBiasTunableOp_float_TN,tn_120_408_240_ld_240_240_120,Gemm_Hipblaslt_6377,0.0179951
GemmAndBiasTunableOp_float_TN,tn_1024_29_512_ld_512_512_1024,Gemm_Hipblaslt_6377,0.0270108
GemmAndBiasTunableOp_float_TN,tn_240_528_120_ld_120_120_240,Gemm_Hipblaslt_6377,0.0193924
GemmAndBiasTunableOp_float_TN,tn_1024_467_512_ld_512_512_1024,Gemm_Hipblaslt_6377,0.213988
GemmAndBiasTunableOp_float_TN,tn_1024_458_512_ld_512_512_1024,Gemm_Hipblaslt_6377,0.199945
GemmAndBiasTunableOp_float_TN,tn_1024_875_512_ld_512_512_1024,Gemm_Hipblaslt_6377,0.401887
GemmAndBiasTunableOp_float_TN,tn_120_864_240_ld_240_240_120,Gemm_Hipblaslt_6377,0.0415878
GemmAndBiasTunableOp_float_TN,tn_360_268_120_ld_120_120_360,Gemm_Hipblaslt_6377,0.0166565
GemmAndBiasTunableOp_float_TN,tn_120_396_120_ld_120_120_120,Gemm_Hipblaslt_6377,0.0119312
GemmAndBiasTunableOp_float_TN,tn_1024_975_512_ld_512_512_1024,Default,0.444029
GemmAndBiasTunableOp_float_TN,tn_1024_2_512_ld_512_512_1024,Gemm_Hipblaslt_6378,0.0218367
GemmAndBiasTunableOp_float_TN,tn_240_426_120_ld_120_120_240,Gemm_Hipblaslt_6377,0.0172
GemmAndBiasTunableOp_float_TN,tn_1024_246_512_ld_512_512_1024,Gemm_Hipblaslt_6377,0.230255
GemmAndBiasTunableOp_float_TN,tn_1024_116_512_ld_512_512_1024,Gemm_Hipblaslt_6377,0.0638024
GemmAndBiasTunableOp_float_TN,tn_97_223_256_ld_256_256_97,Gemm_Hipblaslt_6377,0.0143638
GemmAndBiasTunableOp_float_TN,tn_1024_197_512_ld_512_512_1024,Gemm_Hipblaslt_6377,0.108762
GemmAndBiasTunableOp_float_TN,tn_1024_563_512_ld_512_512_1024,Gemm_Hipblaslt_6377,0.287509
GemmAndBiasTunableOp_float_TN,tn_1024_1002_512_ld_512_512_1024,Gemm_Hipblaslt_6377,0.465155
GemmAndBiasTunableOp_float_TN,tn_1024_877_512_ld_512_512_1024,Default,0.397774
GemmAndBiasTunableOp_float_TN,tn_1024_364_512_ld_512_512_1024,Gemm_Hipblaslt_6377,0.172223
GemmAndBiasTunableOp_float_TN,tn_1024_6_512_ld_512_512_1024,Gemm_Hipblaslt_6378,0.021999
GemmAndBiasTunableOp_float_TN,tn_1024_743_512_ld_512_512_1024,Gemm_Hipblaslt_6377,0.345242
GemmAndBiasTunableOp_float_TN,tn_1024_138_512_ld_512_512_1024,Gemm_Hipblaslt_6377,0.0751068
GemmAndBiasTunableOp_float_TN,tn_1024_120_512_ld_512_512_1024,Gemm_Hipblaslt_6377,0.0641602
GemmAndBiasTunableOp_float_TN,tn_1024_856_512_ld_512_512_1024,Default,0.40027
GemmAndBiasTunableOp_float_TN,tn_97_527_256_ld_256_256_97,Gemm_Hipblaslt_6377,0.0195148
GemmAndBiasTunableOp_float_TN,tn_1024_544_512_ld_512_512_1024,Gemm_Hipblaslt_6377,0.255675
GemmAndBiasTunableOp_float_TN,tn_512_1_1024_ld_1024_1024_512,Gemm_Hipblaslt_6378,0.0296409
GemmAndBiasTunableOp_float_TN,tn_1024_606_512_ld_512_512_1024,Default,0.302285
GemmAndBiasTunableOp_float_TN,tn_120_745_120_ld_120_120_120,Gemm_Hipblaslt_6377,0.0162225
GemmAndBiasTunableOp_float_TN,tn_1024_46_512_ld_512_512_1024,Gemm_Hipblaslt_6377,0.0302886
GemmAndBiasTunableOp_float_TN,tn_1024_432_512_ld_512_512_1024,Gemm_Hipblaslt_6377,0.200226
GemmAndBiasTunableOp_float_TN,tn_360_510_120_ld_120_120_360,Gemm_Hipblaslt_6377,0.0258049
GemmAndBiasTunableOp_float_TN,tn_1024_907_512_ld_512_512_1024,Gemm_Hipblaslt_6377,0.412927
GemmAndBiasTunableOp_float_TN,tn_1024_334_512_ld_512_512_1024,Gemm_Hipblaslt_6377,0.161323
GemmAndBiasTunableOp_float_TN,tn_1024_927_512_ld_512_512_1024,Gemm_Hipblaslt_6377,0.41518
GemmAndBiasTunableOp_float_TN,tn_120_468_120_ld_120_120_120,Gemm_Hipblaslt_6377,0.0206965
GemmAndBiasTunableOp_float_TN,tn_1024_260_512_ld_512_512_1024,Gemm_Hipblaslt_6377,0.138424
GemmAndBiasTunableOp_float_TN,tn_360_672_120_ld_120_120_360,Gemm_Hipblaslt_6377,0.032217
GemmAndBiasTunableOp_float_TN,tn_1024_954_512_ld_512_512_1024,Default,0.445856
GemmAndBiasTunableOp_float_TN,tn_1024_96_512_ld_512_512_1024,Gemm_Hipblaslt_6377,0.050533
GemmAndBiasTunableOp_float_TN,tn_1024_495_512_ld_512_512_1024,Gemm_Hipblaslt_6377,0.217717
GemmAndBiasTunableOp_float_TN,tn_1024_505_512_ld_512_512_1024,Gemm_Hipblaslt_6377,0.229593
GemmAndBiasTunableOp_float_TN,tn_120_384_240_ld_240_240_120,Gemm_Hipblaslt_6376,0.0235163
GemmAndBiasTunableOp_float_TN,tn_97_607_256_ld_256_256_97,Gemm_Hipblaslt_6377,0.0214832
GemmAndBiasTunableOp_float_TN,tn_1024_811_512_ld_512_512_1024,Default,0.373258
GemmAndBiasTunableOp_float_TN,tn_1024_603_512_ld_512_512_1024,Default,0.297032
GemmAndBiasTunableOp_float_TN,tn_1024_317_512_ld_512_512_1024,Gemm_Hipblaslt_6377,0.159693
GemmAndBiasTunableOp_float_TN,tn_1024_1005_512_ld_512_512_1024,Gemm_Hipblaslt_6377,0.455732
GemmAndBiasTunableOp_float_TN,tn_360_738_120_ld_120_120_360,Gemm_Hipblaslt_6377,0.0357351
GemmAndBiasTunableOp_float_TN,tn_1024_135_512_ld_512_512_1024,Gemm_Hipblaslt_6377,0.0755557
GemmAndBiasTunableOp_float_TN,tn_1024_926_512_ld_512_512_1024,Gemm_Hipblaslt_6377,0.422182
GemmAndBiasTunableOp_float_TN,tn_1024_209_512_ld_512_512_1024,Gemm_Hipblaslt_6377,0.114048
GemmAndBiasTunableOp_float_TN,tn_1024_914_512_ld_512_512_1024,Default,0.423339
GemmAndBiasTunableOp_float_TN,tn_192_300_256_ld_256_256_192,Gemm_Hipblaslt_6377,0.0194225
GemmAndBiasTunableOp_float_TN,tn_1024_637_512_ld_512_512_1024,Gemm_Hipblaslt_6377,0.316745
GemmAndBiasTunableOp_float_TN,tn_1024_796_512_ld_512_512_1024,Gemm_Hipblaslt_6377,0.373253
GemmAndBiasTunableOp_float_TN,tn_1024_94_512_ld_512_512_1024,Gemm_Hipblaslt_6377,0.0505478
GemmAndBiasTunableOp_float_TN,tn_3072_26624_768_ld_768_768_3072,Gemm_Hipblaslt_6377,46.6479
GemmAndBiasTunableOp_float_TN,tn_360_750_120_ld_120_120_360,Gemm_Hipblaslt_6377,0.0371851
GemmAndBiasTunableOp_float_TN,tn_1024_867_512_ld_512_512_1024,Gemm_Hipblaslt_6377,0.396656
GemmAndBiasTunableOp_float_TN,tn_120_462_120_ld_120_120_120,Gemm_Hipblaslt_6377,0.0126657
GemmAndBiasTunableOp_float_TN,tn_1024_392_512_ld_512_512_1024,Gemm_Hipblaslt_6377,0.180624
GemmAndBiasTunableOp_float_TN,tn_120_258_120_ld_120_120_120,Gemm_Hipblaslt_6377,0.0108989
GemmAndBiasTunableOp_float_TN,tn_240_408_120_ld_120_120_240,Gemm_Hipblaslt_6377,0.0166597
GemmAndBiasTunableOp_float_TN,tn_1024_325_512_ld_512_512_1024,Gemm_Hipblaslt_6377,0.154562
GemmAndBiasTunableOp_float_TN,tn_1024_427_512_ld_512_512_1024,Gemm_Hipblaslt_6377,0.200088
GemmAndBiasTunableOp_float_TN,tn_1024_386_512_ld_512_512_1024,Gemm_Hipblaslt_6377,0.17624
GemmAndBiasTunableOp_float_TN,tn_240_1050_120_ld_120_120_240,Gemm_Hipblaslt_6377,0.0324001
GemmAndBiasTunableOp_float_TN,tn_256_800_256_ld_256_256_256,Gemm_Hipblaslt_6377,0.0500156
GemmAndBiasTunableOp_float_TN,tn_120_276_120_ld_120_120_120,Gemm_Hipblaslt_6376,0.0131363
GemmAndBiasTunableOp_float_TN,tn_1024_663_512_ld_512_512_1024,Gemm_Hipblaslt_6377,0.319662
GemmAndBiasTunableOp_float_TN,tn_360_444_120_ld_120_120_360,Gemm_Hipblaslt_6377,0.0232942
GemmAndBiasTunableOp_float_TN,tn_1024_371_512_ld_512_512_1024,Gemm_Hipblaslt_6377,0.175708
GemmAndBiasTunableOp_float_TN,tn_256_16800_256_ld_256_256_256,Gemm_Hipblaslt_6377,0.81692
GemmAndBiasTunableOp_float_TN,tn_3_1_512_ld_512_512_3,Gemm_Hipblaslt_6378,0.0182334
GemmAndBiasTunableOp_float_TN,tn_1024_183_512_ld_512_512_1024,Gemm_Hipblaslt_6377,0.0996021
GemmAndBiasTunableOp_float_TN,tn_1024_227_512_ld_512_512_1024,Gemm_Hipblaslt_6377,0.125818
GemmAndBiasTunableOp_float_TN,tn_256_600_256_ld_256_256_256,Gemm_Hipblaslt_6377,0.0404545
GemmAndBiasTunableOp_float_TN,tn_1024_701_512_ld_512_512_1024,Gemm_Hipblaslt_6377,0.333845
GemmAndBiasTunableOp_float_TN,tn_360_264_120_ld_120_120_360,Gemm_Hipblaslt_6377,0.0167595
GemmAndBiasTunableOp_float_TN,tn_1024_446_512_ld_512_512_1024,Gemm_Hipblaslt_6377,0.190848
GemmAndBiasTunableOp_float_TN,tn_1024_215_512_ld_512_512_1024,Gemm_Hipblaslt_6377,0.120924
GemmAndBiasTunableOp_float_TN,tn_1024_300_512_ld_512_512_1024,Gemm_Hipblaslt_6377,0.152647
GemmAndBiasTunableOp_float_TN,tn_1024_125_512_ld_512_512_1024,Gemm_Hipblaslt_6377,0.0634658
GemmAndBiasTunableOp_float_TN,tn_1024_601_512_ld_512_512_1024,Gemm_Hipblaslt_6377,0.296971
GemmAndBiasTunableOp_float_TN,tn_1024_395_512_ld_512_512_1024,Gemm_Hipblaslt_6377,0.178794
GemmAndBiasTunableOp_float_TN,tn_1024_736_512_ld_512_512_1024,Default,0.353837
GemmAndBiasTunableOp_float_TN,tn_1024_557_512_ld_512_512_1024,Gemm_Hipblaslt_6377,0.28259
GemmAndBiasTunableOp_float_TN,tn_97_207_256_ld_256_256_97,Gemm_Hipblaslt_6377,0.0144372
GemmAndBiasTunableOp_float_TN,tn_1024_129_512_ld_512_512_1024,Gemm_Hipblaslt_6377,0.074874
GemmAndBiasTunableOp_float_TN,tn_1024_176_512_ld_512_512_1024,Gemm_Hipblaslt_6377,0.0924426
GemmAndBiasTunableOp_float_TN,tn_1024_280_512_ld_512_512_1024,Gemm_Hipblaslt_6377,0.138042
GemmAndBiasTunableOp_float_TN,tn_1024_460_512_ld_512_512_1024,Gemm_Hipblaslt_6377,0.200004
GemmAndBiasTunableOp_float_TN,tn_1024_839_512_ld_512_512_1024,Gemm_Hipblaslt_6377,0.384663
GemmAndBiasTunableOp_float_TN,tn_1024_546_512_ld_512_512_1024,Gemm_Hipblaslt_6377,0.265852
GemmAndBiasTunableOp_float_TN,tn_1024_930_512_ld_512_512_1024,Gemm_Hipblaslt_6377,0.431889
GemmAndBiasTunableOp_float_TN,tn_1024_751_512_ld_512_512_1024,Gemm_Hipblaslt_6377,0.346745
GemmAndBiasTunableOp_float_TN,tn_1024_255_512_ld_512_512_1024,Gemm_Hipblaslt_6377,0.124613
GemmAndBiasTunableOp_float_TN,tn_1024_167_512_ld_512_512_1024,Gemm_Hipblaslt_6377,0.091724
GemmAndBiasTunableOp_float_TN,tn_1024_924_512_ld_512_512_1024,Gemm_Hipblaslt_6377,0.424482
GemmAndBiasTunableOp_float_TN,tn_120_216_120_ld_120_120_120,Gemm_Hipblaslt_6379,0.0123203
GemmAndBiasTunableOp_float_TN,tn_1024_983_512_ld_512_512_1024,Gemm_Hipblaslt_6377,0.447827
GemmAndBiasTunableOp_float_TN,tn_240_591_120_ld_120_120_240,Gemm_Hipblaslt_6377,0.0235247
GemmAndBiasTunableOp_float_TN,tn_240_268_120_ld_120_120_240,Gemm_Hipblaslt_6377,0.0134494
GemmAndBiasTunableOp_float_TN,tn_240_462_120_ld_120_120_240,Gemm_Hipblaslt_6377,0.0176973
GemmAndBiasTunableOp_float_TN,tn_1024_792_512_ld_512_512_1024,Gemm_Hipblaslt_6377,0.370193
GemmAndBiasTunableOp_float_TN,tn_256_600_1024_ld_1024_1024_256,Gemm_Hipblaslt_6377,0.144752
GemmAndBiasTunableOp_float_TN,tn_1024_98_512_ld_512_512_1024,Gemm_Hipblaslt_6377,0.0575695
GemmAndBiasTunableOp_float_TN,tn_1024_240_512_ld_512_512_1024,Gemm_Hipblaslt_6377,0.127999
GemmAndBiasTunableOp_float_TN,tn_120_306_240_ld_240_240_120,Gemm_Hipblaslt_6377,0.0153993
GemmAndBiasTunableOp_float_TN,tn_120_786_120_ld_120_120_120,Gemm_Hipblaslt_6377,0.0166329
GemmAndBiasTunableOp_float_TN,tn_1024_265_512_ld_512_512_1024,Gemm_Hipblaslt_6377,0.133341
GemmAndBiasTunableOp_float_TN,tn_1024_939_512_ld_512_512_1024,Gemm_Hipblaslt_6377,0.432321
GemmAndBiasTunableOp_float_TN,tn_1024_953_512_ld_512_512_1024,Default,0.442906
GemmAndBiasTunableOp_float_TN,tn_1024_760_512_ld_512_512_1024,Gemm_Hipblaslt_6377,0.352894
GemmAndBiasTunableOp_float_TN,tn_1024_969_512_ld_512_512_1024,Gemm_Hipblaslt_6377,0.444517
GemmAndBiasTunableOp_float_TN,tn_97_447_256_ld_256_256_97,Gemm_Hipblaslt_6377,0.0177185
GemmAndBiasTunableOp_float_TN,tn_1024_846_512_ld_512_512_1024,Default,0.389357
GemmAndBiasTunableOp_float_TN,tn_1024_107_512_ld_512_512_1024,Gemm_Hipblaslt_6377,0.057648
GemmAndBiasTunableOp_float_TN,tn_120_810_240_ld_240_240_120,Gemm_Hipblaslt_6377,0.0280306
GemmAndBiasTunableOp_float_TN,tn_1024_162_512_ld_512_512_1024,Gemm_Hipblaslt_6377,0.0901275
GemmAndBiasTunableOp_float_TN,tn_1024_521_512_ld_512_512_1024,Gemm_Hipblaslt_6377,0.243739
GemmAndBiasTunableOp_float_TN,tn_1024_667_512_ld_512_512_1024,Gemm_Hipblaslt_6377,0.325772
GemmAndBiasTunableOp_float_TN,tn_256_63_512_ld_512_512_256,Gemm_Hipblaslt_6376,0.0199672
GemmAndBiasTunableOp_float_TN,tn_1024_358_512_ld_512_512_1024,Gemm_Hipblaslt_6377,0.17096
GemmAndBiasTunableOp_float_TN,tn_1024_137_512_ld_512_512_1024,Gemm_Hipblaslt_6377,0.0754671
GemmAndBiasTunableOp_float_TN,tn_1024_908_512_ld_512_512_1024,Gemm_Hipblaslt_6377,0.413382
GemmAndBiasTunableOp_float_TN,tn_240_756_120_ld_120_120_240,Gemm_Hipblaslt_6377,0.0251072
GemmAndBiasTunableOp_float_TN,tn_1024_723_512_ld_512_512_1024,Gemm_Hipblaslt_6377,0.341797
GemmAndBiasTunableOp_float_TN,tn_120_540_240_ld_240_240_120,Gemm_Hipblaslt_6377,0.0209189
GemmAndBiasTunableOp_float_TN,tn_1024_897_512_ld_512_512_1024,Gemm_Hipblaslt_6377,0.407424
GemmAndBiasTunableOp_float_TN,tn_1024_683_512_ld_512_512_1024,Gemm_Hipblaslt_6377,0.332064
GemmAndBiasTunableOp_float_TN,tn_256_383_512_ld_512_512_256,Gemm_Hipblaslt_6377,0.0496719
GemmAndBiasTunableOp_float_TN,tn_256_800_1024_ld_1024_1024_256,Gemm_Hipblaslt_6377,0.182428
GemmAndBiasTunableOp_float_TN,tn_97_47_256_ld_256_256_97,Gemm_Hipblaslt_6378,0.0124058
GemmAndBiasTunableOp_float_TN,tn_1024_631_512_ld_512_512_1024,Gemm_Hipblaslt_6377,0.310635
GemmAndBiasTunableOp_float_TN,tn_1024_813_512_ld_512_512_1024,Gemm_Hipblaslt_6377,0.374459
GemmAndBiasTunableOp_float_TN,tn_1024_80_512_ld_512_512_1024,Gemm_Hipblaslt_6377,0.0419954
GemmAndBiasTunableOp_float_TN,tn_240_392_120_ld_120_120_240,Gemm_Hipblaslt_6377,0.0163932
GemmAndBiasTunableOp_float_TN,tn_1024_405_512_ld_512_512_1024,Gemm_Hipblaslt_6377,0.190717
GemmAndBiasTunableOp_float_TN,tn_1024_165_512_ld_512_512_1024,Gemm_Hipblaslt_6377,0.0887288
GemmAndBiasTunableOp_float_TN,tn_120_360_240_ld_240_240_120,Gemm_Hipblaslt_6377,0.0165696
GemmAndBiasTunableOp_float_TN,tn_1024_974_512_ld_512_512_1024,Gemm_Hipblaslt_6377,0.4539
GemmAndBiasTunableOp_float_TN,tn_97_95_256_ld_256_256_97,Gemm_Hipblaslt_6376,0.0127103
GemmAndBiasTunableOp_float_TN,tn_1024_885_512_ld_512_512_1024,Gemm_Hipblaslt_6377,0.405781
GemmAndBiasTunableOp_float_TN,tn_1024_973_512_ld_512_512_1024,Gemm_Hipblaslt_6377,0.443308
GemmAndBiasTunableOp_float_TN,tn_120_462_240_ld_240_240_120,Gemm_Hipblaslt_6377,0.0186715
GemmAndBiasTunableOp_float_TN,tn_1024_214_512_ld_512_512_1024,Gemm_Hipblaslt_6377,0.123194
GemmAndBiasTunableOp_float_TN,tn_1024_47_512_ld_512_512_1024,Gemm_Hipblaslt_6377,0.0306071
GemmAndBiasTunableOp_float_TN,tn_1024_229_512_ld_512_512_1024,Gemm_Hipblaslt_6377,0.129917
GemmAndBiasTunableOp_float_TN,tn_1024_151_512_ld_512_512_1024,Gemm_Hipblaslt_6377,0.0854355
GemmAndBiasTunableOp_float_TN,tn_1024_729_512_ld_512_512_1024,Gemm_Hipblaslt_6377,0.341207
GemmAndBiasTunableOp_float_TN,tn_1024_863_512_ld_512_512_1024,Default,0.394594
GemmAndBiasTunableOp_float_TN,tn_1024_25_512_ld_512_512_1024,Gemm_Hipblaslt_6377,0.0267434
GemmAndBiasTunableOp_float_TN,tn_4_600_256_ld_256_256_4,Gemm_Hipblaslt_6376,0.0128906
GemmAndBiasTunableOp_float_TN,tn_1024_448_512_ld_512_512_1024,Gemm_Hipblaslt_6377,0.190528
GemmAndBiasTunableOp_float_TN,tn_1024_470_512_ld_512_512_1024,Gemm_Hipblaslt_6377,0.226999
GemmAndBiasTunableOp_float_TN,tn_1024_553_512_ld_512_512_1024,Gemm_Hipblaslt_6377,0.270604
GemmAndBiasTunableOp_float_TN,tn_1024_241_512_ld_512_512_1024,Gemm_Hipblaslt_6377,0.124481
GemmAndBiasTunableOp_float_TN,tn_360_392_120_ld_120_120_360,Gemm_Hipblaslt_6379,0.0270192
GemmAndBiasTunableOp_float_TN,tn_1024_424_512_ld_512_512_1024,Gemm_Hipblaslt_6377,0.190146
GemmAndBiasTunableOp_float_TN,tn_1024_991_512_ld_512_512_1024,Gemm_Hipblaslt_6377,0.446046
GemmAndBiasTunableOp_float_TN,tn_1024_133_512_ld_512_512_1024,Gemm_Hipblaslt_6377,0.0757745
GemmAndBiasTunableOp_float_TN,tn_256_47_512_ld_512_512_256,Gemm_Hipblaslt_6376,0.0189949
GemmAndBiasTunableOp_float_TN,tn_1024_711_512_ld_512_512_1024,Default,0.335077
GemmAndBiasTunableOp_float_TN,tn_120_264_240_ld_240_240_120,Gemm_Hipblaslt_6377,0.0148326
GemmAndBiasTunableOp_float_TN,tn_1024_130_512_ld_512_512_1024,Gemm_Hipblaslt_6377,0.0747534
GemmAndBiasTunableOp_float_TN,tn_1024_182_512_ld_512_512_1024,Gemm_Hipblaslt_6377,0.0995745
GemmAndBiasTunableOp_float_TN,tn_1024_302_512_ld_512_512_1024,Gemm_Hipblaslt_6377,0.15088
GemmAndBiasTunableOp_float_TN,tn_1024_169_512_ld_512_512_1024,Gemm_Hipblaslt_6379,0.111175
GemmAndBiasTunableOp_float_TN,tn_1024_901_512_ld_512_512_1024,Gemm_Hipblaslt_6377,0.415443
GemmAndBiasTunableOp_float_TN,tn_120_384_120_ld_120_120_120,Gemm_Hipblaslt_6377,0.0176439
GemmAndBiasTunableOp_float_TN,tn_1024_346_512_ld_512_512_1024,Gemm_Hipblaslt_6377,0.183506
GemmAndBiasTunableOp_float_TN,tn_120_426_240_ld_240_240_120,Gemm_Hipblaslt_6377,0.0180879
GemmAndBiasTunableOp_float_TN,tn_1024_613_512_ld_512_512_1024,Gemm_Hipblaslt_6377,0.308126
GemmAndBiasTunableOp_float_TN,tn_1024_664_512_ld_512_512_1024,Gemm_Hipblaslt_6377,0.319209
GemmAndBiasTunableOp_float_TN,tn_1024_394_512_ld_512_512_1024,Gemm_Hipblaslt_6377,0.183233
GemmAndBiasTunableOp_float_TN,tn_1024_530_512_ld_512_512_1024,Gemm_Hipblaslt_6377,0.27353
GemmAndBiasTunableOp_float_TN,tn_120_288_240_ld_240_240_120,Gemm_Hipblaslt_6377,0.015229
GemmAndBiasTunableOp_float_TN,tn_120_528_240_ld_240_240_120,Gemm_Hipblaslt_6377,0.020606
GemmAndBiasTunableOp_float_TN,tn_1024_502_512_ld_512_512_1024,Gemm_Hipblaslt_6377,0.225498
GemmAndBiasTunableOp_float_TN,tn_1024_579_512_ld_512_512_1024,Gemm_Hipblaslt_6377,0.296268
GemmAndBiasTunableOp_float_TN,tn_1024_1014_512_ld_512_512_1024,Default,0.477958
GemmAndBiasTunableOp_float_TN,tn_1024_181_512_ld_512_512_1024,Gemm_Hipblaslt_6377,0.098066
GemmAndBiasTunableOp_float_TN,tn_240_594_120_ld_120_120_240,Gemm_Hipblaslt_6377,0.0215549
GemmAndBiasTunableOp_float_TN,tn_240_750_120_ld_120_120_240,Gemm_Hipblaslt_6379,0.0330774
GemmAndBiasTunableOp_float_TN,tn_1024_38_512_ld_512_512_1024,Gemm_Hipblaslt_6377,0.0304757
GemmAndBiasTunableOp_float_TN,tn_1024_239_512_ld_512_512_1024,Gemm_Hipblaslt_6377,0.133397
GemmAndBiasTunableOp_float_TN,tn_256_287_512_ld_512_512_256,Gemm_Hipblaslt_6377,0.0402124
GemmAndBiasTunableOp_float_TN,tn_1024_192_512_ld_512_512_1024,Gemm_Hipblaslt_6377,0.100498
GemmAndBiasTunableOp_float_TN,tn_1024_62_512_ld_512_512_1024,Gemm_Hipblaslt_6377,0.0367599
GemmAndBiasTunableOp_float_TN,tn_1024_329_512_ld_512_512_1024,Gemm_Hipblaslt_6377,0.156002
GemmAndBiasTunableOp_float_TN,tn_1024_323_512_ld_512_512_1024,Gemm_Hipblaslt_6377,0.166765
GemmAndBiasTunableOp_float_TN,tn_1024_303_512_ld_512_512_1024,Gemm_Hipblaslt_6377,0.150798
GemmAndBiasTunableOp_float_TN,tn_1024_26_512_ld_512_512_1024,Gemm_Hipblaslt_6377,0.0267315
GemmAndBiasTunableOp_float_TN,tn_1024_127_512_ld_512_512_1024,Gemm_Hipblaslt_6377,0.0670269
GemmAndBiasTunableOp_float_TN,tn_360_516_120_ld_120_120_360,Gemm_Hipblaslt_6377,0.0264726
GemmAndBiasTunableOp_float_TN,tn_1024_154_512_ld_512_512_1024,Gemm_Hipblaslt_6377,0.081373
GemmAndBiasTunableOp_float_TN,tn_360_786_120_ld_120_120_360,Gemm_Hipblaslt_6377,0.0403315
GemmAndBiasTunableOp_float_TN,tn_97_191_256_ld_256_256_97,Gemm_Hipblaslt_6376,0.0140673
GemmAndBiasTunableOp_float_TN,tn_1024_596_512_ld_512_512_1024,Default,0.298824
GemmAndBiasTunableOp_float_TN,tn_1024_328_512_ld_512_512_1024,Gemm_Hipblaslt_6377,0.159998
GemmAndBiasTunableOp_float_TN,tn_1024_312_512_ld_512_512_1024,Gemm_Hipblaslt_6377,0.157992
GemmAndBiasTunableOp_float_TN,tn_1024_163_512_ld_512_512_1024,Gemm_Hipblaslt_6377,0.0893372
GemmAndBiasTunableOp_float_TN,tn_1024_157_512_ld_512_512_1024,Gemm_Hipblaslt_6377,0.0825813
GemmAndBiasTunableOp_float_TN,tn_1024_305_512_ld_512_512_1024,Gemm_Hipblaslt_6377,0.156576
GemmAndBiasTunableOp_float_TN,tn_1024_510_512_ld_512_512_1024,Gemm_Hipblaslt_6377,0.228554
GemmAndBiasTunableOp_float_TN,tn_1024_436_512_ld_512_512_1024,Gemm_Hipblaslt_6377,0.203478
GemmAndBiasTunableOp_float_TN,tn_1024_878_512_ld_512_512_1024,Default,0.408409
GemmAndBiasTunableOp_float_TN,tn_1024_73_512_ld_512_512_1024,Gemm_Hipblaslt_6377,0.042729
GemmAndBiasTunableOp_float_TN,tn_1024_698_512_ld_512_512_1024,Default,0.333691
GemmAndBiasTunableOp_float_TN,tn_1024_561_512_ld_512_512_1024,Default,0.292991
GemmAndBiasTunableOp_float_TN,tn_1024_180_512_ld_512_512_1024,Gemm_Hipblaslt_6377,0.0956839
GemmAndBiasTunableOp_float_TN,tn_1024_971_512_ld_512_512_1024,Gemm_Hipblaslt_6377,0.451053
GemmAndBiasTunableOp_float_TN,tn_1024_61_512_ld_512_512_1024,Gemm_Hipblaslt_6377,0.0367551
GemmAndBiasTunableOp_float_TN,tn_1024_734_512_ld_512_512_1024,Gemm_Hipblaslt_6377,0.345597
GemmAndBiasTunableOp_float_TN,tn_240_672_120_ld_120_120_240,Gemm_Hipblaslt_6377,0.0230653
GemmAndBiasTunableOp_float_TN,tn_97_127_256_ld_256_256_97,Gemm_Hipblaslt_6376,0.0127917
GemmAndBiasTunableOp_float_TN,tn_360_468_120_ld_120_120_360,Gemm_Hipblaslt_6377,0.028119
GemmAndBiasTunableOp_float_TN,tn_1024_279_512_ld_512_512_1024,Gemm_Hipblaslt_6377,0.142612
GemmAndBiasTunableOp_float_TN,tn_1024_577_512_ld_512_512_1024,Gemm_Hipblaslt_6377,0.290178
GemmAndBiasTunableOp_float_TN,tn_240_264_120_ld_120_120_240,Gemm_Hipblaslt_6377,0.0134265
GemmAndBiasTunableOp_float_TN,tn_1024_378_512_ld_512_512_1024,Gemm_Hipblaslt_6377,0.174875
GemmAndBiasTunableOp_float_TN,tn_1024_697_512_ld_512_512_1024,Default,0.34186
GemmAndBiasTunableOp_float_TN,tn_240_390_120_ld_120_120_240,Gemm_Hipblaslt_6377,0.019265
GemmAndBiasTunableOp_float_TN,tn_1024_874_512_ld_512_512_1024,Default,0.403773
GemmAndBiasTunableOp_float_TN,tn_1024_693_512_ld_512_512_1024,Gemm_Hipblaslt_6377,0.33621
GemmAndBiasTunableOp_float_TN,tn_1024_524_512_ld_512_512_1024,Gemm_Hipblaslt_6377,0.258757
GemmAndBiasTunableOp_float_TN,tn_1024_50_512_ld_512_512_1024,Gemm_Hipblaslt_6377,0.0370352
GemmAndBiasTunableOp_float_TN,tn_1024_643_512_ld_512_512_1024,Gemm_Hipblaslt_6377,0.315807
GemmAndBiasTunableOp_float_TN,tn_1024_400_512_ld_512_512_1024,Gemm_Hipblaslt_6377,0.189795
GemmAndBiasTunableOp_float_TN,tn_256_543_512_ld_512_512_256,Gemm_Hipblaslt_6377,0.0694852
GemmAndBiasTunableOp_float_TN,tn_1024_981_512_ld_512_512_1024,Default,0.449947
GemmAndBiasTunableOp_float_TN,tn_1024_496_512_ld_512_512_1024,Gemm_Hipblaslt_6377,0.218396
GemmAndBiasTunableOp_float_TN,tn_360_591_120_ld_120_120_360,Gemm_Hipblaslt_6377,0.0371414
GemmAndBiasTunableOp_float_TN,tn_1024_49_512_ld_512_512_1024,Gemm_Hipblaslt_6377,0.0365427
GemmAndBiasTunableOp_float_TN,tn_1024_274_512_ld_512_512_1024,Gemm_Hipblaslt_6377,0.152795
GemmAndBiasTunableOp_float_TN,tn_1024_473_512_ld_512_512_1024,Gemm_Hipblaslt_6377,0.215555
GemmAndBiasTunableOp_float_TN,tn_1024_170_512_ld_512_512_1024,Gemm_Hipblaslt_6377,0.0907747
GemmAndBiasTunableOp_float_TN,tn_1024_687_512_ld_512_512_1024,Gemm_Hipblaslt_6377,0.329642
GemmAndBiasTunableOp_float_TN,tn_1024_559_512_ld_512_512_1024,Gemm_Hipblaslt_6377,0.269037
GemmAndBiasTunableOp_float_TN,tn_1024_516_512_ld_512_512_1024,Gemm_Hipblaslt_6377,0.245872
GemmAndBiasTunableOp_float_TN,tn_1024_435_512_ld_512_512_1024,Gemm_Hipblaslt_6377,0.198494
GemmAndBiasTunableOp_float_TN,tn_1024_456_512_ld_512_512_1024,Gemm_Hipblaslt_6377,0.202585
GemmAndBiasTunableOp_float_TN,tn_1024_662_512_ld_512_512_1024,Default,0.329195
GemmAndBiasTunableOp_float_TN,tn_120_540_120_ld_120_120_120,Gemm_Hipblaslt_6377,0.0137699
GemmAndBiasTunableOp_float_TN,tn_120_408_120_ld_120_120_120,Gemm_Hipblaslt_6377,0.0123388
GemmAndBiasTunableOp_float_TN,tn_1024_610_512_ld_512_512_1024,Gemm_Hipblaslt_6377,0.299611
GemmAndBiasTunableOp_float_TN,tn_1024_101_512_ld_512_512_1024,Gemm_Hipblaslt_6377,0.0578576
GemmAndBiasTunableOp_float_TN,tn_1024_635_512_ld_512_512_1024,Gemm_Hipblaslt_6377,0.313111
GemmAndBiasTunableOp_float_TN,tn_1024_708_512_ld_512_512_1024,Gemm_Hipblaslt_6377,0.337811
GemmAndBiasTunableOp_float_TN,tn_1024_872_512_ld_512_512_1024,Default,0.406212
GemmAndBiasTunableOp_float_TN,tn_1024_287_512_ld_512_512_1024,Gemm_Hipblaslt_6377,0.145311
GemmAndBiasTunableOp_float_TN,tn_1024_536_512_ld_512_512_1024,Gemm_Hipblaslt_6377,0.268899
GemmAndBiasTunableOp_float_TN,tn_1024_177_512_ld_512_512_1024,Gemm_Hipblaslt_6377,0.101373
GemmAndBiasTunableOp_float_TN,tn_1024_758_512_ld_512_512_1024,Default,0.353336
GemmAndBiasTunableOp_float_TN,tn_1024_126_512_ld_512_512_1024,Gemm_Hipblaslt_6377,0.0640589
GemmAndBiasTunableOp_float_TN,tn_1024_466_512_ld_512_512_1024,Gemm_Hipblaslt_6377,0.20631
GemmAndBiasTunableOp_float_TN,tn_1024_925_512_ld_512_512_1024,Gemm_Hipblaslt_6377,0.418996
GemmAndBiasTunableOp_float_TN,tn_1024_103_512_ld_512_512_1024,Gemm_Hipblaslt_6377,0.0579397
GemmAndBiasTunableOp_float_TN,tn_1024_81_512_ld_512_512_1024,Gemm_Hipblaslt_6377,0.0506777
GemmAndBiasTunableOp_float_TN,tn_1024_487_512_ld_512_512_1024,Gemm_Hipblaslt_6377,0.219363
GemmAndBiasTunableOp_float_TN,tn_13_1_512_ld_512_512_13,Gemm_Hipblaslt_6378,0.0182239
GemmAndBiasTunableOp_float_TN,tn_1024_407_512_ld_512_512_1024,Gemm_Hipblaslt_6377,0.185946
GemmAndBiasTunableOp_float_TN,tn_1024_8_512_ld_512_512_1024,Gemm_Hipblaslt_6378,0.0221553
GemmAndBiasTunableOp_float_TN,tn_120_288_120_ld_120_120_120,Gemm_Hipblaslt_6377,0.0109742
GemmAndBiasTunableOp_float_TN,tn_97_175_256_ld_256_256_97,Gemm_Hipblaslt_6376,0.0135482
GemmAndBiasTunableOp_float_TN,tn_1024_659_512_ld_512_512_1024,Default,0.315091
GemmAndBiasTunableOp_float_TN,tn_1024_175_512_ld_512_512_1024,Gemm_Hipblaslt_6377,0.089358
GemmAndBiasTunableOp_float_TN,tn_1024_882_512_ld_512_512_1024,Default,0.411907
GemmAndBiasTunableOp_float_TN,tn_240_894_120_ld_120_120_240,Gemm_Hipblaslt_6377,0.0321099
GemmAndBiasTunableOp_float_TN,tn_240_702_120_ld_120_120_240,Gemm_Hipblaslt_6379,0.0336237
GemmAndBiasTunableOp_float_TN,tn_1024_1004_512_ld_512_512_1024,Gemm_Hipblaslt_6377,0.463554
GemmAndBiasTunableOp_float_TN,tn_1024_823_512_ld_512_512_1024,Default,0.379302
GemmAndBiasTunableOp_float_TN,tn_1024_244_512_ld_512_512_1024,Gemm_Hipblaslt_6377,0.139159
GemmAndBiasTunableOp_float_TN,tn_1024_526_512_ld_512_512_1024,Gemm_Hipblaslt_6377,0.244009
GemmAndBiasTunableOp_float_TN,tn_1024_738_512_ld_512_512_1024,Gemm_Hipblaslt_6377,0.349495
GemmAndBiasTunableOp_float_TN,tn_1024_808_512_ld_512_512_1024,Default,0.378164
GemmAndBiasTunableOp_float_TN,tn_1024_773_512_ld_512_512_1024,Gemm_Hipblaslt_6377,0.3601
GemmAndBiasTunableOp_float_TN,tn_1024_304_512_ld_512_512_1024,Gemm_Hipblaslt_6377,0.151681
GemmAndBiasTunableOp_float_TN,tn_1024_237_512_ld_512_512_1024,Gemm_Hipblaslt_6377,0.121401
GemmAndBiasTunableOp_float_TN,tn_1024_450_512_ld_512_512_1024,Gemm_Hipblaslt_6377,0.207813
GemmAndBiasTunableOp_float_TN,tn_1024_883_512_ld_512_512_1024,Gemm_Hipblaslt_6377,0.408072
GemmAndBiasTunableOp_float_TN,tn_1024_15_512_ld_512_512_1024,Gemm_Hipblaslt_6378,0.0225673
GemmAndBiasTunableOp_float_TN,tn_1024_393_512_ld_512_512_1024,Gemm_Hipblaslt_6377,0.185377
GemmAndBiasTunableOp_float_TN,tn_1024_864_512_ld_512_512_1024,Default,0.400351
GemmAndBiasTunableOp_float_TN,tn_120_1074_240_ld_240_240_120,Gemm_Hipblaslt_6377,0.0350703
GemmAndBiasTunableOp_float_TN,tn_1024_350_512_ld_512_512_1024,Gemm_Hipblaslt_6377,0.165066
GemmAndBiasTunableOp_float_TN,tn_360_930_120_ld_120_120_360,Gemm_Hipblaslt_6377,0.0417685
GemmAndBiasTunableOp_float_TN,tn_1024_187_512_ld_512_512_1024,Gemm_Hipblaslt_6377,0.099641
GemmAndBiasTunableOp_float_TN,tn_1024_457_512_ld_512_512_1024,Gemm_Hipblaslt_6377,0.201059
GemmAndBiasTunableOp_float_TN,tn_240_402_120_ld_120_120_240,Gemm_Hipblaslt_6377,0.0165315
GemmAndBiasTunableOp_float_TN,tn_1024_132_512_ld_512_512_1024,Gemm_Hipblaslt_6377,0.0741311
GemmAndBiasTunableOp_float_TN,tn_120_212_120_ld_120_120_120,Gemm_Hipblaslt_6377,0.0108155
GemmAndBiasTunableOp_float_TN,tn_1024_992_512_ld_512_512_1024,Default,0.470417
GemmAndBiasTunableOp_float_TN,tn_1024_453_512_ld_512_512_1024,Gemm_Hipblaslt_6377,0.20978
GemmAndBiasTunableOp_float_TN,tn_120_216_240_ld_240_240_120,Gemm_Hipblaslt_6379,0.0200565
GemmAndBiasTunableOp_float_TN,tn_1024_191_512_ld_512_512_1024,Gemm_Hipblaslt_6377,0.0986271
GemmAndBiasTunableOp_float_TN,tn_360_745_120_ld_120_120_360,Gemm_Hipblaslt_6377,0.0354855
GemmAndBiasTunableOp_float_TN,tn_1024_945_512_ld_512_512_1024,Gemm_Hipblaslt_6377,0.432065
GemmAndBiasTunableOp_float_TN,tn_1024_69_512_ld_512_512_1024,Gemm_Hipblaslt_6377,0.0421317
GemmAndBiasTunableOp_float_TN,tn_1024_586_512_ld_512_512_1024,Gemm_Hipblaslt_6377,0.294262
GemmAndBiasTunableOp_float_TN,tn_1024_578_512_ld_512_512_1024,Gemm_Hipblaslt_6377,0.306825
GemmAndBiasTunableOp_float_TN,tn_360_288_120_ld_120_120_360,Gemm_Hipblaslt_6377,0.0175703
GemmAndBiasTunableOp_float_TN,tn_120_702_120_ld_120_120_120,Gemm_Hipblaslt_6377,0.0164718
GemmAndBiasTunableOp_float_TN,tn_120_306_120_ld_120_120_120,Gemm_Hipblaslt_6377,0.0110901
GemmAndBiasTunableOp_float_TN,tn_1024_150_512_ld_512_512_1024,Gemm_Hipblaslt_6377,0.0810148
GemmAndBiasTunableOp_float_TN,tn_360_1074_120_ld_120_120_360,Gemm_Hipblaslt_6377,0.0475117
GemmAndBiasTunableOp_float_TN,tn_1024_53_512_ld_512_512_1024,Gemm_Hipblaslt_6377,0.0366822
GemmAndBiasTunableOp_float_TN,tn_1024_28_512_ld_512_512_1024,Gemm_Hipblaslt_6377,0.0269142
GemmAndBiasTunableOp_float_TN,tn_1024_338_512_ld_512_512_1024,Gemm_Hipblaslt_6377,0.166516
GemmAndBiasTunableOp_float_TN,tn_360_342_120_ld_120_120_360,Gemm_Hipblaslt_6377,0.0195504
GemmAndBiasTunableOp_float_TN,tn_120_426_120_ld_120_120_120,Gemm_Hipblaslt_6377,0.0125497
GemmAndBiasTunableOp_float_TN,tn_96_300_256_ld_256_256_96,Gemm_Hipblaslt_6377,0.014912
GemmAndBiasTunableOp_float_TN,tn_1024_733_512_ld_512_512_1024,Gemm_Hipblaslt_6377,0.337369
GemmAndBiasTunableOp_float_TN,tn_1024_345_512_ld_512_512_1024,Gemm_Hipblaslt_6377,0.165174
GemmAndBiasTunableOp_float_TN,tn_1024_928_512_ld_512_512_1024,Default,0.420112
GemmAndBiasTunableOp_float_TN,tn_1024_468_512_ld_512_512_1024,Gemm_Hipblaslt_6377,0.221134
GemmAndBiasTunableOp_float_TN,tn_1024_178_512_ld_512_512_1024,Gemm_Hipblaslt_6377,0.0992314
GemmAndBiasTunableOp_float_TN,tn_1024_276_512_ld_512_512_1024,Gemm_Hipblaslt_6377,0.141498
GemmAndBiasTunableOp_float_TN,tn_1024_249_512_ld_512_512_1024,Gemm_Hipblaslt_6377,0.145962
GemmAndBiasTunableOp_float_TN,tn_1024_105_512_ld_512_512_1024,Gemm_Hipblaslt_6377,0.0575411
GemmAndBiasTunableOp_float_TN,tn_1024_570_512_ld_512_512_1024,Default,0.295067
GemmAndBiasTunableOp_float_TN,tn_1024_763_512_ld_512_512_1024,Default,0.353722
GemmAndBiasTunableOp_float_TN,tn_1024_841_512_ld_512_512_1024,Gemm_Hipblaslt_6377,0.387319
GemmAndBiasTunableOp_float_TN,tn_120_354_240_ld_240_240_120,Gemm_Hipblaslt_6377,0.0169303
GemmAndBiasTunableOp_float_TN,tn_4_1_256_ld_256_256_4,Gemm_Hipblaslt_6378,0.0128446
GemmAndBiasTunableOp_float_TN,tn_256_207_512_ld_512_512_256,Gemm_Hipblaslt_6377,0.0306201
GemmAndBiasTunableOp_float_TN,tn_1024_493_512_ld_512_512_1024,Gemm_Hipblaslt_6377,0.218399
GemmAndBiasTunableOp_float_TN,tn_1024_434_512_ld_512_512_1024,Gemm_Hipblaslt_6377,0.20364
GemmAndBiasTunableOp_float_TN,tn_240_810_120_ld_120_120_240,Gemm_Hipblaslt_6377,0.0266926
GemmAndBiasTunableOp_float_TN,tn_1024_803_512_ld_512_512_1024,Default,0.370595
GemmAndBiasTunableOp_float_TN,tn_1024_200_512_ld_512_512_1024,Gemm_Hipblaslt_6377,0.107644
GemmAndBiasTunableOp_float_TN,tn_360_276_120_ld_120_120_360,Gemm_Hipblaslt_6377,0.0180038
GemmAndBiasTunableOp_float_TN,tn_1024_542_512_ld_512_512_1024,Gemm_Hipblaslt_6377,0.277029
GemmAndBiasTunableOp_float_TN,tn_1024_55_512_ld_512_512_1024,Gemm_Hipblaslt_6377,0.0367439
GemmAndBiasTunableOp_float_TN,tn_1024_1006_512_ld_512_512_1024,Gemm_Hipblaslt_6377,0.46439
GemmAndBiasTunableOp_float_TN,tn_1024_871_512_ld_512_512_1024,Gemm_Hipblaslt_6377,0.39797
GemmAndBiasTunableOp_float_TN,tn_1024_870_512_ld_512_512_1024,Gemm_Hipblaslt_6377,0.406826
GemmAndBiasTunableOp_float_TN,tn_120_780_120_ld_120_120_120,Gemm_Hipblaslt_6376,0.0251477
GemmAndBiasTunableOp_float_TN,tn_1024_607_512_ld_512_512_1024,Gemm_Hipblaslt_6377,0.295119
GemmAndBiasTunableOp_float_TN,tn_1024_759_512_ld_512_512_1024,Gemm_Hipblaslt_6377,0.352507
GemmAndBiasTunableOp_float_TN,tn_97_239_256_ld_256_256_97,Gemm_Hipblaslt_6377,0.0147638
GemmAndBiasTunableOp_float_TN,tn_1024_710_512_ld_512_512_1024,Gemm_Hipblaslt_6377,0.334606
GemmAndBiasTunableOp_float_TN,tn_1024_639_512_ld_512_512_1024,Gemm_Hipblaslt_6377,0.310722
GemmAndBiasTunableOp_float_TN,tn_1024_262_512_ld_512_512_1024,Gemm_Hipblaslt_6377,0.131303
GemmAndBiasTunableOp_float_TN,tn_1024_666_512_ld_512_512_1024,Gemm_Hipblaslt_6377,0.325948
GemmAndBiasTunableOp_float_TN,tn_1024_798_512_ld_512_512_1024,Gemm_Hipblaslt_6377,0.37128
GemmAndBiasTunableOp_float_TN,tn_1024_486_512_ld_512_512_1024,Gemm_Hipblaslt_6377,0.219577
GemmAndBiasTunableOp_float_TN,tn_97_111_256_ld_256_256_97,Gemm_Hipblaslt_6376,0.0129467
GemmAndBiasTunableOp_float_TN,tn_1024_891_512_ld_512_512_1024,Gemm_Hipblaslt_6377,0.403425
GemmAndBiasTunableOp_float_TN,tn_1024_399_512_ld_512_512_1024,Gemm_Hipblaslt_6377,0.183328
GemmAndBiasTunableOp_float_TN,tn_1024_648_512_ld_512_512_1024,Default,0.32808
GemmAndBiasTunableOp_float_TN,tn_1024_600_512_ld_512_512_1024,Default,0.303349
GemmAndBiasTunableOp_float_TN,tn_1024_1016_512_ld_512_512_1024,Default,0.463822
GemmAndBiasTunableOp_float_TN,tn_1024_972_512_ld_512_512_1024,Default,0.453002
GemmAndBiasTunableOp_float_TN,tn_1024_219_512_ld_512_512_1024,Gemm_Hipblaslt_6379,0.242741
GemmAndBiasTunableOp_float_TN,tn_1024_630_512_ld_512_512_1024,Gemm_Hipblaslt_6377,0.31456
GemmAndBiasTunableOp_float_TN,tn_1024_634_512_ld_512_512_1024,Default,0.316087
GemmAndBiasTunableOp_float_TN,tn_1024_54_512_ld_512_512_1024,Gemm_Hipblaslt_6377,0.0369262
GemmAndBiasTunableOp_float_TN,tn_1024_478_512_ld_512_512_1024,Gemm_Hipblaslt_6377,0.208119
GemmAndBiasTunableOp_float_TN,tn_1024_678_512_ld_512_512_1024,Gemm_Hipblaslt_6377,0.325151
GemmAndBiasTunableOp_float_TN,tn_256_175_512_ld_512_512_256,Gemm_Hipblaslt_6377,0.0269771
GemmAndBiasTunableOp_float_TN,tn_1024_932_512_ld_512_512_1024,Gemm_Hipblaslt_6377,0.428865
GemmAndBiasTunableOp_float_TN,tn_1024_770_512_ld_512_512_1024,Gemm_Hipblaslt_6377,0.361652
GemmAndBiasTunableOp_float_TN,tn_1024_608_512_ld_512_512_1024,Gemm_Hipblaslt_6377,0.298162
GemmAndBiasTunableOp_float_TN,tn_1024_390_512_ld_512_512_1024,Gemm_Hipblaslt_6377,0.177384
GemmAndBiasTunableOp_float_TN,tn_1024_490_512_ld_512_512_1024,Gemm_Hipblaslt_6377,0.220215
GemmAndBiasTunableOp_float_TN,tn_1024_754_512_ld_512_512_1024,Default,0.363126
GemmAndBiasTunableOp_float_TN,tn_1024_958_512_ld_512_512_1024,Gemm_Hipblaslt_6377,0.446346
GemmAndBiasTunableOp_float_TN,tn_1024_21_512_ld_512_512_1024,Gemm_Hipblaslt_6377,0.0265988
GemmStridedBatchedTunableOp_float_TN,tn_332_332_128_B_16_ld_128_2048_332,Gemm_Hipblaslt_6377,0.178896
GemmStridedBatchedTunableOp_float_TN,tn_1541_1541_128_B_16_ld_128_2048_1541,Gemm_Rocblas_6378,3.78547
GemmStridedBatchedTunableOp_float_TN,tn_1270_1270_128_B_16_ld_128_2048_1270,Gemm_Rocblas_6378,2.60968
GemmStridedBatchedTunableOp_float_TN,tn_491_491_128_B_16_ld_128_2048_491,Gemm_Hipblaslt_6377,0.383907
GemmStridedBatchedTunableOp_float_TN,tn_1246_1246_128_B_16_ld_128_2048_1246,Gemm_Rocblas_6378,2.44363
GemmStridedBatchedTunableOp_float_TN,tn_755_755_128_B_16_ld_128_2048_755,Gemm_Rocblas_6378,0.934116
GemmStridedBatchedTunableOp_float_TN,tn_1545_1545_128_B_16_ld_128_2048_1545,Gemm_Rocblas_6378,3.76765
GemmStridedBatchedTunableOp_float_TN,tn_1580_1580_128_B_16_ld_128_2048_1580,Gemm_Rocblas_6378,3.85617
GemmStridedBatchedTunableOp_float_TN,tn_772_772_128_B_16_ld_128_2048_772,Gemm_Rocblas_6378,0.970912
GemmStridedBatchedTunableOp_float_TN,tn_1278_1278_128_B_16_ld_128_2048_1278,Gemm_Hipblaslt_6377,2.57141
GemmStridedBatchedTunableOp_float_TN,tn_1127_1127_128_B_16_ld_128_2048_1127,Gemm_Rocblas_6378,2.02449
GemmStridedBatchedTunableOp_float_TN,tn_1174_1174_128_B_16_ld_128_2048_1174,Gemm_Hipblaslt_6377,2.19208
GemmStridedBatchedTunableOp_float_TN,tn_1237_1237_128_B_16_ld_128_2048_1237,Gemm_Rocblas_6378,2.44033
GemmStridedBatchedTunableOp_float_TN,tn_1282_1282_128_B_16_ld_128_2048_1282,Gemm_Hipblaslt_6377,2.64463
GemmStridedBatchedTunableOp_float_TN,tn_1311_1311_128_B_16_ld_128_2048_1311,Gemm_Rocblas_6378,2.70547
GemmStridedBatchedTunableOp_float_TN,tn_1668_1668_128_B_16_ld_128_2048_1668,Gemm_Hipblaslt_6377,4.32825
GemmStridedBatchedTunableOp_float_TN,tn_1236_1236_128_B_16_ld_128_2048_1236,Gemm_Rocblas_6378,2.37872
GemmStridedBatchedTunableOp_float_TN,tn_982_982_128_B_16_ld_128_2048_982,Gemm_Rocblas_6378,1.54792
GemmStridedBatchedTunableOp_float_TN,tn_715_715_128_B_16_ld_128_2048_715,Gemm_Hipblaslt_6377,0.820161
GemmStridedBatchedTunableOp_float_TN,tn_1537_1537_128_B_16_ld_128_2048_1537,Gemm_Hipblaslt_6377,3.74238
GemmStridedBatchedTunableOp_float_TN,tn_1002_1002_128_B_16_ld_128_2048_1002,Gemm_Hipblaslt_6377,1.59076
GemmStridedBatchedTunableOp_float_TN,tn_1993_1_128_B_16_ld_128_128_1993,Gemm_Hipblaslt_6376,0.0554302
GemmStridedBatchedTunableOp_float_TN,tn_1445_1445_128_B_16_ld_128_2048_1445,Gemm_Hipblaslt_6377,3.32088
GemmStridedBatchedTunableOp_float_TN,tn_1071_1071_128_B_16_ld_128_2048_1071,Gemm_Rocblas_6378,1.82575
GemmStridedBatchedTunableOp_float_TN,tn_1178_1178_128_B_16_ld_128_2048_1178,Gemm_Rocblas_6378,2.16642
GemmStridedBatchedTunableOp_float_TN,tn_1442_1442_128_B_16_ld_128_2048_1442,Gemm_Hipblaslt_6377,3.29139
GemmStridedBatchedTunableOp_float_TN,tn_1486_1486_128_B_16_ld_128_2048_1486,Gemm_Rocblas_6378,3.43374
GemmStridedBatchedTunableOp_float_TN,tn_1248_1248_128_B_16_ld_128_2048_1248,Gemm_Hipblaslt_6377,2.41525
GemmStridedBatchedTunableOp_float_TN,tn_489_489_128_B_16_ld_128_2048_489,Gemm_Rocblas_6378,0.383676
GemmStridedBatchedTunableOp_float_TN,tn_1022_1022_128_B_16_ld_128_2048_1022,Gemm_Hipblaslt_6377,1.63964
GemmStridedBatchedTunableOp_float_TN,tn_828_828_128_B_16_ld_128_2048_828,Gemm_Hipblaslt_6377,1.07118
GemmStridedBatchedTunableOp_float_TN,tn_1594_1594_128_B_16_ld_128_2048_1594,Gemm_Rocblas_6378,3.91354
GemmStridedBatchedTunableOp_float_TN,tn_1182_1182_128_B_16_ld_128_2048_1182,Gemm_Hipblaslt_6377,2.23185
GemmStridedBatchedTunableOp_float_TN,tn_242_242_128_B_16_ld_128_2048_242,Gemm_Hipblaslt_6377,0.110619
GemmStridedBatchedTunableOp_float_TN,tn_1990_1_128_B_16_ld_128_128_1990,Gemm_Hipblaslt_6376,0.0561693
GemmStridedBatchedTunableOp_float_TN,tn_1987_1_128_B_16_ld_128_128_1987,Gemm_Hipblaslt_6376,0.0547503
GemmStridedBatchedTunableOp_float_TN,tn_1985_1_128_B_16_ld_128_128_1985,Gemm_Hipblaslt_6376,0.0549325
GemmStridedBatchedTunableOp_float_TN,tn_1984_1_128_B_16_ld_128_128_1984,Gemm_Hipblaslt_6378,0.0571944
GemmStridedBatchedTunableOp_float_TN,tn_1983_1_128_B_16_ld_128_128_1983,Gemm_Hipblaslt_6376,0.0560094
GemmStridedBatchedTunableOp_float_TN,tn_1981_1_128_B_16_ld_128_128_1981,Gemm_Hipblaslt_6376,0.0562959
GemmStridedBatchedTunableOp_float_TN,tn_1977_1_128_B_16_ld_128_128_1977,Gemm_Hipblaslt_6376,0.0541423
GemmStridedBatchedTunableOp_float_TN,tn_1976_1_128_B_16_ld_128_128_1976,Gemm_Hipblaslt_6376,0.0530887
GemmStridedBatchedTunableOp_float_TN,tn_1974_1_128_B_16_ld_128_128_1974,Gemm_Hipblaslt_6376,0.0552376
GemmStridedBatchedTunableOp_float_TN,tn_1969_1_128_B_16_ld_128_128_1969,Gemm_Hipblaslt_6376,0.0543266
GemmStridedBatchedTunableOp_float_TN,tn_1968_1_128_B_16_ld_128_128_1968,Gemm_Hipblaslt_6376,0.0542621
GemmStridedBatchedTunableOp_float_TN,tn_1965_1_128_B_16_ld_128_128_1965,Gemm_Hipblaslt_6376,0.055345
GemmStridedBatchedTunableOp_float_TN,tn_1963_1_128_B_16_ld_128_128_1963,Gemm_Hipblaslt_6376,0.0544741
GemmStridedBatchedTunableOp_float_TN,tn_1962_1_128_B_16_ld_128_128_1962,Gemm_Hipblaslt_6376,0.0544464
GemmStridedBatchedTunableOp_float_TN,tn_913_913_128_B_16_ld_128_2048_913,Gemm_Rocblas_6378,1.35363
GemmStridedBatchedTunableOp_float_TN,tn_279_279_128_B_16_ld_128_2048_279,Gemm_Rocblas_6378,0.134504
GemmStridedBatchedTunableOp_float_TN,tn_2120_1_128_B_16_ld_128_128_2120,Gemm_Hipblaslt_6376,0.0556752
GemmStridedBatchedTunableOp_float_TN,tn_2118_1_128_B_16_ld_128_128_2118,Gemm_Rocblas_6377,0.056899
GemmStridedBatchedTunableOp_float_TN,tn_2117_1_128_B_16_ld_128_128_2117,Gemm_Hipblaslt_6376,0.0570497
GemmStridedBatchedTunableOp_float_TN,tn_2112_1_128_B_16_ld_128_128_2112,Gemm_Hipblaslt_6376,0.058333
GemmStridedBatchedTunableOp_float_TN,tn_2111_1_128_B_16_ld_128_128_2111,Gemm_Hipblaslt_6376,0.0573579
GemmStridedBatchedTunableOp_float_TN,tn_2110_1_128_B_16_ld_128_128_2110,Gemm_Hipblaslt_6376,0.0568233
GemmStridedBatchedTunableOp_float_TN,tn_2102_1_128_B_16_ld_128_128_2102,Gemm_Rocblas_6377,0.0565912
GemmStridedBatchedTunableOp_float_TN,tn_2101_1_128_B_16_ld_128_128_2101,Gemm_Hipblaslt_6376,0.0564798
GemmStridedBatchedTunableOp_float_TN,tn_2100_1_128_B_16_ld_128_128_2100,Gemm_Hipblaslt_6376,0.0556431
GemmStridedBatchedTunableOp_float_TN,tn_2099_1_128_B_16_ld_128_128_2099,Gemm_Hipblaslt_6376,0.0570878
GemmStridedBatchedTunableOp_float_TN,tn_2097_1_128_B_16_ld_128_128_2097,Gemm_Hipblaslt_6376,0.0573915
GemmStridedBatchedTunableOp_float_TN,tn_2090_1_128_B_16_ld_128_128_2090,Gemm_Hipblaslt_6376,0.0561019
GemmStridedBatchedTunableOp_float_TN,tn_2089_1_128_B_16_ld_128_128_2089,Gemm_Hipblaslt_6376,0.0557381
GemmStridedBatchedTunableOp_float_TN,tn_2088_1_128_B_16_ld_128_128_2088,Gemm_Hipblaslt_6376,0.0565284
GemmStridedBatchedTunableOp_float_TN,tn_2087_1_128_B_16_ld_128_128_2087,Gemm_Hipblaslt_6376,0.0575612
GemmStridedBatchedTunableOp_float_TN,tn_2084_1_128_B_16_ld_128_128_2084,Gemm_Hipblaslt_6376,0.0562911
GemmStridedBatchedTunableOp_float_TN,tn_2081_1_128_B_16_ld_128_128_2081,Gemm_Rocblas_6377,0.0560619
GemmStridedBatchedTunableOp_float_TN,tn_2080_1_128_B_16_ld_128_128_2080,Gemm_Hipblaslt_6376,0.0554179
GemmStridedBatchedTunableOp_float_TN,tn_2079_1_128_B_16_ld_128_128_2079,Gemm_Hipblaslt_6376,0.056435
GemmStridedBatchedTunableOp_float_TN,tn_2075_1_128_B_16_ld_128_128_2075,Gemm_Hipblaslt_6376,0.0555365
GemmStridedBatchedTunableOp_float_TN,tn_2074_1_128_B_16_ld_128_128_2074,Gemm_Hipblaslt_6376,0.0553929
GemmStridedBatchedTunableOp_float_TN,tn_2041_2041_128_B_16_ld_128_2048_2041,Gemm_Hipblaslt_6377,6.30824
GemmStridedBatchedTunableOp_float_TN,tn_1032_1032_128_B_16_ld_128_2048_1032,Gemm_Hipblaslt_6377,1.6907
GemmStridedBatchedTunableOp_float_TN,tn_1772_1_128_B_16_ld_128_128_1772,Gemm_Hipblaslt_6376,0.0510244
GemmStridedBatchedTunableOp_float_TN,tn_1769_1_128_B_16_ld_128_128_1769,Gemm_Hipblaslt_6376,0.0508277
GemmStridedBatchedTunableOp_float_TN,tn_1768_1_128_B_16_ld_128_128_1768,Gemm_Hipblaslt_6376,0.0513137
GemmStridedBatchedTunableOp_float_TN,tn_1764_1_128_B_16_ld_128_128_1764,Gemm_Rocblas_6377,0.0506656
GemmStridedBatchedTunableOp_float_TN,tn_1762_1_128_B_16_ld_128_128_1762,Gemm_Hipblaslt_6376,0.0496145
GemmStridedBatchedTunableOp_float_TN,tn_1493_1493_128_B_16_ld_128_2048_1493,Gemm_Hipblaslt_6377,3.55534
GemmStridedBatchedTunableOp_float_TN,tn_474_474_128_B_16_ld_128_2048_474,Gemm_Hipblaslt_6377,0.356818
GemmStridedBatchedTunableOp_float_TN,tn_1758_1_128_B_16_ld_128_128_1758,Gemm_Hipblaslt_6376,0.0502292
GemmStridedBatchedTunableOp_float_TN,tn_1757_1_128_B_16_ld_128_128_1757,Gemm_Hipblaslt_6376,0.0502942
GemmStridedBatchedTunableOp_float_TN,tn_1756_1_128_B_16_ld_128_128_1756,Gemm_Hipblaslt_6376,0.0516162
GemmStridedBatchedTunableOp_float_TN,tn_1752_1_128_B_16_ld_128_128_1752,Gemm_Hipblaslt_6378,0.0513598
GemmStridedBatchedTunableOp_float_TN,tn_1751_1_128_B_16_ld_128_128_1751,Gemm_Hipblaslt_6376,0.0513791
GemmStridedBatchedTunableOp_float_TN,tn_1749_1_128_B_16_ld_128_128_1749,Gemm_Hipblaslt_6376,0.0502249
GemmStridedBatchedTunableOp_float_TN,tn_1748_1_128_B_16_ld_128_128_1748,Gemm_Hipblaslt_6376,0.0492554
GemmStridedBatchedTunableOp_float_TN,tn_1747_1_128_B_16_ld_128_128_1747,Gemm_Hipblaslt_6376,0.0504866
GemmStridedBatchedTunableOp_float_TN,tn_1209_1209_128_B_16_ld_128_2048_1209,Gemm_Rocblas_6378,2.29022
GemmStridedBatchedTunableOp_float_TN,tn_1746_1_128_B_16_ld_128_128_1746,Gemm_Hipblaslt_6376,0.0492113
GemmStridedBatchedTunableOp_float_TN,tn_1745_1_128_B_16_ld_128_128_1745,Gemm_Hipblaslt_6376,0.0506316
GemmStridedBatchedTunableOp_float_TN,tn_1740_1_128_B_16_ld_128_128_1740,Gemm_Hipblaslt_6376,0.0508856
GemmStridedBatchedTunableOp_float_TN,tn_1739_1_128_B_16_ld_128_128_1739,Gemm_Hipblaslt_6376,0.0504886
GemmStridedBatchedTunableOp_float_TN,tn_1738_1_128_B_16_ld_128_128_1738,Gemm_Hipblaslt_6376,0.0506725
GemmStridedBatchedTunableOp_float_TN,tn_1737_1_128_B_16_ld_128_128_1737,Gemm_Hipblaslt_6376,0.0498302
GemmStridedBatchedTunableOp_float_TN,tn_1736_1_128_B_16_ld_128_128_1736,Gemm_Hipblaslt_6376,0.0489397
GemmStridedBatchedTunableOp_float_TN,tn_1733_1_128_B_16_ld_128_128_1733,Gemm_Hipblaslt_6376,0.0504433
GemmStridedBatchedTunableOp_float_TN,tn_1732_1_128_B_16_ld_128_128_1732,Gemm_Hipblaslt_6376,0.0489653
GemmStridedBatchedTunableOp_float_TN,tn_1731_1_128_B_16_ld_128_128_1731,Gemm_Hipblaslt_6376,0.0488748
GemmStridedBatchedTunableOp_float_TN,tn_1730_1_128_B_16_ld_128_128_1730,Gemm_Hipblaslt_6376,0.0491868
GemmStridedBatchedTunableOp_float_TN,tn_1726_1_128_B_16_ld_128_128_1726,Gemm_Hipblaslt_6376,0.0514384
GemmStridedBatchedTunableOp_float_TN,tn_1725_1_128_B_16_ld_128_128_1725,Gemm_Hipblaslt_6376,0.0498678
GemmStridedBatchedTunableOp_float_TN,tn_1722_1_128_B_16_ld_128_128_1722,Gemm_Hipblaslt_6376,0.0503779
GemmStridedBatchedTunableOp_float_TN,tn_1680_1680_128_B_16_ld_128_2048_1680,Gemm_Rocblas_6378,4.3424
GemmStridedBatchedTunableOp_float_TN,tn_1870_1_128_B_16_ld_128_128_1870,Gemm_Hipblaslt_6376,0.0531608
GemmStridedBatchedTunableOp_float_TN,tn_1866_1_128_B_16_ld_128_128_1866,Gemm_Hipblaslt_6376,0.0511
GemmStridedBatchedTunableOp_float_TN,tn_1865_1_128_B_16_ld_128_128_1865,Gemm_Hipblaslt_6376,0.0519016
GemmStridedBatchedTunableOp_float_TN,tn_1864_1_128_B_16_ld_128_128_1864,Gemm_Hipblaslt_6378,0.054305
GemmStridedBatchedTunableOp_float_TN,tn_1863_1_128_B_16_ld_128_128_1863,Gemm_Hipblaslt_6378,0.0540356
GemmStridedBatchedTunableOp_float_TN,tn_1862_1_128_B_16_ld_128_128_1862,Gemm_Hipblaslt_6376,0.0534994
GemmStridedBatchedTunableOp_float_TN,tn_1859_1_128_B_16_ld_128_128_1859,Gemm_Hipblaslt_6376,0.0524122
GemmStridedBatchedTunableOp_float_TN,tn_1858_1_128_B_16_ld_128_128_1858,Gemm_Rocblas_6377,0.0529968
GemmStridedBatchedTunableOp_float_TN,tn_1857_1_128_B_16_ld_128_128_1857,Gemm_Hipblaslt_6376,0.05234
GemmStridedBatchedTunableOp_float_TN,tn_1851_1_128_B_16_ld_128_128_1851,Gemm_Hipblaslt_6376,0.0514909
GemmStridedBatchedTunableOp_float_TN,tn_1850_1_128_B_16_ld_128_128_1850,Gemm_Hipblaslt_6376,0.051995
GemmStridedBatchedTunableOp_float_TN,tn_1849_1_128_B_16_ld_128_128_1849,Gemm_Hipblaslt_6376,0.0528085
GemmStridedBatchedTunableOp_float_TN,tn_1846_1_128_B_16_ld_128_128_1846,Gemm_Hipblaslt_6376,0.0523063
GemmStridedBatchedTunableOp_float_TN,tn_1844_1844_128_B_16_ld_128_2048_1844,Gemm_Hipblaslt_6377,5.17795
GemmStridedBatchedTunableOp_float_TN,tn_1878_1_128_B_16_ld_128_128_1878,Gemm_Hipblaslt_6376,0.0532281
GemmStridedBatchedTunableOp_float_TN,tn_1877_1_128_B_16_ld_128_128_1877,Gemm_Hipblaslt_6376,0.0539582
GemmStridedBatchedTunableOp_float_TN,tn_1874_1_128_B_16_ld_128_128_1874,Gemm_Hipblaslt_6376,0.0514315
GemmStridedBatchedTunableOp_float_TN,tn_1870_1870_128_B_16_ld_128_2048_1870,Gemm_Rocblas_6378,5.36151
GemmStridedBatchedTunableOp_float_TN,tn_1379_1379_128_B_16_ld_128_2048_1379,Gemm_Rocblas_6378,3.01806
GemmStridedBatchedTunableOp_float_TN,tn_1043_1043_128_B_16_ld_128_2048_1043,Gemm_Rocblas_6378,1.73001
GemmStridedBatchedTunableOp_float_TN,tn_1606_1_128_B_16_ld_128_128_1606,Gemm_Hipblaslt_6376,0.0479
GemmStridedBatchedTunableOp_float_TN,tn_1603_1_128_B_16_ld_128_128_1603,Gemm_Hipblaslt_6376,0.0461696
GemmStridedBatchedTunableOp_float_TN,tn_1600_1_128_B_16_ld_128_128_1600,Gemm_Hipblaslt_6376,0.0477539
GemmStridedBatchedTunableOp_float_TN,tn_1598_1_128_B_16_ld_128_128_1598,Gemm_Hipblaslt_6376,0.0482388
GemmStridedBatchedTunableOp_float_TN,tn_1595_1_128_B_16_ld_128_128_1595,Gemm_Hipblaslt_6376,0.0477826
GemmStridedBatchedTunableOp_float_TN,tn_1594_1_128_B_16_ld_128_128_1594,Gemm_Hipblaslt_6376,0.0477902
GemmStridedBatchedTunableOp_float_TN,tn_1593_1_128_B_16_ld_128_128_1593,Gemm_Hipblaslt_6376,0.0484474
GemmStridedBatchedTunableOp_float_TN,tn_1591_1_128_B_16_ld_128_128_1591,Gemm_Hipblaslt_6376,0.0482358
GemmStridedBatchedTunableOp_float_TN,tn_1582_1_128_B_16_ld_128_128_1582,Gemm_Hipblaslt_6376,0.0468974
GemmStridedBatchedTunableOp_float_TN,tn_1581_1_128_B_16_ld_128_128_1581,Gemm_Hipblaslt_6376,0.0463119
GemmStridedBatchedTunableOp_float_TN,tn_1855_1_128_B_16_ld_128_128_1855,Gemm_Hipblaslt_6376,0.0526546
GemmStridedBatchedTunableOp_float_TN,tn_1550_1550_128_B_16_ld_128_2048_1550,Gemm_Rocblas_6378,3.73505
GemmStridedBatchedTunableOp_float_TN,tn_1839_1_128_B_16_ld_128_128_1839,Gemm_Hipblaslt_6376,0.0522599
GemmStridedBatchedTunableOp_float_TN,tn_1838_1_128_B_16_ld_128_128_1838,Gemm_Hipblaslt_6376,0.0533531
GemmStridedBatchedTunableOp_float_TN,tn_1835_1_128_B_16_ld_128_128_1835,Gemm_Hipblaslt_6376,0.0506657
GemmStridedBatchedTunableOp_float_TN,tn_1833_1_128_B_16_ld_128_128_1833,Gemm_Hipblaslt_6376,0.0520919
GemmStridedBatchedTunableOp_float_TN,tn_1831_1_128_B_16_ld_128_128_1831,Gemm_Hipblaslt_6376,0.051339
GemmStridedBatchedTunableOp_float_TN,tn_1827_1_128_B_16_ld_128_128_1827,Gemm_Hipblaslt_6376,0.051234
GemmStridedBatchedTunableOp_float_TN,tn_1825_1_128_B_16_ld_128_128_1825,Gemm_Hipblaslt_6376,0.0516323
GemmStridedBatchedTunableOp_float_TN,tn_1823_1_128_B_16_ld_128_128_1823,Gemm_Hipblaslt_6376,0.0514704
GemmStridedBatchedTunableOp_float_TN,tn_1819_1_128_B_16_ld_128_128_1819,Gemm_Hipblaslt_6376,0.0502012
GemmStridedBatchedTunableOp_float_TN,tn_1818_1_128_B_16_ld_128_128_1818,Gemm_Hipblaslt_6376,0.0506644
GemmStridedBatchedTunableOp_float_TN,tn_1817_1_128_B_16_ld_128_128_1817,Gemm_Hipblaslt_6376,0.052009
GemmStridedBatchedTunableOp_float_TN,tn_1814_1_128_B_16_ld_128_128_1814,Gemm_Hipblaslt_6376,0.0517681
GemmStridedBatchedTunableOp_float_TN,tn_1806_1_128_B_16_ld_128_128_1806,Gemm_Hipblaslt_6376,0.0511799
GemmStridedBatchedTunableOp_float_TN,tn_1805_1_128_B_16_ld_128_128_1805,Gemm_Hipblaslt_6376,0.0518494
GemmStridedBatchedTunableOp_float_TN,tn_1804_1_128_B_16_ld_128_128_1804,Gemm_Hipblaslt_6376,0.0504485
GemmStridedBatchedTunableOp_float_TN,tn_1801_1_128_B_16_ld_128_128_1801,Gemm_Hipblaslt_6376,0.0510825
GemmStridedBatchedTunableOp_float_TN,tn_1799_1_128_B_16_ld_128_128_1799,Gemm_Hipblaslt_6376,0.051173
GemmStridedBatchedTunableOp_float_TN,tn_1796_1_128_B_16_ld_128_128_1796,Gemm_Hipblaslt_6376,0.0498221
GemmStridedBatchedTunableOp_float_TN,tn_1794_1_128_B_16_ld_128_128_1794,Gemm_Hipblaslt_6376,0.0498583
GemmStridedBatchedTunableOp_float_TN,tn_1792_1_128_B_16_ld_128_128_1792,Gemm_Hipblaslt_6378,0.0521621
GemmStridedBatchedTunableOp_float_TN,tn_1791_1_128_B_16_ld_128_128_1791,Gemm_Hipblaslt_6376,0.0507943
GemmStridedBatchedTunableOp_float_TN,tn_1790_1_128_B_16_ld_128_128_1790,Gemm_Hipblaslt_6376,0.0522911
GemmStridedBatchedTunableOp_float_TN,tn_1787_1_128_B_16_ld_128_128_1787,Gemm_Hipblaslt_6376,0.050323
GemmStridedBatchedTunableOp_float_TN,tn_1786_1_128_B_16_ld_128_128_1786,Gemm_Hipblaslt_6376,0.0503696
GemmStridedBatchedTunableOp_float_TN,tn_1784_1_128_B_16_ld_128_128_1784,Gemm_Hipblaslt_6376,0.0502433
GemmStridedBatchedTunableOp_float_TN,tn_1782_1_128_B_16_ld_128_128_1782,Gemm_Hipblaslt_6376,0.0514388
GemmStridedBatchedTunableOp_float_TN,tn_1780_1_128_B_16_ld_128_128_1780,Gemm_Hipblaslt_6376,0.05108
GemmStridedBatchedTunableOp_float_TN,tn_1777_1_128_B_16_ld_128_128_1777,Gemm_Hipblaslt_6376,0.0500926
GemmStridedBatchedTunableOp_float_TN,tn_1776_1_128_B_16_ld_128_128_1776,Gemm_Hipblaslt_6376,0.0500229
GemmStridedBatchedTunableOp_float_TN,tn_1775_1_128_B_16_ld_128_128_1775,Gemm_Rocblas_6377,0.0505864
GemmStridedBatchedTunableOp_float_TN,tn_611_611_128_B_16_ld_128_2048_611,Gemm_Hipblaslt_6377,0.61226
GemmStridedBatchedTunableOp_float_TN,tn_523_523_128_B_16_ld_128_2048_523,Gemm_Hipblaslt_6377,0.439021
GemmStridedBatchedTunableOp_float_TN,tn_677_677_128_B_16_ld_128_2048_677,Gemm_Rocblas_6378,0.744417
GemmStridedBatchedTunableOp_float_TN,tn_1492_1492_128_B_16_ld_128_2048_1492,Gemm_Hipblaslt_6377,3.42236
GemmStridedBatchedTunableOp_float_TN,tn_871_871_128_B_16_ld_128_2048_871,Gemm_Hipblaslt_6377,1.218
GemmStridedBatchedTunableOp_float_TN,tn_1230_1230_128_B_16_ld_128_2048_1230,Gemm_Rocblas_6378,2.37052
GemmStridedBatchedTunableOp_float_TN,tn_734_734_128_B_16_ld_128_2048_734,Gemm_Hipblaslt_6377,0.853937
GemmStridedBatchedTunableOp_float_TN,tn_1830_1_128_B_16_ld_128_128_1830,Gemm_Hipblaslt_6376,0.0525625
GemmStridedBatchedTunableOp_float_TN,tn_1580_1_128_B_16_ld_128_128_1580,Gemm_Hipblaslt_6376,0.0472841
GemmStridedBatchedTunableOp_float_TN,tn_1579_1_128_B_16_ld_128_128_1579,Gemm_Hipblaslt_6376,0.0460863
GemmStridedBatchedTunableOp_float_TN,tn_1577_1_128_B_16_ld_128_128_1577,Gemm_Hipblaslt_6376,0.045356
GemmStridedBatchedTunableOp_float_TN,tn_1574_1_128_B_16_ld_128_128_1574,Gemm_Hipblaslt_6376,0.0471455
GemmStridedBatchedTunableOp_float_TN,tn_1573_1_128_B_16_ld_128_128_1573,Gemm_Hipblaslt_6376,0.0471983
GemmStridedBatchedTunableOp_float_TN,tn_1571_1_128_B_16_ld_128_128_1571,Gemm_Hipblaslt_6376,0.0457753
GemmStridedBatchedTunableOp_float_TN,tn_1569_1_128_B_16_ld_128_128_1569,Gemm_Hipblaslt_6376,0.0468365
GemmStridedBatchedTunableOp_float_TN,tn_1568_1_128_B_16_ld_128_128_1568,Gemm_Hipblaslt_6376,0.0449702
GemmStridedBatchedTunableOp_float_TN,tn_1567_1_128_B_16_ld_128_128_1567,Gemm_Hipblaslt_6378,0.0466922
GemmStridedBatchedTunableOp_float_TN,tn_1566_1_128_B_16_ld_128_128_1566,Gemm_Hipblaslt_6376,0.0466597
GemmStridedBatchedTunableOp_float_TN,tn_1563_1_128_B_16_ld_128_128_1563,Gemm_Hipblaslt_6376,0.045895
GemmStridedBatchedTunableOp_float_TN,tn_1562_1_128_B_16_ld_128_128_1562,Gemm_Hipblaslt_6376,0.0456265
GemmStridedBatchedTunableOp_float_TN,tn_1556_1_128_B_16_ld_128_128_1556,Gemm_Hipblaslt_6376,0.0464638
GemmStridedBatchedTunableOp_float_TN,tn_1551_1_128_B_16_ld_128_128_1551,Gemm_Hipblaslt_6376,0.0476712
GemmStridedBatchedTunableOp_float_TN,tn_1548_1_128_B_16_ld_128_128_1548,Gemm_Hipblaslt_6376,0.0459765
GemmStridedBatchedTunableOp_float_TN,tn_1419_1419_128_B_16_ld_128_2048_1419,Gemm_Hipblaslt_6377,3.15521
GemmStridedBatchedTunableOp_float_TN,tn_1547_1_128_B_16_ld_128_128_1547,Gemm_Rocblas_6377,0.0459624
GemmStridedBatchedTunableOp_float_TN,tn_1546_1_128_B_16_ld_128_128_1546,Gemm_Hipblaslt_6376,0.0450639
GemmStridedBatchedTunableOp_float_TN,tn_1545_1_128_B_16_ld_128_128_1545,Gemm_Hipblaslt_6376,0.0455313
GemmStridedBatchedTunableOp_float_TN,tn_1971_1_128_B_16_ld_128_128_1971,Gemm_Hipblaslt_6376,0.0553633
GemmStridedBatchedTunableOp_float_TN,tn_1345_1345_128_B_16_ld_128_2048_1345,Gemm_Hipblaslt_6377,2.89559
GemmStridedBatchedTunableOp_float_TN,tn_1461_1_128_B_16_ld_128_128_1461,Gemm_Hipblaslt_6376,0.0452122
GemmStridedBatchedTunableOp_float_TN,tn_1425_1425_128_B_16_ld_128_2048_1425,Gemm_Rocblas_6378,3.24529
GemmStridedBatchedTunableOp_float_TN,tn_904_904_128_B_16_ld_128_2048_904,Gemm_Hipblaslt_6377,1.28395
GemmStridedBatchedTunableOp_float_TN,tn_1465_1_128_B_16_ld_128_128_1465,Gemm_Hipblaslt_6376,0.0449316
GemmStridedBatchedTunableOp_float_TN,tn_1464_1_128_B_16_ld_128_128_1464,Gemm_Hipblaslt_6376,0.0428534
GemmStridedBatchedTunableOp_float_TN,tn_1461_1461_128_B_16_ld_128_2048_1461,Gemm_Hipblaslt_6377,3.41887
GemmStridedBatchedTunableOp_float_TN,tn_654_654_128_B_16_ld_128_2048_654,Gemm_Hipblaslt_6377,0.683656
GemmStridedBatchedTunableOp_float_TN,tn_466_466_128_B_16_ld_128_2048_466,Gemm_Rocblas_6378,0.359323
GemmStridedBatchedTunableOp_float_TN,tn_850_850_128_B_16_ld_128_2048_850,Gemm_Hipblaslt_6377,1.19825
GemmStridedBatchedTunableOp_float_TN,tn_688_1_64_B_8_ld_512_64_688,Gemm_Hipblaslt_6376,0.0112363
GemmStridedBatchedTunableOp_float_TN,tn_1887_1_128_B_16_ld_128_128_1887,Gemm_Hipblaslt_6376,0.0531601
GemmStridedBatchedTunableOp_float_TN,tn_2028_1_128_B_16_ld_128_128_2028,Gemm_Hipblaslt_6376,0.0572059
GemmStridedBatchedTunableOp_float_TN,tn_1343_1_64_B_18_ld_64_64_1343,Gemm_Rocblas_-9,0.0139583
GemmStridedBatchedTunableOp_float_TN,tn_1669_1_128_B_16_ld_128_128_1669,Gemm_Hipblaslt_6376,0.0500244
GemmStridedBatchedTunableOp_float_TN,tn_1540_1_64_B_18_ld_64_64_1540,Gemm_Rocblas_-9,0.0158751
GemmStridedBatchedTunableOp_float_TN,tn_482_1_128_B_16_ld_128_128_482,Gemm_Rocblas_6377,0.0200068
GemmStridedBatchedTunableOp_float_TN,tn_1824_1_128_B_16_ld_128_128_1824,Gemm_Hipblaslt_6378,0.0530959
GemmStridedBatchedTunableOp_float_TN,tn_1484_1_128_B_16_ld_128_128_1484,Gemm_Hipblaslt_6376,0.0444452
GemmStridedBatchedTunableOp_float_TN,tn_1555_1_128_B_16_ld_128_128_1555,Gemm_Hipblaslt_6376,0.0454682
GemmStridedBatchedTunableOp_float_TN,tn_969_1_64_B_18_ld_64_64_969,Gemm_Rocblas_-9,0.0117566
GemmStridedBatchedTunableOp_float_TN,tn_1442_1_64_B_18_ld_64_64_1442,Gemm_Rocblas_-9,0.0144003
GemmStridedBatchedTunableOp_float_TN,tn_1235_1_64_B_18_ld_64_64_1235,Gemm_Rocblas_-9,0.0133856
GemmStridedBatchedTunableOp_float_TN,tn_1185_1_128_B_16_ld_128_128_1185,Gemm_Hipblaslt_6378,0.0420146
GemmStridedBatchedTunableOp_float_TN,tn_1283_1_64_B_18_ld_64_64_1283,Gemm_Rocblas_-9,0.0124486
GemmStridedBatchedTunableOp_float_TN,tn_217_1_64_B_8_ld_512_64_217,Gemm_Rocblas_6379,0.00894362
GemmStridedBatchedTunableOp_float_TN,tn_1712_1_64_B_18_ld_64_64_1712,Gemm_Rocblas_-9,0.0163913
GemmStridedBatchedTunableOp_float_TN,tn_945_1_128_B_16_ld_128_128_945,Gemm_Hipblaslt_6378,0.037412
GemmStridedBatchedTunableOp_float_TN,tn_568_1_128_B_16_ld_128_128_568,Gemm_Rocblas_6379,0.0234893
GemmStridedBatchedTunableOp_float_TN,tn_833_1_64_B_8_ld_512_64_833,Gemm_Rocblas_6377,0.0126349
GemmStridedBatchedTunableOp_float_TN,tn_1715_1_128_B_16_ld_128_128_1715,Gemm_Hipblaslt_6376,0.0493836
GemmStridedBatchedTunableOp_float_TN,tn_1027_1027_128_B_16_ld_128_2048_1027,Gemm_Rocblas_6378,1.70968
GemmStridedBatchedTunableOp_float_TN,tn_1347_1_128_B_16_ld_128_128_1347,Gemm_Hipblaslt_6376,0.0443286
GemmStridedBatchedTunableOp_float_TN,tn_651_651_128_B_16_ld_128_2048_651,Gemm_Hipblaslt_6377,0.689412
GemmStridedBatchedTunableOp_float_TN,tn_968_1_64_B_18_ld_64_64_968,Gemm_Rocblas_-9,0.0116419
GemmStridedBatchedTunableOp_float_TN,tn_1672_1_64_B_18_ld_64_64_1672,Gemm_Rocblas_-9,0.0158286
GemmStridedBatchedTunableOp_float_TN,tn_1086_1_128_B_16_ld_128_128_1086,Gemm_Rocblas_6379,0.0397215
GemmStridedBatchedTunableOp_float_TN,tn_669_1_128_B_16_ld_128_128_669,Gemm_Hipblaslt_6378,0.0264557
GemmStridedBatchedTunableOp_float_TN,tn_599_1_128_B_16_ld_128_128_599,Gemm_Rocblas_6379,0.0245341
GemmStridedBatchedTunableOp_float_TN,tn_694_1_128_B_16_ld_128_128_694,Gemm_Rocblas_6379,0.0324858
GemmStridedBatchedTunableOp_float_TN,tn_181_1_64_B_8_ld_512_64_181,Gemm_Rocblas_6379,0.00879897
GemmStridedBatchedTunableOp_float_TN,tn_1213_1_128_B_16_ld_128_128_1213,Gemm_Rocblas_6379,0.0425098
GemmStridedBatchedTunableOp_float_TN,tn_980_1_64_B_18_ld_64_64_980,Gemm_Rocblas_-9,0.0117461
GemmStridedBatchedTunableOp_float_TN,tn_37_1_64_B_8_ld_512_64_37,Gemm_Rocblas_-9,0.00687813
GemmStridedBatchedTunableOp_float_TN,tn_1083_1_128_B_16_ld_128_128_1083,Gemm_Hipblaslt_6378,0.0394631
GemmStridedBatchedTunableOp_float_TN,tn_253_1_128_B_16_ld_128_128_253,Gemm_Rocblas_6377,0.0140011
GemmStridedBatchedTunableOp_float_TN,tn_135_1_64_B_8_ld_512_64_135,Gemm_Rocblas_6379,0.00872643
GemmStridedBatchedTunableOp_float_TN,tn_2030_1_128_B_16_ld_128_128_2030,Gemm_Hipblaslt_6376,0.0568384
GemmStridedBatchedTunableOp_float_TN,tn_1775_1_64_B_18_ld_64_64_1775,Gemm_Rocblas_-9,0.0167167
GemmStridedBatchedTunableOp_float_TN,tn_1230_1_64_B_18_ld_64_64_1230,Gemm_Rocblas_-9,0.0133588
GemmStridedBatchedTunableOp_float_TN,tn_375_1_64_B_8_ld_512_64_375,Gemm_Rocblas_6377,0.00871841
GemmStridedBatchedTunableOp_float_TN,tn_435_1_128_B_16_ld_128_128_435,Gemm_Hipblaslt_6376,0.0187961
GemmStridedBatchedTunableOp_float_TN,tn_1020_1_64_B_18_ld_64_64_1020,Gemm_Rocblas_-9,0.0116603
GemmStridedBatchedTunableOp_float_TN,tn_886_1_128_B_16_ld_128_128_886,Gemm_Rocblas_6379,0.0367887
GemmStridedBatchedTunableOp_float_TN,tn_993_1_128_B_16_ld_128_128_993,Gemm_Hipblaslt_6378,0.0384214
GemmStridedBatchedTunableOp_float_TN,tn_463_1_128_B_16_ld_128_128_463,Gemm_Hipblaslt_6376,0.0195696
GemmStridedBatchedTunableOp_float_TN,tn_734_1_128_B_16_ld_128_128_734,Gemm_Rocblas_6379,0.0344051
GemmStridedBatchedTunableOp_float_TN,tn_1344_1_128_B_16_ld_128_128_1344,Gemm_Hipblaslt_6376,0.0444924
GemmStridedBatchedTunableOp_float_TN,tn_2112_1_64_B_18_ld_64_64_2112,Gemm_Rocblas_-9,0.0187148
GemmStridedBatchedTunableOp_float_TN,tn_897_1_128_B_16_ld_128_128_897,Gemm_Rocblas_6379,0.0370969
GemmStridedBatchedTunableOp_float_TN,tn_356_1_128_B_16_ld_128_128_356,Gemm_Rocblas_6377,0.0168472
GemmStridedBatchedTunableOp_float_TN,tn_704_1_64_B_8_ld_512_64_704,Gemm_Hipblaslt_6376,0.0111982
GemmStridedBatchedTunableOp_float_TN,tn_749_1_128_B_16_ld_128_128_749,Gemm_Rocblas_6379,0.0350327
GemmStridedBatchedTunableOp_float_TN,tn_592_1_128_B_16_ld_128_128_592,Gemm_Rocblas_6379,0.0244724
GemmStridedBatchedTunableOp_float_TN,tn_793_1_64_B_8_ld_512_64_793,Gemm_Rocblas_6377,0.0121553
GemmStridedBatchedTunableOp_float_TN,tn_541_1_128_B_16_ld_128_128_541,Gemm_Rocblas_6377,0.0214202
GemmStridedBatchedTunableOp_float_TN,tn_1463_1_128_B_16_ld_128_128_1463,Gemm_Hipblaslt_6376,0.0455308
GemmStridedBatchedTunableOp_float_TN,tn_326_1_128_B_16_ld_128_128_326,Gemm_Hipblaslt_6376,0.0161167
GemmStridedBatchedTunableOp_float_TN,tn_172_1_64_B_8_ld_512_64_172,Gemm_Hipblaslt_6378,0.00879652
GemmStridedBatchedTunableOp_float_TN,tn_1065_1_64_B_18_ld_64_64_1065,Gemm_Rocblas_-9,0.0125444
GemmStridedBatchedTunableOp_float_TN,tn_325_1_64_B_8_ld_512_64_325,Gemm_Hipblaslt_6376,0.00905226
GemmStridedBatchedTunableOp_float_TN,tn_1667_1_128_B_16_ld_128_128_1667,Gemm_Hipblaslt_6376,0.0501159
GemmStridedBatchedTunableOp_float_TN,tn_1783_1_128_B_16_ld_128_128_1783,Gemm_Hipblaslt_6376,0.0512219
GemmStridedBatchedTunableOp_float_TN,tn_717_1_128_B_16_ld_128_128_717,Gemm_Hipblaslt_6378,0.0345117
GemmStridedBatchedTunableOp_float_TN,tn_2179_1_64_B_18_ld_64_64_2179,Gemm_Rocblas_-9,0.0187817
GemmStridedBatchedTunableOp_float_TN,tn_738_1_64_B_8_ld_512_64_738,Gemm_Rocblas_6377,0.0119348
GemmStridedBatchedTunableOp_float_TN,tn_1118_1_128_B_16_ld_128_128_1118,Gemm_Rocblas_6379,0.0403458
GemmStridedBatchedTunableOp_float_TN,tn_583_1_64_B_8_ld_512_64_583,Gemm_Rocblas_6377,0.0104308
GemmStridedBatchedTunableOp_float_TN,tn_175_1_64_B_8_ld_512_64_175,Gemm_Hipblaslt_6378,0.00875527
GemmStridedBatchedTunableOp_float_TN,tn_1139_1_128_B_16_ld_128_128_1139,Gemm_Rocblas_6379,0.041005
GemmStridedBatchedTunableOp_float_TN,tn_1445_1_64_B_18_ld_64_64_1445,Gemm_Rocblas_-9,0.0147005
GemmStridedBatchedTunableOp_float_TN,tn_189_1_128_B_16_ld_128_128_189,Gemm_Hipblaslt_6376,0.0115181
GemmStridedBatchedTunableOp_float_TN,tn_669_1_64_B_8_ld_512_64_669,Gemm_Rocblas_6377,0.0109775
GemmStridedBatchedTunableOp_float_TN,tn_1659_1_64_B_18_ld_64_64_1659,Gemm_Rocblas_-9,0.0158858
GemmStridedBatchedTunableOp_float_TN,tn_115_1_64_B_8_ld_512_64_115,Gemm_Hipblaslt_6378,0.00861673
GemmStridedBatchedTunableOp_float_TN,tn_1522_1_64_B_18_ld_64_64_1522,Gemm_Rocblas_-9,0.0149621
GemmStridedBatchedTunableOp_float_TN,tn_675_1_128_B_16_ld_128_128_675,Gemm_Rocblas_6379,0.0314916
GemmStridedBatchedTunableOp_float_TN,tn_954_1_64_B_8_ld_512_64_954,Gemm_Rocblas_6377,0.0137254
GemmStridedBatchedTunableOp_float_TN,tn_789_1_64_B_8_ld_512_64_789,Gemm_Hipblaslt_6376,0.0121292
GemmStridedBatchedTunableOp_float_TN,tn_958_1_64_B_8_ld_512_64_958,Gemm_Rocblas_6377,0.0136977
GemmStridedBatchedTunableOp_float_TN,tn_937_1_64_B_8_ld_512_64_937,Gemm_Rocblas_6377,0.0135275
GemmStridedBatchedTunableOp_float_TN,tn_641_1_128_B_16_ld_128_128_641,Gemm_Hipblaslt_6378,0.0267371
GemmStridedBatchedTunableOp_float_TN,tn_866_1_64_B_8_ld_512_64_866,Gemm_Rocblas_6377,0.0127836
GemmStridedBatchedTunableOp_float_TN,tn_1169_1_128_B_16_ld_128_128_1169,Gemm_Rocblas_6379,0.0415088
GemmStridedBatchedTunableOp_float_TN,tn_1294_1_64_B_18_ld_64_64_1294,Gemm_Rocblas_-9,0.0140355
GemmStridedBatchedTunableOp_float_TN,tn_2020_1_64_B_18_ld_64_64_2020,Gemm_Rocblas_-9,0.0175335
GemmStridedBatchedTunableOp_float_TN,tn_934_1_64_B_18_ld_64_64_934,Gemm_Rocblas_-9,0.011482
GemmStridedBatchedTunableOp_float_TN,tn_632_1_64_B_8_ld_512_64_632,Gemm_Hipblaslt_6376,0.0106636
GemmStridedBatchedTunableOp_float_TN,tn_828_1_128_B_16_ld_128_128_828,Gemm_Rocblas_6379,0.0359098
GemmStridedBatchedTunableOp_float_TN,tn_1663_1_128_B_16_ld_128_128_1663,Gemm_Hipblaslt_6376,0.0499294
GemmStridedBatchedTunableOp_float_TN,tn_1591_1_64_B_18_ld_64_64_1591,Gemm_Rocblas_-9,0.0155516
GemmStridedBatchedTunableOp_float_TN,tn_1364_1_64_B_18_ld_64_64_1364,Gemm_Rocblas_-9,0.0142404
GemmStridedBatchedTunableOp_float_TN,tn_1684_1_64_B_18_ld_64_64_1684,Gemm_Rocblas_-9,0.0160025
GemmStridedBatchedTunableOp_float_TN,tn_1312_1_64_B_18_ld_64_64_1312,Gemm_Rocblas_-9,0.0140616
GemmStridedBatchedTunableOp_float_TN,tn_1228_1_128_B_16_ld_128_128_1228,Gemm_Rocblas_6379,0.0425387
GemmStridedBatchedTunableOp_float_TN,tn_892_1_64_B_8_ld_512_64_892,Gemm_Rocblas_6377,0.013071
GemmStridedBatchedTunableOp_float_TN,tn_1976_1_64_B_18_ld_64_64_1976,Gemm_Rocblas_-9,0.0177486
GemmStridedBatchedTunableOp_float_TN,tn_160_1_64_B_8_ld_512_64_160,Gemm_Hipblaslt_6378,0.00874646
GemmStridedBatchedTunableOp_float_TN,tn_1175_1175_128_B_16_ld_128_2048_1175,Default,2.26599
GemmStridedBatchedTunableOp_float_TN,tn_1998_1_64_B_18_ld_64_64_1998,Gemm_Rocblas_-9,0.0175851
GemmStridedBatchedTunableOp_float_TN,tn_197_1_64_B_8_ld_512_64_197,Gemm_Hipblaslt_6378,0.00880341
GemmStridedBatchedTunableOp_float_TN,tn_1200_1_64_B_18_ld_64_64_1200,Gemm_Rocblas_-9,0.0130958
GemmStridedBatchedTunableOp_float_TN,tn_978_1_128_B_16_ld_128_128_978,Gemm_Rocblas_6379,0.037902
GemmStridedBatchedTunableOp_float_TN,tn_924_1_128_B_16_ld_128_128_924,Gemm_Hipblaslt_6378,0.0366569
GemmStridedBatchedTunableOp_float_TN,tn_96_1_64_B_8_ld_512_64_96,Gemm_Rocblas_6379,0.0082479
GemmStridedBatchedTunableOp_float_TN,tn_692_1_64_B_8_ld_512_64_692,Gemm_Rocblas_6377,0.0111518
GemmStridedBatchedTunableOp_float_TN,tn_1373_1_128_B_16_ld_128_128_1373,Gemm_Hipblaslt_6376,0.0451308
GemmStridedBatchedTunableOp_float_TN,tn_745_1_64_B_8_ld_512_64_745,Gemm_Rocblas_6377,0.0117993
GemmStridedBatchedTunableOp_float_TN,tn_1007_1_128_B_16_ld_128_128_1007,Gemm_Rocblas_6379,0.0382294
GemmStridedBatchedTunableOp_float_TN,tn_792_1_128_B_16_ld_128_128_792,Gemm_Hipblaslt_6378,0.0342777
GemmStridedBatchedTunableOp_float_TN,tn_1937_1_128_B_16_ld_128_128_1937,Gemm_Hipblaslt_6376,0.0546758
GemmStridedBatchedTunableOp_float_TN,tn_1766_1_128_B_16_ld_128_128_1766,Gemm_Hipblaslt_6376,0.0514881
GemmStridedBatchedTunableOp_float_TN,tn_1202_1202_128_B_16_ld_128_2048_1202,Gemm_Rocblas_6378,2.31078
GemmStridedBatchedTunableOp_float_TN,tn_907_1_128_B_16_ld_128_128_907,Gemm_Rocblas_6379,0.0333695
GemmStridedBatchedTunableOp_float_TN,tn_471_1_64_B_8_ld_512_64_471,Gemm_Rocblas_6377,0.00932278
GemmStridedBatchedTunableOp_float_TN,tn_1085_1_64_B_18_ld_64_64_1085,Gemm_Rocblas_-9,0.012546
GemmStridedBatchedTunableOp_float_TN,tn_917_1_64_B_8_ld_512_64_917,Gemm_Hipblaslt_6376,0.0132224
GemmStridedBatchedTunableOp_float_TN,tn_419_1_128_B_16_ld_128_128_419,Gemm_Rocblas_6377,0.0182912
GemmStridedBatchedTunableOp_float_TN,tn_250_1_64_B_8_ld_512_64_250,Gemm_Rocblas_6379,0.00946149
GemmStridedBatchedTunableOp_float_TN,tn_1787_1_64_B_18_ld_64_64_1787,Gemm_Rocblas_-9,0.0165246
GemmStridedBatchedTunableOp_float_TN,tn_1585_1_64_B_18_ld_64_64_1585,Gemm_Rocblas_-9,0.0158249
GemmStridedBatchedTunableOp_float_TN,tn_652_1_128_B_16_ld_128_128_652,Gemm_Hipblaslt_6378,0.0268865
GemmStridedBatchedTunableOp_float_TN,tn_703_1_128_B_16_ld_128_128_703,Gemm_Rocblas_6379,0.0333093
GemmStridedBatchedTunableOp_float_TN,tn_609_1_64_B_8_ld_512_64_609,Gemm_Rocblas_6377,0.01066
GemmStridedBatchedTunableOp_float_TN,tn_282_1_128_B_16_ld_128_128_282,Gemm_Rocblas_6377,0.0149272
GemmStridedBatchedTunableOp_float_TN,tn_1850_1_64_B_18_ld_64_64_1850,Gemm_Rocblas_-9,0.0172296
GemmStridedBatchedTunableOp_float_TN,tn_634_1_128_B_16_ld_128_128_634,Gemm_Hipblaslt_6378,0.0264024
GemmStridedBatchedTunableOp_float_TN,tn_334_1_128_B_16_ld_128_128_334,Gemm_Rocblas_6377,0.0161972
GemmStridedBatchedTunableOp_float_TN,tn_2114_1_128_B_16_ld_128_128_2114,Gemm_Hipblaslt_6376,0.0562178
GemmStridedBatchedTunableOp_float_TN,tn_1118_1118_128_B_16_ld_128_2048_1118,Gemm_Rocblas_6378,2.04117
GemmStridedBatchedTunableOp_float_TN,tn_617_1_64_B_8_ld_512_64_617,Gemm_Rocblas_6377,0.0107858
GemmStridedBatchedTunableOp_float_TN,tn_856_1_128_B_16_ld_128_128_856,Gemm_Hipblaslt_6378,0.0354523
GemmStridedBatchedTunableOp_float_TN,tn_1034_1_128_B_16_ld_128_128_1034,Gemm_Rocblas_6379,0.038835
GemmStridedBatchedTunableOp_float_TN,tn_672_1_128_B_16_ld_128_128_672,Gemm_Hipblaslt_6378,0.0306375
GemmStridedBatchedTunableOp_float_TN,tn_1611_1_128_B_16_ld_128_128_1611,Gemm_Hipblaslt_6376,0.049366
GemmStridedBatchedTunableOp_float_TN,tn_1886_1_128_B_16_ld_128_128_1886,Gemm_Hipblaslt_6376,0.0540393
GemmStridedBatchedTunableOp_float_TN,tn_600_1_128_B_16_ld_128_128_600,Gemm_Rocblas_6379,0.0246932
GemmStridedBatchedTunableOp_float_TN,tn_2120_1_64_B_18_ld_64_64_2120,Gemm_Rocblas_-9,0.0185361
GemmStridedBatchedTunableOp_float_TN,tn_288_1_64_B_8_ld_512_64_288,Gemm_Rocblas_-9,0.0297007
GemmStridedBatchedTunableOp_float_TN,tn_543_1_128_B_16_ld_128_128_543,Gemm_Hipblaslt_6376,0.0215417
GemmStridedBatchedTunableOp_float_TN,tn_2015_1_64_B_18_ld_64_64_2015,Gemm_Rocblas_-9,0.0178904
GemmStridedBatchedTunableOp_float_TN,tn_405_1_128_B_16_ld_128_128_405,Gemm_Rocblas_6377,0.0180415
GemmStridedBatchedTunableOp_float_TN,tn_1048_1_64_B_18_ld_64_64_1048,Gemm_Rocblas_-9,0.0127676
GemmStridedBatchedTunableOp_float_TN,tn_1318_1318_128_B_16_ld_128_2048_1318,Gemm_Rocblas_6378,2.85521
GemmStridedBatchedTunableOp_float_TN,tn_961_1_64_B_8_ld_512_64_961,Gemm_Hipblaslt_6376,0.0138156
GemmStridedBatchedTunableOp_float_TN,tn_1656_1_128_B_16_ld_128_128_1656,Gemm_Hipblaslt_6376,0.0497816
GemmStridedBatchedTunableOp_float_TN,tn_1364_1_128_B_16_ld_128_128_1364,Gemm_Hipblaslt_6376,0.0433447
GemmStridedBatchedTunableOp_float_TN,tn_1352_1_64_B_18_ld_64_64_1352,Gemm_Rocblas_-9,0.0139959
GemmStridedBatchedTunableOp_float_TN,tn_805_1_128_B_16_ld_128_128_805,Gemm_Rocblas_6379,0.0362813
GemmStridedBatchedTunableOp_float_TN,tn_1551_1_64_B_18_ld_64_64_1551,Gemm_Rocblas_-9,0.0155313
GemmStridedBatchedTunableOp_float_TN,tn_996_1_128_B_16_ld_128_128_996,Gemm_Hipblaslt_6378,0.0377721
GemmStridedBatchedTunableOp_float_TN,tn_915_1_128_B_16_ld_128_128_915,Gemm_Hipblaslt_6378,0.0371907
GemmStridedBatchedTunableOp_float_TN,tn_611_1_128_B_16_ld_128_128_611,Gemm_Hipblaslt_6378,0.0254129
GemmStridedBatchedTunableOp_float_TN,tn_36_1_64_B_8_ld_512_64_36,Gemm_Rocblas_-9,0.00679393
GemmStridedBatchedTunableOp_float_TN,tn_1361_1_128_B_16_ld_128_128_1361,Gemm_Hipblaslt_6376,0.0433543
GemmStridedBatchedTunableOp_float_TN,tn_1820_1_64_B_18_ld_64_64_1820,Gemm_Rocblas_-9,0.0170373
GemmStridedBatchedTunableOp_float_TN,tn_935_1_64_B_18_ld_64_64_935,Gemm_Rocblas_-9,0.0114007
GemmStridedBatchedTunableOp_float_TN,tn_1707_1_128_B_16_ld_128_128_1707,Gemm_Hipblaslt_6376,0.0503651
GemmStridedBatchedTunableOp_float_TN,tn_1808_1_64_B_18_ld_64_64_1808,Gemm_Rocblas_-9,0.0169735
GemmStridedBatchedTunableOp_float_TN,tn_1227_1227_128_B_16_ld_128_2048_1227,Gemm_Hipblaslt_6377,2.37223
GemmStridedBatchedTunableOp_float_TN,tn_956_1_64_B_18_ld_64_64_956,Gemm_Rocblas_-9,0.0116239
GemmStridedBatchedTunableOp_float_TN,tn_501_1_64_B_8_ld_512_64_501,Gemm_Rocblas_6377,0.00985458
GemmStridedBatchedTunableOp_float_TN,tn_603_1_128_B_16_ld_128_128_603,Gemm_Hipblaslt_6378,0.0251368
GemmStridedBatchedTunableOp_float_TN,tn_1999_1_128_B_16_ld_128_128_1999,Gemm_Hipblaslt_6376,0.0583428
GemmStridedBatchedTunableOp_float_TN,tn_1765_1_128_B_16_ld_128_128_1765,Gemm_Hipblaslt_6376,0.0508581
GemmStridedBatchedTunableOp_float_TN,tn_1526_1_128_B_16_ld_128_128_1526,Gemm_Hipblaslt_6376,0.0455576
GemmStridedBatchedTunableOp_float_TN,tn_1677_1_128_B_16_ld_128_128_1677,Gemm_Hipblaslt_6376,0.0501811
GemmStridedBatchedTunableOp_float_TN,tn_1203_1_128_B_16_ld_128_128_1203,Gemm_Hipblaslt_6378,0.0423484
GemmStridedBatchedTunableOp_float_TN,tn_436_1_128_B_16_ld_128_128_436,Gemm_Rocblas_6377,0.0186651
GemmStridedBatchedTunableOp_float_TN,tn_502_1_64_B_8_ld_512_64_502,Gemm_Rocblas_6377,0.00987497
GemmStridedBatchedTunableOp_float_TN,tn_1135_1_128_B_16_ld_128_128_1135,Gemm_Hipblaslt_6378,0.0408897
GemmStridedBatchedTunableOp_float_TN,tn_1694_1_128_B_16_ld_128_128_1694,Gemm_Hipblaslt_6376,0.0497474
GemmStridedBatchedTunableOp_float_TN,tn_1153_1_128_B_16_ld_128_128_1153,Gemm_Hipblaslt_6378,0.0411413
GemmStridedBatchedTunableOp_float_TN,tn_181_1_128_B_16_ld_128_128_181,Gemm_Hipblaslt_6376,0.0119464
GemmStridedBatchedTunableOp_float_TN,tn_1990_1_64_B_18_ld_64_64_1990,Gemm_Rocblas_-9,0.0177153
GemmStridedBatchedTunableOp_float_TN,tn_128_1_128_B_16_ld_128_128_128,Gemm_Rocblas_6379,0.010719
GemmStridedBatchedTunableOp_float_TN,tn_660_1_128_B_16_ld_128_128_660,Gemm_Rocblas_6379,0.0261985
GemmStridedBatchedTunableOp_float_TN,tn_1401_1_64_B_18_ld_64_64_1401,Gemm_Rocblas_-9,0.0143987
GemmStridedBatchedTunableOp_float_TN,tn_1941_1_64_B_18_ld_64_64_1941,Gemm_Rocblas_-9,0.0178063
GemmStridedBatchedTunableOp_float_TN,tn_1222_1_64_B_18_ld_64_64_1222,Gemm_Rocblas_-9,0.0131111
GemmStridedBatchedTunableOp_float_TN,tn_1506_1_128_B_16_ld_128_128_1506,Gemm_Hipblaslt_6376,0.0452395
GemmStridedBatchedTunableOp_float_TN,tn_1486_1_64_B_18_ld_64_64_1486,Gemm_Rocblas_-9,0.013358
GemmStridedBatchedTunableOp_float_TN,tn_2164_1_64_B_18_ld_64_64_2164,Gemm_Rocblas_-9,0.0187461
GemmStridedBatchedTunableOp_float_TN,tn_907_1_64_B_18_ld_64_64_907,Gemm_Rocblas_-9,0.0113053
GemmStridedBatchedTunableOp_float_TN,tn_1386_1_128_B_16_ld_128_128_1386,Gemm_Hipblaslt_6376,0.044775
GemmStridedBatchedTunableOp_float_TN,tn_828_1_64_B_8_ld_512_64_828,Gemm_Rocblas_6377,0.0125877
GemmStridedBatchedTunableOp_float_TN,tn_967_1_64_B_18_ld_64_64_967,Gemm_Rocblas_-9,0.0116813
GemmStridedBatchedTunableOp_float_TN,tn_1101_1_128_B_16_ld_128_128_1101,Gemm_Hipblaslt_6378,0.0396666
GemmStridedBatchedTunableOp_float_TN,tn_223_1_128_B_16_ld_128_128_223,Gemm_Hipblaslt_6376,0.013172
GemmStridedBatchedTunableOp_float_TN,tn_381_1_64_B_8_ld_512_64_381,Gemm_Hipblaslt_6376,0.00883699
GemmStridedBatchedTunableOp_float_TN,tn_682_1_128_B_16_ld_128_128_682,Gemm_Hipblaslt_6378,0.0321792
GemmStridedBatchedTunableOp_float_TN,tn_2186_1_64_B_18_ld_64_64_2186,Gemm_Rocblas_-9,0.0188286
GemmStridedBatchedTunableOp_float_TN,tn_1094_1094_128_B_16_ld_128_2048_1094,Gemm_Hipblaslt_6377,2.17176
GemmStridedBatchedTunableOp_float_TN,tn_1021_1_64_B_8_ld_512_64_1021,Gemm_Rocblas_6377,0.0141145
GemmStridedBatchedTunableOp_float_TN,tn_1907_1_128_B_16_ld_128_128_1907,Gemm_Hipblaslt_6376,0.0534591
GemmStridedBatchedTunableOp_float_TN,tn_476_1_64_B_8_ld_512_64_476,Gemm_Hipblaslt_6376,0.00936926
GemmStridedBatchedTunableOp_float_TN,tn_1000_1_64_B_18_ld_64_64_1000,Gemm_Rocblas_-9,0.0116142
GemmStridedBatchedTunableOp_float_TN,tn_982_1_128_B_16_ld_128_128_982,Gemm_Hipblaslt_6378,0.0353364
GemmStridedBatchedTunableOp_float_TN,tn_1905_1_128_B_16_ld_128_128_1905,Gemm_Rocblas_6377,0.0530343
GemmStridedBatchedTunableOp_float_TN,tn_1766_1_64_B_18_ld_64_64_1766,Gemm_Rocblas_-9,0.0166017
GemmStridedBatchedTunableOp_float_TN,tn_572_1_64_B_8_ld_512_64_572,Gemm_Rocblas_6377,0.0104312
GemmStridedBatchedTunableOp_float_TN,tn_1036_1036_128_B_16_ld_128_2048_1036,Gemm_Rocblas_6378,1.73864
GemmStridedBatchedTunableOp_float_TN,tn_302_1_128_B_16_ld_128_128_302,Gemm_Hipblaslt_6376,0.0154242
GemmStridedBatchedTunableOp_float_TN,tn_118_1_128_B_16_ld_128_128_118,Gemm_Hipblaslt_6378,0.0106088
GemmStridedBatchedTunableOp_float_TN,tn_1661_1_128_B_16_ld_128_128_1661,Gemm_Hipblaslt_6376,0.0501226
GemmStridedBatchedTunableOp_float_TN,tn_1946_1_128_B_16_ld_128_128_1946,Gemm_Hipblaslt_6376,0.0533193
GemmStridedBatchedTunableOp_float_TN,tn_177_177_128_B_16_ld_128_2048_177,Gemm_Rocblas_6378,0.0713968
GemmStridedBatchedTunableOp_float_TN,tn_967_1_128_B_16_ld_128_128_967,Gemm_Rocblas_6379,0.0375081
GemmStridedBatchedTunableOp_float_TN,tn_97_1_64_B_8_ld_512_64_97,Gemm_Hipblaslt_6376,0.00861263
GemmStridedBatchedTunableOp_float_TN,tn_1081_1_64_B_18_ld_64_64_1081,Gemm_Rocblas_-9,0.0125908
GemmStridedBatchedTunableOp_float_TN,tn_221_1_64_B_8_ld_512_64_221,Gemm_Hipblaslt_6378,0.00933479
GemmStridedBatchedTunableOp_float_TN,tn_656_1_128_B_16_ld_128_128_656,Gemm_Hipblaslt_6378,0.0276528
GemmStridedBatchedTunableOp_float_TN,tn_1717_1_128_B_16_ld_128_128_1717,Gemm_Hipblaslt_6376,0.0509362
GemmStridedBatchedTunableOp_float_TN,tn_1947_1_128_B_16_ld_128_128_1947,Gemm_Hipblaslt_6376,0.0534102
GemmStridedBatchedTunableOp_float_TN,tn_1958_1_64_B_18_ld_64_64_1958,Gemm_Rocblas_-9,0.0175258
GemmStridedBatchedTunableOp_float_TN,tn_960_1_64_B_8_ld_512_64_960,Gemm_Rocblas_6377,0.0136677
GemmStridedBatchedTunableOp_float_TN,tn_700_1_128_B_16_ld_128_128_700,Gemm_Hipblaslt_6378,0.0333975
GemmStridedBatchedTunableOp_float_TN,tn_506_1_128_B_16_ld_128_128_506,Gemm_Rocblas_6377,0.0204417
GemmStridedBatchedTunableOp_float_TN,tn_1918_1_128_B_16_ld_128_128_1918,Gemm_Hipblaslt_6376,0.0535521
GemmStridedBatchedTunableOp_float_TN,tn_169_1_128_B_16_ld_128_128_169,Gemm_Hipblaslt_6376,0.0117645
GemmStridedBatchedTunableOp_float_TN,tn_1875_1_128_B_16_ld_128_128_1875,Gemm_Hipblaslt_6376,0.053986
GemmStridedBatchedTunableOp_float_TN,tn_135_1_128_B_16_ld_128_128_135,Gemm_Rocblas_6379,0.0107967
GemmStridedBatchedTunableOp_float_TN,tn_2007_1_64_B_18_ld_64_64_2007,Gemm_Rocblas_-9,0.0180247
GemmStridedBatchedTunableOp_float_TN,tn_335_1_128_B_16_ld_128_128_335,Gemm_Rocblas_6377,0.0162582
GemmStridedBatchedTunableOp_float_TN,tn_266_1_128_B_16_ld_128_128_266,Gemm_Rocblas_6377,0.0143538
GemmStridedBatchedTunableOp_float_TN,tn_777_1_64_B_8_ld_512_64_777,Gemm_Hipblaslt_6376,0.0116218
GemmStridedBatchedTunableOp_float_TN,tn_133_1_128_B_16_ld_128_128_133,Gemm_Rocblas_6377,0.0108039
GemmStridedBatchedTunableOp_float_TN,tn_467_1_64_B_8_ld_512_64_467,Gemm_Hipblaslt_6376,0.00938843
GemmStridedBatchedTunableOp_float_TN,tn_1272_1_128_B_16_ld_128_128_1272,Gemm_Rocblas_6377,0.0437346
GemmStridedBatchedTunableOp_float_TN,tn_1673_1_128_B_16_ld_128_128_1673,Gemm_Hipblaslt_6376,0.0508676
GemmStridedBatchedTunableOp_float_TN,tn_1273_1_64_B_18_ld_64_64_1273,Gemm_Rocblas_-9,0.0135202
GemmStridedBatchedTunableOp_float_TN,tn_154_1_128_B_16_ld_128_128_154,Gemm_Rocblas_6377,0.0114704
GemmStridedBatchedTunableOp_float_TN,tn_1137_1137_128_B_16_ld_128_2048_1137,Gemm_Hipblaslt_6377,2.13423
GemmStridedBatchedTunableOp_float_TN,tn_164_1_128_B_16_ld_128_128_164,Gemm_Rocblas_6377,0.0115654
GemmStridedBatchedTunableOp_float_TN,tn_686_1_128_B_16_ld_128_128_686,Gemm_Hipblaslt_6378,0.0314471
GemmStridedBatchedTunableOp_float_TN,tn_1179_1_128_B_16_ld_128_128_1179,Gemm_Rocblas_6379,0.0417946
GemmStridedBatchedTunableOp_float_TN,tn_1457_1_128_B_16_ld_128_128_1457,Gemm_Hipblaslt_6376,0.0461839
GemmStridedBatchedTunableOp_float_TN,tn_202_1_64_B_8_ld_512_64_202,Gemm_Rocblas_6379,0.00843029
GemmStridedBatchedTunableOp_float_TN,tn_668_1_128_B_16_ld_128_128_668,Gemm_Hipblaslt_6378,0.0298176
GemmStridedBatchedTunableOp_float_TN,tn_1095_1095_128_B_16_ld_128_2048_1095,Gemm_Rocblas_6378,1.93964
GemmStridedBatchedTunableOp_float_TN,tn_1310_1_128_B_16_ld_128_128_1310,Gemm_Hipblaslt_6376,0.0447862
GemmStridedBatchedTunableOp_float_TN,tn_1501_1_64_B_18_ld_64_64_1501,Gemm_Rocblas_-9,0.0150191
GemmStridedBatchedTunableOp_float_TN,tn_1706_1_128_B_16_ld_128_128_1706,Gemm_Hipblaslt_6376,0.0492626
GemmStridedBatchedTunableOp_float_TN,tn_1307_1_128_B_16_ld_128_128_1307,Gemm_Hipblaslt_6376,0.0438392
GemmStridedBatchedTunableOp_float_TN,tn_562_1_128_B_16_ld_128_128_562,Gemm_Rocblas_6377,0.0222478
GemmStridedBatchedTunableOp_float_TN,tn_117_1_128_B_16_ld_128_128_117,Gemm_Rocblas_6377,0.0106219
GemmStridedBatchedTunableOp_float_TN,tn_1520_1_64_B_18_ld_64_64_1520,Gemm_Rocblas_-9,0.0148708
GemmStridedBatchedTunableOp_float_TN,tn_857_1_128_B_16_ld_128_128_857,Gemm_Hipblaslt_6378,0.0368393
GemmStridedBatchedTunableOp_float_TN,tn_1923_1_128_B_16_ld_128_128_1923,Gemm_Hipblaslt_6376,0.0537385
GemmStridedBatchedTunableOp_float_TN,tn_1118_1_64_B_18_ld_64_64_1118,Gemm_Rocblas_-9,0.0127789
GemmStridedBatchedTunableOp_float_TN,tn_1679_1_128_B_16_ld_128_128_1679,Gemm_Hipblaslt_6376,0.049283
GemmStridedBatchedTunableOp_float_TN,tn_532_1_64_B_8_ld_512_64_532,Gemm_Rocblas_6377,0.01002
GemmStridedBatchedTunableOp_float_TN,tn_134_1_64_B_8_ld_512_64_134,Gemm_Rocblas_6377,0.00864145
GemmStridedBatchedTunableOp_float_TN,tn_896_896_128_B_16_ld_128_2048_896,Default,1.30301
GemmStridedBatchedTunableOp_float_TN,tn_1542_1_128_B_16_ld_128_128_1542,Gemm_Hipblaslt_6376,0.0466541
GemmStridedBatchedTunableOp_float_TN,tn_1822_1_64_B_18_ld_64_64_1822,Gemm_Rocblas_-9,0.0172244
GemmStridedBatchedTunableOp_float_TN,tn_701_1_128_B_16_ld_128_128_701,Gemm_Rocblas_6379,0.0334549
GemmStridedBatchedTunableOp_float_TN,tn_126_126_128_B_16_ld_128_2048_126,Gemm_Hipblaslt_6377,0.0355938
GemmStridedBatchedTunableOp_float_TN,tn_294_1_128_B_16_ld_128_128_294,Gemm_Rocblas_6377,0.0151316
GemmStridedBatchedTunableOp_float_TN,tn_581_1_64_B_8_ld_512_64_581,Gemm_Hipblaslt_6376,0.0103442
GemmStridedBatchedTunableOp_float_TN,tn_953_1_128_B_16_ld_128_128_953,Gemm_Rocblas_6379,0.0374824
GemmStridedBatchedTunableOp_float_TN,tn_1911_1_128_B_16_ld_128_128_1911,Gemm_Hipblaslt_6376,0.0536511
GemmStridedBatchedTunableOp_float_TN,tn_129_1_64_B_8_ld_512_64_129,Gemm_Hipblaslt_6376,0.00863069
GemmStridedBatchedTunableOp_float_TN,tn_1662_1_128_B_16_ld_128_128_1662,Gemm_Hipblaslt_6376,0.0501042
GemmStridedBatchedTunableOp_float_TN,tn_144_1_64_B_8_ld_512_64_144,Gemm_Hipblaslt_6378,0.00870202
GemmStridedBatchedTunableOp_float_TN,tn_610_1_128_B_16_ld_128_128_610,Gemm_Rocblas_6379,0.0251601
GemmStridedBatchedTunableOp_float_TN,tn_623_1_64_B_8_ld_512_64_623,Gemm_Rocblas_6377,0.0105995
GemmStridedBatchedTunableOp_float_TN,tn_684_1_128_B_16_ld_128_128_684,Gemm_Rocblas_6379,0.0319372
GemmStridedBatchedTunableOp_float_TN,tn_1957_1_128_B_16_ld_128_128_1957,Gemm_Hipblaslt_6376,0.0553327
GemmStridedBatchedTunableOp_float_TN,tn_938_1_64_B_18_ld_64_64_938,Gemm_Rocblas_-9,0.0116956
GemmStridedBatchedTunableOp_float_TN,tn_602_1_128_B_16_ld_128_128_602,Gemm_Hipblaslt_6378,0.0252138
GemmStridedBatchedTunableOp_float_TN,tn_975_1_128_B_16_ld_128_128_975,Gemm_Rocblas_6379,0.037698
GemmStridedBatchedTunableOp_float_TN,tn_690_1_128_B_16_ld_128_128_690,Gemm_Rocblas_6379,0.0331343
GemmStridedBatchedTunableOp_float_TN,tn_1722_1_64_B_18_ld_64_64_1722,Gemm_Rocblas_-9,0.0162342
GemmStridedBatchedTunableOp_float_TN,tn_1063_1063_128_B_16_ld_128_2048_1063,Gemm_Rocblas_6378,1.90332
GemmStridedBatchedTunableOp_float_TN,tn_1625_1_64_B_18_ld_64_64_1625,Gemm_Rocblas_-9,0.0158951
GemmStridedBatchedTunableOp_float_TN,tn_2033_1_64_B_18_ld_64_64_2033,Gemm_Rocblas_-9,0.0181104
GemmStridedBatchedTunableOp_float_TN,tn_427_1_128_B_16_ld_128_128_427,Gemm_Hipblaslt_6376,0.0185637
GemmStridedBatchedTunableOp_float_TN,tn_1666_1_128_B_16_ld_128_128_1666,Gemm_Hipblaslt_6376,0.0495867
GemmStridedBatchedTunableOp_float_TN,tn_535_1_128_B_16_ld_128_128_535,Gemm_Rocblas_6377,0.0214656
GemmStridedBatchedTunableOp_float_TN,tn_2085_1_64_B_18_ld_64_64_2085,Gemm_Rocblas_-9,0.0185962
GemmStridedBatchedTunableOp_float_TN,tn_680_1_128_B_16_ld_128_128_680,Gemm_Hipblaslt_6378,0.0292253
GemmStridedBatchedTunableOp_float_TN,tn_1675_1_128_B_16_ld_128_128_1675,Gemm_Hipblaslt_6376,0.0499583
GemmStridedBatchedTunableOp_float_TN,tn_269_1_64_B_8_ld_512_64_269,Gemm_Hipblaslt_6376,0.018248
GemmStridedBatchedTunableOp_float_TN,tn_2010_1_128_B_16_ld_128_128_2010,Gemm_Hipblaslt_6376,0.0564421
GemmStridedBatchedTunableOp_float_TN,tn_597_1_128_B_16_ld_128_128_597,Gemm_Rocblas_6379,0.0244158
GemmStridedBatchedTunableOp_float_TN,tn_1170_1_64_B_18_ld_64_64_1170,Gemm_Rocblas_-9,0.0130317
GemmStridedBatchedTunableOp_float_TN,tn_861_1_128_B_16_ld_128_128_861,Gemm_Hipblaslt_6378,0.0364937
GemmStridedBatchedTunableOp_float_TN,tn_426_1_128_B_16_ld_128_128_426,Gemm_Rocblas_6377,0.0185441
GemmStridedBatchedTunableOp_float_TN,tn_1696_1_128_B_16_ld_128_128_1696,Gemm_Hipblaslt_6378,0.0510395
GemmStridedBatchedTunableOp_float_TN,tn_1355_1_128_B_16_ld_128_128_1355,Gemm_Hipblaslt_6376,0.0429992
GemmStridedBatchedTunableOp_float_TN,tn_148_148_128_B_16_ld_128_2048_148,Gemm_Hipblaslt_6377,0.0545262
GemmStridedBatchedTunableOp_float_TN,tn_162_1_128_B_16_ld_128_128_162,Gemm_Rocblas_6377,0.0114772
GemmStridedBatchedTunableOp_float_TN,tn_1046_1_64_B_18_ld_64_64_1046,Gemm_Rocblas_-9,0.012625
GemmStridedBatchedTunableOp_float_TN,tn_58_1_64_B_8_ld_512_64_58,Gemm_Rocblas_-9,0.00771493
GemmStridedBatchedTunableOp_float_TN,tn_986_986_128_B_16_ld_128_2048_986,Gemm_Rocblas_6378,1.55278
GemmStridedBatchedTunableOp_float_TN,tn_630_1_128_B_16_ld_128_128_630,Gemm_Rocblas_6379,0.0264369
GemmStridedBatchedTunableOp_float_TN,tn_670_1_128_B_16_ld_128_128_670,Gemm_Hipblaslt_6378,0.0295251
GemmStridedBatchedTunableOp_float_TN,tn_772_1_128_B_16_ld_128_128_772,Gemm_Rocblas_6379,0.0352161
GemmStridedBatchedTunableOp_float_TN,tn_941_1_128_B_16_ld_128_128_941,Gemm_Rocblas_6379,0.0377173
GemmStridedBatchedTunableOp_float_TN,tn_469_469_128_B_16_ld_128_2048_469,Gemm_Hipblaslt_6377,0.35969
GemmStridedBatchedTunableOp_float_TN,tn_1934_1_128_B_16_ld_128_128_1934,Gemm_Hipblaslt_6376,0.0529534
GemmStridedBatchedTunableOp_float_TN,tn_145_1_128_B_16_ld_128_128_145,Gemm_Rocblas_6377,0.0110828
GemmStridedBatchedTunableOp_float_TN,tn_537_1_128_B_16_ld_128_128_537,Gemm_Rocblas_6377,0.0213633
GemmStridedBatchedTunableOp_float_TN,tn_834_1_64_B_8_ld_512_64_834,Gemm_Rocblas_6377,0.0126462
GemmStridedBatchedTunableOp_float_TN,tn_124_1_64_B_8_ld_512_64_124,Gemm_Rocblas_6379,0.00866391
GemmStridedBatchedTunableOp_float_TN,tn_983_1_64_B_18_ld_64_64_983,Gemm_Rocblas_-9,0.0119177
GemmStridedBatchedTunableOp_float_TN,tn_1617_1_64_B_18_ld_64_64_1617,Gemm_Rocblas_-9,0.0157801
GemmStridedBatchedTunableOp_float_TN,tn_588_1_128_B_16_ld_128_128_588,Gemm_Rocblas_6377,0.0238052
GemmStridedBatchedTunableOp_float_TN,tn_1096_1_128_B_16_ld_128_128_1096,Gemm_Rocblas_6379,0.0399956
GemmStridedBatchedTunableOp_float_TN,tn_950_1_128_B_16_ld_128_128_950,Gemm_Rocblas_6379,0.0377015
GemmStridedBatchedTunableOp_float_TN,tn_372_1_64_B_8_ld_512_64_372,Gemm_Rocblas_6377,0.00914923
GemmStridedBatchedTunableOp_float_TN,tn_976_1_128_B_16_ld_128_128_976,Gemm_Rocblas_6379,0.0375811
GemmStridedBatchedTunableOp_float_TN,tn_1120_1_64_B_18_ld_64_64_1120,Gemm_Rocblas_-9,0.0131548
GemmStridedBatchedTunableOp_float_TN,tn_1750_1_64_B_18_ld_64_64_1750,Gemm_Rocblas_-9,0.016342
GemmStridedBatchedTunableOp_float_TN,tn_1184_1_128_B_16_ld_128_128_1184,Gemm_Rocblas_6379,0.0415513
GemmStridedBatchedTunableOp_float_TN,tn_1011_1011_128_B_16_ld_128_2048_1011,Default,1.7066
GemmStridedBatchedTunableOp_float_TN,tn_817_1_128_B_16_ld_128_128_817,Gemm_Hipblaslt_6378,0.0362265
GemmStridedBatchedTunableOp_float_TN,tn_1986_1_64_B_18_ld_64_64_1986,Gemm_Rocblas_-9,0.0175158
GemmStridedBatchedTunableOp_float_TN,tn_549_1_128_B_16_ld_128_128_549,Gemm_Rocblas_6377,0.0216202
GemmStridedBatchedTunableOp_float_TN,tn_1159_1159_128_B_16_ld_128_2048_1159,Default,2.25581
GemmStridedBatchedTunableOp_float_TN,tn_1900_1_128_B_16_ld_128_128_1900,Gemm_Hipblaslt_6376,0.0526892
GemmStridedBatchedTunableOp_float_TN,tn_1720_1_128_B_16_ld_128_128_1720,Gemm_Hipblaslt_6378,0.051849
GemmStridedBatchedTunableOp_float_TN,tn_310_1_64_B_8_ld_512_64_310,Gemm_Rocblas_6379,0.00901893
GemmStridedBatchedTunableOp_float_TN,tn_1719_1_128_B_16_ld_128_128_1719,Gemm_Hipblaslt_6376,0.0514828
GemmStridedBatchedTunableOp_float_TN,tn_966_1_64_B_8_ld_512_64_966,Gemm_Rocblas_6377,0.0136982
GemmStridedBatchedTunableOp_float_TN,tn_1243_1_128_B_16_ld_128_128_1243,Gemm_Hipblaslt_6378,0.0432096
GemmStridedBatchedTunableOp_float_TN,tn_1558_1_128_B_16_ld_128_128_1558,Gemm_Hipblaslt_6376,0.0479894
GemmStridedBatchedTunableOp_float_TN,tn_2175_1_64_B_18_ld_64_64_2175,Gemm_Rocblas_-9,0.0188984
GemmStridedBatchedTunableOp_float_TN,tn_693_1_64_B_8_ld_512_64_693,Gemm_Hipblaslt_6376,0.0111778
GemmStridedBatchedTunableOp_float_TN,tn_1301_1_64_B_18_ld_64_64_1301,Gemm_Rocblas_-9,0.0140283
GemmStridedBatchedTunableOp_float_TN,tn_1939_1_128_B_16_ld_128_128_1939,Gemm_Hipblaslt_6376,0.0530671
GemmStridedBatchedTunableOp_float_TN,tn_1705_1_128_B_16_ld_128_128_1705,Gemm_Hipblaslt_6376,0.0512367
GemmStridedBatchedTunableOp_float_TN,tn_1279_1279_128_B_16_ld_128_2048_1279,Gemm_Hipblaslt_6377,2.54753
GemmStridedBatchedTunableOp_float_TN,tn_1695_1_128_B_16_ld_128_128_1695,Gemm_Hipblaslt_6376,0.0509954
GemmStridedBatchedTunableOp_float_TN,tn_1966_1_128_B_16_ld_128_128_1966,Gemm_Rocblas_6377,0.0556819
GemmStridedBatchedTunableOp_float_TN,tn_1452_1_128_B_16_ld_128_128_1452,Gemm_Hipblaslt_6376,0.044575
GemmStridedBatchedTunableOp_float_TN,tn_1540_1_128_B_16_ld_128_128_1540,Gemm_Hipblaslt_6376,0.0472993
GemmStridedBatchedTunableOp_float_TN,tn_1688_1_128_B_16_ld_128_128_1688,Gemm_Hipblaslt_6376,0.0517689
GemmStridedBatchedTunableOp_float_TN,tn_204_1_128_B_16_ld_128_128_204,Gemm_Rocblas_6377,0.0126318
GemmStridedBatchedTunableOp_float_TN,tn_784_1_128_B_16_ld_128_128_784,Gemm_Rocblas_6379,0.0339141
GemmStridedBatchedTunableOp_float_TN,tn_1687_1_128_B_16_ld_128_128_1687,Gemm_Hipblaslt_6376,0.0504124
GemmStridedBatchedTunableOp_float_TN,tn_1256_1_128_B_16_ld_128_128_1256,Gemm_Hipblaslt_6378,0.0435743
GemmStridedBatchedTunableOp_float_TN,tn_1088_1088_128_B_16_ld_128_2048_1088,Gemm_Hipblaslt_6377,1.85188
GemmStridedBatchedTunableOp_float_TN,tn_455_1_128_B_16_ld_128_128_455,Gemm_Hipblaslt_6376,0.0192859
GemmStridedBatchedTunableOp_float_TN,tn_306_1_128_B_16_ld_128_128_306,Gemm_Rocblas_6377,0.0153368
GemmStridedBatchedTunableOp_float_TN,tn_1686_1_128_B_16_ld_128_128_1686,Gemm_Hipblaslt_6376,0.0501984
GemmStridedBatchedTunableOp_float_TN,tn_1437_1_64_B_18_ld_64_64_1437,Gemm_Rocblas_-9,0.0145982
GemmStridedBatchedTunableOp_float_TN,tn_2117_1_64_B_18_ld_64_64_2117,Gemm_Rocblas_-9,0.0188707
GemmStridedBatchedTunableOp_float_TN,tn_973_1_64_B_18_ld_64_64_973,Gemm_Rocblas_-9,0.0113634
GemmStridedBatchedTunableOp_float_TN,tn_1040_1_128_B_16_ld_128_128_1040,Gemm_Hipblaslt_6378,0.0386155
GemmStridedBatchedTunableOp_float_TN,tn_915_1_64_B_18_ld_64_64_915,Gemm_Rocblas_-9,0.0113694
GemmStridedBatchedTunableOp_float_TN,tn_492_1_128_B_16_ld_128_128_492,Gemm_Rocblas_6377,0.0201022
GemmStridedBatchedTunableOp_float_TN,tn_1060_1060_128_B_16_ld_128_2048_1060,Gemm_Hipblaslt_6377,1.86317
GemmStridedBatchedTunableOp_float_TN,tn_2115_1_128_B_16_ld_128_128_2115,Gemm_Hipblaslt_6376,0.056768
GemmStridedBatchedTunableOp_float_TN,tn_524_1_128_B_16_ld_128_128_524,Gemm_Hipblaslt_6376,0.0210908
GemmStridedBatchedTunableOp_float_TN,tn_1672_1_128_B_16_ld_128_128_1672,Gemm_Hipblaslt_6376,0.0501562
GemmStridedBatchedTunableOp_float_TN,tn_1671_1_128_B_16_ld_128_128_1671,Gemm_Hipblaslt_6376,0.050387
GemmStridedBatchedTunableOp_float_TN,tn_1316_1_128_B_16_ld_128_128_1316,Gemm_Hipblaslt_6376,0.0440287
GemmStridedBatchedTunableOp_float_TN,tn_912_1_64_B_18_ld_64_64_912,Gemm_Rocblas_-9,0.0117197
GemmStridedBatchedTunableOp_float_TN,tn_1508_1_128_B_16_ld_128_128_1508,Gemm_Hipblaslt_6376,0.0458021
GemmStridedBatchedTunableOp_float_TN,tn_1883_1_64_B_18_ld_64_64_1883,Gemm_Rocblas_-9,0.0198842
GemmStridedBatchedTunableOp_float_TN,tn_1229_1_64_B_18_ld_64_64_1229,Gemm_Rocblas_-9,0.0130245
GemmStridedBatchedTunableOp_float_TN,tn_467_1_128_B_16_ld_128_128_467,Gemm_Rocblas_6377,0.019533
GemmStridedBatchedTunableOp_float_TN,tn_909_1_128_B_16_ld_128_128_909,Gemm_Rocblas_6379,0.0374343
GemmStridedBatchedTunableOp_float_TN,tn_878_1_128_B_16_ld_128_128_878,Gemm_Hipblaslt_6378,0.0364321
GemmStridedBatchedTunableOp_float_TN,tn_1216_1_128_B_16_ld_128_128_1216,Gemm_Hipblaslt_6378,0.0424731
GemmStridedBatchedTunableOp_float_TN,tn_1698_1_128_B_16_ld_128_128_1698,Gemm_Hipblaslt_6376,0.0492016
GemmStridedBatchedTunableOp_float_TN,tn_626_1_64_B_8_ld_512_64_626,Gemm_Hipblaslt_6376,0.010838
GemmStridedBatchedTunableOp_float_TN,tn_1148_1_64_B_18_ld_64_64_1148,Gemm_Rocblas_-9,0.0126822
GemmStridedBatchedTunableOp_float_TN,tn_751_1_128_B_16_ld_128_128_751,Gemm_Rocblas_6379,0.034262
GemmStridedBatchedTunableOp_float_TN,tn_984_1_64_B_18_ld_64_64_984,Gemm_Rocblas_-9,0.0115273
GemmStridedBatchedTunableOp_float_TN,tn_125_1_128_B_16_ld_128_128_125,Gemm_Hipblaslt_6376,0.0106793
GemmStridedBatchedTunableOp_float_TN,tn_1750_1_128_B_16_ld_128_128_1750,Gemm_Hipblaslt_6376,0.0512363
GemmStridedBatchedTunableOp_float_TN,tn_810_1_64_B_8_ld_512_64_810,Gemm_Rocblas_6377,0.0123997
GemmStridedBatchedTunableOp_float_TN,tn_1400_1_128_B_16_ld_128_128_1400,Gemm_Hipblaslt_6376,0.0446239
GemmStridedBatchedTunableOp_float_TN,tn_1952_1_128_B_16_ld_128_128_1952,Gemm_Hipblaslt_6376,0.0547247
GemmStridedBatchedTunableOp_float_TN,tn_1440_1_128_B_16_ld_128_128_1440,Gemm_Hipblaslt_6376,0.0451304
GemmStridedBatchedTunableOp_float_TN,tn_1697_1_64_B_18_ld_64_64_1697,Gemm_Rocblas_-9,0.0162843
GemmStridedBatchedTunableOp_float_TN,tn_1116_1_128_B_16_ld_128_128_1116,Gemm_Rocblas_6379,0.0405362
GemmStridedBatchedTunableOp_float_TN,tn_1698_1_64_B_18_ld_64_64_1698,Gemm_Rocblas_-9,0.0151513
GemmStridedBatchedTunableOp_float_TN,tn_1090_1_128_B_16_ld_128_128_1090,Gemm_Rocblas_6379,0.0397863
GemmStridedBatchedTunableOp_float_TN,tn_941_1_64_B_8_ld_512_64_941,Gemm_Rocblas_6377,0.0134689
GemmStridedBatchedTunableOp_float_TN,tn_226_1_128_B_16_ld_128_128_226,Gemm_Hipblaslt_6376,0.0131758
GemmStridedBatchedTunableOp_float_TN,tn_1414_1_128_B_16_ld_128_128_1414,Gemm_Hipblaslt_6376,0.0444194
GemmStridedBatchedTunableOp_float_TN,tn_401_1_128_B_16_ld_128_128_401,Gemm_Hipblaslt_6376,0.018076
GemmStridedBatchedTunableOp_float_TN,tn_92_1_64_B_8_ld_512_64_92,Gemm_Hipblaslt_6378,0.00822915
GemmStridedBatchedTunableOp_float_TN,tn_530_1_64_B_8_ld_512_64_530,Gemm_Hipblaslt_6376,0.00974795
GemmStridedBatchedTunableOp_float_TN,tn_190_1_128_B_16_ld_128_128_190,Gemm_Rocblas_6377,0.0122818
GemmStridedBatchedTunableOp_float_TN,tn_114_1_64_B_8_ld_512_64_114,Gemm_Hipblaslt_6378,0.00868839
GemmStridedBatchedTunableOp_float_TN,tn_1090_1_64_B_18_ld_64_64_1090,Gemm_Rocblas_-9,0.0126289
GemmStridedBatchedTunableOp_float_TN,tn_981_1_64_B_8_ld_512_64_981,Gemm_Hipblaslt_6376,0.0139298
GemmStridedBatchedTunableOp_float_TN,tn_1504_1_128_B_16_ld_128_128_1504,Gemm_Hipblaslt_6376,0.045748
GemmStridedBatchedTunableOp_float_TN,tn_78_1_64_B_8_ld_512_64_78,Gemm_Rocblas_-9,0.00848318
GemmStridedBatchedTunableOp_float_TN,tn_1856_1_64_B_18_ld_64_64_1856,Gemm_Rocblas_-9,0.0198449
GemmStridedBatchedTunableOp_float_TN,tn_1039_1_64_B_18_ld_64_64_1039,Gemm_Rocblas_-9,0.0125977
GemmStridedBatchedTunableOp_float_TN,tn_317_1_128_B_16_ld_128_128_317,Gemm_Hipblaslt_6376,0.0159055
GemmStridedBatchedTunableOp_float_TN,tn_1828_1_128_B_16_ld_128_128_1828,Gemm_Hipblaslt_6376,0.0508601
GemmStridedBatchedTunableOp_float_TN,tn_198_1_128_B_16_ld_128_128_198,Gemm_Hipblaslt_6376,0.0124782
GemmStridedBatchedTunableOp_float_TN,tn_406_1_64_B_8_ld_512_64_406,Gemm_Rocblas_6377,0.0092634
GemmStridedBatchedTunableOp_float_TN,tn_1723_1_64_B_18_ld_64_64_1723,Gemm_Rocblas_-9,0.0164161
GemmStridedBatchedTunableOp_float_TN,tn_1038_1_128_B_16_ld_128_128_1038,Gemm_Rocblas_6379,0.0387384
GemmStridedBatchedTunableOp_float_TN,tn_1959_1_64_B_18_ld_64_64_1959,Gemm_Rocblas_-9,0.0176557
GemmStridedBatchedTunableOp_float_TN,tn_2005_1_128_B_16_ld_128_128_2005,Gemm_Hipblaslt_6376,0.0574484
GemmStridedBatchedTunableOp_float_TN,tn_345_1_64_B_8_ld_512_64_345,Gemm_Rocblas_6377,0.00903533
GemmStridedBatchedTunableOp_float_TN,tn_925_1_64_B_8_ld_512_64_925,Gemm_Hipblaslt_6376,0.0134917
GemmStridedBatchedTunableOp_float_TN,tn_1055_1_128_B_16_ld_128_128_1055,Gemm_Rocblas_6379,0.0389589
GemmStridedBatchedTunableOp_float_TN,tn_1248_1_128_B_16_ld_128_128_1248,Gemm_Rocblas_6377,0.0431692
GemmStridedBatchedTunableOp_float_TN,tn_639_1_128_B_16_ld_128_128_639,Gemm_Rocblas_6379,0.0266886
GemmStridedBatchedTunableOp_float_TN,tn_1535_1_64_B_18_ld_64_64_1535,Gemm_Rocblas_-9,0.014989
GemmStridedBatchedTunableOp_float_TN,tn_637_1_128_B_16_ld_128_128_637,Gemm_Rocblas_6379,0.0264685
GemmStridedBatchedTunableOp_float_TN,tn_1238_1_128_B_16_ld_128_128_1238,Gemm_Rocblas_6379,0.0428437
GemmStridedBatchedTunableOp_float_TN,tn_1860_1_64_B_18_ld_64_64_1860,Gemm_Rocblas_-9,0.0169976
GemmStridedBatchedTunableOp_float_TN,tn_1152_1_64_B_18_ld_64_64_1152,Gemm_Rocblas_-9,0.0128726
GemmStridedBatchedTunableOp_float_TN,tn_164_1_64_B_8_ld_512_64_164,Gemm_Rocblas_6379,0.00872475
GemmStridedBatchedTunableOp_float_TN,tn_697_1_64_B_8_ld_512_64_697,Gemm_Rocblas_6377,0.0113136
GemmStridedBatchedTunableOp_float_TN,tn_1585_1_128_B_16_ld_128_128_1585,Gemm_Hipblaslt_6376,0.0463479
GemmStridedBatchedTunableOp_float_TN,tn_620_1_128_B_16_ld_128_128_620,Gemm_Hipblaslt_6378,0.0259575
GemmStridedBatchedTunableOp_float_TN,tn_2042_1_128_B_16_ld_128_128_2042,Gemm_Hipblaslt_6376,0.0571806
GemmStridedBatchedTunableOp_float_TN,tn_553_1_128_B_16_ld_128_128_553,Gemm_Hipblaslt_6376,0.0218956
GemmStridedBatchedTunableOp_float_TN,tn_1442_1_128_B_16_ld_128_128_1442,Gemm_Hipblaslt_6376,0.0450684
GemmStridedBatchedTunableOp_float_TN,tn_981_981_128_B_16_ld_128_2048_981,Default,1.6296
GemmStridedBatchedTunableOp_float_TN,tn_287_1_64_B_8_ld_512_64_287,Gemm_Hipblaslt_6378,0.009289
GemmStridedBatchedTunableOp_float_TN,tn_98_1_64_B_8_ld_512_64_98,Gemm_Hipblaslt_6378,0.00861219
GemmStridedBatchedTunableOp_float_TN,tn_642_1_64_B_8_ld_512_64_642,Gemm_Hipblaslt_6376,0.0107886
GemmStridedBatchedTunableOp_float_TN,tn_1620_1_64_B_18_ld_64_64_1620,Gemm_Rocblas_-9,0.0159481
GemmStridedBatchedTunableOp_float_TN,tn_373_1_64_B_8_ld_512_64_373,Gemm_Rocblas_6377,0.00914642
GemmStridedBatchedTunableOp_float_TN,tn_1109_1_128_B_16_ld_128_128_1109,Gemm_Hipblaslt_6378,0.0403338
GemmStridedBatchedTunableOp_float_TN,tn_816_1_128_B_16_ld_128_128_816,Gemm_Rocblas_6379,0.0348002
GemmStridedBatchedTunableOp_float_TN,tn_81_1_64_B_8_ld_512_64_81,Gemm_Rocblas_-9,0.00855414
GemmStridedBatchedTunableOp_float_TN,tn_228_1_64_B_8_ld_512_64_228,Gemm_Rocblas_-9,0.026247
GemmStridedBatchedTunableOp_float_TN,tn_452_1_128_B_16_ld_128_128_452,Gemm_Rocblas_6377,0.0192226
GemmStridedBatchedTunableOp_float_TN,tn_7_1_64_B_8_ld_512_64_7,Gemm_Rocblas_-9,0.00583578
GemmStridedBatchedTunableOp_float_TN,tn_1705_1_64_B_18_ld_64_64_1705,Gemm_Rocblas_-9,0.0161199
GemmStridedBatchedTunableOp_float_TN,tn_1241_1_128_B_16_ld_128_128_1241,Gemm_Hipblaslt_6376,0.0429243
GemmStridedBatchedTunableOp_float_TN,tn_969_1_64_B_8_ld_512_64_969,Gemm_Hipblaslt_6376,0.0137899
GemmStridedBatchedTunableOp_float_TN,tn_1867_1_64_B_18_ld_64_64_1867,Gemm_Rocblas_-9,0.0201687
GemmStridedBatchedTunableOp_float_TN,tn_723_1_128_B_16_ld_128_128_723,Gemm_Rocblas_6379,0.0342435
GemmStridedBatchedTunableOp_float_TN,tn_1597_1_128_B_16_ld_128_128_1597,Gemm_Hipblaslt_6376,0.0483261
GemmStridedBatchedTunableOp_float_TN,tn_866_1_128_B_16_ld_128_128_866,Gemm_Rocblas_6379,0.0366136
GemmStridedBatchedTunableOp_float_TN,tn_1026_1_128_B_16_ld_128_128_1026,Gemm_Rocblas_6379,0.0388314
GemmStridedBatchedTunableOp_float_TN,tn_401_1_64_B_8_ld_512_64_401,Gemm_Rocblas_6377,0.00935805
GemmStridedBatchedTunableOp_float_TN,tn_727_1_128_B_16_ld_128_128_727,Gemm_Rocblas_6379,0.0336087
GemmStridedBatchedTunableOp_float_TN,tn_1453_1_128_B_16_ld_128_128_1453,Gemm_Hipblaslt_6378,0.0454414
GemmStridedBatchedTunableOp_float_TN,tn_368_1_128_B_16_ld_128_128_368,Gemm_Hipblaslt_6376,0.017115
GemmStridedBatchedTunableOp_float_TN,tn_1610_1_128_B_16_ld_128_128_1610,Gemm_Hipblaslt_6376,0.0488578
GemmStridedBatchedTunableOp_float_TN,tn_1060_1_128_B_16_ld_128_128_1060,Gemm_Hipblaslt_6378,0.0393128
GemmStridedBatchedTunableOp_float_TN,tn_918_1_64_B_18_ld_64_64_918,Gemm_Rocblas_-9,0.0114351
GemmStridedBatchedTunableOp_float_TN,tn_942_1_128_B_16_ld_128_128_942,Gemm_Rocblas_6379,0.0379084
GemmStridedBatchedTunableOp_float_TN,tn_797_1_64_B_8_ld_512_64_797,Gemm_Rocblas_6377,0.0121905
GemmStridedBatchedTunableOp_float_TN,tn_429_1_128_B_16_ld_128_128_429,Gemm_Rocblas_6377,0.0185368
GemmStridedBatchedTunableOp_float_TN,tn_39_1_64_B_8_ld_512_64_39,Gemm_Rocblas_-9,0.00697873
GemmStridedBatchedTunableOp_float_TN,tn_984_1_128_B_16_ld_128_128_984,Gemm_Hipblaslt_6378,0.0374111
GemmStridedBatchedTunableOp_float_TN,tn_1738_1_64_B_18_ld_64_64_1738,Gemm_Rocblas_-9,0.0161034
GemmStridedBatchedTunableOp_float_TN,tn_1282_1_128_B_16_ld_128_128_1282,Gemm_Hipblaslt_6376,0.0435911
GemmStridedBatchedTunableOp_float_TN,tn_1893_1_128_B_16_ld_128_128_1893,Gemm_Hipblaslt_6376,0.0540273
GemmStridedBatchedTunableOp_float_TN,tn_1746_1_64_B_18_ld_64_64_1746,Gemm_Rocblas_-9,0.0164802
GemmStridedBatchedTunableOp_float_TN,tn_284_1_64_B_8_ld_512_64_284,Gemm_Hipblaslt_6378,0.00893196
GemmStridedBatchedTunableOp_float_TN,tn_1021_1_128_B_16_ld_128_128_1021,Gemm_Rocblas_6379,0.0389151
GemmStridedBatchedTunableOp_float_TN,tn_151_151_128_B_16_ld_128_2048_151,Gemm_Hipblaslt_6377,0.0546171
GemmStridedBatchedTunableOp_float_TN,tn_894_1_128_B_16_ld_128_128_894,Gemm_Rocblas_6379,0.0363411
GemmStridedBatchedTunableOp_float_TN,tn_1531_1_64_B_18_ld_64_64_1531,Gemm_Rocblas_-9,0.0148099
GemmStridedBatchedTunableOp_float_TN,tn_377_1_128_B_16_ld_128_128_377,Gemm_Hipblaslt_6376,0.0173858
GemmStridedBatchedTunableOp_float_TN,tn_386_1_128_B_16_ld_128_128_386,Gemm_Rocblas_6377,0.0173474
GemmStridedBatchedTunableOp_float_TN,tn_722_1_64_B_8_ld_512_64_722,Gemm_Hipblaslt_6376,0.0115164
GemmStridedBatchedTunableOp_float_TN,tn_1938_1_128_B_16_ld_128_128_1938,Gemm_Hipblaslt_6376,0.054085
GemmStridedBatchedTunableOp_float_TN,tn_195_1_64_B_8_ld_512_64_195,Gemm_Rocblas_6379,0.00874445
GemmStridedBatchedTunableOp_float_TN,tn_444_1_128_B_16_ld_128_128_444,Gemm_Rocblas_6377,0.0188278
GemmStridedBatchedTunableOp_float_TN,tn_79_1_64_B_8_ld_512_64_79,Gemm_Hipblaslt_6376,0.00858696
GemmStridedBatchedTunableOp_float_TN,tn_155_1_64_B_8_ld_512_64_155,Gemm_Hipblaslt_6378,0.00871317
GemmStridedBatchedTunableOp_float_TN,tn_411_1_64_B_8_ld_512_64_411,Gemm_Hipblaslt_6376,0.00930024
GemmStridedBatchedTunableOp_float_TN,tn_710_1_64_B_8_ld_512_64_710,Gemm_Hipblaslt_6376,0.0113369
GemmStridedBatchedTunableOp_float_TN,tn_555_555_128_B_16_ld_128_2048_555,Gemm_Hipblaslt_6377,0.485161
GemmStridedBatchedTunableOp_float_TN,tn_875_1_128_B_16_ld_128_128_875,Gemm_Rocblas_6379,0.0368688
GemmStridedBatchedTunableOp_float_TN,tn_1293_1_64_B_18_ld_64_64_1293,Gemm_Rocblas_-9,0.0142677
GemmStridedBatchedTunableOp_float_TN,tn_628_1_64_B_8_ld_512_64_628,Gemm_Rocblas_6377,0.0107322
GemmStridedBatchedTunableOp_float_TN,tn_655_1_128_B_16_ld_128_128_655,Gemm_Hipblaslt_6378,0.0273666
GemmStridedBatchedTunableOp_float_TN,tn_598_1_128_B_16_ld_128_128_598,Gemm_Hipblaslt_6376,0.0240808
GemmStridedBatchedTunableOp_float_TN,tn_1781_1_64_B_18_ld_64_64_1781,Gemm_Rocblas_-9,0.0164421
GemmStridedBatchedTunableOp_float_TN,tn_1646_1_128_B_16_ld_128_128_1646,Gemm_Hipblaslt_6376,0.0493732
GemmStridedBatchedTunableOp_float_TN,tn_163_1_64_B_8_ld_512_64_163,Gemm_Rocblas_6379,0.00872608
GemmStridedBatchedTunableOp_float_TN,tn_1801_1_64_B_18_ld_64_64_1801,Gemm_Rocblas_-9,0.0168997
GemmStridedBatchedTunableOp_float_TN,tn_1117_1_128_B_16_ld_128_128_1117,Gemm_Hipblaslt_6378,0.04002
GemmStridedBatchedTunableOp_float_TN,tn_967_1_64_B_8_ld_512_64_967,Gemm_Rocblas_6377,0.0137643
GemmStridedBatchedTunableOp_float_TN,tn_1372_1_128_B_16_ld_128_128_1372,Gemm_Hipblaslt_6376,0.044581
GemmStridedBatchedTunableOp_float_TN,tn_1076_1_128_B_16_ld_128_128_1076,Gemm_Hipblaslt_6378,0.0397484
GemmStridedBatchedTunableOp_float_TN,tn_2089_1_64_B_18_ld_64_64_2089,Gemm_Rocblas_-9,0.0159651
GemmStridedBatchedTunableOp_float_TN,tn_598_1_64_B_8_ld_512_64_598,Gemm_Hipblaslt_6376,0.0105674
GemmStridedBatchedTunableOp_float_TN,tn_1131_1131_128_B_16_ld_128_2048_1131,Gemm_Hipblaslt_6377,2.03953
GemmStridedBatchedTunableOp_float_TN,tn_422_1_64_B_8_ld_512_64_422,Gemm_Hipblaslt_6376,0.00909999
GemmStridedBatchedTunableOp_float_TN,tn_1019_1_64_B_8_ld_512_64_1019,Gemm_Hipblaslt_6376,0.0140284
GemmStridedBatchedTunableOp_float_TN,tn_1276_1_128_B_16_ld_128_128_1276,Gemm_Rocblas_6377,0.0428898
GemmStridedBatchedTunableOp_float_TN,tn_862_1_128_B_16_ld_128_128_862,Gemm_Hipblaslt_6378,0.0365053
GemmStridedBatchedTunableOp_float_TN,tn_1406_1_64_B_18_ld_64_64_1406,Gemm_Rocblas_-9,0.0143831
GemmStridedBatchedTunableOp_float_TN,tn_303_1_64_B_8_ld_512_64_303,Gemm_Rocblas_6377,0.00899373
GemmStridedBatchedTunableOp_float_TN,tn_1015_1_64_B_8_ld_512_64_1015,Gemm_Rocblas_6377,0.0139995
GemmStridedBatchedTunableOp_float_TN,tn_714_1_64_B_8_ld_512_64_714,Gemm_Hipblaslt_6376,0.0114736
GemmStridedBatchedTunableOp_float_TN,tn_1308_1_128_B_16_ld_128_128_1308,Gemm_Hipblaslt_6376,0.043325
GemmStridedBatchedTunableOp_float_TN,tn_342_1_64_B_8_ld_512_64_342,Gemm_Rocblas_6377,0.00877969
GemmStridedBatchedTunableOp_float_TN,tn_1215_1_64_B_18_ld_64_64_1215,Gemm_Rocblas_-9,0.0130674
GemmStridedBatchedTunableOp_float_TN,tn_1587_1_128_B_16_ld_128_128_1587,Gemm_Hipblaslt_6376,0.0468349
GemmStridedBatchedTunableOp_float_TN,tn_282_1_64_B_8_ld_512_64_282,Gemm_Hipblaslt_6378,0.00893438
GemmStridedBatchedTunableOp_float_TN,tn_951_1_64_B_8_ld_512_64_951,Gemm_Hipblaslt_6376,0.0135555
GemmStridedBatchedTunableOp_float_TN,tn_895_1_128_B_16_ld_128_128_895,Gemm_Hipblaslt_6378,0.0367222
GemmStridedBatchedTunableOp_float_TN,tn_338_1_128_B_16_ld_128_128_338,Gemm_Rocblas_6377,0.0166064
GemmStridedBatchedTunableOp_float_TN,tn_257_1_64_B_8_ld_512_64_257,Gemm_Hipblaslt_6377,0.0101451
GemmStridedBatchedTunableOp_float_TN,tn_689_1_64_B_8_ld_512_64_689,Gemm_Hipblaslt_6376,0.0111205
GemmStridedBatchedTunableOp_float_TN,tn_2064_1_64_B_18_ld_64_64_2064,Gemm_Rocblas_-9,0.0161684
GemmStridedBatchedTunableOp_float_TN,tn_382_1_128_B_16_ld_128_128_382,Gemm_Hipblaslt_6376,0.017369
GemmStridedBatchedTunableOp_float_TN,tn_2034_1_128_B_16_ld_128_128_2034,Gemm_Hipblaslt_6376,0.0566598
GemmStridedBatchedTunableOp_float_TN,tn_133_1_64_B_8_ld_512_64_133,Gemm_Hipblaslt_6378,0.00832244
GemmStridedBatchedTunableOp_float_TN,tn_236_1_64_B_8_ld_512_64_236,Gemm_Hipblaslt_6379,0.0119156
GemmStridedBatchedTunableOp_float_TN,tn_2005_1_64_B_18_ld_64_64_2005,Gemm_Rocblas_-9,0.0181209
GemmStridedBatchedTunableOp_float_TN,tn_1140_1_128_B_16_ld_128_128_1140,Gemm_Hipblaslt_6378,0.0410468
GemmStridedBatchedTunableOp_float_TN,tn_183_1_64_B_8_ld_512_64_183,Gemm_Rocblas_6379,0.00878214
GemmStridedBatchedTunableOp_float_TN,tn_223_1_64_B_8_ld_512_64_223,Gemm_Hipblaslt_6378,0.00962821
GemmStridedBatchedTunableOp_float_TN,tn_481_1_64_B_8_ld_512_64_481,Gemm_Rocblas_6377,0.00940169
GemmStridedBatchedTunableOp_float_TN,tn_1802_1_64_B_18_ld_64_64_1802,Gemm_Rocblas_-9,0.0170604
GemmStridedBatchedTunableOp_float_TN,tn_1559_1_128_B_16_ld_128_128_1559,Gemm_Hipblaslt_6376,0.0469102
GemmStridedBatchedTunableOp_float_TN,tn_1897_1_128_B_16_ld_128_128_1897,Gemm_Hipblaslt_6376,0.0534382
GemmStridedBatchedTunableOp_float_TN,tn_1609_1609_128_B_16_ld_128_2048_1609,Gemm_Rocblas_6378,4.05171
GemmStridedBatchedTunableOp_float_TN,tn_725_1_128_B_16_ld_128_128_725,Gemm_Hipblaslt_6378,0.0294089
GemmStridedBatchedTunableOp_float_TN,tn_1810_1_128_B_16_ld_128_128_1810,Gemm_Hipblaslt_6376,0.0518215
GemmStridedBatchedTunableOp_float_TN,tn_2127_1_64_B_18_ld_64_64_2127,Gemm_Rocblas_-9,0.019023
GemmStridedBatchedTunableOp_float_TN,tn_1371_1_64_B_18_ld_64_64_1371,Gemm_Rocblas_-9,0.014137
GemmStridedBatchedTunableOp_float_TN,tn_580_1_64_B_8_ld_512_64_580,Gemm_Hipblaslt_6376,0.0103595
GemmStridedBatchedTunableOp_float_TN,tn_457_1_64_B_8_ld_512_64_457,Gemm_Hipblaslt_6376,0.00970263
GemmStridedBatchedTunableOp_float_TN,tn_1298_1_128_B_16_ld_128_128_1298,Gemm_Hipblaslt_6376,0.043281
GemmStridedBatchedTunableOp_float_TN,tn_1171_1171_128_B_16_ld_128_2048_1171,Default,2.24275
GemmStridedBatchedTunableOp_float_TN,tn_2081_1_64_B_18_ld_64_64_2081,Gemm_Rocblas_-9,0.0186711
GemmStridedBatchedTunableOp_float_TN,tn_897_897_128_B_16_ld_128_2048_897,Gemm_Hipblaslt_6377,1.31448
GemmStridedBatchedTunableOp_float_TN,tn_905_1_128_B_16_ld_128_128_905,Gemm_Rocblas_6379,0.0368577
GemmStridedBatchedTunableOp_float_TN,tn_792_1_64_B_8_ld_512_64_792,Gemm_Hipblaslt_6376,0.0120843
GemmStridedBatchedTunableOp_float_TN,tn_2133_1_64_B_18_ld_64_64_2133,Gemm_Rocblas_-9,0.018952
GemmStridedBatchedTunableOp_float_TN,tn_1798_1_128_B_16_ld_128_128_1798,Gemm_Hipblaslt_6376,0.0515061
GemmStridedBatchedTunableOp_float_TN,tn_784_1_64_B_8_ld_512_64_784,Gemm_Hipblaslt_6376,0.0121316
GemmStridedBatchedTunableOp_float_TN,tn_1709_1_128_B_16_ld_128_128_1709,Gemm_Hipblaslt_6378,0.0516098
GemmStridedBatchedTunableOp_float_TN,tn_513_1_64_B_8_ld_512_64_513,Gemm_Hipblaslt_6376,0.00996557
GemmStridedBatchedTunableOp_float_TN,tn_729_1_128_B_16_ld_128_128_729,Gemm_Hipblaslt_6378,0.0349777
GemmStridedBatchedTunableOp_float_TN,tn_1790_1_64_B_18_ld_64_64_1790,Gemm_Rocblas_-9,0.0165347
GemmStridedBatchedTunableOp_float_TN,tn_995_1_128_B_16_ld_128_128_995,Gemm_Hipblaslt_6378,0.0376025
GemmStridedBatchedTunableOp_float_TN,tn_982_1_64_B_18_ld_64_64_982,Gemm_Rocblas_-9,0.011571
GemmStridedBatchedTunableOp_float_TN,tn_500_1_128_B_16_ld_128_128_500,Gemm_Rocblas_6377,0.0202886
GemmStridedBatchedTunableOp_float_TN,tn_266_1_64_B_8_ld_512_64_266,Gemm_Rocblas_-9,0.0156836
GemmStridedBatchedTunableOp_float_TN,tn_153_1_64_B_8_ld_512_64_153,Gemm_Hipblaslt_6378,0.00874083
GemmStridedBatchedTunableOp_float_TN,tn_1626_1_128_B_16_ld_128_128_1626,Gemm_Hipblaslt_6376,0.0479966
GemmStridedBatchedTunableOp_float_TN,tn_1683_1_128_B_16_ld_128_128_1683,Gemm_Hipblaslt_6376,0.050555
GemmStridedBatchedTunableOp_float_TN,tn_1214_1_128_B_16_ld_128_128_1214,Gemm_Hipblaslt_6378,0.0423853
GemmStridedBatchedTunableOp_float_TN,tn_1010_1_128_B_16_ld_128_128_1010,Gemm_Hipblaslt_6378,0.0371395
GemmStridedBatchedTunableOp_float_TN,tn_2098_1_128_B_16_ld_128_128_2098,Gemm_Hipblaslt_6376,0.0567151
GemmStridedBatchedTunableOp_float_TN,tn_1609_1_64_B_18_ld_64_64_1609,Gemm_Rocblas_-9,0.0158158
GemmStridedBatchedTunableOp_float_TN,tn_147_1_128_B_16_ld_128_128_147,Gemm_Rocblas_6377,0.0110937
GemmStridedBatchedTunableOp_float_TN,tn_474_1_64_B_8_ld_512_64_474,Gemm_Hipblaslt_6376,0.00969382
GemmStridedBatchedTunableOp_float_TN,tn_843_843_128_B_16_ld_128_2048_843,Gemm_Rocblas_6378,1.1384
GemmStridedBatchedTunableOp_float_TN,tn_2050_1_64_B_18_ld_64_64_2050,Gemm_Rocblas_-9,0.0187625
GemmStridedBatchedTunableOp_float_TN,tn_1010_1_64_B_18_ld_64_64_1010,Gemm_Rocblas_-9,0.0118764
GemmStridedBatchedTunableOp_float_TN,tn_1150_1_64_B_18_ld_64_64_1150,Gemm_Rocblas_-9,0.0131042
GemmStridedBatchedTunableOp_float_TN,tn_639_1_64_B_8_ld_512_64_639,Gemm_Hipblaslt_6376,0.0108432
GemmStridedBatchedTunableOp_float_TN,tn_1218_1_128_B_16_ld_128_128_1218,Gemm_Hipblaslt_6378,0.0426666
GemmStridedBatchedTunableOp_float_TN,tn_605_1_128_B_16_ld_128_128_605,Gemm_Rocblas_6379,0.0251929
GemmStridedBatchedTunableOp_float_TN,tn_1713_1_128_B_16_ld_128_128_1713,Gemm_Hipblaslt_6376,0.0511024
GemmStridedBatchedTunableOp_float_TN,tn_1773_1_128_B_16_ld_128_128_1773,Gemm_Hipblaslt_6376,0.0512673
GemmStridedBatchedTunableOp_float_TN,tn_1051_1_128_B_16_ld_128_128_1051,Gemm_Rocblas_6379,0.0391263
GemmStridedBatchedTunableOp_float_TN,tn_1075_1_128_B_16_ld_128_128_1075,Gemm_Hipblaslt_6378,0.0396489
GemmStridedBatchedTunableOp_float_TN,tn_1128_1_128_B_16_ld_128_128_1128,Gemm_Rocblas_6379,0.0406424
GemmStridedBatchedTunableOp_float_TN,tn_1065_1_128_B_16_ld_128_128_1065,Gemm_Hipblaslt_6378,0.0394701
GemmStridedBatchedTunableOp_float_TN,tn_1120_1_128_B_16_ld_128_128_1120,Gemm_Hipblaslt_6378,0.0402941
GemmStridedBatchedTunableOp_float_TN,tn_1107_1_64_B_18_ld_64_64_1107,Gemm_Rocblas_-9,0.0129459
GemmStridedBatchedTunableOp_float_TN,tn_2076_1_128_B_16_ld_128_128_2076,Gemm_Hipblaslt_6376,0.0561904
GemmStridedBatchedTunableOp_float_TN,tn_1853_1_128_B_16_ld_128_128_1853,Gemm_Hipblaslt_6376,0.0534366
GemmStridedBatchedTunableOp_float_TN,tn_611_1_64_B_8_ld_512_64_611,Gemm_Hipblaslt_6376,0.0106264
GemmStridedBatchedTunableOp_float_TN,tn_1434_1_128_B_16_ld_128_128_1434,Gemm_Hipblaslt_6376,0.045183
GemmStridedBatchedTunableOp_float_TN,tn_1933_1_128_B_16_ld_128_128_1933,Gemm_Hipblaslt_6376,0.054146
GemmStridedBatchedTunableOp_float_TN,tn_1816_1_64_B_18_ld_64_64_1816,Gemm_Rocblas_-9,0.0169819
GemmStridedBatchedTunableOp_float_TN,tn_850_1_128_B_16_ld_128_128_850,Gemm_Rocblas_6379,0.0363607
GemmStridedBatchedTunableOp_float_TN,tn_1196_1_128_B_16_ld_128_128_1196,Gemm_Hipblaslt_6378,0.0422022
GemmStridedBatchedTunableOp_float_TN,tn_2110_1_64_B_18_ld_64_64_2110,Gemm_Rocblas_-9,0.0184804
GemmStridedBatchedTunableOp_float_TN,tn_1171_1_128_B_16_ld_128_128_1171,Gemm_Hipblaslt_6378,0.041423
GemmStridedBatchedTunableOp_float_TN,tn_1227_1_128_B_16_ld_128_128_1227,Gemm_Rocblas_6379,0.0427992
GemmStridedBatchedTunableOp_float_TN,tn_1251_1_128_B_16_ld_128_128_1251,Gemm_Rocblas_6379,0.0434328
GemmStridedBatchedTunableOp_float_TN,tn_737_1_64_B_8_ld_512_64_737,Gemm_Rocblas_6377,0.0117564
GemmStridedBatchedTunableOp_float_TN,tn_256_1_64_B_8_ld_512_64_256,Gemm_Rocblas_6377,0.0130213
GemmStridedBatchedTunableOp_float_TN,tn_1945_1_128_B_16_ld_128_128_1945,Gemm_Hipblaslt_6376,0.0540002
GemmStridedBatchedTunableOp_float_TN,tn_1403_1_64_B_18_ld_64_64_1403,Gemm_Rocblas_-9,0.0141742
GemmStridedBatchedTunableOp_float_TN,tn_1888_1_128_B_16_ld_128_128_1888,Gemm_Hipblaslt_6376,0.0532768
GemmStridedBatchedTunableOp_float_TN,tn_2153_1_64_B_18_ld_64_64_2153,Gemm_Rocblas_-9,0.0190014
GemmStridedBatchedTunableOp_float_TN,tn_1032_1_128_B_16_ld_128_128_1032,Gemm_Rocblas_6379,0.0382311
GemmStridedBatchedTunableOp_float_TN,tn_577_1_128_B_16_ld_128_128_577,Gemm_Rocblas_6377,0.0233319
GemmStridedBatchedTunableOp_float_TN,tn_1555_1_64_B_18_ld_64_64_1555,Gemm_Rocblas_-9,0.0157296
GemmStridedBatchedTunableOp_float_TN,tn_300_300_32_B_8_ld_32_32_300,Gemm_Hipblaslt_6377,0.0295323
GemmStridedBatchedTunableOp_float_TN,tn_725_1_64_B_8_ld_512_64_725,Gemm_Rocblas_6377,0.0116026
GemmStridedBatchedTunableOp_float_TN,tn_1378_1_64_B_18_ld_64_64_1378,Gemm_Rocblas_-9,0.0146196
GemmStridedBatchedTunableOp_float_TN,tn_237_1_64_B_8_ld_512_64_237,Gemm_Hipblaslt_6376,0.00875964
GemmStridedBatchedTunableOp_float_TN,tn_1225_1_64_B_18_ld_64_64_1225,Gemm_Rocblas_-9,0.0133675
GemmStridedBatchedTunableOp_float_TN,tn_1045_1_128_B_16_ld_128_128_1045,Gemm_Hipblaslt_6378,0.0386483
GemmStridedBatchedTunableOp_float_TN,tn_700_1_64_B_8_ld_512_64_700,Gemm_Rocblas_6377,0.0112226
GemmStridedBatchedTunableOp_float_TN,tn_2051_1_128_B_16_ld_128_128_2051,Gemm_Hipblaslt_6376,0.0567462
GemmStridedBatchedTunableOp_float_TN,tn_972_1_64_B_18_ld_64_64_972,Gemm_Rocblas_-9,0.0115694
GemmStridedBatchedTunableOp_float_TN,tn_1009_1_128_B_16_ld_128_128_1009,Gemm_Rocblas_6379,0.0382719
GemmStridedBatchedTunableOp_float_TN,tn_872_872_128_B_16_ld_128_2048_872,Gemm_Rocblas_6378,1.21099
GemmStridedBatchedTunableOp_float_TN,tn_2021_1_128_B_16_ld_128_128_2021,Gemm_Hipblaslt_6376,0.0566969
GemmStridedBatchedTunableOp_float_TN,tn_1223_1_64_B_18_ld_64_64_1223,Gemm_Rocblas_-9,0.0132898
GemmStridedBatchedTunableOp_float_TN,tn_1338_1_128_B_16_ld_128_128_1338,Gemm_Hipblaslt_6376,0.0434849
GemmStridedBatchedTunableOp_float_TN,tn_1224_1_128_B_16_ld_128_128_1224,Gemm_Rocblas_6379,0.042582
GemmStridedBatchedTunableOp_float_TN,tn_375_1_128_B_16_ld_128_128_375,Gemm_Rocblas_6377,0.0172292
GemmStridedBatchedTunableOp_float_TN,tn_57_1_64_B_8_ld_512_64_57,Gemm_Rocblas_-9,0.00754854
GemmStridedBatchedTunableOp_float_TN,tn_664_1_128_B_16_ld_128_128_664,Gemm_Rocblas_6379,0.0293468
GemmStridedBatchedTunableOp_float_TN,tn_1247_1_64_B_18_ld_64_64_1247,Gemm_Rocblas_-9,0.0131351
GemmStridedBatchedTunableOp_float_TN,tn_393_1_64_B_8_ld_512_64_393,Gemm_Hipblaslt_6376,0.00894241
GemmStridedBatchedTunableOp_float_TN,tn_1245_1_128_B_16_ld_128_128_1245,Gemm_Rocblas_6379,0.0433134
GemmStridedBatchedTunableOp_float_TN,tn_874_1_128_B_16_ld_128_128_874,Gemm_Rocblas_6379,0.0362878
GemmStridedBatchedTunableOp_float_TN,tn_35_1_64_B_8_ld_512_64_35,Gemm_Rocblas_-9,0.00686214
GemmStridedBatchedTunableOp_float_TN,tn_1012_1_128_B_16_ld_128_128_1012,Gemm_Hipblaslt_6378,0.0384487
GemmStridedBatchedTunableOp_float_TN,tn_1963_1_64_B_18_ld_64_64_1963,Gemm_Rocblas_-9,0.0177202
GemmStridedBatchedTunableOp_float_TN,tn_916_1_128_B_16_ld_128_128_916,Gemm_Rocblas_6379,0.0368994
GemmStridedBatchedTunableOp_float_TN,tn_1052_1_128_B_16_ld_128_128_1052,Gemm_Hipblaslt_6378,0.0388366
GemmStridedBatchedTunableOp_float_TN,tn_2166_1_64_B_18_ld_64_64_2166,Gemm_Rocblas_-9,0.0189749
GemmStridedBatchedTunableOp_float_TN,tn_1950_1_128_B_16_ld_128_128_1950,Gemm_Hipblaslt_6376,0.054047
GemmStridedBatchedTunableOp_float_TN,tn_192_1_128_B_16_ld_128_128_192,Gemm_Rocblas_6377,0.0122178
GemmStridedBatchedTunableOp_float_TN,tn_442_1_128_B_16_ld_128_128_442,Gemm_Hipblaslt_6376,0.0190903
GemmStridedBatchedTunableOp_float_TN,tn_618_1_128_B_16_ld_128_128_618,Gemm_Hipblaslt_6378,0.0259744
GemmStridedBatchedTunableOp_float_TN,tn_173_1_128_B_16_ld_128_128_173,Gemm_Hipblaslt_6376,0.0117749
GemmStridedBatchedTunableOp_float_TN,tn_740_1_128_B_16_ld_128_128_740,Gemm_Rocblas_6379,0.0349216
GemmStridedBatchedTunableOp_float_TN,tn_395_1_128_B_16_ld_128_128_395,Gemm_Hipblaslt_6376,0.0178243
GemmStridedBatchedTunableOp_float_TN,tn_1205_1_128_B_16_ld_128_128_1205,Gemm_Hipblaslt_6378,0.042348
GemmStridedBatchedTunableOp_float_TN,tn_171_1_128_B_16_ld_128_128_171,Gemm_Hipblaslt_6376,0.0118523
GemmStridedBatchedTunableOp_float_TN,tn_1284_1_128_B_16_ld_128_128_1284,Gemm_Hipblaslt_6376,0.0429712
GemmStridedBatchedTunableOp_float_TN,tn_109_1_64_B_8_ld_512_64_109,Gemm_Rocblas_6377,0.00863018
GemmStridedBatchedTunableOp_float_TN,tn_1430_1_128_B_16_ld_128_128_1430,Gemm_Hipblaslt_6376,0.0439586
GemmStridedBatchedTunableOp_float_TN,tn_1840_1_64_B_18_ld_64_64_1840,Gemm_Rocblas_-9,0.017289
GemmStridedBatchedTunableOp_float_TN,tn_650_1_128_B_16_ld_128_128_650,Gemm_Rocblas_6379,0.0269566
GemmStridedBatchedTunableOp_float_TN,tn_1067_1_128_B_16_ld_128_128_1067,Gemm_Hipblaslt_6378,0.0393319
GemmStridedBatchedTunableOp_float_TN,tn_1359_1_128_B_16_ld_128_128_1359,Gemm_Hipblaslt_6376,0.0444564
GemmStridedBatchedTunableOp_float_TN,tn_129_1_128_B_16_ld_128_128_129,Gemm_Hipblaslt_6376,0.0108179
GemmStridedBatchedTunableOp_float_TN,tn_846_1_128_B_16_ld_128_128_846,Gemm_Rocblas_6379,0.0359857
GemmStridedBatchedTunableOp_float_TN,tn_565_1_64_B_8_ld_512_64_565,Gemm_Rocblas_6377,0.0099843
GemmStridedBatchedTunableOp_float_TN,tn_569_1_128_B_16_ld_128_128_569,Gemm_Hipblaslt_6376,0.0219625
GemmStridedBatchedTunableOp_float_TN,tn_1483_1_128_B_16_ld_128_128_1483,Gemm_Hipblaslt_6376,0.0441494
GemmStridedBatchedTunableOp_float_TN,tn_263_1_64_B_8_ld_512_64_263,Gemm_Rocblas_-9,0.015755
GemmStridedBatchedTunableOp_float_TN,tn_1018_1_128_B_16_ld_128_128_1018,Gemm_Hipblaslt_6378,0.0381965
GemmStridedBatchedTunableOp_float_TN,tn_457_1_128_B_16_ld_128_128_457,Gemm_Hipblaslt_6376,0.0187789
GemmStridedBatchedTunableOp_float_TN,tn_934_1_64_B_8_ld_512_64_934,Gemm_Rocblas_6377,0.013521
GemmStridedBatchedTunableOp_float_TN,tn_415_1_64_B_8_ld_512_64_415,Gemm_Hipblaslt_6376,0.00901255
GemmStridedBatchedTunableOp_float_TN,tn_1318_1_64_B_18_ld_64_64_1318,Gemm_Rocblas_-9,0.0141125
GemmStridedBatchedTunableOp_float_TN,tn_1932_1_128_B_16_ld_128_128_1932,Gemm_Rocblas_6377,0.0530415
GemmStridedBatchedTunableOp_float_TN,tn_1314_1_64_B_18_ld_64_64_1314,Gemm_Rocblas_-9,0.0141297
GemmStridedBatchedTunableOp_float_TN,tn_1236_1_64_B_18_ld_64_64_1236,Gemm_Rocblas_-9,0.0129351
GemmStridedBatchedTunableOp_float_TN,tn_400_1_64_B_8_ld_512_64_400,Gemm_Rocblas_6377,0.00922294
GemmStridedBatchedTunableOp_float_TN,tn_1531_1_128_B_16_ld_128_128_1531,Gemm_Hipblaslt_6376,0.0466027
GemmStridedBatchedTunableOp_float_TN,tn_188_1_128_B_16_ld_128_128_188,Gemm_Rocblas_6377,0.0123324
GemmStridedBatchedTunableOp_float_TN,tn_461_1_128_B_16_ld_128_128_461,Gemm_Hipblaslt_6376,0.0194265
GemmStridedBatchedTunableOp_float_TN,tn_594_1_64_B_8_ld_512_64_594,Gemm_Rocblas_6377,0.0105098
GemmStridedBatchedTunableOp_float_TN,tn_1122_1_128_B_16_ld_128_128_1122,Gemm_Hipblaslt_6378,0.0404492
GemmStridedBatchedTunableOp_float_TN,tn_1738_1738_128_B_16_ld_128_2048_1738,Gemm_Rocblas_6378,4.6613
GemmStridedBatchedTunableOp_float_TN,tn_9_1_64_B_8_ld_512_64_9,Gemm_Rocblas_-9,0.00553362
GemmStridedBatchedTunableOp_float_TN,tn_895_1_64_B_18_ld_64_64_895,Gemm_Rocblas_-9,0.0113971
GemmStridedBatchedTunableOp_float_TN,tn_706_1_64_B_8_ld_512_64_706,Gemm_Hipblaslt_6376,0.0113682
GemmStridedBatchedTunableOp_float_TN,tn_555_1_128_B_16_ld_128_128_555,Gemm_Rocblas_6377,0.0218891
GemmStridedBatchedTunableOp_float_TN,tn_707_1_128_B_16_ld_128_128_707,Gemm_Rocblas_6379,0.034274
GemmStridedBatchedTunableOp_float_TN,tn_1444_1_128_B_16_ld_128_128_1444,Gemm_Hipblaslt_6376,0.0448911
GemmStridedBatchedTunableOp_float_TN,tn_2093_1_64_B_18_ld_64_64_2093,Gemm_Rocblas_-9,0.0188447
GemmStridedBatchedTunableOp_float_TN,tn_519_1_64_B_8_ld_512_64_519,Gemm_Rocblas_6377,0.00954915
GemmStridedBatchedTunableOp_float_TN,tn_972_1_128_B_16_ld_128_128_972,Gemm_Rocblas_6379,0.0378756
GemmStridedBatchedTunableOp_float_TN,tn_214_1_64_B_8_ld_512_64_214,Gemm_Rocblas_-9,0.0141626
GemmStridedBatchedTunableOp_float_TN,tn_839_1_128_B_16_ld_128_128_839,Gemm_Hipblaslt_6378,0.0363214
GemmStridedBatchedTunableOp_float_TN,tn_1692_1_128_B_16_ld_128_128_1692,Gemm_Hipblaslt_6376,0.0487284
GemmStridedBatchedTunableOp_float_TN,tn_493_1_64_B_8_ld_512_64_493,Gemm_Rocblas_6377,0.00953393
GemmStridedBatchedTunableOp_float_TN,tn_2096_1_64_B_18_ld_64_64_2096,Gemm_Rocblas_-9,0.0188843
GemmStridedBatchedTunableOp_float_TN,tn_964_1_64_B_18_ld_64_64_964,Gemm_Rocblas_-9,0.0115433
GemmStridedBatchedTunableOp_float_TN,tn_333_1_64_B_8_ld_512_64_333,Gemm_Rocblas_6379,0.00904861
GemmStridedBatchedTunableOp_float_TN,tn_727_1_64_B_8_ld_512_64_727,Gemm_Hipblaslt_6376,0.0115657
GemmStridedBatchedTunableOp_float_TN,tn_885_1_128_B_16_ld_128_128_885,Gemm_Hipblaslt_6378,0.0371655
GemmStridedBatchedTunableOp_float_TN,tn_1831_1_64_B_18_ld_64_64_1831,Gemm_Rocblas_-9,0.017438
GemmStridedBatchedTunableOp_float_TN,tn_531_1_64_B_8_ld_512_64_531,Gemm_Hipblaslt_6376,0.0101406
GemmStridedBatchedTunableOp_float_TN,tn_349_1_128_B_16_ld_128_128_349,Gemm_Rocblas_6377,0.0166252
GemmStridedBatchedTunableOp_float_TN,tn_278_1_64_B_8_ld_512_64_278,Gemm_Hipblaslt_6376,0.0090025
GemmStridedBatchedTunableOp_float_TN,tn_247_1_64_B_8_ld_512_64_247,Gemm_Rocblas_6377,0.00964121
GemmStridedBatchedTunableOp_float_TN,tn_1552_1_128_B_16_ld_128_128_1552,Gemm_Hipblaslt_6376,0.0454803
GemmStridedBatchedTunableOp_float_TN,tn_692_1_128_B_16_ld_128_128_692,Gemm_Rocblas_6379,0.0328345
GemmStridedBatchedTunableOp_float_TN,tn_1325_1_64_B_18_ld_64_64_1325,Gemm_Rocblas_-9,0.0140068
GemmStridedBatchedTunableOp_float_TN,tn_462_1_128_B_16_ld_128_128_462,Gemm_Rocblas_6377,0.0194389
GemmStridedBatchedTunableOp_float_TN,tn_1101_1_64_B_18_ld_64_64_1101,Gemm_Rocblas_-9,0.0127491
GemmStridedBatchedTunableOp_float_TN,tn_1129_1_128_B_16_ld_128_128_1129,Gemm_Rocblas_6379,0.0405883
GemmStridedBatchedTunableOp_float_TN,tn_1427_1_64_B_18_ld_64_64_1427,Gemm_Rocblas_-9,0.0144279
GemmStridedBatchedTunableOp_float_TN,tn_824_1_64_B_8_ld_512_64_824,Gemm_Hipblaslt_6376,0.0124133
GemmStridedBatchedTunableOp_float_TN,tn_922_1_64_B_8_ld_512_64_922,Gemm_Rocblas_6377,0.0134437
GemmStridedBatchedTunableOp_float_TN,tn_235_1_64_B_8_ld_512_64_235,Gemm_Rocblas_-9,0.020164
GemmStridedBatchedTunableOp_float_TN,tn_1233_1_64_B_18_ld_64_64_1233,Gemm_Rocblas_-9,0.0132037
GemmStridedBatchedTunableOp_float_TN,tn_271_1_64_B_8_ld_512_64_271,Gemm_Hipblaslt_6376,0.0103771
GemmStridedBatchedTunableOp_float_TN,tn_1989_1_128_B_16_ld_128_128_1989,Gemm_Hipblaslt_6376,0.0555104
GemmStridedBatchedTunableOp_float_TN,tn_310_1_128_B_16_ld_128_128_310,Gemm_Rocblas_6377,0.0153773
GemmStridedBatchedTunableOp_float_TN,tn_1959_1_128_B_16_ld_128_128_1959,Gemm_Hipblaslt_6376,0.055295
GemmStridedBatchedTunableOp_float_TN,tn_968_1_128_B_16_ld_128_128_968,Gemm_Hipblaslt_6378,0.036616
GemmStridedBatchedTunableOp_float_TN,tn_2048_1_64_B_18_ld_64_64_2048,Gemm_Rocblas_-9,0.017452
GemmStridedBatchedTunableOp_float_TN,tn_472_1_64_B_8_ld_512_64_472,Gemm_Rocblas_6377,0.0092718
GemmStridedBatchedTunableOp_float_TN,tn_2032_1_128_B_16_ld_128_128_2032,Gemm_Hipblaslt_6376,0.0561046
GemmStridedBatchedTunableOp_float_TN,tn_410_1_128_B_16_ld_128_128_410,Gemm_Rocblas_6377,0.0179654
GemmStridedBatchedTunableOp_float_TN,tn_320_1_64_B_8_ld_512_64_320,Gemm_Hipblaslt_6376,0.00906305
GemmStridedBatchedTunableOp_float_TN,tn_743_1_64_B_8_ld_512_64_743,Gemm_Hipblaslt_6376,0.0118041
GemmStridedBatchedTunableOp_float_TN,tn_152_1_128_B_16_ld_128_128_152,Gemm_Rocblas_6377,0.0112363
GemmStridedBatchedTunableOp_float_TN,tn_1624_1_64_B_18_ld_64_64_1624,Gemm_Rocblas_-9,0.0158082
GemmStridedBatchedTunableOp_float_TN,tn_909_1_64_B_18_ld_64_64_909,Gemm_Rocblas_-9,0.0112744
GemmStridedBatchedTunableOp_float_TN,tn_560_1_128_B_16_ld_128_128_560,Gemm_Hipblaslt_6378,0.0231623
GemmStridedBatchedTunableOp_float_TN,tn_899_1_128_B_16_ld_128_128_899,Gemm_Hipblaslt_6378,0.0370023
GemmStridedBatchedTunableOp_float_TN,tn_691_1_64_B_8_ld_512_64_691,Gemm_Rocblas_6377,0.0112047
GemmStridedBatchedTunableOp_float_TN,tn_881_1_128_B_16_ld_128_128_881,Gemm_Hipblaslt_6378,0.0371201
GemmStridedBatchedTunableOp_float_TN,tn_1339_1_64_B_18_ld_64_64_1339,Gemm_Rocblas_-9,0.0140741
GemmStridedBatchedTunableOp_float_TN,tn_382_1_64_B_8_ld_512_64_382,Gemm_Rocblas_6377,0.00886871
GemmStridedBatchedTunableOp_float_TN,tn_203_1_128_B_16_ld_128_128_203,Gemm_Hipblaslt_6376,0.0126666
GemmStridedBatchedTunableOp_float_TN,tn_1068_1_64_B_18_ld_64_64_1068,Gemm_Rocblas_-9,0.0126847
GemmStridedBatchedTunableOp_float_TN,tn_574_1_128_B_16_ld_128_128_574,Gemm_Rocblas_6377,0.0224882
GemmStridedBatchedTunableOp_float_TN,tn_1876_1_128_B_16_ld_128_128_1876,Gemm_Hipblaslt_6376,0.0524227
GemmStridedBatchedTunableOp_float_TN,tn_359_1_128_B_16_ld_128_128_359,Gemm_Hipblaslt_6376,0.0168978
GemmStridedBatchedTunableOp_float_TN,tn_1523_1_128_B_16_ld_128_128_1523,Gemm_Rocblas_6377,0.0460473
GemmStridedBatchedTunableOp_float_TN,tn_685_1_128_B_16_ld_128_128_685,Gemm_Hipblaslt_6378,0.0322009
GemmStridedBatchedTunableOp_float_TN,tn_1165_1_64_B_18_ld_64_64_1165,Gemm_Rocblas_-9,0.0113725
GemmStridedBatchedTunableOp_float_TN,tn_82_1_64_B_8_ld_512_64_82,Gemm_Rocblas_6379,0.00854729
GemmStridedBatchedTunableOp_float_TN,tn_491_1_128_B_16_ld_128_128_491,Gemm_Rocblas_6377,0.0202569
GemmStridedBatchedTunableOp_float_TN,tn_425_1_64_B_8_ld_512_64_425,Gemm_Rocblas_6377,0.0094646
GemmStridedBatchedTunableOp_float_TN,tn_1289_1_128_B_16_ld_128_128_1289,Gemm_Hipblaslt_6376,0.0440011
GemmStridedBatchedTunableOp_float_TN,tn_403_1_64_B_8_ld_512_64_403,Gemm_Hipblaslt_6376,0.00926422
GemmStridedBatchedTunableOp_float_TN,tn_399_1_128_B_16_ld_128_128_399,Gemm_Rocblas_6377,0.0178083
GemmStridedBatchedTunableOp_float_TN,tn_371_1_128_B_16_ld_128_128_371,Gemm_Hipblaslt_6376,0.0172228
GemmStridedBatchedTunableOp_float_TN,tn_683_1_64_B_8_ld_512_64_683,Gemm_Rocblas_6377,0.0111385
GemmStridedBatchedTunableOp_float_TN,tn_1583_1_128_B_16_ld_128_128_1583,Gemm_Hipblaslt_6376,0.047392
GemmStridedBatchedTunableOp_float_TN,tn_1931_1_128_B_16_ld_128_128_1931,Gemm_Hipblaslt_6376,0.0530536
GemmStridedBatchedTunableOp_float_TN,tn_1395_1_128_B_16_ld_128_128_1395,Gemm_Hipblaslt_6376,0.0443229
GemmStridedBatchedTunableOp_float_TN,tn_219_1_128_B_16_ld_128_128_219,Gemm_Hipblaslt_6376,0.0130701
GemmStridedBatchedTunableOp_float_TN,tn_1760_1_128_B_16_ld_128_128_1760,Gemm_Hipblaslt_6376,0.0480772
GemmStridedBatchedTunableOp_float_TN,tn_647_1_128_B_16_ld_128_128_647,Gemm_Hipblaslt_6378,0.0269202
GemmStridedBatchedTunableOp_float_TN,tn_950_1_64_B_8_ld_512_64_950,Gemm_Hipblaslt_6376,0.013588
GemmStridedBatchedTunableOp_float_TN,tn_465_1_64_B_8_ld_512_64_465,Gemm_Hipblaslt_6376,0.00930714
GemmStridedBatchedTunableOp_float_TN,tn_232_1_64_B_8_ld_512_64_232,Gemm_Hipblaslt_6378,0.010115
GemmStridedBatchedTunableOp_float_TN,tn_1537_1_128_B_16_ld_128_128_1537,Gemm_Hipblaslt_6376,0.0475505
GemmStridedBatchedTunableOp_float_TN,tn_220_1_64_B_8_ld_512_64_220,Gemm_Rocblas_6379,0.00920936
GemmStridedBatchedTunableOp_float_TN,tn_762_1_128_B_16_ld_128_128_762,Gemm_Rocblas_6379,0.0355432
GemmStridedBatchedTunableOp_float_TN,tn_62_1_64_B_8_ld_512_64_62,Gemm_Rocblas_-9,0.00786511
GemmStridedBatchedTunableOp_float_TN,tn_1906_1_128_B_16_ld_128_128_1906,Gemm_Hipblaslt_6376,0.0526708
GemmStridedBatchedTunableOp_float_TN,tn_983_1_64_B_8_ld_512_64_983,Gemm_Hipblaslt_6376,0.013909
GemmStridedBatchedTunableOp_float_TN,tn_1417_1_64_B_18_ld_64_64_1417,Gemm_Rocblas_-9,0.014206
GemmStridedBatchedTunableOp_float_TN,tn_1263_1_128_B_16_ld_128_128_1263,Gemm_Hipblaslt_6378,0.0439125
GemmStridedBatchedTunableOp_float_TN,tn_721_721_128_B_16_ld_128_2048_721,Gemm_Rocblas_6378,0.893665
GemmStridedBatchedTunableOp_float_TN,tn_188_1_64_B_8_ld_512_64_188,Gemm_Hipblaslt_6378,0.00876368
GemmStridedBatchedTunableOp_float_TN,tn_552_1_64_B_8_ld_512_64_552,Gemm_Hipblaslt_6376,0.00985976
GemmStridedBatchedTunableOp_float_TN,tn_186_1_128_B_16_ld_128_128_186,Gemm_Rocblas_6377,0.012185
GemmStridedBatchedTunableOp_float_TN,tn_242_1_64_B_8_ld_512_64_242,Gemm_Rocblas_6379,0.00942825
GemmStridedBatchedTunableOp_float_TN,tn_2144_1_64_B_18_ld_64_64_2144,Gemm_Rocblas_-9,0.0187589
GemmStridedBatchedTunableOp_float_TN,tn_408_1_128_B_16_ld_128_128_408,Gemm_Hipblaslt_6376,0.0171302
GemmStridedBatchedTunableOp_float_TN,tn_53_1_64_B_8_ld_512_64_53,Gemm_Rocblas_-9,0.00759629
GemmStridedBatchedTunableOp_float_TN,tn_532_1_128_B_16_ld_128_128_532,Gemm_Hipblaslt_6376,0.0203439
GemmStridedBatchedTunableOp_float_TN,tn_867_1_64_B_8_ld_512_64_867,Gemm_Hipblaslt_6376,0.0128309
GemmStridedBatchedTunableOp_float_TN,tn_72_1_64_B_8_ld_512_64_72,Gemm_Rocblas_-9,0.00838054
GemmStridedBatchedTunableOp_float_TN,tn_1007_1_64_B_18_ld_64_64_1007,Gemm_Rocblas_-9,0.0116503
GemmStridedBatchedTunableOp_float_TN,tn_465_1_128_B_16_ld_128_128_465,Gemm_Rocblas_6377,0.019386
GemmStridedBatchedTunableOp_float_TN,tn_1443_1_128_B_16_ld_128_128_1443,Gemm_Hipblaslt_6376,0.0447184
GemmStridedBatchedTunableOp_float_TN,tn_644_644_128_B_16_ld_128_2048_644,Gemm_Rocblas_6378,0.707773
GemmStridedBatchedTunableOp_float_TN,tn_1112_1112_128_B_16_ld_128_2048_1112,Gemm_Hipblaslt_6377,1.96283
GemmStridedBatchedTunableOp_float_TN,tn_1143_1_128_B_16_ld_128_128_1143,Gemm_Rocblas_6379,0.0411629
GemmStridedBatchedTunableOp_float_TN,tn_2055_1_128_B_16_ld_128_128_2055,Gemm_Hipblaslt_6376,0.0561528
GemmStridedBatchedTunableOp_float_TN,tn_2104_1_64_B_18_ld_64_64_2104,Gemm_Rocblas_-9,0.0185397
GemmStridedBatchedTunableOp_float_TN,tn_1188_1188_128_B_16_ld_128_2048_1188,Default,2.34009
GemmStridedBatchedTunableOp_float_TN,tn_2056_1_128_B_16_ld_128_128_2056,Gemm_Hipblaslt_6376,0.0554639
GemmStridedBatchedTunableOp_float_TN,tn_994_1_128_B_16_ld_128_128_994,Gemm_Hipblaslt_6378,0.0353035
GemmStridedBatchedTunableOp_float_TN,tn_89_1_64_B_8_ld_512_64_89,Gemm_Rocblas_6379,0.00863943
GemmStridedBatchedTunableOp_float_TN,tn_779_1_64_B_8_ld_512_64_779,Gemm_Rocblas_6377,0.0120326
GemmStridedBatchedTunableOp_float_TN,tn_559_1_128_B_16_ld_128_128_559,Gemm_Rocblas_6377,0.0221668
GemmStridedBatchedTunableOp_float_TN,tn_1330_1_128_B_16_ld_128_128_1330,Gemm_Hipblaslt_6376,0.0435254
GemmStridedBatchedTunableOp_float_TN,tn_1508_1_64_B_18_ld_64_64_1508,Gemm_Rocblas_-9,0.0145678
GemmStridedBatchedTunableOp_float_TN,tn_658_1_128_B_16_ld_128_128_658,Gemm_Rocblas_6379,0.028685
GemmStridedBatchedTunableOp_float_TN,tn_978_1_64_B_8_ld_512_64_978,Gemm_Rocblas_6377,0.0138364
GemmStridedBatchedTunableOp_float_TN,tn_1643_1_64_B_18_ld_64_64_1643,Gemm_Rocblas_-9,0.0159869
GemmStridedBatchedTunableOp_float_TN,tn_1244_1_128_B_16_ld_128_128_1244,Gemm_Rocblas_6379,0.0433383
GemmStridedBatchedTunableOp_float_TN,tn_470_1_64_B_8_ld_512_64_470,Gemm_Hipblaslt_6376,0.00963932
GemmStridedBatchedTunableOp_float_TN,tn_1996_1_128_B_16_ld_128_128_1996,Gemm_Rocblas_6377,0.0590313
GemmStridedBatchedTunableOp_float_TN,tn_1373_1_64_B_18_ld_64_64_1373,Gemm_Rocblas_-9,0.0143883
GemmStridedBatchedTunableOp_float_TN,tn_68_1_64_B_8_ld_512_64_68,Gemm_Rocblas_-9,0.00815097
GemmStridedBatchedTunableOp_float_TN,tn_1407_1_128_B_16_ld_128_128_1407,Gemm_Hipblaslt_6376,0.0460044
GemmStridedBatchedTunableOp_float_TN,tn_141_1_64_B_8_ld_512_64_141,Gemm_Rocblas_6377,0.0086691
GemmStridedBatchedTunableOp_float_TN,tn_1034_1_64_B_18_ld_64_64_1034,Gemm_Rocblas_-9,0.0123901
GemmStridedBatchedTunableOp_float_TN,tn_1059_1_64_B_18_ld_64_64_1059,Gemm_Rocblas_-9,0.0124699
GemmStridedBatchedTunableOp_float_TN,tn_953_1_64_B_8_ld_512_64_953,Gemm_Rocblas_6377,0.0136593
GemmStridedBatchedTunableOp_float_TN,tn_111_1_64_B_8_ld_512_64_111,Gemm_Hipblaslt_6376,0.00865747
GemmStridedBatchedTunableOp_float_TN,tn_1277_1_128_B_16_ld_128_128_1277,Gemm_Hipblaslt_6376,0.0443461
GemmStridedBatchedTunableOp_float_TN,tn_1602_1_128_B_16_ld_128_128_1602,Gemm_Hipblaslt_6376,0.0464822
GemmStridedBatchedTunableOp_float_TN,tn_859_1_64_B_8_ld_512_64_859,Gemm_Hipblaslt_6376,0.0127905
GemmStridedBatchedTunableOp_float_TN,tn_136_1_64_B_8_ld_512_64_136,Gemm_Rocblas_6379,0.00870351
GemmStridedBatchedTunableOp_float_TN,tn_207_1_64_B_8_ld_512_64_207,Gemm_Rocblas_6377,0.00886786
GemmStridedBatchedTunableOp_float_TN,tn_492_1_64_B_8_ld_512_64_492,Gemm_Rocblas_6377,0.00989582
GemmStridedBatchedTunableOp_float_TN,tn_215_1_64_B_8_ld_512_64_215,Gemm_Rocblas_6379,0.00875889
GemmStridedBatchedTunableOp_float_TN,tn_1146_1_128_B_16_ld_128_128_1146,Gemm_Rocblas_6379,0.0410483
GemmStridedBatchedTunableOp_float_TN,tn_2029_1_128_B_16_ld_128_128_2029,Gemm_Hipblaslt_6376,0.0570427
GemmStridedBatchedTunableOp_float_TN,tn_2031_1_128_B_16_ld_128_128_2031,Gemm_Hipblaslt_6376,0.0580708
GemmStridedBatchedTunableOp_float_TN,tn_333_1_128_B_16_ld_128_128_333,Gemm_Rocblas_6377,0.0163611
GemmStridedBatchedTunableOp_float_TN,tn_121_1_64_B_8_ld_512_64_121,Gemm_Hipblaslt_6376,0.00863185
GemmStridedBatchedTunableOp_float_TN,tn_173_1_64_B_8_ld_512_64_173,Gemm_Hipblaslt_6378,0.00871159
GemmStridedBatchedTunableOp_float_TN,tn_1167_1_64_B_18_ld_64_64_1167,Gemm_Rocblas_-9,0.0129448
GemmStridedBatchedTunableOp_float_TN,tn_894_1_64_B_8_ld_512_64_894,Gemm_Hipblaslt_6376,0.0132008
GemmStridedBatchedTunableOp_float_TN,tn_831_1_64_B_8_ld_512_64_831,Gemm_Hipblaslt_6376,0.0119974
GemmStridedBatchedTunableOp_float_TN,tn_1687_1_64_B_18_ld_64_64_1687,Gemm_Rocblas_-9,0.0160662
GemmStridedBatchedTunableOp_float_TN,tn_583_1_128_B_16_ld_128_128_583,Gemm_Rocblas_6377,0.023606
GemmStridedBatchedTunableOp_float_TN,tn_854_854_128_B_16_ld_128_2048_854,Default,1.21163
GemmStridedBatchedTunableOp_float_TN,tn_100_1_64_B_8_ld_512_64_100,Gemm_Rocblas_6377,0.00863991
GemmStridedBatchedTunableOp_float_TN,tn_1900_1_64_B_18_ld_64_64_1900,Gemm_Rocblas_-9,0.0208896
GemmStridedBatchedTunableOp_float_TN,tn_1914_1_64_B_18_ld_64_64_1914,Gemm_Rocblas_-9,0.0173274
GemmStridedBatchedTunableOp_float_TN,tn_245_1_128_B_16_ld_128_128_245,Gemm_Rocblas_6377,0.0137017
GemmStridedBatchedTunableOp_float_TN,tn_1539_1_128_B_16_ld_128_128_1539,Gemm_Hipblaslt_6376,0.0469655
GemmStridedBatchedTunableOp_float_TN,tn_1066_1_128_B_16_ld_128_128_1066,Gemm_Hipblaslt_6378,0.0394674
GemmStridedBatchedTunableOp_float_TN,tn_995_995_128_B_16_ld_128_2048_995,Gemm_Hipblaslt_6377,1.61141
GemmStridedBatchedTunableOp_float_TN,tn_615_1_64_B_8_ld_512_64_615,Gemm_Rocblas_6377,0.010624
GemmStridedBatchedTunableOp_float_TN,tn_31_1_64_B_8_ld_512_64_31,Gemm_Rocblas_-9,0.0068432
GemmStridedBatchedTunableOp_float_TN,tn_724_1_64_B_8_ld_512_64_724,Gemm_Hipblaslt_6376,0.0117172
GemmStridedBatchedTunableOp_float_TN,tn_1384_1_128_B_16_ld_128_128_1384,Gemm_Hipblaslt_6376,0.0444231
GemmStridedBatchedTunableOp_float_TN,tn_590_1_64_B_8_ld_512_64_590,Gemm_Rocblas_6377,0.0101014
GemmStridedBatchedTunableOp_float_TN,tn_65_1_64_B_8_ld_512_64_65,Gemm_Rocblas_-9,0.007973
GemmStridedBatchedTunableOp_float_TN,tn_157_1_64_B_8_ld_512_64_157,Gemm_Hipblaslt_6378,0.00873609
GemmStridedBatchedTunableOp_float_TN,tn_301_1_128_B_16_ld_128_128_301,Gemm_Rocblas_6377,0.0154149
GemmStridedBatchedTunableOp_float_TN,tn_1111_1_128_B_16_ld_128_128_1111,Gemm_Rocblas_6379,0.0405619
GemmStridedBatchedTunableOp_float_TN,tn_69_1_64_B_8_ld_512_64_69,Gemm_Rocblas_-9,0.0080984
GemmStridedBatchedTunableOp_float_TN,tn_1105_1105_128_B_16_ld_128_2048_1105,Gemm_Rocblas_6378,2.04997
GemmStridedBatchedTunableOp_float_TN,tn_1062_1_64_B_18_ld_64_64_1062,Gemm_Rocblas_-9,0.0127087
GemmStridedBatchedTunableOp_float_TN,tn_52_1_64_B_8_ld_512_64_52,Gemm_Rocblas_-9,0.00755145
GemmStridedBatchedTunableOp_float_TN,tn_158_1_128_B_16_ld_128_128_158,Gemm_Hipblaslt_6376,0.0114427
GemmStridedBatchedTunableOp_float_TN,tn_147_1_64_B_8_ld_512_64_147,Gemm_Rocblas_6377,0.00867711
GemmStridedBatchedTunableOp_float_TN,tn_1063_1_128_B_16_ld_128_128_1063,Gemm_Hipblaslt_6378,0.0391043
GemmStridedBatchedTunableOp_float_TN,tn_1478_1_128_B_16_ld_128_128_1478,Gemm_Hipblaslt_6376,0.0455043
GemmStridedBatchedTunableOp_float_TN,tn_1070_1_64_B_18_ld_64_64_1070,Gemm_Rocblas_-9,0.0126025
GemmStridedBatchedTunableOp_float_TN,tn_2025_1_128_B_16_ld_128_128_2025,Gemm_Hipblaslt_6376,0.0573281
GemmStridedBatchedTunableOp_float_TN,tn_970_1_64_B_18_ld_64_64_970,Gemm_Rocblas_-9,0.0116804
GemmStridedBatchedTunableOp_float_TN,tn_821_1_64_B_8_ld_512_64_821,Gemm_Rocblas_6377,0.0125904
GemmStridedBatchedTunableOp_float_TN,tn_885_1_64_B_8_ld_512_64_885,Gemm_Rocblas_6377,0.0129824
GemmStridedBatchedTunableOp_float_TN,tn_793_1_128_B_16_ld_128_128_793,Gemm_Hipblaslt_6378,0.0355268
GemmStridedBatchedTunableOp_float_TN,tn_1258_1_128_B_16_ld_128_128_1258,Gemm_Rocblas_6377,0.0427696
GemmStridedBatchedTunableOp_float_TN,tn_418_1_128_B_16_ld_128_128_418,Gemm_Rocblas_6377,0.0182375
GemmStridedBatchedTunableOp_float_TN,tn_264_1_128_B_16_ld_128_128_264,Gemm_Rocblas_6377,0.0142693
GemmStridedBatchedTunableOp_float_TN,tn_2149_1_64_B_18_ld_64_64_2149,Gemm_Rocblas_-9,0.0191465
GemmStridedBatchedTunableOp_float_TN,tn_283_1_64_B_8_ld_512_64_283,Gemm_Hipblaslt_6376,0.00858291
GemmStridedBatchedTunableOp_float_TN,tn_387_1_64_B_8_ld_512_64_387,Gemm_Rocblas_6377,0.00891196
GemmStridedBatchedTunableOp_float_TN,tn_1146_1_64_B_18_ld_64_64_1146,Gemm_Rocblas_-9,0.012601
GemmStridedBatchedTunableOp_float_TN,tn_1181_1_128_B_16_ld_128_128_1181,Gemm_Rocblas_6379,0.0418575
GemmStridedBatchedTunableOp_float_TN,tn_1857_1_64_B_18_ld_64_64_1857,Gemm_Rocblas_-9,0.0175975
GemmStridedBatchedTunableOp_float_TN,tn_582_1_128_B_16_ld_128_128_582,Gemm_Hipblaslt_6376,0.0230437
GemmStridedBatchedTunableOp_float_TN,tn_156_1_64_B_8_ld_512_64_156,Gemm_Hipblaslt_6378,0.00836933
GemmStridedBatchedTunableOp_float_TN,tn_1133_1_64_B_18_ld_64_64_1133,Gemm_Rocblas_-9,0.0126623
GemmStridedBatchedTunableOp_float_TN,tn_1913_1_128_B_16_ld_128_128_1913,Gemm_Hipblaslt_6376,0.054043
GemmStridedBatchedTunableOp_float_TN,tn_514_1_64_B_8_ld_512_64_514,Gemm_Rocblas_6377,0.00960488
GemmStridedBatchedTunableOp_float_TN,tn_1057_1_64_B_18_ld_64_64_1057,Gemm_Rocblas_-9,0.0125219
GemmStridedBatchedTunableOp_float_TN,tn_1077_1077_128_B_16_ld_128_2048_1077,Gemm_Hipblaslt_6377,1.86134
GemmStridedBatchedTunableOp_float_TN,tn_407_1_128_B_16_ld_128_128_407,Gemm_Hipblaslt_6376,0.0180178
GemmStridedBatchedTunableOp_float_TN,tn_1477_1_128_B_16_ld_128_128_1477,Gemm_Hipblaslt_6376,0.0449232
GemmStridedBatchedTunableOp_float_TN,tn_1788_1_64_B_18_ld_64_64_1788,Gemm_Rocblas_-9,0.0164129
GemmStridedBatchedTunableOp_float_TN,tn_794_1_64_B_8_ld_512_64_794,Gemm_Rocblas_6377,0.0122486
GemmStridedBatchedTunableOp_float_TN,tn_509_1_128_B_16_ld_128_128_509,Gemm_Hipblaslt_6376,0.020612
GemmStridedBatchedTunableOp_float_TN,tn_297_1_64_B_8_ld_512_64_297,Gemm_Rocblas_6379,0.00898763
GemmStridedBatchedTunableOp_float_TN,tn_665_1_64_B_8_ld_512_64_665,Gemm_Rocblas_6377,0.0108997
GemmStridedBatchedTunableOp_float_TN,tn_1039_1_128_B_16_ld_128_128_1039,Gemm_Hipblaslt_6378,0.0366621
GemmStridedBatchedTunableOp_float_TN,tn_1836_1_128_B_16_ld_128_128_1836,Gemm_Hipblaslt_6376,0.0513851
GemmStridedBatchedTunableOp_float_TN,tn_445_1_64_B_8_ld_512_64_445,Gemm_Rocblas_6377,0.00953873
GemmStridedBatchedTunableOp_float_TN,tn_1381_1_128_B_16_ld_128_128_1381,Gemm_Hipblaslt_6376,0.0437422
GemmStridedBatchedTunableOp_float_TN,tn_717_1_64_B_8_ld_512_64_717,Gemm_Rocblas_6377,0.0115209
GemmStridedBatchedTunableOp_float_TN,tn_245_1_64_B_8_ld_512_64_245,Gemm_Hipblaslt_6378,0.01678
GemmStridedBatchedTunableOp_float_TN,tn_416_1_64_B_8_ld_512_64_416,Gemm_Rocblas_6377,0.00895211
GemmStridedBatchedTunableOp_float_TN,tn_544_1_64_B_8_ld_512_64_544,Gemm_Rocblas_6377,0.0101495
GemmStridedBatchedTunableOp_float_TN,tn_507_1_128_B_16_ld_128_128_507,Gemm_Rocblas_6377,0.0204697
GemmStridedBatchedTunableOp_float_TN,tn_1927_1_64_B_18_ld_64_64_1927,Gemm_Rocblas_-9,0.017462
GemmStridedBatchedTunableOp_float_TN,tn_260_1_64_B_8_ld_512_64_260,Gemm_Hipblaslt_6377,0.0096806
GemmStridedBatchedTunableOp_float_TN,tn_624_1_128_B_16_ld_128_128_624,Gemm_Hipblaslt_6378,0.0260004
GemmStridedBatchedTunableOp_float_TN,tn_1697_1_128_B_16_ld_128_128_1697,Gemm_Hipblaslt_6376,0.0510085
GemmStridedBatchedTunableOp_float_TN,tn_1138_1_128_B_16_ld_128_128_1138,Gemm_Hipblaslt_6378,0.0386879
GemmStridedBatchedTunableOp_float_TN,tn_1224_1224_128_B_16_ld_128_2048_1224,Default,2.43688
GemmStridedBatchedTunableOp_float_TN,tn_1068_1_128_B_16_ld_128_128_1068,Gemm_Rocblas_6379,0.0396562
GemmStridedBatchedTunableOp_float_TN,tn_795_1_64_B_8_ld_512_64_795,Gemm_Rocblas_6377,0.0122166
GemmStridedBatchedTunableOp_float_TN,tn_638_1_128_B_16_ld_128_128_638,Gemm_Rocblas_6379,0.0264717
GemmStridedBatchedTunableOp_float_TN,tn_189_1_64_B_8_ld_512_64_189,Gemm_Hipblaslt_6378,0.00878971
GemmStridedBatchedTunableOp_float_TN,tn_433_1_128_B_16_ld_128_128_433,Gemm_Hipblaslt_6376,0.0188242
GemmStridedBatchedTunableOp_float_TN,tn_908_1_128_B_16_ld_128_128_908,Gemm_Rocblas_6379,0.0369751
GemmStridedBatchedTunableOp_float_TN,tn_2134_1_64_B_18_ld_64_64_2134,Gemm_Rocblas_-9,0.0188759
GemmStridedBatchedTunableOp_float_TN,tn_327_1_64_B_8_ld_512_64_327,Gemm_Hipblaslt_6376,0.00902622
GemmStridedBatchedTunableOp_float_TN,tn_246_1_64_B_8_ld_512_64_246,Gemm_Rocblas_6377,0.0268485
GemmStridedBatchedTunableOp_float_TN,tn_2078_1_64_B_18_ld_64_64_2078,Gemm_Rocblas_-9,0.0185341
GemmStridedBatchedTunableOp_float_TN,tn_314_1_64_B_8_ld_512_64_314,Gemm_Rocblas_6379,0.00904384
GemmStridedBatchedTunableOp_float_TN,tn_520_1_64_B_8_ld_512_64_520,Gemm_Rocblas_6377,0.00957124
GemmStridedBatchedTunableOp_float_TN,tn_478_1_64_B_8_ld_512_64_478,Gemm_Rocblas_6377,0.00938053
GemmStridedBatchedTunableOp_float_TN,tn_230_230_128_B_16_ld_128_2048_230,Gemm_Rocblas_6378,0.109094
GemmStridedBatchedTunableOp_float_TN,tn_1376_1_64_B_18_ld_64_64_1376,Gemm_Rocblas_-9,0.0143266
GemmStridedBatchedTunableOp_float_TN,tn_1096_1_64_B_18_ld_64_64_1096,Gemm_Rocblas_-9,0.0129853
GemmStridedBatchedTunableOp_float_TN,tn_340_1_64_B_8_ld_512_64_340,Gemm_Hipblaslt_6376,0.0086835
GemmStridedBatchedTunableOp_float_TN,tn_1668_1_64_B_18_ld_64_64_1668,Gemm_Rocblas_-9,0.0157685
GemmStridedBatchedTunableOp_float_TN,tn_1549_1_128_B_16_ld_128_128_1549,Gemm_Hipblaslt_6376,0.0469379
GemmStridedBatchedTunableOp_float_TN,tn_735_1_64_B_8_ld_512_64_735,Gemm_Hipblaslt_6376,0.0116396
GemmStridedBatchedTunableOp_float_TN,tn_1533_1_64_B_18_ld_64_64_1533,Gemm_Rocblas_-9,0.0151577
GemmStridedBatchedTunableOp_float_TN,tn_1106_1_128_B_16_ld_128_128_1106,Gemm_Rocblas_6379,0.0398674
GemmStridedBatchedTunableOp_float_TN,tn_1366_1_128_B_16_ld_128_128_1366,Gemm_Hipblaslt_6376,0.0435898
GemmStridedBatchedTunableOp_float_TN,tn_2035_1_64_B_18_ld_64_64_2035,Gemm_Rocblas_-9,0.0181658
GemmStridedBatchedTunableOp_float_TN,tn_1487_1_64_B_18_ld_64_64_1487,Gemm_Rocblas_-9,0.0145963
GemmStridedBatchedTunableOp_float_TN,tn_175_1_128_B_16_ld_128_128_175,Gemm_Hipblaslt_6376,0.0114443
GemmStridedBatchedTunableOp_float_TN,tn_343_1_64_B_8_ld_512_64_343,Gemm_Rocblas_6379,0.00911435
GemmStridedBatchedTunableOp_float_TN,tn_1077_1_64_B_18_ld_64_64_1077,Gemm_Rocblas_-9,0.0126578
GemmStridedBatchedTunableOp_float_TN,tn_1058_1058_128_B_16_ld_128_2048_1058,Default,1.88729
GemmStridedBatchedTunableOp_float_TN,tn_629_1_128_B_16_ld_128_128_629,Gemm_Rocblas_6379,0.0264686
GemmStridedBatchedTunableOp_float_TN,tn_1412_1_128_B_16_ld_128_128_1412,Gemm_Hipblaslt_6376,0.0439714
GemmStridedBatchedTunableOp_float_TN,tn_1624_1_128_B_16_ld_128_128_1624,Gemm_Rocblas_6379,0.0500285
GemmStridedBatchedTunableOp_float_TN,tn_1576_1_128_B_16_ld_128_128_1576,Gemm_Hipblaslt_6376,0.0463407
GemmStridedBatchedTunableOp_float_TN,tn_436_1_64_B_8_ld_512_64_436,Gemm_Rocblas_6377,0.00945578
GemmStridedBatchedTunableOp_float_TN,tn_2095_1_64_B_18_ld_64_64_2095,Gemm_Rocblas_-9,0.0188775
GemmStridedBatchedTunableOp_float_TN,tn_989_1_64_B_8_ld_512_64_989,Gemm_Hipblaslt_6376,0.013757
GemmStridedBatchedTunableOp_float_TN,tn_1048_1_128_B_16_ld_128_128_1048,Gemm_Hipblaslt_6378,0.0389556
GemmStridedBatchedTunableOp_float_TN,tn_443_1_64_B_8_ld_512_64_443,Gemm_Hipblaslt_6376,0.00925939
GemmStridedBatchedTunableOp_float_TN,tn_2017_1_64_B_18_ld_64_64_2017,Gemm_Rocblas_-9,0.0178912
GemmStridedBatchedTunableOp_float_TN,tn_322_1_64_B_8_ld_512_64_322,Gemm_Hipblaslt_6376,0.00903861
GemmStridedBatchedTunableOp_float_TN,tn_304_1_64_B_8_ld_512_64_304,Gemm_Hipblaslt_6376,0.00897768
GemmStridedBatchedTunableOp_float_TN,tn_2000_1_128_B_16_ld_128_128_2000,Gemm_Hipblaslt_6376,0.0562846
GemmStridedBatchedTunableOp_float_TN,tn_2072_1_128_B_16_ld_128_128_2072,Gemm_Hipblaslt_6376,0.0579441
GemmStridedBatchedTunableOp_float_TN,tn_243_1_64_B_8_ld_512_64_243,Gemm_Rocblas_6377,0.00889156
GemmStridedBatchedTunableOp_float_TN,tn_1306_1_128_B_16_ld_128_128_1306,Gemm_Hipblaslt_6376,0.0440604
GemmStridedBatchedTunableOp_float_TN,tn_1382_1_64_B_18_ld_64_64_1382,Gemm_Rocblas_-9,0.0143005
GemmStridedBatchedTunableOp_float_TN,tn_1600_1_64_B_18_ld_64_64_1600,Gemm_Rocblas_-9,0.0158411
GemmStridedBatchedTunableOp_float_TN,tn_518_1_128_B_16_ld_128_128_518,Gemm_Rocblas_6377,0.0205887
GemmStridedBatchedTunableOp_float_TN,tn_438_1_128_B_16_ld_128_128_438,Gemm_Rocblas_6377,0.0187792
GemmStridedBatchedTunableOp_float_TN,tn_1927_1_128_B_16_ld_128_128_1927,Gemm_Hipblaslt_6376,0.0544209
GemmStridedBatchedTunableOp_float_TN,tn_224_1_64_B_8_ld_512_64_224,Gemm_Hipblaslt_6378,0.00993271
GemmStridedBatchedTunableOp_float_TN,tn_1071_1_128_B_16_ld_128_128_1071,Gemm_Rocblas_6379,0.0395583
GemmStridedBatchedTunableOp_float_TN,tn_137_1_128_B_16_ld_128_128_137,Gemm_Rocblas_6377,0.0109975
GemmStridedBatchedTunableOp_float_TN,tn_1074_1_128_B_16_ld_128_128_1074,Gemm_Rocblas_6379,0.0396818
GemmStridedBatchedTunableOp_float_TN,tn_1521_1_64_B_18_ld_64_64_1521,Gemm_Rocblas_-9,0.0145887
GemmStridedBatchedTunableOp_float_TN,tn_1492_1_128_B_16_ld_128_128_1492,Gemm_Hipblaslt_6376,0.0445446
GemmStridedBatchedTunableOp_float_TN,tn_1815_1_128_B_16_ld_128_128_1815,Gemm_Hipblaslt_6376,0.0508539
GemmStridedBatchedTunableOp_float_TN,tn_393_1_128_B_16_ld_128_128_393,Gemm_Rocblas_6377,0.0177986
GemmStridedBatchedTunableOp_float_TN,tn_1944_1_128_B_16_ld_128_128_1944,Gemm_Hipblaslt_6376,0.0553891
GemmStridedBatchedTunableOp_float_TN,tn_1077_1_128_B_16_ld_128_128_1077,Gemm_Rocblas_6379,0.0397323
GemmStridedBatchedTunableOp_float_TN,tn_584_1_64_B_8_ld_512_64_584,Gemm_Hipblaslt_6376,0.010517
GemmStridedBatchedTunableOp_float_TN,tn_1058_1_128_B_16_ld_128_128_1058,Gemm_Rocblas_6379,0.0392101
GemmStridedBatchedTunableOp_float_TN,tn_346_1_128_B_16_ld_128_128_346,Gemm_Rocblas_6377,0.0166541
GemmStridedBatchedTunableOp_float_TN,tn_383_1_128_B_16_ld_128_128_383,Gemm_Hipblaslt_6376,0.0174977
GemmStridedBatchedTunableOp_float_TN,tn_1967_1_128_B_16_ld_128_128_1967,Gemm_Hipblaslt_6376,0.0555813
GemmStridedBatchedTunableOp_float_TN,tn_926_1_64_B_18_ld_64_64_926,Gemm_Rocblas_-9,0.0105963
GemmStridedBatchedTunableOp_float_TN,tn_994_1_64_B_8_ld_512_64_994,Gemm_Hipblaslt_6376,0.0139623
GemmStridedBatchedTunableOp_float_TN,tn_1057_1_128_B_16_ld_128_128_1057,Gemm_Rocblas_6379,0.0391547
GemmStridedBatchedTunableOp_float_TN,tn_63_1_64_B_8_ld_512_64_63,Gemm_Rocblas_-9,0.00803505
GemmStridedBatchedTunableOp_float_TN,tn_960_1_64_B_18_ld_64_64_960,Gemm_Rocblas_-9,0.0115565
GemmStridedBatchedTunableOp_float_TN,tn_905_1_64_B_8_ld_512_64_905,Gemm_Rocblas_6377,0.0132598
GemmStridedBatchedTunableOp_float_TN,tn_1958_1_128_B_16_ld_128_128_1958,Gemm_Hipblaslt_6376,0.0540875
GemmStridedBatchedTunableOp_float_TN,tn_1158_1_128_B_16_ld_128_128_1158,Gemm_Rocblas_6379,0.0413673
GemmStridedBatchedTunableOp_float_TN,tn_278_1_128_B_16_ld_128_128_278,Gemm_Rocblas_6377,0.0148435
GemmStridedBatchedTunableOp_float_TN,tn_353_1_64_B_8_ld_512_64_353,Gemm_Hipblaslt_6376,0.00872684
GemmStridedBatchedTunableOp_float_TN,tn_870_1_64_B_8_ld_512_64_870,Gemm_Rocblas_6377,0.0128826
GemmStridedBatchedTunableOp_float_TN,tn_651_1_128_B_16_ld_128_128_651,Gemm_Rocblas_6379,0.027141
GemmStridedBatchedTunableOp_float_TN,tn_2076_1_64_B_18_ld_64_64_2076,Gemm_Rocblas_-9,0.018581
GemmStridedBatchedTunableOp_float_TN,tn_1344_1_64_B_18_ld_64_64_1344,Gemm_Rocblas_-9,0.0144588
GemmStridedBatchedTunableOp_float_TN,tn_1809_1_64_B_18_ld_64_64_1809,Gemm_Rocblas_-9,0.0171698
GemmStridedBatchedTunableOp_float_TN,tn_1003_1_128_B_16_ld_128_128_1003,Gemm_Rocblas_6379,0.0383288
GemmStridedBatchedTunableOp_float_TN,tn_1049_1_64_B_18_ld_64_64_1049,Gemm_Rocblas_-9,0.0126935
GemmStridedBatchedTunableOp_float_TN,tn_1087_1_128_B_16_ld_128_128_1087,Gemm_Rocblas_6379,0.0399283
GemmStridedBatchedTunableOp_float_TN,tn_216_1_128_B_16_ld_128_128_216,Gemm_Rocblas_6377,0.0129231
GemmStridedBatchedTunableOp_float_TN,tn_376_1_64_B_8_ld_512_64_376,Gemm_Hipblaslt_6376,0.00887746
GemmStridedBatchedTunableOp_float_TN,tn_296_1_64_B_8_ld_512_64_296,Gemm_Rocblas_6377,0.00898327
GemmStridedBatchedTunableOp_float_TN,tn_1936_1_128_B_16_ld_128_128_1936,Gemm_Hipblaslt_6376,0.0551884
GemmStridedBatchedTunableOp_float_TN,tn_927_1_64_B_8_ld_512_64_927,Gemm_Rocblas_6377,0.0133523
GemmStridedBatchedTunableOp_float_TN,tn_965_1_128_B_16_ld_128_128_965,Gemm_Rocblas_6379,0.0374688
GemmStridedBatchedTunableOp_float_TN,tn_2130_1_64_B_18_ld_64_64_2130,Gemm_Rocblas_-9,0.0187297
GemmStridedBatchedTunableOp_float_TN,tn_126_1_64_B_8_ld_512_64_126,Gemm_Rocblas_6379,0.00867034
GemmStridedBatchedTunableOp_float_TN,tn_55_1_64_B_8_ld_512_64_55,Gemm_Rocblas_-9,0.00777866
GemmStridedBatchedTunableOp_float_TN,tn_819_1_128_B_16_ld_128_128_819,Gemm_Rocblas_6379,0.0359852
GemmStridedBatchedTunableOp_float_TN,tn_1854_1_128_B_16_ld_128_128_1854,Gemm_Hipblaslt_6376,0.0524907
GemmStridedBatchedTunableOp_float_TN,tn_1528_1_64_B_18_ld_64_64_1528,Gemm_Rocblas_-9,0.0147949
GemmStridedBatchedTunableOp_float_TN,tn_1294_1294_128_B_16_ld_128_2048_1294,Default,2.75377
GemmStridedBatchedTunableOp_float_TN,tn_253_1_64_B_8_ld_512_64_253,Gemm_Rocblas_6377,0.00946502
GemmStridedBatchedTunableOp_float_TN,tn_2026_1_128_B_16_ld_128_128_2026,Gemm_Hipblaslt_6376,0.0565951
GemmStridedBatchedTunableOp_float_TN,tn_887_1_64_B_8_ld_512_64_887,Gemm_Hipblaslt_6376,0.0129996
GemmStridedBatchedTunableOp_float_TN,tn_820_1_64_B_8_ld_512_64_820,Gemm_Rocblas_6377,0.0123577
GemmStridedBatchedTunableOp_float_TN,tn_373_1_128_B_16_ld_128_128_373,Gemm_Rocblas_6377,0.0171815
GemmStridedBatchedTunableOp_float_TN,tn_1191_1_64_B_18_ld_64_64_1191,Gemm_Rocblas_-9,0.0127252
GemmStridedBatchedTunableOp_float_TN,tn_103_1_64_B_8_ld_512_64_103,Gemm_Rocblas_6379,0.00856772
GemmStridedBatchedTunableOp_float_TN,tn_431_1_64_B_8_ld_512_64_431,Gemm_Rocblas_6377,0.00944986
GemmStridedBatchedTunableOp_float_TN,tn_1043_1_128_B_16_ld_128_128_1043,Gemm_Hipblaslt_6378,0.0391512
GemmStridedBatchedTunableOp_float_TN,tn_2003_1_128_B_16_ld_128_128_2003,Gemm_Hipblaslt_6376,0.0561687
GemmStridedBatchedTunableOp_float_TN,tn_351_1_64_B_8_ld_512_64_351,Gemm_Hipblaslt_6376,0.00908865
GemmStridedBatchedTunableOp_float_TN,tn_1470_1_128_B_16_ld_128_128_1470,Gemm_Hipblaslt_6376,0.0460746
GemmStridedBatchedTunableOp_float_TN,tn_192_1_64_B_8_ld_512_64_192,Gemm_Hipblaslt_6378,0.00884585
GemmStridedBatchedTunableOp_float_TN,tn_337_1_64_B_8_ld_512_64_337,Gemm_Rocblas_6377,0.00901052
GemmStridedBatchedTunableOp_float_TN,tn_229_1_128_B_16_ld_128_128_229,Gemm_Hipblaslt_6376,0.0133336
GemmStridedBatchedTunableOp_float_TN,tn_697_1_128_B_16_ld_128_128_697,Gemm_Hipblaslt_6378,0.0328649
GemmStridedBatchedTunableOp_float_TN,tn_1788_1_128_B_16_ld_128_128_1788,Gemm_Hipblaslt_6376,0.0501502
GemmStridedBatchedTunableOp_float_TN,tn_222_1_64_B_8_ld_512_64_222,Gemm_Hipblaslt_6376,0.00888311
GemmStridedBatchedTunableOp_float_TN,tn_928_1_64_B_18_ld_64_64_928,Gemm_Rocblas_-9,0.0117368
GemmStridedBatchedTunableOp_float_TN,tn_986_1_64_B_18_ld_64_64_986,Gemm_Rocblas_-9,0.0117857
GemmStridedBatchedTunableOp_float_TN,tn_1233_1_128_B_16_ld_128_128_1233,Gemm_Hipblaslt_6378,0.0426806
GemmStridedBatchedTunableOp_float_TN,tn_1253_1_64_B_18_ld_64_64_1253,Gemm_Rocblas_-9,0.01344
GemmStridedBatchedTunableOp_float_TN,tn_1168_1168_128_B_16_ld_128_2048_1168,Default,2.2084
GemmStridedBatchedTunableOp_float_TN,tn_1128_1128_128_B_16_ld_128_2048_1128,Default,2.07794
GemmStridedBatchedTunableOp_float_TN,tn_616_1_128_B_16_ld_128_128_616,Gemm_Rocblas_6379,0.0256514
GemmStridedBatchedTunableOp_float_TN,tn_648_1_64_B_8_ld_512_64_648,Gemm_Rocblas_6377,0.0108172
GemmStridedBatchedTunableOp_float_TN,tn_206_1_64_B_8_ld_512_64_206,Gemm_Rocblas_6379,0.00878058
GemmStridedBatchedTunableOp_float_TN,tn_1762_1_64_B_18_ld_64_64_1762,Gemm_Rocblas_-9,0.016572
GemmStridedBatchedTunableOp_float_TN,tn_339_1_64_B_8_ld_512_64_339,Gemm_Rocblas_6377,0.00906148
GemmStridedBatchedTunableOp_float_TN,tn_305_1_128_B_16_ld_128_128_305,Gemm_Rocblas_6377,0.0154482
GemmStridedBatchedTunableOp_float_TN,tn_1732_1_64_B_18_ld_64_64_1732,Gemm_Rocblas_-9,0.0162089
GemmStridedBatchedTunableOp_float_TN,tn_1689_1_64_B_18_ld_64_64_1689,Gemm_Rocblas_-9,0.0157091
GemmStridedBatchedTunableOp_float_TN,tn_488_1_128_B_16_ld_128_128_488,Gemm_Rocblas_6377,0.0201367
GemmStridedBatchedTunableOp_float_TN,tn_674_1_128_B_16_ld_128_128_674,Gemm_Rocblas_6379,0.0310111
GemmStridedBatchedTunableOp_float_TN,tn_397_1_128_B_16_ld_128_128_397,Gemm_Rocblas_6377,0.0180147
GemmStridedBatchedTunableOp_float_TN,tn_1049_1_128_B_16_ld_128_128_1049,Gemm_Rocblas_6379,0.0393159
GemmStridedBatchedTunableOp_float_TN,tn_379_1_128_B_16_ld_128_128_379,Gemm_Hipblaslt_6376,0.0174264
GemmStridedBatchedTunableOp_float_TN,tn_1655_1_64_B_18_ld_64_64_1655,Gemm_Rocblas_-9,0.0157892
GemmStridedBatchedTunableOp_float_TN,tn_1001_1_128_B_16_ld_128_128_1001,Gemm_Hipblaslt_6378,0.0381333
GemmStridedBatchedTunableOp_float_TN,tn_824_1_128_B_16_ld_128_128_824,Gemm_Hipblaslt_6378,0.0349219
GemmStridedBatchedTunableOp_float_TN,tn_1894_1_128_B_16_ld_128_128_1894,Gemm_Hipblaslt_6376,0.0530568
GemmStridedBatchedTunableOp_float_TN,tn_1172_1_128_B_16_ld_128_128_1172,Gemm_Hipblaslt_6378,0.0417296
GemmStridedBatchedTunableOp_float_TN,tn_2022_1_64_B_18_ld_64_64_2022,Gemm_Rocblas_-9,0.0178163
GemmStridedBatchedTunableOp_float_TN,tn_1523_1_64_B_18_ld_64_64_1523,Gemm_Rocblas_-9,0.0147897
GemmStridedBatchedTunableOp_float_TN,tn_755_1_128_B_16_ld_128_128_755,Gemm_Rocblas_6379,0.0348667
GemmStridedBatchedTunableOp_float_TN,tn_275_1_64_B_8_ld_512_64_275,Gemm_Rocblas_6377,0.0167066
GemmStridedBatchedTunableOp_float_TN,tn_479_1_64_B_8_ld_512_64_479,Gemm_Rocblas_6377,0.00937047
GemmStridedBatchedTunableOp_float_TN,tn_443_1_128_B_16_ld_128_128_443,Gemm_Hipblaslt_6376,0.0188984
GemmStridedBatchedTunableOp_float_TN,tn_901_1_64_B_8_ld_512_64_901,Gemm_Rocblas_6377,0.0132368
GemmStridedBatchedTunableOp_float_TN,tn_887_1_64_B_18_ld_64_64_887,Gemm_Rocblas_-9,0.0113197
GemmStridedBatchedTunableOp_float_TN,tn_1761_1_128_B_16_ld_128_128_1761,Gemm_Hipblaslt_6376,0.0502044
GemmStridedBatchedTunableOp_float_TN,tn_1219_1219_128_B_16_ld_128_2048_1219,Gemm_Hipblaslt_6377,2.34674
GemmStridedBatchedTunableOp_float_TN,tn_796_1_64_B_8_ld_512_64_796,Gemm_Hipblaslt_6376,0.0121084
GemmStridedBatchedTunableOp_float_TN,tn_384_1_128_B_16_ld_128_128_384,Gemm_Rocblas_6377,0.0174845
GemmStridedBatchedTunableOp_float_TN,tn_739_1_64_B_8_ld_512_64_739,Gemm_Hipblaslt_6376,0.0117176
GemmStridedBatchedTunableOp_float_TN,tn_852_1_128_B_16_ld_128_128_852,Gemm_Hipblaslt_6378,0.0360013
GemmStridedBatchedTunableOp_float_TN,tn_1718_1_128_B_16_ld_128_128_1718,Gemm_Hipblaslt_6376,0.0506873
GemmStridedBatchedTunableOp_float_TN,tn_2010_1_64_B_18_ld_64_64_2010,Gemm_Rocblas_-9,0.0179586
GemmStridedBatchedTunableOp_float_TN,tn_1616_1_128_B_16_ld_128_128_1616,Gemm_Hipblaslt_6378,0.0491617
GemmStridedBatchedTunableOp_float_TN,tn_1450_1_64_B_18_ld_64_64_1450,Gemm_Rocblas_-9,0.0144568
GemmStridedBatchedTunableOp_float_TN,tn_1999_1_64_B_18_ld_64_64_1999,Gemm_Rocblas_-9,0.0179602
GemmStridedBatchedTunableOp_float_TN,tn_2077_1_128_B_16_ld_128_128_2077,Gemm_Hipblaslt_6376,0.0565335
GemmStridedBatchedTunableOp_float_TN,tn_316_1_64_B_8_ld_512_64_316,Gemm_Hipblaslt_6376,0.00907024
